,id,price,added_reduced,address,description,type_house,bathrooms,bedrooms,size,tenure,key_features,close_stations,close_stations_type,tenure_ground_rent,tenure_annual_service_charge,tenure_lease_length,council_tax_band,sold_under_offer
0,138377699,"£529,950",Added on 07/08/2023,"Golders Court, Golders Green NW11","A deceptively spacious three bedroom top floor apartment situated in this ever popular purpose built block within the heart of Golders Green and walking distance of Golders Green Tube station, Shopping facilities, local amenities and Golders Hill Park. The apartment is set around a communal Garde...",Apartment,1,3,,Share of Freehold,"['Three bedrooms', 'Large living room', 'Separate Kitchen/Breakfast room', 'Family bathroom', 'Off street parking', 'Walking distance to Golders Green Tube station', 'Chain Free ', 'Sole Agents']","[['Golders Green ', '0.3 miles'], ['Brent Cross ', '0.6 miles'], ['Cricklewood ', '1.1 miles']]","['underground', 'underground', 'nationalrail']",Ask agent,Ask agent,Ask agent,Ask agent,False
1,133045040,"£550,000",Added on 29/03/2023,"Woodlands, Golders Green, NW11 9QX","A bright and spacious south facing two bedroom flat situated in this sought after area off Golders Green Road. The flat offers spacious living accommodation. The flat offer living-room, kitchen, bathroom/wc, guest wc, balcony, garage, underfloor heating, lift, communal gardens and early vacant ...",Apartment,1,2,,Share of Freehold,"['Two Bedrooms', 'First Floor', 'Spacious Lounge', 'Balcony', 'EPC Rating C', 'Garage', 'Share of Freehold', 'Communal Gardens', 'Chain Free']","[['Brent Cross ', '0.4 miles'], ['Hendon Central ', '0.7 miles'], ['Golders Green ', '1.0 miles']]","['underground', 'underground', 'underground']",Ask agent,£5039,900 years left,Band: F,False
2,85973010,"£550,000",Reduced on 24/06/2023,"Garden Apartment, Pennine Drive, Golders Green Estate, NW2","This recently refurbished ground floor abode, located within a meticulously converted semi-detached house, boasts a wonderful private garden and off street parking, and is the epitome of a contemporary two bedroom apartment. This stunning property boasts impeccable finishes throughout, i...",Flat,2,2,872 sq. ft.(81 sq. m.),Share of Freehold,"['Spacious reception with bi fold doors', 'Private garden', 'Separate office/gym', 'Newly converted', 'Off street parking']","[['Cricklewood ', '0.6 miles'], ['Brent Cross ', '0.7 miles'], ['Golders Green ', '0.9 miles']]","['nationalrail', 'underground', 'underground']",Ask agent,Ask agent,Ask agent,Ask agent,False
3,138248144,"£550,000",Reduced on 22/08/2023,"North End Road, NW11","2 Bed 2 bath, share of freehold, Off street parking, Private garden moments from Golders Green Station !",Flat,2,2,,Share of Freehold,"['Off Street Parking FCFS', 'Private Garden', 'Share of Freehold', 'Chain Free', 'Main bedroom on separate level', 'Moments from Golders Green Station']","[['Golders Green ', '0.1 miles'], ['Brent Cross ', '1.0 miles'], ['Hampstead ', '1.1 miles']]","['underground', 'underground', 'underground']",Ask agent,Ask agent,Ask agent,Ask agent,False
4,86037054,"£550,000",Reduced on 17/10/2023,"Chandos Way, London",YOPA are delighted to offer for sale this spacious three bedroom top floor split level apartment located within the leafy north-west London suburb of Golders Green.,Flat,1,3,,Leasehold,"['Ideal investment opportunity', 'Three bedrooms', 'Balcony', 'Close to open-spaces of Hampstead Heath', 'Ample storage space', 'Underground Parking', 'Top floor split level', 'Chain free']","[['Golders Green ', '0.2 miles'], ['Brent Cross ', '1.1 miles'], ['Hampstead ', '1.1 miles']]","['underground', 'underground', 'underground']",Ask agent,Ask agent,Ask agent,Ask agent,False
5,136190756,"£550,000",Reduced on 11/09/2023,"Tudor House, Madoc Close, London NW2","Situated on a small development of luxury modern houses and flats is this 2 bedroom, 2 bathroom first floor apartment. The property comprises an open plan high specification kitchen lounge dining room, two good size bedrooms with master benefiting from a luxury ensuite shower room and a guest bat...",Flat,2,2,,Share of Freehold,"['2 Bedrooms', '2 bathrooms (Ensuite to master)', 'Open plan kitchen/lounge/dining room', 'Allocated parking space', '993 year lease', 'Chain free', 'Share of Freehold']","[['Golders Green ', '0.6 miles'], ['Cricklewood ', '0.7 miles'], ['Hampstead ', '1.0 miles']]","['underground', 'nationalrail', 'underground']",Ask agent,Ask agent,Ask agent,Ask agent,False
6,139585484,"£550,000",Added on 06/09/2023,"North End Road, NW11","A generously proportioned 706 sq. ft. 2 bedroom, 2 bathroom duplex apartment, located on the ground & first floors of this converted building. Offering bright, modern accommodation throughout and benefiting a private garden & off street parking on a first come first serve basis. ",Flat,2,2,706 sq. ft.(66 sq. m.),Share of Freehold,"['Chain Free', 'Share of Freehold', 'Private Gardens', '2 bedrooms', '2 bathrooms', 'Well located']","[['Golders Green ', '0.1 miles'], ['Brent Cross ', '0.9 miles'], ['Hampstead ', '1.2 miles']]","['underground', 'underground', 'underground']",Ask agent,Ask agent,74 years left,Ask agent,False
7,122267285,"£550,000",Added on 11/04/2022,"Eagle Lodge, Golders Green NW11","Situated on the top floor of this stunning art-deco building, within 0.5 miles of Golders Green Underground Station is this extremely spacious three double bedroom apartment. Internally the property comprises a spacious living room, bathroom, separate WC, fitted kitchen and three double bedrooms....",Apartment,1,3,,Leasehold,"['THREE DOUBLE BEDROOMS', 'BATHROOM', 'SEPARATE WC', 'SPACIOUS LIVING ROOM', 'KITCHEN', 'CHAIN FREE']","[['Brent Cross ', '0.5 miles'], ['Golders Green ', '0.5 miles'], ['Hendon Central ', '1.1 miles']]","['underground', 'underground', 'underground']",Ask agent,Ask agent,Ask agent,Ask agent,False
8,134065736,"£550,000",Reduced on 08/05/2023,"Hoop Lane, Golders Green","This spacious two bedroom split-level maisonette has its own front door and offers over 1,000 sq ft. The property has a private garage and will be sold with no onward chain.",Flat,2,2,,Freehold,"['Two Bedrooms', 'Separate Kitchen', 'Private Entrance', 'Garage', 'Duplex', 'No Onward Chain']","[['Golders Green ', '0.2 miles'], ['Brent Cross ', '0.7 miles'], ['Cricklewood ', '1.2 miles']]","['underground', 'underground', 'nationalrail']",Ask agent,Ask agent,Ask agent,Ask agent,False
9,139714331,"£550,000",Added on 08/09/2023,"Orchid Court, Granville Road, Childs Hill, NW2","Popular development in CHILDS HILL near HAMPSTEAD, this impressive garden apartment has PRIVATE WEST FACING TERRACE, two beds/two baths and good standard throughout. Viewing recommended.",Apartment,2,2,786 sq. ft.(73 sq. m.),Leasehold,"['Stunning Ground floor apartment located in Childs Hill', 'Two bedrooms with main room en-suite', 'Private terrace located just off the reception room', 'Modern fixtures throughout', 'Situated between Golders Green and Hampstead', 'Viewing highly recommended']","[['Golders Green ', '0.5 miles'], ['Cricklewood ', '0.7 miles'], ['Brent Cross ', '0.8 miles']]","['underground', 'nationalrail', 'underground']",Ask agent,£2650,Ask agent,Band: E,False
10,137969507,"£550,000",Added on 27/07/2023,"Pennine Drive, Golders Green Estate, NW2","LUXURIOUS ground floor apartment located near to GOLDERS GREEN & WEST HAMPSTEAD - No onward chain with high end finishes the property includes a PRIVATE GARDEN, PRIVATE PARKING AND STUDIO/ANNEX (with ensuite) in the garden.",Ground Flat,2,2,872 sq. ft.(81 sq. m.),Share of Freehold,"['Luxury ground floor apartment', 'Studio/Annex located in the Garden', 'Private south facing rear garden', 'Beautiful features and presentation throughout', 'Impressive open plan Kitchen/dining room/living area', 'Viewing recommended - No onward chain']","[['Cricklewood ', '0.6 miles'], ['Brent Cross ', '0.7 miles'], ['Golders Green ', '0.8 miles']]","['nationalrail', 'underground', 'underground']",Ask agent,Ask agent,Ask agent,Band: E,False
11,138995738,"£550,000",Added on 23/08/2023,"Finchley Road, NW11","Step into spacious living with this 712 sq. ft apartment boasting two double bedrooms and two bathrooms. Situated on the first floor of a modern conversion, this property offers both comfort and convenience. The airy and well-lit interior creates an inviting atmosphere througho...",Flat,2,2,712 sq. ft.(66 sq. m.),Leasehold,"['Chain free', 'Low outgoings', '2 double bedrooms', 'Private balcony', '2 bathrooms', 'Spacious 712 sq. ft']","[['Golders Green ', '0.5 miles'], ['Cricklewood ', '0.8 miles'], ['Hampstead ', '1.0 miles']]","['underground', 'nationalrail', 'underground']",Ask agent,Ask agent,150 years left,Band: A,False
12,139297913,"£549,950",Added on 31/08/2023,"Granville Road, Childs Hill",This two bedroom maisonette backs on to Childs Hill Park and has direct access to a large private garden. The property will be sold with no onward chain.,Flat,1,2,,Leasehold,"['Two Double Bedrooms', 'Private Garden', 'Open Plan', 'Integrated Appliances', 'Outbuilding', 'No Onward Chain']","[['Golders Green ', '0.5 miles'], ['Cricklewood ', '0.7 miles'], ['Brent Cross ', '0.8 miles']]","['underground', 'nationalrail', 'underground']",Ask agent,Ask agent,Ask agent,Ask agent,False
13,132754151,"£549,000",Reduced on 15/05/2023,"Golders Green Road, London, NW11 9PX","A Delightful Ground Floor Apartment
Exclusive Building with Concierge",Ground Flat,2,2,,Leasehold,"['En-Suite', 'Walk-in Shower Room (Seniors)', 'Parking', 'Intruder Alarm / CCTV / Security Bars', 'Ground Floor', 'Guest Bathroom', 'Outdoor Terrace', 'Hot Water & Heating Included']","[['Brent Cross ', '0.3 miles'], ['Hendon Central ', '0.7 miles'], ['Golders Green ', '0.9 miles']]","['underground', 'underground', 'underground']",£0 per year,£0,177 years left,Ask agent,False
14,132121610,"£545,000",Reduced on 23/08/2023,"Meadway, Hampstead Garden Suburb","A delightful 2 bedroom ground floor apartment set within this highly desirable Grade II listed building located on the south side of Hampstead Garden Suburb, close to the Heath Extension, Temple Fortune and Golders Green.2 bedrooms, bathroom/WC, galley style kitchen, cosy reception room...",Apartment,1,2,,Leasehold,[],"[['Golders Green ', '0.7 miles'], ['East Finchley ', '1.0 miles'], ['Brent Cross ', '1.3 miles']]","['underground', 'underground', 'underground']",Ask agent,Ask agent,Ask agent,Ask agent,True
15,85973229,"£530,000",Reduced on 14/09/2023,"Upper Maisonette, Pennine Drive, Golders Green Estate, NW2","For those who seek a turn-key abode, this elegant and meticulously refurbished first and second floor duplex apartment enjoys use of a private garden and the benefit of off street parking. This stunning property promises to deliver both the necessities and a bounty of luxury features, an...",Flat,1,2,848 sq. ft.(79 sq. m.),Share of Freehold,"['Contemporary kitchen / breakfast room', 'Private garden', 'Access to flat roof', 'Off street parking', 'Newly refurbished to exquisite standard']","[['Cricklewood ', '0.6 miles'], ['Brent Cross ', '0.7 miles'], ['Golders Green ', '0.9 miles']]","['nationalrail', 'underground', 'underground']",Ask agent,Ask agent,Ask agent,Ask agent,False
16,137969636,"£530,000",Reduced on 14/09/2023,"Pennine Drive, Golders Green Estate, London, NW2","NEWLY converted duplex apartment located in GOLDERS GREEN ESTATE, with PRIVATE section of the GARDEN at the rear. Luxurious and High standard of finish with versatile accommodation. NO ONWARD CHAIN.",Apartment,1,2,854 sq. ft.(79 sq. m.),Freehold,"['Stunning duplex apartment located in Golders Green Estate', 'Two double bedrooms', 'High end finish', 'Garden to the rear', 'Modern fitted kitchen/breakfast room', 'Viewing Highly recommended']","[['Cricklewood ', '0.6 miles'], ['Brent Cross ', '0.7 miles'], ['Golders Green ', '0.8 miles']]","['nationalrail', 'underground', 'underground']",Ask agent,Ask agent,Ask agent,Ask agent,False
17,138377699,"£529,950",Added on 07/08/2023,"Golders Court, Golders Green NW11","A deceptively spacious three bedroom top floor apartment situated in this ever popular purpose built block within the heart of Golders Green and walking distance of Golders Green Tube station, Shopping facilities, local amenities and Golders Hill Park. The apartment is set around a communal Garde...",Apartment,1,3,,Share of Freehold,"['Three bedrooms', 'Large living room', 'Separate Kitchen/Breakfast room', 'Family bathroom', 'Off street parking', 'Walking distance to Golders Green Tube station', 'Chain Free ', 'Sole Agents']","[['Golders Green ', '0.3 miles'], ['Brent Cross ', '0.6 miles'], ['Cricklewood ', '1.1 miles']]","['underground', 'underground', 'nationalrail']",Ask agent,Ask agent,Ask agent,Ask agent,False
18,119866391,"£525,000",Reduced on 25/05/2023,"Britten Close, NW11","A very well maintained apartment set within this ever popular development in close proximity of The Heath Extension, Golders Hill Park & Golders Green with its numerous shops, restaurants and transport facilities. Arranged over two floors and offering bright & spacious accommodation thr...",Duplex,2,2,853 sq. ft.(79 sq. m.),Leasehold,"['2 double bedrooms', 'Moments from Golders Hill Park', 'Secure parking', 'Immaculate communal gardens', 'Bright & spacious', 'Duplex']","[['Golders Green ', '0.3 miles'], ['Hampstead ', '1.1 miles'], ['Brent Cross ', '1.2 miles']]","['underground', 'underground', 'underground']",Ask agent,Ask agent,158 years left,Band: E,True
19,132848921,"£525,000",Added on 22/03/2023,Brook Lodge,"A spacious and well presented three bedroom ground floor apartment situated in this attractive mansion block within walking distance of public transport, shopping facilities and local amenities. The property benefits from large living/dining room, separate fitted kitchen, two double bedrooms, one...",Flat,1,3,894 sq. ft.(83 sq. m.),Leasehold,[],"[['Brent Cross ', '0.3 miles'], ['Hendon Central ', '0.6 miles'], ['Golders Green ', '1.0 miles']]","['underground', 'underground', 'underground']",Ask agent,Ask agent,Ask agent,Ask agent,False
20,137822822,"£525,000",Reduced on 07/09/2023,"Cheviot Gardens, NW2","The generously proportioned three bedrooms and two bathrooms provide ample space for families or those seeking room for guests and home offices. The open-plan living room serves as the heart of the home, ideal for gatherings and relaxation. The west-facing garden bathes the interior in warm su...",Flat,2,3,755 sq. ft.(70 sq. m.),Ask agent,"['Open plan living room/ kitchen', '3 bedrooms and 2 bathrooms with one en-suite', 'Wooden floors throughout', 'Private garden', 'Close to all types of transport', 'Quiet tree lined street', 'Brent Cross Shopping Centre moments away', 'Ideal for buy to live or buy to let', 'Off street parking', 'EPC rating C']","[['Cricklewood ', '0.4 miles'], ['Brent Cross ', '0.8 miles'], ['Golders Green ', '1.0 miles']]","['nationalrail', 'underground', 'underground']",Ask agent,Ask agent,Ask agent,Band: D,False
21,135471449,"£525,000",Added on 30/05/2023,"Cricklewood Lane, Cricklewood, London, NW2","This fantastic 2 bedroom garden flat features a stunning bay-fronted double bedroom, spacious reception room and conservatory with access to the private garden.",Flat,1,2,796 sq. ft.(74 sq. m.),Share of Freehold,"['Superb 2 bedroom garden flat', 'Period conversion', 'Spacious reception room', 'Conservatory', 'Private garden with patio', 'Bay-fronted double bedroom', 'Bright kitchen']","[['Cricklewood ', '0.3 miles'], ['Golders Green ', '0.9 miles'], ['Kilburn ', '1.0 miles']]","['nationalrail', 'underground', 'underground']",Ask agent,Ask agent,Ask agent,Ask agent,True
22,137817302,"£525,000",Reduced on 07/09/2023,Cheviot Gardens NW2,"Introducing a beautifully renovated ground floor flat with three bedrooms and two bathrooms, in a sought-after area near Golders Green, Brent Cross, and Childs Hill. ",Ground Flat,2,3,755 sq. ft.(70 sq. m.),Share of Freehold,[],"[['Cricklewood ', '0.4 miles'], ['Brent Cross ', '0.8 miles'], ['Golders Green ', '1.0 miles']]","['nationalrail', 'underground', 'underground']",Ask agent,Ask agent,Ask agent,Ask agent,False
23,135238244,"£525,000",Added on 24/05/2023,"North Circular Road, London","A very spacious 3 bedroom apartment situated on the ground floor of this mansion block and extremely well presented, the service charge includes hot water and heating. Located within walking distance of public transport and local amenities. Comprising very spacious reception room with door leadin...",Flat,1,3,,Leasehold,"['Modern Apartment', 'Private Balcony', 'Off Street Parking', 'Communal Gardens']","[['Brent Cross ', '0.4 miles'], ['Hendon Central ', '0.6 miles'], ['Golders Green ', '1.0 miles']]","['underground', 'underground', 'underground']",Ask agent,£3200,144 years left,Band: C,False
24,86615382,"£520,000",Added on 12/10/2023,"CREWYS ROAD, LONDON, NW2","A newly decorated bright and spacious 2 bedroom ground floor flat (47sqm-
505sqft) in this converted period property with a share of the rear garden and own
front garden. *Golders Green (Northern line) and Cricklewood Thameslink are the nearest stations and there are numerous buses to the West ...",Ground Flat,1,2,505 sq. ft.(47 sq. m.),Share of Freehold,"['NEWLY DECORATED GARDEN FLAT', '2 BEDROOMS', 'BRIGHT RECEPTION ROOM', 'OWN FRONT GARDEN', 'SHARED REAR GARDEN', 'MODERN KITCHEN', 'BATHROOM/WC', 'SHARE OF FREEHOLD / NO CHAIN', 'EPC BAND C', 'COUNCIL TAX BAND D']","[['Golders Green ', '0.6 miles'], ['Cricklewood ', '0.7 miles'], ['Hampstead ', '1.0 miles']]","['underground', 'nationalrail', 'underground']",Ask agent,Ask agent,Ask agent,Ask agent,False
25,138332249,"£500,000",Reduced on 18/10/2023,"Granville Road, London, NW2","A two double bedroom apartment located on Granville Road, NW2. This modern apartment is exceptionally well presented throughout and is approximately 885 sq. ft. The property has a semi open plan kitchen and living room with integrated appliances with doors opening on to the private terrace. Ther...",Flat,2,2,,Leasehold,"['2 bedrooms', '1 reception room', '2 bathrooms', 'Lift', 'Modern', 'Ground Floor', 'Parking', 'Terrace', 'Town/City', 'Private Parking']","[['Golders Green ', '0.5 miles'], ['Cricklewood ', '0.7 miles'], ['Brent Cross ', '0.8 miles']]","['underground', 'nationalrail', 'underground']",£275 per year,£3023.19,993 years left,Band: E,False
26,132687701,"£500,000",Reduced on 07/06/2023,"Wendover Court, Child's Hill, London, NW2","This excellent 2 bedroom ground floor flat is situated in a popular period building, and boasts attractive interiors including a generous double bedroom with built-in wardrobes.",Flat,,2,956 sq. ft.(89 sq. m.),Leasehold,"['Fabulous 2 bedroom flat', 'Imposing period building', 'Lovely wood floors throughout', 'Spacious reception room boasting a feature fireplace', 'Generous main bedroom with fitted storage', 'Well-proportioned second bedroom', 'Manicured communal gardens', 'Sought-after location']","[['Cricklewood ', '0.6 miles'], ['West Hampstead Thameslink ', '0.8 miles'], ['Hampstead ', '0.9 miles']]","['nationalrail', 'nationalrail', 'underground']",Ask agent,£5500,Ask agent,Ask agent,False
27,134419874,"£500,000",Reduced on 15/09/2023,"Hocroft Court, 
Hendon Way, NW2","Located on the second floor of this well-maintained purpose built block, this spacious two bedroom apartment with a balcony, two double bedrooms and a separate kitchen.",Flat,1,2,,Share of Freehold,"['Two double bedrooms', 'Balcony', 'Share of freehold', 'Parking']","[['Cricklewood ', '0.5 miles'], ['Golders Green ', '0.8 miles'], ['West Hampstead Thameslink ', '1.0 miles']]","['nationalrail', 'underground', 'nationalrail']",Ask agent,£3360,986 years left,Band: D,False
28,140358878,"£500,000",Reduced on 18/10/2023,"Granville Road, London, NW2","A two double bedroom apartment located on Granville Road, NW2. This comfortable, modern apartment, spanning approximately 750 sq. ft., offers a well-presented living space. It features an open plan kitchen and living area, equipped with integrated appliances. Doors from this space lead out to a ...",Flat,2,2,,Leasehold,"['2 bedrooms', '1 reception room', '2 bathrooms', 'Modern', 'Balcony', 'Parking', 'Town/City', 'Private Parking', 'Garden flat', 'Lateral']","[['Golders Green ', '0.5 miles'], ['Cricklewood ', '0.7 miles'], ['Brent Cross ', '0.8 miles']]","['underground', 'nationalrail', 'underground']",£350 per year,£3500,111 years left,Band: E,False
29,137680142,"£500,000",Added on 23/11/2022,"Finchley Road, Temple Fortune, London, NW11","Featuring modern interiors, this bright and airy 2 bedroom flat features well proportioned rooms, separate kitchen and 2 en suite rooms exceptionally well-presented throughout.",Flat,2,2,806 sq. ft.(75 sq. m.),Leasehold,"['Stunning 2 bedroom 2 bathroom flat', 'Situated on first floor', 'Close to local shops', 'Separate contemporary kitchen', 'Communal garden to rear']","[['Golders Green ', '0.7 miles'], ['Brent Cross ', '0.7 miles'], ['Hendon Central ', '1.2 miles']]","['underground', 'underground', 'underground']",£200 per year (Ask agent about the review period)When and how often your ground rent will be reviewed.Read more about ground rent review period in our glossary page.,£1500,143 years left,Ask agent,False
30,134620568,"£500,000",Reduced on 13/09/2023,"Beechcroft Avenue, Golders Green, NW11",EXCLUSIVE MARKETING AGENT - NEW PRICE - MOTIVATED TO SELL - In need of some updating this THREE BEDROOM Ground floor flat extends to 915 ft2 and is located near Golders Green Underground Station (Northern Line/Zone 3).,Flat,1,3,915 sq. ft.(85 sq. m.),Share of Freehold,"['A three bedroom ground floor apartment', 'Spacious Lounge', 'Purpose Built Block', 'Close to Golders Green Station (Northern Line/Zone 3)', 'No onward chain', 'Viewing highly recommended']","[['Golders Green ', '0.2 miles'], ['Brent Cross ', '0.7 miles'], ['Cricklewood ', '1.2 miles']]","['underground', 'underground', 'nationalrail']",Ask agent,£4774,Ask agent,Band: E,False
31,136998146,"£500,000",Added on 06/07/2023,"Prayle Grove, London, NW2","Chain free. A spacious 3 bedroom semi detached family home ideally located in a popular residential location close to the impressive regeneration area of Brent Cross town. Benefits include excellent transport links, close to shops, close to park, huge potential to update and extend (STPP), good s...",Semi-Detached,1,3,,Freehold,"['EXCELLENT TRANSPORT LINKS', 'CLOSE TO SHOPS', 'CLOSE TO PARK', 'HUGE POTENTIAL TO UPDATE AND EXTEND (STPP)', 'GOOD SIZED GARDEN', 'SOLD WITH NO CHAIN', 'COUNCIL TAX BAND D']","[['Brent Cross ', '0.3 miles'], ['Cricklewood ', '0.9 miles'], ['Hendon Central ', '0.9 miles']]","['underground', 'nationalrail', 'underground']",Ask agent,Ask agent,Ask agent,Band: TBC,False
32,137222237,"£500,000",Added on 11/07/2023,"Sandringham Road, Golders Green, London, NW11","EXCLUSIVE MARKETING AGENT Exquisite two double bedroom duplex apartment located in Golders Green and close to Brent Cross underground station. Benefitting from spacious reception, modern eat in kitchen and no onward chain.",Apartment,1,2,832 sq. ft.(77 sq. m.),Share of Freehold,"['Stunning two bedroom duplex style apartment', 'Golders Green location near Brent Cross Underground station (Zone3/Northern Line)', 'Good size reception spanning the width of the building', 'Modern eat in kitchen/dining room', 'Fitted bathroom suite', 'No onward chain']","[['Brent Cross ', '0.3 miles'], ['Golders Green ', '0.7 miles'], ['Hendon Central ', '1.0 miles']]","['underground', 'underground', 'underground']",Ask agent,Ask agent,Ask agent,Band: D,True
33,127850843,"£500,000",Reduced on 23/01/2023,"Heathway Court, Finchley Road, Hampstead, NW3","A beautifully presented ground floor two bedroom apartment set within a portered purpose built mansion block. The property has been recently refurbished throughout and boasts a great size reception room with high ceilings and lots of light, stylish kitchen with integrated appliances, two spaciou...",Apartment,1,2,,Leasehold,"['Two bedrooms', 'One bathroom', 'Porter', 'Communal gardens', 'Off street parking on a first come first serve basis', 'Leasehold']","[['Golders Green ', '0.6 miles'], ['Cricklewood ', '0.8 miles'], ['Hampstead ', '0.9 miles']]","['underground', 'nationalrail', 'underground']",£0 per year,£3741,972 years left,Band: TBC,True
34,132293033,"£500,000",Added on 06/03/2023,"Hamilton Road, London, NW11","CHAIN FREE! A 2 DOUBLE BEDROOM GROUND FLOOR apartment with an exceptionally GOOD SIZED GARDEN ideally situated close to tube station and local shopping facilities. Benefits include: en suite shower room, family bathroom, modern interior, own garden, long lease, convenient location and sold with n...",Apartment,2,2,,Leasehold,"['EN SUITE SHOWER ROOM', 'FAMILY BATHROOM', 'MODERN INTERIOR', 'OWN GARDEN', 'LONG LEASE', 'CONVENIENT LOCATION', 'SOLD WITH NO CHAIN']","[['Brent Cross ', '0.2 miles'], ['Golders Green ', '0.8 miles'], ['Hendon Central ', '0.9 miles']]","['underground', 'underground', 'underground']",£0 per year,£0,Ask agent,Band: TBC,False
35,135521456,"£497,750",Reduced on 27/06/2023,"Hendon Way, London, NW2",A beautiful two bedroom ground floor garden flat with private parking situated in Hendon Way NW2 for sale. ,Flat,1,2,,Leasehold,"['Service Charge : 29% share of maintenance needed and approved by 4 flats.', 'Ground Rent : Peppercorn', 'Council tax : D', 'Monthly rent : £2300,   ROI : 5%']","[['Cricklewood ', '0.5 miles'], ['Golders Green ', '0.7 miles'], ['Brent Cross ', '0.9 miles']]","['nationalrail', 'underground', 'underground']",Ask agent,Ask agent,117 years left,Ask agent,False
