,id,price,added_reduced,address,description,price_change_date,price_change_value,type_house,bathrooms,bedrooms,size,tenure,key_features,close_stations,close_stations_type,tenure_ground_rent,tenure_annual_service_charge,tenure_lease_length,council_tax_band
0,136348346,"£550,000",Added on 21/06/2023,"Kitchener Road, London, N2","We offer this well presented 2 double bedroom (originally a 3 bed) first floor purpose built maisonette with direct access to own rear garden. The property is located in a highly popular residential Road, minutes from shops and amenities and within 0.5 miles from East Finchley tube (...",['21/06/2023'],"['Initial entry found: £550,000']",Maisonette,1,2,,Freehold,"['Spacious lounge/ diner', '2 double bedrooms', 'Own private garden', 'Loft storage space', '120 year lease plus freehold', 'Within 0.5 miles of East Finchley tube', 'Gas central heating', 'Chain free']","[['East Finchley ', '0.3 miles'], ['Highgate ', '1.3 miles'], ['Finchley Central ', '1.3 miles']]","['underground', 'underground', 'underground']",Ask agent,Ask agent,Ask agent,Ask agent
1,137985692,"£550,000",Added on 28/07/2023,"Princes Avenue, London","This well laid out, two double bedroom ground floor flat situated in the heart of Muswell Hill boasts a separate kitchen, a spacious reception room and two private patios. This flat is offered on a chain free basis ideal for first time buyers.",['28/07/2023'],"['Initial entry found: £550,000']",Flat,1,2,,Share of Freehold,"['Ground Floor', 'Heart of Muswell Hill', 'Private Patio', 'Spacious Reception Room', 'Wooden Floors Throughout', 'Ample Storage Space']","[['Highgate ', '0.9 miles'], ['East Finchley ', '0.9 miles'], ['Alexandra Palace ', '1.2 miles']]","['underground', 'underground', 'nationalrail']",Ask agent,Ask agent,Ask agent,Ask agent
2,138360038,"£550,000",Added on 06/07/2023,"Archway Road, Highgate, N6","A large two bedroom garden flat with within an period property. The property comprises of a reception room which leads onto a private garden, a separate kitchen, two double bedrooms and a three piece bathroom. Situated directly opposite Highgate Woods the property is ideally located moments from...",['08/08/2023'],"['Initial entry found: £550,000']",Flat,1,2,,Share of Freehold,[],"[['Highgate ', '0.1 miles'], ['East Finchley ', '1.1 miles'], ['Archway ', '0.9 miles']]","['underground', 'underground', 'underground']",Ask agent,Ask agent,Ask agent,Ask agent
3,136984064,"£550,000",Added on 06/07/2023,"Archway Road, Highgate, N6","A large two bedroom garden flat with within an period property. The property comprises of a reception room which leads onto a private garden, a separate kitchen, two double bedrooms and a three piece bathroom. Situated directly opposite Highgate Woods the property is ideally located moments from...",['06/07/2023'],"['Initial entry found: £550,000']",Flat,1,2,,Share of Freehold,[],"[['Highgate ', '0.1 miles'], ['East Finchley ', '1.1 miles'], ['Archway ', '0.9 miles']]","['underground', 'underground', 'underground']",Ask agent,Ask agent,Ask agent,Ask agent
4,135009719,"£550,000",Added on 20/05/2023,"Kitchener Road, East Finchley, N2",Situated in this residential turning off East Finchley High Road within walking distance to local shops and amenities and conveniently located in the catchment area for a number of popular schools including the Archer Academy is this well presented three bedroom first floor maisonette. The proper...,['19/05/2023'],"['Initial entry found: £550,000']",Apartment,1,3,776 sq. ft.(72 sq. m.),Leasehold,"['Three Bedrooms', 'First Floor Maisonette', 'Modern Kitchen Diner', 'Own Garden', 'Close to Shops', 'Catchment for Popular Schools']","[['East Finchley ', '0.3 miles'], ['Highgate ', '1.3 miles'], ['Finchley Central ', '1.3 miles']]","['underground', 'underground', 'underground']",£250 per year (Ask agent about the review period)When and how often your ground rent will be reviewed.Read more about ground rent review period in our glossary page.,£1515,105 years left,Band: D
5,132069758,"£550,000",Added on 28/02/2023,"Kings Avenue, Muswell Hill","A bright & airy second floor two bedroom, garden facing, Edwardian conversion in this prime location of Muswell Hill. Providing spacious accommodation & good decor throughout.",['28/02/2023'],"['Initial entry found: £550,000']",Flat,1,2,,Leasehold,"['Period conversion ', 'Two bedrooms', 'Open plan kitchen ', 'Double glazed windows', 'Outstanding schools', 'Prime location ', 'Leasehold']","[['East Finchley ', '0.8 miles'], ['Highgate ', '1.0 miles'], ['Alexandra Palace ', '1.3 miles']]","['underground', 'underground', 'nationalrail']",Ask agent,Ask agent,Ask agent,Ask agent
6,134968082,"£535,000",Added on 18/05/2023,"Shepherds Hill, Highgate, London, N6",A delightful first floor 1 bedroom converted apartment within this imposing period mansion. This charming flat benefits from an exceptional 20' x 10' Southerly facing private roof terrace overlooking stunning communal gardens.,['18/05/2023'],"['Initial entry found: £535,000']",Apartment,1,1,,Share of Freehold,['Southerly Facing Living Room with Doors to 20ft Southerly Facing Roof Terrace * Fitted Double Bedroom * Fitted Kitchen * Bathroom WC * Huge Southerly Communal Gardens * Entirely Rear (truncated)'],"[['Highgate ', '0.3 miles'], ['Archway ', '0.8 miles'], ['Upper Holloway ', '1.1 miles']]","['underground', 'underground', 'overground']",£0 per year,£1380,146 years left,Band: D
7,133626629,"£520,000",Added on 14/04/2023,"Kitchener Road, London, N2","A spacious three bedroom first floor purpose built maisonette situated in this highly popular residential road, minutes from shops and bus routes at East Finchley High Road, and within 0.5 mile of East Finchley tube (Zone 3). Offered chain free, with a new 125 year lease, the property has the ...",['14/04/2023'],"['Initial entry found: £520,000']",Maisonette,1,3,,Leasehold,"['Three Bedrooms', 'Gas Central Heating', 'Chain Free', 'New 125 Year Lease', 'Own Rear Garden', 'Close to Shops and Tube Station', 'Good Size Kitchen', 'Part Double Glazed']","[['East Finchley ', '0.2 miles'], ['Highgate ', '1.2 miles'], ['Finchley Central ', '1.4 miles']]","['underground', 'underground', 'underground']",Ask agent,Ask agent,Ask agent,Ask agent
8,131616332,"£515,000",Added on 11/02/2023,"Kitchener Road, London, N2",A fantastic opportunity to refurbish this three-bedroom first floor purpose-built maisonette featuring its own front door and direct access to a private double width garden.,['11/02/2023'],"['Initial entry found: £515,000']",Maisonette,1,3,,Freehold,"['Three Bedrooms', 'Kitchen/Diner', 'First Floor', 'Purpose Built Maisonette', 'Private Garden', 'Own Front Door', 'Fantastic Location', 'East Finchley Tube Station 0.3 Miles', 'Several Ofsted Outstanding Schools Nearby']","[['East Finchley ', '0.3 miles'], ['Highgate ', '1.3 miles'], ['Finchley Central ', '1.3 miles']]","['underground', 'underground', 'underground']",Ask agent,Ask agent,Ask agent,Band: D
9,132533267,"£500,000",Added on 15/08/2022,"29, Queens Avenue, London, N10 3RQ","A first floor 2 double bedroom flat with open plan kitchen/living/diner with attractive fireplace
in a lovely HMO building with access to a great shared garden and friendly neighbours in the sought-after area of Muswell hill, London.",['14/03/2023'],"['Initial entry found: £500,000']",Flat,1,2,,Freehold,[],"[['Highgate ', '0.9 miles'], ['East Finchley ', '1.0 miles'], ['Alexandra Palace ', '1.1 miles']]","['underground', 'underground', 'nationalrail']",Ask agent,Ask agent,Ask agent,Ask agent
10,134614412,"£500,000",Added on 10/05/2023,"North Hill, Highgate, N6","A spacious two bedroom third floor flat, with lift access, situated in a sought after 1920`s, Art Deco purpose built block within close walking distance to Highgate Underground Station. The accommodation comprises a reception room with balcony, separate kitchen, two double bedrooms and bathroom.",['10/05/2023'],"['Initial entry found: £500,000']",Apartment,1,2,638 sq. ft.(59 sq. m.),Share of Freehold,"['Purpose Built Art-Deco Apartment', 'Third Floor With Lift Access', 'South-West Facing Balcony', 'Wooden Floors', 'Close To Highgate Underground Station', 'Chain Free']","[['Highgate ', '0.3 miles'], ['East Finchley ', '0.8 miles'], ['Archway ', '1.2 miles']]","['underground', 'underground', 'underground']",£100 per year (Ask agent about the review period)When and how often your ground rent will be reviewed.Read more about ground rent review period in our glossary page.,£7100,995 years left,Band: D
11,135436523,"£500,000",Added on 30/05/2023,"North Hill, Highgate, N6","A spacious two bedroom second floor flat, with lift access, situated in a sought after 1920s, Art Deco purpose built block within close walking distance to Highgate Underground Station. The accommodation comprises a reception room with balcony, separate kitchen, two double bedrooms and bathroom.",['30/05/2023'],"['Initial entry found: £500,000']",Apartment,1,2,559 sq. ft.(52 sq. m.),Share of Freehold,"['Art Deco Purpose Built Apartment', 'South-East Facing Balcony', 'Wooden Floors Throughout', 'Double Glazed Windows', 'Second Floor With Lift Access', 'Close To Highgate Tube']","[['Highgate ', '0.3 miles'], ['East Finchley ', '0.8 miles'], ['Archway ', '1.2 miles']]","['underground', 'underground', 'underground']",£100 per year (Ask agent about the review period)When and how often your ground rent will be reviewed.Read more about ground rent review period in our glossary page.,£5408,988 years left,Band: D
12,133098251,"£490,000",Added on 30/03/2023,"Heath View, East Finchley, London, N2",Spacious two double bedroom first floor maisonette with modern fitted kitchen and bathroom. Early viewings are highly recommended. ,['30/03/2023'],"['Initial entry found: £490,000']",Maisonette,1,2,,Leasehold,"['2 Bedrooms', 'Large open plan living space', 'Bright and spacious with large windows', 'Fitted kitchen', 'Private front door/entrance', 'Amazing views of gardens', 'Free on-street parking', 'Long lease']","[['East Finchley ', '0.5 miles'], ['Finchley Central ', '1.1 miles'], ['Golders Green ', '1.3 miles']]","['underground', 'underground', 'underground']",£0 per year,£1200,938 years left,Band: E
13,134736884,"£485,000",Reduced on 04/07/2023,"North Hill, Highgate, London, N6",A charming ground floor 1 bedroom apartment within an attractive Victorian property (built 1877) known as Springfield Cottages. This well proportioned apartment enjoys direct access to a patio area with communal gardens beyond. Highgate Station is approx 0.5 miles & Highgate Village ...,"['04/07/2023', '12/05/2023']","['Price changed from £525,000 to £485,000', 'Initial entry found: £525,000']",Apartment,1,1,,Leasehold,['Charming Living Room with Bay Window * Fitted Double Bedroom * 14 x 10 Kitchen Diner with Door to Gardens * Modern Bathroom WC * Patio Area leading to Communal Gardens * Brick Built (truncated)'],"[['Highgate ', '0.4 miles'], ['East Finchley ', '0.6 miles'], ['Archway ', '1.3 miles']]","['underground', 'underground', 'underground']",£0 per year,£0,91 years left,Band: C
14,135846965,"£475,000",Added on 08/06/2023,"The Causeway, East Finchley N2","Situated in this popular tree lined residential location off East End Road and conveniently located within minutes’ walk of East Finchley tube station is this well presented two double bedroom, lower ground floor purpose built apartment. The property is offered chain free and benefits from an app...",['08/06/2023'],"['Initial entry found: £475,000']",Apartment,1,2,944 sq. ft.(88 sq. m.),Leasehold,"['Two Double Bedrooms', 'Close to Tube Station', 'Modern Kitchen With Integrated Appliances', 'Chain Free', 'Private Front and Rear Garden', 'Allocated Off Street Parking', 'Long Lease']","[['East Finchley ', '0.1 miles'], ['Highgate ', '1.2 miles'], ['Finchley Central ', '1.4 miles']]","['underground', 'underground', 'underground']",£10 per year (Ask agent about the review period)When and how often your ground rent will be reviewed.Read more about ground rent review period in our glossary page.,£1100,170 years left,Band: D
15,134918882,"£475,000",Reduced on 04/07/2023,"Park Gate, East Finchley","A delightful ground floor 2 bedroom flat featuring a generous reception room leading out to a private garden, a stylish bathroom and contemporary kitchen as well as off street parking.","['04/07/2023', '17/05/2023']","['Price changed from £490,000 to £475,000', 'Initial entry found: £490,000']",Flat,1,2,,Leasehold,"['Two bedrooms', 'Spacious living room', 'Private garden', 'Excellent transport links', 'Contemporary kitchen', 'Off street parking', 'Ground floor', 'EPC - C']","[['East Finchley ', '0.4 miles'], ['Finchley Central ', '1.2 miles'], ['Highgate ', '1.4 miles']]","['underground', 'underground', 'underground']",Ask agent,Ask agent,Ask agent,Ask agent
16,134159906,"£475,000",Reduced on 12/06/2023,"Lyttelton Court, Hampstead Garden Suburb, N2","A beautifully presented two double bedroom ground floor apartment set within this imposing block located in the Hampstead Garden Suburb, N2. The property has been maintained to a very high standard and offers large living space, large kitchen, bathroom, vast amounts of storage, balcony, residents...","['12/06/2023', '27/04/2023']","['Price changed from £495,000 to £475,000', 'Initial entry found: £495,000']",Apartment,1,2,,Leasehold,"['Two Double Bedrooms', 'Large Reception', 'Large Kitchen', 'Bathroom', 'Balcony', 'Good Storage', 'Residents Off Street Parking', 'Chain Free']","[['East Finchley ', '0.6 miles'], ['Golders Green ', '1.2 miles'], ['Finchley Central ', '1.2 miles']]","['underground', 'underground', 'underground']",Ask agent,Ask agent,141 years left,Ask agent
17,135705539,"£465,000",Reduced on 07/06/2023,"Parkland Views, Muswell Hill, London, N10","A luxury 1 bedroom apartment with terrace located in the heart of Muswell Hill, on the door step of the Broadway. Ready to move in. This prestigious development benefits a concierge, residents' gym & underground parking There is a variety of different apartments to choose from so enquire today","['07/06/2023', '05/06/2023']","['Price changed from £485,000 to £465,000', 'Initial entry found: £485,000']",Apartment,1,1,,Leasehold,"['Luxury Development', 'Immaculately Presented', 'Chain Free and Ready to Move In', 'High Ceilings', 'Concierge ', 'Underground Parking ', 'Residents Gym', 'Incentives available*']","[['Highgate ', '0.9 miles'], ['East Finchley ', '1.0 miles'], ['Alexandra Palace ', '1.1 miles']]","['underground', 'underground', 'nationalrail']",£0 per year,£0,124 years left,Band: F
18,131476736,"£450,000",,"Leicester Mews, East Finchley N2","Cash buyers only!!! Situated in this popular mews off Leicester Road and within walking distance to local shops, amenities and East Finchley tube station is this well presented B1 category C (light industrial) freehold building. The property has potential to be converted into a two bedroom mews h...",['07/02/2023'],"['Initial entry found: £450,000']",Plot,1,2,870 sq. ft.(81 sq. m.),,"['Unmodernised B1 Category C', 'Two Bedrooms', 'Character Features', 'Modern Kitchen', 'Popular Location', 'Courtyard Garden', 'Potential To Be Converted (STPP)', 'Chain Free', 'Bathroom']","[['East Finchley ', '0.3 miles'], ['Highgate ', '1.2 miles'], ['Finchley Central ', '1.4 miles']]","['underground', 'underground', 'underground']",Ask agent,Ask agent,Ask agent,Ask agent
19,127188098,"£450,000",Reduced on 27/06/2023,"Market Place, London, N2","Edwardian conversion, two double bedroom garden flat ideally located to local shopping and transport facilities. The property is being offered for sale chain free.","['27/06/2023', '22/03/2023', '16/11/2022', '22/09/2022']","['Price changed from £475,000 to £450,000', 'Price changed from £499,950 to £475,000', 'Price changed from £515,000 to £499,950', 'Initial entry found: £515,000']",Apartment,1,2,,Leasehold,"['Reception Room', 'Two Double Bedrooms', 'Kitchen', 'Bathroom', 'Courtyard Garden', 'Chain Free']","[['East Finchley ', '0.2 miles'], ['Highgate ', '1.2 miles'], ['Finchley Central ', '1.3 miles']]","['underground', 'underground', 'underground']",£400 per year,£85,90 years left,Band: C
20,138648161,"£450,000",Added on 15/08/2023,"Widecombe Court, Lyttelton Road, East Finchley, London, N2","We are pleased to offer this well-presented two bedroom first floor purpose built apartment with private balcony entrance and storage. The property is conveniently located for East Finchley underground station, an array of shops, bars and restaurants, as well as ample local recreational parkland,...",['15/08/2023'],"['Initial entry found: £450,000']",Apartment,1,2,,Leasehold,"['Purpose built development', 'First floor', 'Spacious throughout', 'Two double bedrooms', 'Large Reception room', 'Eat-in kitchen', 'Private balcony & Storage', 'Communal grounds']","[['East Finchley ', '0.4 miles'], ['Golders Green ', '1.3 miles'], ['Highgate ', '1.3 miles']]","['underground', 'underground', 'underground']",£100 per year,£1630,91 years left,Band: D
21,86065026,"£445,000",Reduced on 09/05/2023,"Aylmer Road, East Finchley","A two bedroom converted bungalow with two bathrooms, reception room and a kitchen breakfast room, quietly positioned amongst the communal gardens.","['09/05/2023', '17/04/2023', '24/03/2023', '23/02/2023']","['Price changed from £495,000 to £445,000', 'Price changed from £525,000 to £495,000', 'Price changed from £575,000 to £525,000', 'Initial entry found: £575,000']",House,2,2,,Leasehold,"['Two Bedrooms', 'Bathroom', 'En Suite Shower', 'Reception Room', 'Kitchen', 'Communal Gardens']","[['East Finchley ', '0.5 miles'], ['Highgate ', '0.6 miles'], ['Archway ', '1.5 miles']]","['underground', 'underground', 'underground']",Ask agent,Ask agent,Ask agent,Ask agent
22,137654030,"£425,000",Added on 12/05/2023,"New Ash Close, East Finchley, London, N2","This amazing 2 bed flat is situated on second floor and it offers 2 bright double bedrooms, spacious reception and modern kitchen and bathroom.",['20/07/2023'],"['Initial entry found: £425,000']",Flat,1,2,569 sq. ft.(53 sq. m.),Leasehold,"['Amazing 2 bed flat', 'Bright and spacious bedrooms', 'Modern kitchen and bathroom', 'Close to schools and local amenities', 'Easy transport links']","[['East Finchley ', '0.4 miles'], ['Finchley Central ', '1.2 miles'], ['Highgate ', '1.4 miles']]","['underground', 'underground', 'underground']",Ask agent,Ask agent,Ask agent,Ask agent
23,131197277,"£425,000",Reduced on 28/02/2023,"Bishops Road, Highgate Village ,London, N6","LitLitchfields is pleased to offer a top floor (2nd) one bedroom flat set in a quiet, semi-detached period conversion in Highgate Village. The flat is offered chain free with a long lease and share of freehold. This bright and airy apartment is in good internal condition and our seller informs us...","['28/02/2023', '30/01/2023']","['Price changed from £450,000 to £425,000', 'Initial entry found: £450,000']",Apartment,1,1,,Share of Freehold,"['Chain Free', 'Top floor conversion ( 2nd)', 'Reception  room', 'Double Bedroom', 'Kitchen', 'Bathroom', 'Share of Freehold', 'Close to local Shops', 'close to Highgate Woods', 'within 500 yards approx of Highgate underground station']","[['Highgate ', '0.1 miles'], ['East Finchley ', '0.9 miles'], ['Archway ', '1.0 miles']]","['underground', 'underground', 'underground']",Ask agent,Ask agent,Ask agent,Band: C
24,137822984,"£415,000",Reduced on 17/08/2023,"Tetherdown, Muswell Hill, London, N10","Set on the ground floor of a stunning period conversion this beautifully finished 1 bedroom flat offers an incredible Garden and wonderfully bright and airy interiors, with an exceptional bay-fronted reception room.","['17/08/2023', '24/07/2023']","['Price changed from £425,000 to £415,000', 'Initial entry found: £425,000']",Flat,1,1,488 sq. ft.(45 sq. m.),Share of Freehold,"['Excellent 1 bedroom apartment', 'Set in a stunning period conversion', 'Good-sized private garden', 'Large reception room with ample space to dine', 'Charming fitted modern kitchen', 'Well-presented throughout']","[['East Finchley ', '0.8 miles'], ['Highgate ', '1.0 miles'], ['Alexandra Palace ', '1.3 miles']]","['underground', 'underground', 'nationalrail']",Ask agent,Ask agent,Ask agent,Ask agent
25,115147133,"£390,000",Reduced on 01/03/2023,"Creighton Avenue, East Finchley, London, N2","Newly decorated, one bedroom garden flat with its own private entrance, set within an attractive converted church on a tree lined avenue. Other benefits include private gated parking, a share of the freehold, and no onward chain.","['01/03/2023', '16/09/2022', '30/05/2022', '04/01/2022', '21/10/2021']","['Price changed from £400,000 to £390,000', 'Price changed from £415,000 to £400,000', 'Price changed from £425,000 to £415,000', 'Price changed from £435,000 to £425,000', 'Initial entry found: £435,000']",Apartment,1,1,,Share of Freehold,"['Converted Church', 'Original Features', 'Chain Free', 'Private Entrance', 'Off Street Parking', 'Share of Freehold', 'Garden']","[['East Finchley ', '0.5 miles'], ['Finchley Central ', '1.2 miles'], ['Highgate ', '1.4 miles']]","['underground', 'underground', 'underground']",£0 per year,£665.64,90 years left,Band: D
26,123255245,"£390,000",Added on 06/01/2023,"Muswell Hill Road, Muswell Hill",A one bedroom apartment on the first floor of an Edwardian double fronted period conversion with a balcony situated only moments away from Muswell Hill Broadway.,['12/05/2022'],"['Initial entry found: £390,000']",Flat,1,1,441 sq. ft.(41 sq. m.),Share of Freehold,"['Period Conversion', 'Balcony', 'First Floor', 'Moments Away From Muswell Hill Broadway', 'Share of Freehold', 'Chain Free']","[['Highgate ', '0.7 miles'], ['East Finchley ', '0.8 miles'], ['Alexandra Palace ', '1.4 miles']]","['underground', 'underground', 'nationalrail']",Ask agent,£432,998 years left,Band: C
27,131216048,"£385,000",Added on 30/01/2023,"Summersby Road, Highgate, N6","A one bedroom garden flat situated in a sought after location close to Highgate Underground Station. Set within the Highgate conservation area, this spacious purpose-built ground floor flat with a private garden and is just a 5 minute walk to Highgate Underground station.",['30/01/2023'],"['Initial entry found: £385,000']",Flat,1,1,470 sq. ft.(44 sq. m.),Leasehold,"['Private Garden', 'Purpose Built', 'Own Entrance', 'Large Reception Room & Separate Kitchen', 'Close To Highgate Tube', 'Chain Free']","[['Highgate ', '0.2 miles'], ['East Finchley ', '0.9 miles'], ['Archway ', '1.1 miles']]","['underground', 'underground', 'underground']",£10 per year (Ask agent about the review period)When and how often your ground rent will be reviewed.Read more about ground rent review period in our glossary page.,£1754,89 years left,Band: C
