,id,price,added_reduced,address,description,type_house,bathrooms,bedrooms,size,tenure,key_features,close_stations,close_stations_type,tenure_ground_rent,tenure_annual_service_charge,tenure_lease_length,council_tax_band,sold_under_offer
542,138384098,"£795,000",Reduced on 15/09/2023,"Victoria Park Road, London, E9","A pretty two-bedroom freehold cottage for sale, overlooking Victoria Park, E9. This pretty two bedroom freehold cottage, with a gated front garden, is located within the Victoria Park Conservation Area, overlooking Victoria Park. The entrance hall leads to a largely open-plan ground floor, wit...",Terraced,1,2,,Freehold,"['2 bedrooms', '1 reception room', '1 bathroom', 'Period', 'Garden', 'Terraced', 'Town/City']","[['Homerton ', '0.4 miles'], ['Hackney Wick ', '0.4 miles'], ['Hackney Central ', '1.0 miles']]","['overground', 'overground', 'overground']",Ask agent,Ask agent,Ask agent,Band: D,False
543,140029583,"£410,000",Added on 15/09/2023,"Reedham Close, London, N17",A beautiful and extremely desirable two double bedroom flat located a few minutes walk Tottenham Hale Station. An ideal property for a first time buyer or a rental investor.,Apartment,1,2,848 sq. ft.(79 sq. m.),Leasehold,"['Shops and amenities nearby', 'Fitted Kitchen', 'Double glazing', 'Close to public transport', 'Balcony']","[['Tottenham Hale ', '0.1 miles'], ['Seven Sisters ', '0.7 miles'], ['Blackhorse Road ', '0.7 miles']]","['nationalrail', 'nationalrail', 'underground']",£0 per year,£0,Ask agent,Ask agent,False
544,140028716,"£350,000",Added on 15/09/2023,"Loddiges Road, Hackney","A one bedroom apartment in this purpose built mansion block in the heart of Hackney. The property features a separate living room, a modern kitchen and south facing balcony.",Flat,1,1,,Leasehold,"['Offers In Excess Of', 'South Facing Balcony', 'Secure Entry System', 'Lift Serviced', 'London Fields', 'Broadway Market']","[['London Fields ', '0.2 miles'], ['Hackney Central ', '0.3 miles'], ['Hackney Downs ', '0.5 miles']]","['nationalrail', 'overground', 'nationalrail']",Ask agent,Ask agent,Ask agent,Ask agent,False
545,140028407,"£325,000",Added on 15/09/2023,"Leabank View, South Tottenham ",Situated in a fantastic and unique location directly on the River Lea with stunning views over Walthamstow Wetlands is this one double bedroom first floor purpose built flat in a small quiet block offering access to South Tottenham Station and Seven Sisters Underground (Victoria Line) and Overgro...,Apartment,1,1,,Leasehold,"['One double bedroom', 'Stunning views of reservoir', 'Modern fitted kitchen ', 'Balcony', 'Ample storage space ', 'Close to transport links ', 'Contemporary decor']","[['South Tottenham ', '0.4 miles'], ['Seven Sisters ', '0.5 miles'], ['Stamford Hill ', '0.6 miles']]","['overground', 'nationalrail', 'nationalrail']",Ask agent,Ask agent,Ask agent,Ask agent,False
546,140027945,"£650,000",Added on 15/09/2023,"Anderson Square, Islington, London, N1",Set in a hugely desirable modern development in the heart of Angel is this fantastic two bedroom flat which is set over the second floor and spans 649sqft of usable space. The living room offers ample space for entertaining and offers wonderful views over stunning residents gardens whilst the sep...,Apartment,1,2,,Leasehold,[],"[['Essex Road ', '0.3 miles'], ['Angel ', '0.4 miles'], ['Highbury & Islington ', '0.6 miles']]","['nationalrail', 'underground', 'nationalrail']",£0 per year,£0,Ask agent,Band: F,False
547,140026817,"£325,000",Added on 15/09/2023,"Rosedene Terrace, Leyton, London","A spacious one bedroom purpose built apartment located in a well appointed modern development on Rosedene Terrace. The property has a very contemporary style and boasts a large open plan kitchen and lounge with an island breakfast bar, the bedroom is a generously sized double with bui...",Apartment,1,1,,Leasehold,"['Spacious one bedroom apartment', 'Good order throughout', 'Great first time purchase', '2nd floor', 'Contemporary design', 'Juliet balcony', 'Open plan kitchen lounge', 'Short walk to Leyton Midland Station', 'Private parking']","[['Leyton Midland Road ', '0.5 miles'], ['Leyton ', '0.6 miles'], ['Leytonstone High Road ', '1.0 miles']]","['overground', 'underground', 'overground']",£0 per year,£0,110 years left,Band: B,False
548,140025320,"£1,100,000",Added on 15/09/2023,"Graham Road, Hackney","A three bedroom period conversion, split over three floors, with a private garden and off street parking. The property has been extended at the rear with an open plan kitchen/diner and glass bi-fold doors. It retains many of its period features; wooden flooring, marble fireplaces, cornicing and i...",House,2,3,,Share of Freehold,"['Three Bedrooms', 'Two Bathrooms', 'Share of Freehold', 'Chain Free', 'Private Garden', 'Off Street Parking']","[['Hackney Downs ', '0.2 miles'], ['Hackney Central ', '0.3 miles'], ['London Fields ', '0.4 miles']]","['nationalrail', 'overground', 'nationalrail']",Ask agent,Ask agent,Ask agent,Ask agent,False
549,138101333,"£275,000",Reduced on 15/09/2023,"Kirkwall Place, London, E2",Spacious studio flat with a parking space situated on the first floor of this purpose built block in vibrant Bethnal Green,Flat,1,1,,Leasehold,"['First Floor', 'Separate kitchen', 'Bethnal Green station', 'Cambridge Heath station', 'Victoria Park', 'Bright and airy', 'Great Investment', 'Allocated car parking']","[['Bethnal Green (Underground) ', '0.2 miles'], ['Cambridge Heath ', '0.4 miles'], ['Stepney Green ', '0.5 miles']]","['underground', 'nationalrail', 'underground']",Ask agent,Ask agent,Ask agent,Ask agent,False
550,139584923,"£1,950,000",Added on 06/09/2023,"Lucerne Road, 
Highbury Barn, N5","A light-filled, five double bedroom Victorian bay-fronted mid-terraced family home, set on a peaceful street near Highbury Barn.",Terraced,3,5,,Freehold,"['Victorian Freehold', 'Substantial family home', 'Five double bedrooms', 'Three bathrooms', 'South facing garden', 'Fully extended, offering c 2,257 sqft of internal space (including cellar)', 'Moments from the shops at Highbury Barn and the greenery at Highbury Fields']","[['Arsenal ', '0.3 miles'], ['Drayton Park ', '0.4 miles'], ['Holloway Road ', '0.6 miles']]","['underground', 'nationalrail', 'underground']",Ask agent,Ask agent,Ask agent,Band: G,False
551,138101333,"£275,000",Reduced on 15/09/2023,"Kirkwall Place, London, E2",Spacious studio flat with a parking space situated on the first floor of this purpose built block in vibrant Bethnal Green,Flat,1,1,,Leasehold,"['First Floor', 'Separate kitchen', 'Bethnal Green station', 'Cambridge Heath station', 'Victoria Park', 'Bright and airy', 'Great Investment', 'Allocated car parking']","[['Bethnal Green (Underground) ', '0.2 miles'], ['Cambridge Heath ', '0.4 miles'], ['Stepney Green ', '0.5 miles']]","['underground', 'nationalrail', 'underground']",Ask agent,Ask agent,Ask agent,Ask agent,False
552,140023535,"£675,000",Added on 15/09/2023,"Lovelace Street, E8","Located within walking distance to Liverpool Street, the City, Old Street and Shoreditch is this excellently presented and generously proportioned two bedroom, two bathroom top (fifth) floor south-west facing contemporary apartment with a large terrace. The apartment boasts 649sqft (60.3sqm) of l...",Apartment,2,2,649 sq. ft.(60 sq. m.),Leasehold,"['Excellently presented top floor contemporary apartment.', 'South-west facing aspect offers an abundance of light.', 'Generously proportioned throughout with 649sqft (60.3sqm).', 'Spacious reception room with a stylish open-plan kitchen.', 'Two double bedrooms and two bathrooms inc. one en-suite.', 'Large south-west facing terrace with panoramic City views.', 'Plenty of built-in storage & allocated parking space.', 'Broadway Market and London Fields close by.', 'Moments from the vibrant life of Dalston and Hoxton.', 'Shoreditch, the City and Liverpool Street in easy reach.']","[['Haggerston ', '0.2 miles'], ['Hoxton ', '0.5 miles'], ['Dalston Junction ', '0.6 miles']]","['overground', 'overground', 'overground']",Ask agent,Ask agent,Ask agent,Ask agent,False
553,140022656,"£750,000",Added on 15/09/2023,"Columbia Road, London","A two-bedroom modern apartment situated by the famous Sunday Flower Market, this very bright property offers open plan living, parquet flooring, a fantastic bathroom and a south-facing private balcony with market and city views.",Flat,1,2,,Leasehold,"['Overlooks parks', 'Floor to ceiling windows', 'Famous flower market', 'Private balcony', 'No passing traffic', 'Great location', 'Easy access to the City']","[['Hoxton ', '0.4 miles'], ['Cambridge Heath ', '0.4 miles'], ['Bethnal Green (Underground) ', '0.6 miles']]","['overground', 'nationalrail', 'underground']",Ask agent,Ask agent,Ask agent,Ask agent,False
554,140021999,"£575,000",Added on 15/09/2023,"Commercial Street, Spitalfields","A one bedroom apartment located on the second floor in one of the City's most sought after developments, the Exchange Building. The apartment has an open-plan living room/kitchen with large windows throughout.",Flat,1,1,,Ask agent,"['One Bedroom', 'Unique Conversion', 'Large Windows', 'Parking', '24 Hour Concierge', 'Lift Access']","[['Shoreditch High Street ', '0.1 miles'], ['Liverpool Street ', '0.4 miles'], ['Aldgate East ', '0.4 miles']]","['overground', 'nationalrail', 'underground']",Ask agent,Ask agent,Ask agent,Ask agent,False
555,138611297,"£695,000",Reduced on 15/09/2023,"Bateman's Row, London, EC2A","*** This property is EWS1 compliant. A certificate can be provided upon request. *** Presenting an exceptional opportunity, this property unveils an expansive one bedroom apartment, exceeding the standard size, complete with a dedicated study area. Nestled within the highly sought-afte...",Apartment,1,1,,Leasehold,"['Separate study/home office/ second reception room', 'EWS1 compliant', '950+ square feet', 'One bedroom apartment', 'Excellent transport links']","[['Shoreditch High Street ', '0.2 miles'], ['Old Street ', '0.4 miles'], ['Hoxton ', '0.4 miles']]","['overground', 'nationalrail', 'overground']",Ask agent,Ask agent,Ask agent,Ask agent,False
556,140020871,"£475,000",Added on 15/09/2023,"Manor Road, Leyton, E10",A beautifully presented and unique two bedroom apartment benefitting from a private terraced area which is accessed via a spacious lounge.,Apartment,1,2,625 sq. ft.(58 sq. m.),Share of Freehold,"['Unique two bedroom apartment', 'Secluded private terraced area - accessed from lounge', 'Light and airy with numerous sky lights throughout', 'Sold with Share of Freehold', 'Private Development of only 3 unique apartments', 'Secure and private location']","[['Leyton Midland Road ', '0.5 miles'], ['Lea Bridge0.8 miles'], ['Walthamstow Queens Road ', '0.8 miles']]","['overground', 'nationalrail', 'overground']",£0 per year,£0,Ask agent,Band: TBC,False
557,140019773,"£550,000",Added on 15/09/2023,"85 Royal Mint Street, London, Essex",Larger than average luxury studio apartment located on the 8th floor within the prestigious Royal Mint Gardens development in Aldgate. Located within a short walk into The City and minutes from the DLR and London Underground.,Apartment,1,1,,Ask agent,"['Large Studio Apartment', '460 sqft', 'Balcony', '8th Floor', 'Integrated Siemens Appliances', '0.1 mile to Tower Hill Station', '24-hour Concierge', ""Resident's Pool & Gym""]","[['Tower Hill ', '0.1 miles'], ['Tower Gateway ', '0.1 miles'], ['Aldgate ', '0.3 miles']]","['underground', 'dlr', 'underground']",Ask agent,Ask agent,Ask agent,Band: E,False
558,140018711,"£700,000",Added on 15/09/2023,"Marcon Place, Hackney Downs, E8","A spacious three double bedroom apartment with patio garden in a recently built, private, gated development, moments from Hackney Downs Station. ",Apartment,2,3,"1,012 sq. ft.(94 sq. m.)",Leasehold,"['Private gated development', 'Three double bedrooms', 'Over 1000 square feet of internal living space', 'Secure bike storage', 'Patio garden', 'Vacant Possession', 'Chain Free', 'Close to Hackney Downs Station']","[['Hackney Downs ', '0.0 miles'], ['Hackney Central ', '0.2 miles'], ['London Fields ', '0.5 miles']]","['nationalrail', 'overground', 'nationalrail']",£350 per year (Ask agent about the review period)When and how often your ground rent will be reviewed.Read more about ground rent review period in our glossary page.,£3100,116 years left,Band: D,False
559,134528981,"£400,000",Reduced on 15/09/2023,"Bow Connection, E3","Price Guide £400,000 - £425,000 Set within one of East London's historical conservation areas (Fairfield Road) is this spacious two-bedroom, two bathroom apartment – Spanning 713 Sq/ft the apartment provides generous living accommodation throughout, no onward chain, and benefits from the use ...",Flat,2,2,,Leasehold,"['Communal Roof-Top Garden', 'Two Bathrooms', 'Second Floor (Lift Access)', 'Fairfield Road Conservation Area', 'Bow Road Tube Station Close By', '713 Sq/Ft Internal Living Space', 'Offered Chain Free', 'EWS1 Compliant', 'Roman Road Market Close By', 'Award Winning Victoria Park']","[['Bow Road ', '0.2 miles'], ['Bow Church ', '0.2 miles'], ['Pudding Mill Lane ', '0.5 miles']]","['underground', 'dlr', 'dlr']",£350 per year (Ask agent about the review period)When and how often your ground rent will be reviewed.Read more about ground rent review period in our glossary page.,£2500,106 years left,Band: D,False
560,140017961,"£750,000",Added on 15/09/2023,"St. Barnabas Road, Walthamstow, London, E17","This bright and spacious 5 bedroom terraced house offers plenty of storage, 5 generous size bedrooms, large and sunny garden, modern interior and great location.",Terraced,2,5,"1,218 sq. ft.(113 sq. m.)",Freehold,"['Bright and spacious 5 bed house', 'Great location within a short walk of Thomas Gamuel Park', 'Close to local amenities including several independent cafes, restaurants and shops', 'Large and sunny garden', '5 generous size bedrooms', 'Open plan living room', 'Easy transport links close to Victoria and Overground lines', 'Modern kitchen']","[['Walthamstow Queens Road ', '0.4 miles'], ['Walthamstow Central ', '0.5 miles'], ['St. James Street ', '0.6 miles']]","['overground', 'nationalrail', 'nationalrail']",Ask agent,Ask agent,Ask agent,Ask agent,False
561,137382590,"£565,000",Reduced on 15/09/2023,"Hudson Building, Aldgate","Situated on a quiet residential street off the Iconic and artistic hub that is Brick Lane is this 843 Sq/Ft, two-bedroom, two-bathroom apartment. This exceptional property occupies a wonderful position on the first floor of Hudson Building and has been designed with an open-plan layout, offering ...",Flat,2,2,,Leasehold,"['Secure Purpose Built Development', 'Iconic Brick Lane Moments Away', 'Video Entry System', '843 Sq/ft Internal Living Space', 'Two Bathrooms', 'Chain Free', 'Secure Underground Parking', 'Juliette Balcony', 'EWS1 Compliant', 'Aldgate East (District Line / Hammersmith  & City) Is The Closest Underground Tube Station']","[['Aldgate East ', '0.3 miles'], ['Aldgate ', '0.4 miles'], ['Whitechapel ', '0.4 miles']]","['underground', 'underground', 'underground']",£350 per year (Ask agent about the review period)When and how often your ground rent will be reviewed.Read more about ground rent review period in our glossary page.,£4000,107 years left,Band: C,False
562,138921533,"£725,000",Reduced on 15/09/2023,"Salcombe Road, Walthamstow, London, E17","This bright and spacious 4 bedroom house offers 4 generous size bedrooms, modern kitchen with extended dining area and sunny garden, great location.",House,2,4,"1,266 sq. ft.(118 sq. m.)",Freehold,"['Spacious 4 bed house', '1,266 sqft for internal space', 'Extended kitchen with dining area', 'Chain free', 'Downstairs WC', '4 double bedrooms', 'Great location within a short walk of local cafes, shops and amenities', 'Easy transport links including Overground and Victoria tube lines']","[['Lea Bridge0.6 miles'], ['Walthamstow Queens Road ', '0.7 miles'], ['St. James Street ', '0.7 miles']]","['nationalrail', 'overground', 'nationalrail']",Ask agent,Ask agent,Ask agent,Ask agent,False
563,140017220,"£400,000",Added on 15/09/2023,"Lea Bridge Road, Leyton, London, E10","This fantastic 2 bedroom property is situated on the ground floor, it benefits from a bright reception room, 2 sizeable bedrooms and a lovely private garden.",Flat,1,2,703 sq. ft.(65 sq. m.),Leasehold,"['Lovely 2 bedroom property on the ground floor', 'Bright reception room with space to relax and dine', 'Separate kitchen with fitted appliances', '2 sizeable bedrooms', 'Well-presented shower room', 'Lovely rear garden with space to relax and entertain', 'Moments away from amenities and transport links']","[['Lea Bridge0.2 miles'], ['St. James Street ', '0.9 miles'], ['Walthamstow Queens Road ', '1.0 miles']]","['nationalrail', 'nationalrail', 'overground']",Ask agent,Ask agent,Ask agent,Ask agent,False
564,140017217,"£400,000",Added on 15/09/2023,"Towpath Walk, Hackney, London, E9","A charming 1 bedroom flat situated on the third floor of a purpose built block boasting bright interiors throughout, lovely canal views and a quiet residential location.",Flat,1,1,583 sq. ft.(54 sq. m.),Leasehold,"['Spacious reception room', 'Separate eat-in kitchen', 'Generous bedroom', 'Bright bathroom', 'Purpose built block', 'Wonderful views of the canal', 'Quiet location', 'Moments from amenities']","[['Hackney Wick ', '0.5 miles'], ['Homerton ', '0.6 miles'], ['Stratford International ', '1.0 miles']]","['overground', 'overground', 'nationalrail']",Ask agent,Ask agent,Ask agent,Ask agent,False
565,140016305,"£675,000",Added on 15/09/2023,"Free Trade Wharf, Wapping E1W","A Southwesterly facing two bedroom apartment of 934 sq ft, offering picturesque views over the River Thames, in this iconic Riverside development adjacent the Thames Path. Set on the third floor, and offering flowing natural light throughout from a perfect Southwesterly vista, this good sized ap...",Apartment,2,2,,Share of Freehold,"['2 bedrooms', '1 reception room', '2 bathrooms', 'Extending to 934 sq ft', 'Views over communal gardens towards the River Thames', 'Landmark Riverside development', 'Wonderful panoramic views of The River Thames', 'Beautifully maintained communal grounds', 'Southwesterly facing balcony', '24hr concierge']","[['Limehouse ', '0.3 miles'], ['Shadwell ', '0.5 miles'], ['Wapping ', '0.6 miles']]","['nationalrail', 'dlr', 'overground']",£400 per year,£6500,90 years left,Band: G,False
566,140015705,"£550,000",Added on 15/09/2023,"Gloucester Drive, London N4","First Floor Two Bedroom Apartment located under 10 minutes from Finsbury Park Station, on the quiet, sought after Gloucester Drive, N4. This period conversion comprises a spacious, light reception; two good sized double bedrooms; a sleek fully-fitted kitchen and family bathroom. Convenient...",Flat,1,2,,Share of Freehold,"['Chain Free', 'High Ceilings', 'Two Double Bedrooms', 'Great for First Time Buyers', 'Large Windows / Heaps of Natural Light', 'Close to Finsbury and Clissold Park', 'Walking Distance to Local Amenities', '9 Minute Walk to Station', 'Victoria / Piccadilly Line, & National Rail', 'Viewings Highly Recommended']","[['Finsbury Park ', '0.4 miles'], ['Manor House ', '0.4 miles'], ['Arsenal ', '0.6 miles']]","['nationalrail', 'underground', 'underground']",Ask agent,Ask agent,989 years left,Band: C,False
567,140014304,"£395,000",Added on 15/09/2023,"Kelday Heights, Shadwell, E1","Presenting this charming 2-bedroom, 1-bathroom flat in E1, available without the burden of a chain. This property offers an excellent opportunity for first-time buyers or investors. Located on the 8th floor of the highly sought-after Kelday Heights development, this apartment is filled w...",Apartment,1,2,,Leasehold,"['Generous two bedroom apartment', 'Both bedrooms are spacious and of equal size', 'Private balcony with far reaching views from the 8th floor', 'Practical layout', 'Overall excellent decorative order', 'Secure parking available', 'Excellent transportation links', 'Secure development', 'Offered chain free']","[['Shadwell ', '0.1 miles'], ['Wapping ', '0.5 miles'], ['Whitechapel ', '0.5 miles']]","['dlr', 'overground', 'underground']",£250 per year (Ask agent about the review period)When and how often your ground rent will be reviewed.Read more about ground rent review period in our glossary page.,£2952,110 years left,Band: D,False
568,140014010,"£1,350,000",Added on 15/09/2023,"Esther Anne Place, Islington Square, Islington, London, N1","A stunning two bedroom apartment with a terrace in the heart of Islington with porterage, parking and excellent facilities. KEY FEATURES • Gated Community • 24-hour Concierge & Security • 1 Underground Parking Space included • Comfort C...",Apartment,2,2,,Leasehold,[],"[['Essex Road ', '0.3 miles'], ['Angel ', '0.4 miles'], ['Highbury & Islington ', '0.5 miles']]","['nationalrail', 'underground', 'nationalrail']",£0 per year,£0,Ask agent,Band: TBC,False
569,140013122,"£600,000",Added on 15/09/2023,"Weymouth Terrace, London, E2","This stylish three-bedroom split-level maisonette located in the heart of Fellows Court, is approximately 899 square feet, this contemporary residence offers a unique blend of modern design and practical living spaces. As you step inside, you'll be greeted by a spacious ground floor that's e...",Ground Flat,1,3,,Leasehold,[],"[['Hoxton ', '0.3 miles'], ['Haggerston ', '0.4 miles'], ['Cambridge Heath ', '0.7 miles']]","['overground', 'overground', 'nationalrail']",£9 per year,£1820.31,89 years left,Band: C,False
570,139287158,"£265,000",Reduced on 15/09/2023,"Medina Road, ., London, ., N7 7JU","Bright one bedroom lower ground floor flat set within an attractive Victorian property, suitable for CASH BUYERS only due to 59 year lease, and offered for sale by auction with no onward chain. Property is currently tenanted. Ideally situated within easy reach of Finsbury Park station, the pro...",Flat,1,1,,Leasehold,"['Being Sold via Secure Sale online bidding. Terms & Conditions apply.', 'One Bedroom Lower Ground Floor Flat', 'Currently Tenanted', 'Attractive Victorian Conversion', 'Close to Transport Links and Amenities', 'Cash Buyers Only', 'No Chain']","[['Arsenal ', '0.3 miles'], ['Finsbury Park ', '0.4 miles'], ['Holloway Road ', '0.5 miles']]","['underground', 'nationalrail', 'underground']",Ask agent,Ask agent,Ask agent,Band: C,False
571,139577222,"£450,000",Reduced on 15/09/2023,"Lordship Road, London, N16","Arranged over the third floor of a well-maintained purpose built block is this beautiful, modern and spacious two bedroom apartment boasting 700 sq. ft. (65 sqm.) of internal accommodation and a private balcony overlooking the reservoir. Available to view by appointment only, the proper...",Apartment,1,2,700 sq. ft.(65 sq. m.),Leasehold,"['Views of the Reservoir', 'Two Bedrooms', 'Private Balcony', 'Third Floor', 'Excellent Condition Throughout', 'Lift', 'Close to Tube Station', 'Close to Church Street']","[['Manor House ', '0.4 miles'], ['Stamford Hill ', '0.6 miles'], ['Stoke Newington ', '0.6 miles']]","['underground', 'nationalrail', 'nationalrail']",£9 per year (Ask agent about the review period)When and how often your ground rent will be reviewed.Read more about ground rent review period in our glossary page.,£1877.69,85 years left,Band: B,False
572,140012621,"£425,000",Added on 15/09/2023,"Barleycorn Way, London, E14","Visit PURPLEBRICKS.CO.UK anytime 24/7 to make arrangements to view! Purplebricks take pleasure in presenting to the market this outstanding three double bedroom top floor apartment. Boasting a hugely impressive 900 sq ft (approx) of accommodation, this represents a rare opportunity that will ...",Apartment,1,3,,Leasehold,"['Three Bedroom Top Floor Apartment', 'Highly Sought-After Narrow Street Location', ""Canary Wharf - 20 Minute Walk Approx'"", 'Great Scope And Potential', 'Easy Access To Local DLR & Bus Links', 'Secured Entrance', ""900 Square Feet Approx' Of Accommodation""]","[['Westferry ', '0.2 miles'], ['Limehouse ', '0.4 miles'], ['West India Quay ', '0.5 miles']]","['dlr', 'nationalrail', 'dlr']",£10 per year,£2121,77 years left,Band: C,False
573,138178736,"£2,000,000",Reduced on 15/09/2023,Principal Place London EC2A,"A spectacular 40th floor, 3 bedroom apartment situated in Principal Tower in the City and Shoreditch corridor, EC2. Principal Tower is in an idyllic location, a short walk to Liverpool Street Station (0.3 miles) as well as Shoreditch High Street Station (0.3 miles). The development boasts excelle...",Apartment,3,3,,Leasehold,"['3 Bedrooms', '2 Bathrooms', '40th floor', 'Balcony', 'On-site facilities including pool, spa and cinema', '24 hour concierge', '0.3 miles from Liverpool Street Station', 'Approx. 1,118 sq ft (103.9 sq m)', 'Furnished', 'EPC: B']","[['Old Street ', '0.3 miles'], ['Liverpool Street ', '0.3 miles'], ['Shoreditch High Street ', '0.3 miles']]","['nationalrail', 'nationalrail', 'overground']",Ask agent,Ask agent,Ask agent,Ask agent,False
574,137294795,"£400,000",Reduced on 15/09/2023,"Eastway, London","This part of Hackney Wick continues to be an extremely popular area among younger buyers looking to make their first purchase, due to its proximity to Victoria Park & the ease with which you can travel to Stratford international station, a hub allowing you to travel throughout London & ev...",Apartment,1,2,614 sq. ft.(57 sq. m.),Leasehold,"['Top Floor, Corner Position ', 'Loft Access', '2 Double Bedrooms', 'Lounge & Separate Kitchen', 'CHAIN FREE', 'Close to Many Amenities ']","[['Hackney Wick ', '0.3 miles'], ['Homerton ', '0.6 miles'], ['Stratford International ', '0.9 miles']]","['overground', 'overground', 'nationalrail']",Ask agent,Ask agent,Ask agent,Ask agent,False
