,id,price,added_reduced,address,description,type_house,bathrooms,bedrooms,size,tenure,key_features,close_stations,close_stations_type,tenure_ground_rent,tenure_annual_service_charge,tenure_lease_length,council_tax_band,sold_under_offer
772,137840045,"£725,000",Reduced on 13/09/2023,"Manor Road, London","This contemporary three-bedroom apartment is the perfect hideaway, tucked away in a gated development behind Bouverie Road, with short walking distance to vibrant Stoke Newington Church Street. Located on the north-west corner of this development, the flat flat is arranged over the ground & f...",Maisonette,1,3,,Share of Freehold,"['NO ONWARD CHAIN', 'THREE DOUBLE BEDROOMS', 'PRIVATE GARDEN', 'CLOSE TO CHURCH STREET', 'CLOSE TO TRANSPORT', '1172 SQFT', 'PARKING SPACE']","[['Stoke Newington ', '0.2 miles'], ['Stamford Hill ', '0.5 miles'], ['Rectory Road ', '0.7 miles']]","['nationalrail', 'nationalrail', 'nationalrail']",Ask agent,Ask agent,109 years left,Band: C,False
773,139875143,"£1,650,000",Added on 13/09/2023,"Chesholm Road, London, N16","At 1,850 sq. ft., this superb mid-terraced family home has been beautifully renovated throughout, boasting an exquisite design and finish and coming complete with a landscaped, leafy and secluded west-facing rear garden. Sitting within the ever-popular South-of-Church Street neighbourhood, this g...",Terraced,2,4,,Freehold,"['Stunning Family Home', 'Catchment to Outstanding Local Schools', 'Beautifully Refurbished with a High End Design', 'Gorgeous West-Facing Garden', 'Superb Stokey Location']","[['Rectory Road ', '0.4 miles'], ['Stoke Newington ', '0.4 miles'], ['Dalston Kingsland ', '0.8 miles']]","['nationalrail', 'nationalrail', 'overground']",Ask agent,Ask agent,Ask agent,Band: E,False
774,138613622,"£650,000",Added on 14/08/2023,"Chatham Road, Walthamstow, London, E17","Having lived here for 17 years, the current owner has modernised and extended this two bedroom Victorian mid terrace in order to create something really special. There is a reception room to the front where the original covings and feature fireplace create a clean, modern feel and having extende...",Terraced,1,2,,Freehold,"['Approx. 870 Sq. Ft.', 'Two Bedroom House', 'Extended Kitchen/Diner', 'First Floor Bathroom', 'Close to Tube', 'Immaculate Condition', 'Extension Potential', 'Council Tax Band C']","[['Blackhorse Road ', '0.4 miles'], ['St. James Street ', '0.5 miles'], ['Walthamstow Queens Road ', '0.6 miles']]","['underground', 'nationalrail', 'overground']",Ask agent,Ask agent,Ask agent,Band: C,False
775,134273351,"£300,000",Added on 29/04/2023,"Delafield House, Christian Street, London, E1","Guide Price £300,000 - £325,000. This delightful and well presented one bedroom apartment has been given a modern makeover, situated on the fifth floor of this secure purpose built development and located within minutes from Whitechapel Overground and Elizabeth Line Stations",Flat,1,1,,Leasehold,"['Fifth Floor', 'One Double Bedrooms', 'Newly Modernised', 'View of London Skyline', 'Secure Entrance', 'Private Balcony', 'Close to Whitechapel Station', 'Close to the Elizabeth Line']","[['Shadwell ', '0.3 miles'], ['Whitechapel ', '0.4 miles'], ['Aldgate East ', '0.4 miles']]","['dlr', 'underground', 'underground']",Ask agent,Ask agent,Ask agent,Band: B,False
776,139871510,"£650,000",Added on 13/09/2023,"Highbury Hill, London, N5","A lovely first floor, two bedroom apartment with private garden on Highbury Hill. With excellent access to Highbury Fields, overground, Piccadilly and Victoria lines this bright and airy flat is offered with no onward chain. The accommodation briefly comprises a living room with kitche...",Apartment,1,2,,Share of Freehold,"['Recently refurbished, bright airy first floor flat, with balcony and private garden', 'East/ west orientation, so great morning and afternoon. evening sun', 'Great transport links via Piccadilly, Victoria & Overground lines', 'EPC - D']","[['Arsenal ', '0.2 miles'], ['Drayton Park ', '0.2 miles'], ['Holloway Road ', '0.4 miles']]","['underground', 'nationalrail', 'underground']",£0 per year,£0,Ask agent,Band: TBC,False
777,139871516,"£750,000",Added on 13/09/2023,"Kelvin Road, Highbury, London, N5",A fantastic garden maisonette situated on this quiet and well situated road. Offering in excess of 68sq. meters / 735 sq. feet of living space set over two floors and with access to a private and secluded south facing garden. With its own private entrance and set over the lower groun...,Apartment,1,2,,Leasehold,"['Split level apartment, light and airy throughout', 'Great location on no through road moments from Highbury Fields', 'Super transport links via Victoria and Overground lines', 'Vacant possession offered with no onward chain']","[['Drayton Park ', '0.4 miles'], ['Canonbury ', '0.4 miles'], ['Arsenal ', '0.5 miles']]","['nationalrail', 'overground', 'underground']",£0 per year,£0,Ask agent,Band: D,False
778,139871204,"£395,000",Added on 12/09/2023,"Frith Road, Leytonstone, London","***GUIDE PRICE £395,000 - £425,000*** Situated within Leyton's most convenient and upcoming location moments from Leyton Central Tube can be found this spacious first floor two bedroom Victorian conversion. The excellent accommodation comprises communal entrance,...",Apartment,1,2,,Leasehold,"['Superb Order Throughout', 'Moments Walk to Leyton Tube Station', 'Two Bedrooms', 'Long Lease', 'Commuters Dream', 'Leyton Tube (0.2M)', 'Great first time purchase']","[['Leyton ', '0.2 miles'], ['Maryland ', '0.7 miles'], ['Leytonstone High Road ', '0.7 miles']]","['underground', 'nationalrail', 'overground']",£0 per year,£0,149 years left,Band: B,False
779,139866524,"£375,000",Added on 12/09/2023,"Shirley Road, Stratford, London, E15","Situated over 2 floors, this fantastic 3 bedroom property offers bright and comfortable living with a sizeable reception room and located in a great area.",Maisonette,2,3,798 sq. ft.(74 sq. m.),Leasehold,"['Gorgeous 3 bedroom property over 2 floors', 'Bright reception room with space to relax and dine', 'Separate kitchen with integrated appliances', '2 double bedrooms with a further single bedroom', 'Well-presented shower room', 'Finished to a high standard throughout', 'Excellent location moments away from amenities and transport links']","[['Maryland ', '0.4 miles'], ['Stratford High Street ', '0.5 miles'], ['Stratford ', '0.6 miles']]","['nationalrail', 'dlr', 'nationalrail']",Ask agent,Ask agent,Ask agent,Ask agent,False
780,138553877,"£450,000",Reduced on 12/09/2023,"Barry Blandford Way, Bow, London, E3","A stunning 2 bedroom flat situated on the 2nd floor of the 'Skyline Collection' development boasting bright and spacious accommodation throughout, a private balcony and an excellent Bow location.",Flat,1,2,765 sq. ft.(71 sq. m.),Leasehold,"['Spacious reception room', 'Modern open-plan kitchen', '2 generous bedroom', 'Stylish bathroom', 'Private balcony', 'Secure development with lift', 'Communal garden', 'Moments from amenities']","[['Devons Road ', '0.1 miles'], ['Bromley-by-Bow ', '0.3 miles'], ['Bow Church ', '0.4 miles']]","['dlr', 'underground', 'dlr']",£400 per year (Ask agent about the review period)When and how often your ground rent will be reviewed.Read more about ground rent review period in our glossary page.,£2167.68,118 years left,Ask agent,False
781,139864484,"£400,000",Added on 12/09/2023,"Curtain Road, Shoreditch EC2A","Discover a hidden gem in the heart of London's Shoreditch Triangle with this charming 1-bedroom apartment. Situated on the second floor of this boutique warehouse conversion, this stylish property offers an opportunity to experience urban living at its finest. Enjoy the benefits of abundant natu...",Apartment,1,1,,Leasehold,"['One Bedroom Apartment', '999 Year lease from 2013', 'Warehouse Conversion', 'Second Floor', 'Shoreditch Triangle', 'Currently Let Until March 2024']","[['Shoreditch High Street ', '0.3 miles'], ['Old Street ', '0.4 miles'], ['Hoxton ', '0.7 miles']]","['overground', 'nationalrail', 'overground']",£100 per year (Ask agent about the review period)When and how often your ground rent will be reviewed.Read more about ground rent review period in our glossary page.,£1755,989 years left,Band: C,False
782,135212135,"£625,000",Reduced on 12/09/2023,"John Fisher Street, London E1","Ludlowthompson are delighted to present to the market this fantastic, split -level, top floor flat, sold chain free. Located on the 4th floor comprising of a bright and airy open-plan reception rooms with fully equipped sleek kitchens with integrated high-end appliances, substantial bedrooms ...",Flat,3,3,,Leasehold,"['Fully fitted kitchen', 'Wooden floors', 'Double glazed', 'Three bedrooms three bathrooms', 'Private balcony', 'Top floor apartment', 'Bike storage and basement lockup', 'Call now on  ', 'Moments from Tower Bridge']","[['Tower Hill ', '0.2 miles'], ['Tower Gateway ', '0.2 miles'], ['Aldgate East ', '0.3 miles']]","['underground', 'dlr', 'underground']",Ask agent,£3056.85,120 years left,Band: H,False
783,139862387,"£375,000",Added on 12/09/2023,"Kettlebaston Road, Leyton","A spacious and charming one bedroom ex-Warner apartment on a tree lined residential street moments from Lea Bridge Road. These enduringly popular properties have a whole host of desirable features, including private front door, shared garden and well proportioned rooms. This gorgeous brick fronte...",Flat,1,1,608 sq. ft.(56 sq. m.),Leasehold,"['Ground Floor', 'One Bedroom', 'Chain Free', 'Own Section of Rear Garden', 'Own Front Door', 'Moments from Lea Bridge Station']","[['Lea Bridge0.2 miles'], ['St. James Street ', '1.0 miles'], ['Leyton Midland Road ', '1.1 miles']]","['nationalrail', 'nationalrail', 'overground']",£0 per year,Ask agent,137 years left,Band: B,False
784,139861202,"£600,000",Added on 12/09/2023,"Bromley Road, London","** CHAIN FREE - TERRACED HOUSE WITH GREAT POTENTIAL IN A PROMINENT LOCATION OFF LEA BRIDGE ROAD, LEYTON - VIRTUAL TOUR AVAILABLE** OC Homes is delighted to offer to the sales market, this three-bedroom terraced house ideally situated within walking distance to Walthamstow Central Station...",Terraced,1,3,"1,133 sq. ft.(105 sq. m.)",Freehold,"['POTENETIAL FOR REAR AND LOFT EXTENSION', 'IDEAL LOCATED OFF LEA BRIDGE ROAD, LEYON', 'WALKING DISTANCE TO WALTHAMSTOW CENTRAL STATION', 'IDEAL FOR FIRST TIME BUYERS AND INVESTORS', 'CHAIN FREE']","[['Leyton Midland Road ', '0.4 miles'], ['Walthamstow Central ', '0.7 miles'], ['Walthamstow Queens Road ', '0.7 miles']]","['overground', 'nationalrail', 'overground']",Ask agent,Ask agent,Ask agent,Band: C,False
785,139860902,"£415,000",Added on 12/09/2023,"Murray Grove, London, N1","Located on the fourth floor of this modern, gated developement set moments from Old Street is this fantastic, one bedroom apartment. Accommodation comprises of a generous double bedroom, family bathroom and a wonderfully bright open-plan kitchen & reception room which leads directly out to a ...",Apartment,1,1,,Leasehold,[],"[['Old Street ', '0.4 miles'], ['Hoxton ', '0.6 miles'], ['Angel ', '0.7 miles']]","['nationalrail', 'overground', 'underground']",£0 per year,£0,Ask agent,Band: C,False
786,139861886,"£815,000",Added on 12/09/2023,"Kingsland Road, London, E8",A beautifully presented three bedroom ground floor apartment.,Apartment,2,3,,Leasehold,"['Three Bedrooms', 'Great Transport Links', 'Desirable location', 'Approx 950sqft', 'No EWS1', 'EPC Rating = B']","[['Haggerston ', '0.1 miles'], ['Hoxton ', '0.4 miles'], ['Dalston Junction ', '0.6 miles']]","['overground', 'overground', 'overground']",£400 per year,£3000,103 years left,Band: D,False
787,139860482,"£285,000",Added on 12/09/2023,"Romford Road, London, E7","Set just off Romford Road, this two bedroom leasehold apartment is not to be missed! Accessible via a communal entrance, this is a first floor home with a lounge, providing access into a fitted kitchen, two bedrooms and a bathroom. Atherton leisure centre is across the road...",Apartment,1,2,,Leasehold,"['Two bedroom purpose built leasehold flat', 'Great Investment opportunity or first time purchase', 'Off Romford Road with shops within reach', 'Excellent transport links in and out of London', 'Secure gated development', 'EPC Grade D. Council Tax Band B.']","[['Maryland ', '0.4 miles'], ['Forest Gate ', '0.5 miles'], ['Wanstead Park ', '0.7 miles']]","['nationalrail', 'nationalrail', 'overground']",£0 per year,£0,Ask agent,Band: B,False
788,139859072,"£850,000",Added on 12/09/2023,"Walden Street, London, E1","Four bedroom Georgian freehold house, over four storeys situated in Walden Street.",Terraced,,3,,Freehold,"['Freehold house', 'Nestled within a gated row of Georgian houses', 'Private landscaped garden', 'Located within approximately 0.3 miles from Whitechapel station and 0.6 miles from Aldgate East', 'On-street residents parking', 'EPC Rating = D']","[['Whitechapel ', '0.2 miles'], ['Shadwell ', '0.4 miles'], ['Bethnal Green (Mainline) ', '0.5 miles']]","['underground', 'dlr', 'nationalrail']",Ask agent,Ask agent,Ask agent,Band: F,False
789,139855382,"£750,000",Added on 12/09/2023,"Skyline Apartment, Woodberry Down, Devan Grove, London, N4",** Take a look at this large dual aspect 2-bed apartment with a private balcony located at Woodberry Down.,Flat,2,2,861 sq. ft.(80 sq. m.),Leasehold,"['1st Floor & Internal Area 861 Sqft', 'Dual Aspect Private Balcony 456 Sqft - Great Lighting', '**Equipped With Premium Siemens Electric Appliances', '**Comes With Wine Cooler', '**Underfloor Heating Throughout', ""Resident's Facilities: 24hr concierge, Communal Gardens & Roof Terrace"", 'Spectacular Natural Surroundings Adjacent To 2 Beautiful Reservoirs and Finsbury Park', '**Calling For Investors! Yield 4.6%']","[['Manor House ', '0.3 miles'], ['Harringay Green Lanes ', '0.5 miles'], ['Stamford Hill ', '0.6 miles']]","['underground', 'overground', 'nationalrail']",Ask agent,Ask agent,Ask agent,Ask agent,False
790,139856318,"£1,550,000",Added on 12/09/2023,"Gibson Square, Islington",A great opportunity to own a house on one of Islington's most sought after squares. This charming property will benefit from modernisation and would make an amazing project for someone to upgrade and extend STPP,House,2,2,,Freehold,"['Freehold', 'Terraced House', 'Four Floors', 'Prime Location', 'Front and Rear Patio Garden']","[['Essex Road ', '0.4 miles'], ['Angel ', '0.4 miles'], ['Caledonian Road & Barnsbury ', '0.5 miles']]","['nationalrail', 'underground', 'overground']",Ask agent,Ask agent,Ask agent,Ask agent,False
791,139853837,"£700,000",Added on 12/09/2023,"Downsfield Road, Walthamstow, London, E17","Located in a peaceful spot but near the buzz of Walthamstow, this three-bedroom house has tasteful touches and top-to-bottom appeal. You could say it’s the whole caboodle.",Terraced,1,3,981 sq. ft.(91 sq. m.),Freehold,"['Type: Terraced house', 'Beds: Three bedrooms', 'Baths: One bathroom and downstairs WC', 'Living: Separate kitchen diner and living space', 'Garden:Alovelysecludedgarden', 'Love: Having a downstairs toilet is super handy', 'Green space: Walthamstow Wetlands and St James Park are nearby', 'Transport: Walthamstow Central Underground (0.9 miles) St James Street Overground (0.5 miles)', 'Size: 91.15 sq. m / 981 sq. ft (excluding restricted height area)', 'Status: Owners looking to move to Scotland and link the sale']","[['St. James Street ', '0.3 miles'], ['Walthamstow Queens Road ', '0.5 miles'], ['Walthamstow Central ', '0.7 miles']]","['nationalrail', 'overground', 'nationalrail']",Ask agent,Ask agent,Ask agent,Band: C,False
792,139853519,"£585,000",Reduced on 12/09/2023,"Gillman House, Pritchards Road, London","This fantastic light-filled three bedroom, third and fourth floor flat flat is part of a well-serviced block situated on a quiet street between Broadway Market and Bethnal Green. ",Maisonette,1,3,,Leasehold,[],"[['Cambridge Heath ', '0.3 miles'], ['Bethnal Green (Underground) ', '0.5 miles'], ['London Fields ', '0.6 miles']]","['nationalrail', 'underground', 'nationalrail']",£0 per year,£2221.4,174 years left,Band: C,False
793,139852316,"£700,000",Added on 12/09/2023,"Sunnyside Road, Leytonstone, London, E10","Situated over 3 floors with a cellar, this fantastic 4 bedroom house offers comfortable living with sizeable rooms and access to a rear garden.",Terraced,1,4,"1,587 sq. ft.(147 sq. m.)",Freehold,"['Excellent 4 bedroom house over 3 floors and a cellar', 'Welcoming reception room with bayed windows and lead through dining room', 'Separate kitchen with fitted appliances as well as a kitchenette on the top floor', '4 sizeable bedrooms with built in storage space', '2 well presented shower rooms', 'Rear garden with space to relax', 'Located on a peaceful residential street']","[['Leyton Midland Road ', '0.6 miles'], ['Lea Bridge0.7 miles'], ['Walthamstow Queens Road ', '1.0 miles']]","['overground', 'nationalrail', 'overground']",Ask agent,Ask agent,Ask agent,Ask agent,False
794,137912189,"£385,000",Reduced on 12/09/2023,"Tylers Court, Walthamstow, London, E17","This top floor 2 bedroom flat offers generous size bedrooms with plenty of storage, spacious reception room, modern kitchen and bathroom and great location.",Flat,1,2,829 sq. ft.(77 sq. m.),Leasehold,"['Large 2 bed flat offering 829 sqft of internal space', 'Bright and spacious living space with two generous sized double bedrooms', 'Offering sole use of the loft', 'Off road private parking', 'Spacious reception room', 'Great location moments from Walthamstow central (Victoria and Overground lines)', 'Access to a communal garden', 'Modern kitchen and bathroom']","[['Walthamstow Central ', '0.2 miles'], ['Walthamstow Queens Road ', '0.2 miles'], ['St. James Street ', '0.5 miles']]","['nationalrail', 'overground', 'nationalrail']",£200 per year (Ask agent about the review period)When and how often your ground rent will be reviewed.Read more about ground rent review period in our glossary page.,£1800,96 years left,Ask agent,False
795,139851392,"£350,000",Added on 12/09/2023,"Bow Central, Bow",Situated on the third floor of this secure gated development (Bow Central) which is now an established residential quarter of East London is this stylish one bedroom apartment. Spanning 557.1 Sq/Ft the apartment enjoys a wealth of living space with its open plan kitchen / living area.,Apartment,1,1,,Leasehold,"['Third Floor Apartment', 'Private Balcony', '980 Year Lease', '557 Sq/Ft Internal Living Space', 'One Bedroom', 'Chain Free', 'Open Plan Living Space', 'Walking Distance To Bow Road Tube Station', 'The Award Winning Victoria Park Close By', 'Historic Roman Road Market']","[['Bow Road ', '0.3 miles'], ['Bow Church ', '0.4 miles'], ['Mile End ', '0.4 miles']]","['underground', 'dlr', 'underground']",£250 per year (Ask agent about the review period)When and how often your ground rent will be reviewed.Read more about ground rent review period in our glossary page.,£1679,980 years left,Band: C,False
796,138172718,"£400,000",Reduced on 12/09/2023,"Onyx Mews, Stratford","We are delighted to offer for sale this spacious and well maintained two double bedroom split level maisonette, accessible via a private gated entrance and is ideally situated close to Stratford Westfield shopping centre and Stratford Station. This property offers spacious living throu...",Maisonette,2,2,,Leasehold,"['Two Bedroom Apartment', 'Split Level', 'Two Bathrooms', 'Ground Floor W/C', 'Allocated Parking Space', 'Communal Gym', 'EPC Rating E', 'Council Tax Newham Band C']","[['Maryland ', '0.3 miles'], ['Stratford High Street ', '0.6 miles'], ['Stratford ', '0.6 miles']]","['nationalrail', 'dlr', 'nationalrail']",£280 per year (Ask agent about the review period)When and how often your ground rent will be reviewed.Read more about ground rent review period in our glossary page.,£4049.88,133 years left,Band: C,False
797,139851281,"£675,000",Added on 12/09/2023,"Hornsey Road, Islington, London, N7","This gorgeous 3 bedroom flat is located next to station and offers 3 double bedrooms, 2 bathrooms, open plan living room with amazing kitchen and plenty of storage.",Flat,2,3,929 sq. ft.(86 sq. m.),Leasehold,"['Stunning 3 bed flat', '2 bathrooms', 'Open plan living room', 'Stylish kitchen', 'Plenty of storage', '3 double bedrooms', 'Located next to station', 'Close to local amentiies']","[['Arsenal ', '0.3 miles'], ['Holloway Road ', '0.4 miles'], ['Finsbury Park ', '0.5 miles']]","['underground', 'underground', 'nationalrail']",Ask agent,Ask agent,Ask agent,Ask agent,False
798,139850906,"£425,000",Added on 12/09/2023,"Clarissa Street, Hackney","A well presented two bedroom purpose built apartment. This recently refurbished property comprises of two double bedrooms, open plan kitchen/ living area with a juliette balcony and next to Regents Canal.",Flat,1,2,,Leasehold,"['Offers In Excess Of', 'Juliette Balcony', 'Purpose Built', 'Regents Canal', 'Haggerston Station', 'Stonebridge Gardens']","[['Haggerston ', '0.2 miles'], ['Hoxton ', '0.5 miles'], ['Dalston Junction ', '0.6 miles']]","['overground', 'overground', 'overground']",Ask agent,Ask agent,Ask agent,Ask agent,False
799,139850519,"£850,000",Added on 12/09/2023,"Walden Street, London, E1","Enviably nestled within a private gated terrace of Georgian townhouses is this Grade II listed three/four bedroom home offering over 1,150 sqft (107 sqm) approx. of internal space over four floors. This quintessential East London house retains much of its original character includ...",Terraced,2,3,,Freehold,"['Georgian terrace', 'Original features', 'Private garden']","[['Whitechapel ', '0.2 miles'], ['Shadwell ', '0.4 miles'], ['Bethnal Green (Mainline) ', '0.5 miles']]","['underground', 'dlr', 'nationalrail']",Ask agent,Ask agent,Ask agent,Band: F,False
800,86089368,"£330,000",Reduced on 04/09/2023,"Pepys House, Kirkwall Place, London, E2","GUIDE PRICE £330,000 - £340,000 Elms Estates are delighted to be able to offer to the market for sale this amazing One double bedroom apartment situated in the heart of Bethnal Green. Pepys House is superbly located just off Roman Road and within a 5 minute walk of Bethnal Green tube (c...",Flat,1,1,,Leasehold,"['One Double Bedroom Apartment', 'CHAIN FREE', 'Separate Kitchen', 'Excellent Transport Links', 'Short Walk To Victoria Park', 'Third Floor']","[['Bethnal Green (Underground) ', '0.3 miles'], ['Cambridge Heath ', '0.4 miles'], ['Stepney Green ', '0.5 miles']]","['underground', 'nationalrail', 'underground']",Ask agent,Ask agent,87 years left,Band: B,False
801,139849667,"£475,000",Added on 12/09/2023,"Talwin Street, London E3","A spacious, modern apartment next to Bromley-by-Bow station (District and Hammersmith & City) located in an attractive building with a secure entry system. The property comprises; an open-plan kitchen/living space that leads out onto the large balcony. This space offers enough room for a lounge ...",Flat,2,3,,Leasehold,"['Chain Free', 'Gated Parking', 'Large Private Development', 'Moments from Bromley by Bow station']","[['Bromley-by-Bow ', '0.1 miles'], ['Devons Road ', '0.3 miles'], ['Bow Church ', '0.4 miles']]","['underground', 'dlr', 'dlr']",£400 per year (Ask agent about the review period)When and how often your ground rent will be reviewed.Read more about ground rent review period in our glossary page.,£1920,980 years left,Band: D,False
802,138620105,"£350,000",Reduced on 12/09/2023,"Cannon Street Road, London E1","LudlowThompson are delighted to present to the market this immaculate one bedroom apartment with a large double bedroom, spacious reception room, modern bathroom, kitchen, and also boasts a private balcony. Located in the vibrant heart of Stepney with easy access to the City, Canary Wharf & Wappi...",Flat,1,1,,Leasehold,"['Spacious One Bed', 'Close to Brick Lane', 'A short Walk From Wapping', 'Private Balcony', 'Park-Side Location']","[['Shadwell ', '0.3 miles'], ['Whitechapel ', '0.4 miles'], ['Aldgate East ', '0.5 miles']]","['dlr', 'underground', 'underground']",£10 per year (Ask agent about the review period)When and how often your ground rent will be reviewed.Read more about ground rent review period in our glossary page.,£445.43,151 years left,Band: H,False
803,139682477,"£605,000",Reduced on 12/09/2023,"Wiverton Tower, 4 New Drum Street, Aldgate, E1","A wonderful one double bedroom apartment in the very sought after Wiverton Tower, Aldgate Place on the 18th floor. This modern apartment offers residents a gymnasium, 24-hour concierge and a roof-top terrace as well as a wide range of bars, restaurants and amenities locally. ",Apartment,1,1,,Leasehold,"['1 bedroom', '18th floor', 'Winter garden', 'Bright and spacious', 'Open-plan', 'Air conditioning', 'Fantastic location', '24 hour concierge and gymnasium', 'Zone 1']","[['Aldgate East ', '0.0 miles'], ['Aldgate ', '0.2 miles'], ['Tower Gateway ', '0.3 miles']]","['underground', 'underground', 'dlr']",£350 per year,£3638,989 years left,Band: TBC,False
804,139848614,"£350,000",Added on 12/09/2023,"Homer Road, London, E9","This exceptionally well-presented one bedroom flat on the second floor offers approximately 530 sq ft of modern elegance. As you step inside you're greeted by a spacious hallway, the property benefits from a generously sized three-piece bathroom suite, a large storage cupboard within the hallway...",Apartment,1,1,,Leasehold,[],"[['Homerton ', '0.4 miles'], ['Hackney Wick ', '0.4 miles'], ['Hackney Central ', '0.9 miles']]","['overground', 'overground', 'overground']",£0 per year,£1553,111 years left,Band: C,False
