,id,price,added_reduced,address,description,type_house,bathrooms,bedrooms,size,tenure,key_features,close_stations,close_stations_type,tenure_ground_rent,tenure_annual_service_charge,tenure_lease_length,council_tax_band,sold_under_offer
273,140191097,"£300,000",Added on 20/09/2023,"Roth Walk, LONDON","AUCTION SALE 18 October 2023 - Leasehold two bedroom flat,Investment Let on Assured Shorthold Tenancy,Rent reserved £18,900 per annum.",Flat,1,2,,Leasehold,"['AUCTION SALE', '18 October 2023', 'EPC Rating - D', 'To view: no viewings available.']","[['Finsbury Park ', '0.3 miles'], ['Arsenal ', '0.4 miles'], ['Crouch Hill ', '0.7 miles']]","['nationalrail', 'underground', 'overground']",Ask agent,Ask agent,Ask agent,Band: B,False
274,140190257,"£600,000",Added on 20/09/2023,"Remus Road, E3","*Guide Price £600,000 - £625,000* Located in the heart of Fish Island Village, Hackney Wick, in The Old Smoke House development, this spacious & well-presented 2-bedroom apartment is the ideal home for anyone looking to be in this new creative area, offering an exciting place to live and unwind.",Flat,2,2,859 sq. ft.(80 sq. m.),Leasehold,"['Two Bedroom Apartment', 'Two Bathrooms', 'Offered Chain Free', 'High-Spec Modern Interior With Integrated Bosch Appliances & Built-In Sonos Speaker System', 'Canalside Living & Westfield Shopping Centre', ""Residents' Gym, Bike Storage, Communal Roof Terrace & 24hr Concierge"", 'Stone Flooring With Underfloor Heating Throughout', 'London Fields, Victoria & QE Park Close By', '859 Sq Ft (80 Sq M)']","[['Hackney Wick ', '0.3 miles'], ['Pudding Mill Lane ', '0.6 miles'], ['Bow Road ', '0.8 miles']]","['overground', 'dlr', 'underground']",Ask agent,Ask agent,245 years left,Ask agent,False
275,140385638,"£800,000",Added today,"International Way, E20","Manhattan Loft Gardens is a remarkable project developed by Manhattan Loft Corporation, a distinctive double-cantilevered tower that offers spacious living areas, three sky gardens, two restaurants and a design hotel.",Flat,2,2,765 sq. ft.(71 sq. m.),Leasehold,"['Two Double Bedroom Loft Apartment', 'Two Bathrooms', 'EWS1 Form Compliant', 'Three Rooftop Gardens With Incredible Views', 'Two Restaurants, Fitness Centre, Three Bars, Co-Working Spaces, Fully Equipped Meeting Rooms & Event Spaces', 'High-Spec Modern Interior With Integrated Siemens Appliances', 'Underfloor Heating Throughout', '24-Hour Concierge', 'Amazing Location Next To Transport Links & Westfield Shopping Centre', '765 Sq Ft (71.1 Sq M)']","[['Stratford International ', '0.1 miles'], ['Stratford ', '0.3 miles'], ['Stratford High Street ', '0.6 miles']]","['nationalrail', 'nationalrail', 'dlr']",Ask agent,Ask agent,235 years left,Ask agent,False
276,140191097,"£300,000",Added on 20/09/2023,"Roth Walk, LONDON","AUCTION SALE 18 October 2023 - Leasehold two bedroom flat,Investment Let on Assured Shorthold Tenancy,Rent reserved £18,900 per annum.",Flat,1,2,,Leasehold,"['AUCTION SALE', '18 October 2023', 'EPC Rating - D', 'To view: no viewings available.']","[['Finsbury Park ', '0.3 miles'], ['Arsenal ', '0.4 miles'], ['Crouch Hill ', '0.7 miles']]","['nationalrail', 'underground', 'overground']",Ask agent,Ask agent,Ask agent,Band: B,False
277,140190257,"£600,000",Added on 20/09/2023,"Remus Road, E3","*Guide Price £600,000 - £625,000* Located in the heart of Fish Island Village, Hackney Wick, in The Old Smoke House development, this spacious & well-presented 2-bedroom apartment is the ideal home for anyone looking to be in this new creative area, offering an exciting place to live and unwind.",Flat,2,2,859 sq. ft.(80 sq. m.),Leasehold,"['Two Bedroom Apartment', 'Two Bathrooms', 'Offered Chain Free', 'High-Spec Modern Interior With Integrated Bosch Appliances & Built-In Sonos Speaker System', 'Canalside Living & Westfield Shopping Centre', ""Residents' Gym, Bike Storage, Communal Roof Terrace & 24hr Concierge"", 'Stone Flooring With Underfloor Heating Throughout', 'London Fields, Victoria & QE Park Close By', '859 Sq Ft (80 Sq M)']","[['Hackney Wick ', '0.3 miles'], ['Pudding Mill Lane ', '0.6 miles'], ['Bow Road ', '0.8 miles']]","['overground', 'dlr', 'underground']",Ask agent,Ask agent,245 years left,Ask agent,False
278,139573604,"£770,000",Reduced on 20/09/2023,"Victoria Park Road, Victoria Park","A beautiful two bedroom apartment split over two floors with views of the Village. This property offers a separate kitchen and a large living space with exposed brickwork, a large bay window and access to two levels of outdoor space, including a private terrace.",Flat,1,2,,Leasehold,"['Victoria Park Village', 'Private Terrace', 'Exposed Brickwork', 'Victoria Park', 'Private Entrance', 'Local Markets']","[['London Fields ', '0.6 miles'], ['Cambridge Heath ', '0.7 miles'], ['Homerton ', '0.6 miles']]","['nationalrail', 'nationalrail', 'overground']",Ask agent,Ask agent,Ask agent,Ask agent,False
279,140189159,"£825,000",Added on 20/09/2023,"Columbia Road, Columbia Road","A two bedroom maisonette with a south facing private garden, located on the famous Columbia Road. This property is over 850 sq ft and has been recently renovated throughout to a high standard with an open plan kitchen, dining and living room.",Maisonette,1,2,,Ask agent,"['Two Bedrooms', 'South Facing Garden', 'Maisonette', 'Columbia Road', 'Recently renovated']","[['Hoxton ', '0.3 miles'], ['Shoreditch High Street ', '0.4 miles'], ['Bethnal Green (Mainline) ', '0.6 miles']]","['overground', 'overground', 'nationalrail']",Ask agent,Ask agent,Ask agent,Ask agent,False
280,140186906,"£700,000",Added on 20/09/2023,"Loxford Gardens, London, N5",Two bedroom apartment in Loxford Gardens,Apartment,2,2,,Leasehold,"['24 Hour concierge', 'Set in a highly acclaimed Loxford Gardens', 'High specification apartment', 'Bright and airy rooms', 'Located near Highbury Fields', 'Excellent transport links', 'EPC Rating = B']","[['Arsenal ', '0.3 miles'], ['Drayton Park ', '0.4 miles'], ['Finsbury Park ', '0.6 miles']]","['underground', 'nationalrail', 'nationalrail']",£400 per year (Ask agent about the review period)When and how often your ground rent will be reviewed.Read more about ground rent review period in our glossary page.,£6350.48,112 years left,Band: E,False
281,138293198,"£750,000",Reduced on 20/09/2023,"Wesley Road, London, E10",Charming 4-Bedroom House in Leyton - A Perfect Blend of Convenience and Serenity.,Terraced,2,4,,Freehold,"['4 Bedrooms', 'Garden', 'Loft Extended', 'Modernised Throughout', 'Moments From Local Amenities', 'Close to Public Transport']","[['Leyton Midland Road ', '0.1 miles'], ['Leytonstone ', '0.7 miles'], ['Leytonstone High Road ', '0.8 miles']]","['overground', 'underground', 'overground']",Ask agent,Ask agent,Ask agent,Band: TBC,False
282,138177413,"£800,000",Reduced on 20/09/2023,"Melville Road, E17","Guide Price £800,000 to £850,000 Location, location, location! And boy, does this place have it. Nestled in a desirable corner of vibrant Walthamstow, a neighbourhood so trendy that even the pigeons wear skinny jeans, this three-bedroom house is just waiting for you to come and mak...",Terraced,1,3,"1,100 sq. ft.(102 sq. m.)",Freehold,[],"[['Walthamstow Central ', '0.5 miles'], ['Walthamstow Queens Road ', '0.5 miles'], ['St. James Street ', '0.7 miles']]","['nationalrail', 'overground', 'nationalrail']",Ask agent,Ask agent,Ask agent,Band: D,False
283,130644653,"£360,000",Reduced on 20/09/2023,"Brooke Road, London, E5","This spacious property offers spades of potential for the new owner to put their on stamp on it. The flat benefits from three double bedrooms, a good sized kitchen which could be opened out in to the reception room, a bathroom suite and a separate WC. It's located within close proximi...",Apartment,1,3,,Leasehold,[],"[['Clapton ', '0.2 miles'], ['Rectory Road ', '0.4 miles'], ['Hackney Downs ', '0.8 miles']]","['nationalrail', 'nationalrail', 'nationalrail']",£9 per year,£1500,88 years left,Band: C,False
284,140178323,"£625,000",Added on 20/09/2023,"Chatham Place, Hackney, E9",Square Quarters are excited to present for sale this gorgeous two bedroom apartment with private balcony within the sought after Textile Building Warehouse Conversion development in the heart of Hackney moments to Hackney Central Station.,Flat,1,2,636 sq. ft.(59 sq. m.),Leasehold,"['Close to amenities', 'Fitted Kitchen', 'Concierge', 'Close to public transport', 'Private Balcony', 'High Ceilings', 'Warehouse Conversion', 'Lots Of Character']","[['Hackney Central ', '0.2 miles'], ['Homerton ', '0.4 miles'], ['Hackney Downs ', '0.4 miles']]","['overground', 'overground', 'nationalrail']",£300 per year (Ask agent about the review period)When and how often your ground rent will be reviewed.Read more about ground rent review period in our glossary page.,£2400,990 years left,Ask agent,False
285,137073476,"£1,300,000",Reduced on 20/09/2023,"Union Wharf, 23 Wenlock Road, London, N1",A stunning two bedroom apartment in Union Wharf.,Apartment,2,2,,Share of Freehold,"['Immaculate duplex apartment', 'Views over Shepherdess park', 'Wonderfully light throughout', 'Concierge', 'Share of Freehold', 'EPC Rating = C']","[['Angel ', '0.5 miles'], ['Essex Road ', '0.5 miles'], ['Old Street ', '0.6 miles']]","['underground', 'nationalrail', 'nationalrail']",£200 per year,£4308,988 years left,Band: E,False
286,140177120,"£375,000",Added on 19/09/2023,"Queens Drive, Finsbury Park, London, N4","A spacious One-Double Bedroom Apartment which has undergone a complete “back to brick” refurbishment, located on a quiet residential turning just a short walk from Clissold Park, Woodberry Wetlands and Finsbury Park Station (Victoria, Piccadilly and Main Lines).",Maisonette,1,1,,Share of Freehold,"['Victorian Conversion', 'No Chain', 'Long Lease', 'One Double Bedroom', 'Open-Plan Kitchen/Reception Room', 'Bay Window', 'Private Entrance', 'Situated On A Quiet Tree Lined Street', ""10 Minutes' Walk To Finsbury Park Station"", 'Close to Clissold Park']","[['Finsbury Park ', '0.4 miles'], ['Arsenal ', '0.5 miles'], ['Manor House ', '0.5 miles']]","['nationalrail', 'underground', 'underground']",£0 per year,£1271.18,973 years left,Band: C,False
287,139359692,"£400,000",Reduced on 19/09/2023,"Theatre Building, 1 Paton Close, London, E3","Guide Price £400,000 - £425,000. The Lime Group are excited to bring to market, this spacious 2 bed flat in the popular Theatre Building. Currently tenanted at £1875.00 pcm.",Flat,1,2,777 sq. ft.(72 sq. m.),Leasehold,"['Guide Price £400,000 - £425,000', '777 Sq.ft', '2 Bedrooms', 'Tenanted at £1875.00 pcm', 'Sought After Area', '£250.00 pa Ground Rent & £5,500 pa Service Charge', 'Long Lease of 102 Years', 'Lift Access', 'Available Vacant', 'EPC = C']","[['Bow Church ', '0.1 miles'], ['Bow Road ', '0.1 miles'], ['Devons Road ', '0.5 miles']]","['dlr', 'underground', 'dlr']",Ask agent,Ask agent,102 years left,Ask agent,False
288,140173583,"£550,000",Added on 19/09/2023,"Sky View Tower, Stratford, London, E15","Set in the luxurious Sky View Tower, this stylish 2 bed apartment offers stunning panoramic views of the city with floor to ceiling windows, outstanding fixtures and fittings and space to dine and entertain throughout.",Flat,1,2,50 sq. ft.(5 sq. m.),Leasehold,"['An outstanding 2 bedroom luxury apartment', 'Located on the 24th floor with stunning city views', 'Generous open plan reception room with space to dine and entertain', 'Fully fitted kitchen with new fridge freezer and integrated fixtures', 'Main bedroom with fitted storage space and a stylish en suite shower room', '2nd well proportioned bedroom, sleek family bathroom', 'Offers ample storage space throughout, communal gym and concierge service', 'Enviable location on the doorstep to transport links and amenities']","[['Pudding Mill Lane ', '0.3 miles'], ['Bow Church ', '0.4 miles'], ['Bromley-by-Bow ', '0.4 miles']]","['dlr', 'dlr', 'underground']",Ask agent,Ask agent,Ask agent,Ask agent,False
289,139584662,"£550,000",Reduced on 19/09/2023,"Evelyn Road, Walthamstow, London, E17","This amazing 3 bedroom end of terrace house offers 3 bedrooms, large and sunny garden, spacious living room, modern kitchen and great location.",Terraced,1,3,"1,052 sq. ft.(98 sq. m.)",Freehold,"['Stunning end of terrace 3 bed house', 'Spacious living room with downstairs toilet', 'Great location within a short walk of Walthamstow village', 'Close by to Wood street offering an abundance of local shops, cafes and bars', 'Large and sunny garden', 'Including a utility and study room', 'Recently renovated modern kitchen', 'Easy transport links']","[['Wood Street ', '0.2 miles'], ['Walthamstow Central ', '0.6 miles'], ['Walthamstow Queens Road ', '0.8 miles']]","['nationalrail', 'nationalrail', 'overground']",Ask agent,Ask agent,Ask agent,Ask agent,False
290,140173319,"£675,000",Added on 19/09/2023,"Queensland Road, Islington, London, N7","Ideally located opposite the Emirates Stadium, this 2 bedroom 2 bathroom flat features spacious open-plan living in a secure development with concierge and facilities.",Flat,2,2,887 sq. ft.(82 sq. m.),Leasehold,"['Secure development with concierge', 'Excellent location', '2 bedroom, 2 bathroom flat', 'Open-plan reception/kitchen', 'Close to Arsenal and Drayton Park stations', 'Good use of storage throughout']","[['Drayton Park ', '0.1 miles'], ['Holloway Road ', '0.2 miles'], ['Arsenal ', '0.4 miles']]","['nationalrail', 'underground', 'underground']",Ask agent,Ask agent,Ask agent,Ask agent,False
291,137665046,"£750,000",Reduced on 19/09/2023,"Wenlock Road, Islington, London, N1",This stunning 2 bedroom flat is situated in an impressive modern development close to the canal and benefits from light and spacious rooms and a large private terrace.,Flat,1,2,738 sq. ft.(69 sq. m.),Leasehold,"['Stunning 2 bed flat', 'Impressive modern development', 'Large private terrace', 'Light and spacious', 'Well-proportioned bedrooms', 'Amazing views over park', 'Excellent transport links', 'Close to amenities']","[['Angel ', '0.5 miles'], ['Old Street ', '0.5 miles'], ['Essex Road ', '0.6 miles']]","['underground', 'nationalrail', 'nationalrail']",Ask agent,Ask agent,115 years left,Ask agent,False
292,137822954,"£425,000",Reduced on 19/09/2023,"Carmine Wharf, Limehouse, London, E14","GUIDE PRICE £425,000 - £450,000 - A stylish 2 bedroom flat located within a secure modern development, boasting a generous reception room with a fully integrated open-plan kitchen and a private decked Terrace.",Flat,1,2,661 sq. ft.(61 sq. m.),Leasehold,"['GUIDE PRICE £425,000 - £450,000', 'Stylish reception room opening onto Terrace', 'Includes allocated parking', 'Good-sized double bedrooms and modern bathroom', 'Located within a secure modern development', 'Open-plan kitchen with integrated appliances']","[['Westferry ', '0.3 miles'], ['Limehouse ', '0.5 miles'], ['West India Quay ', '0.6 miles']]","['dlr', 'nationalrail', 'dlr']",£300 per year (Ask agent about the review period)When and how often your ground rent will be reviewed.Read more about ground rent review period in our glossary page.,£3400,112 years left,Ask agent,False
293,140171375,"£1,150,000",Added on 19/09/2023,"Highbury New Park, London, N5",An opportunity to buy an extended three double bedroom property with a share of the garden in the heart of Highbury.,Flat,3,3,"1,100 sq. ft.(102 sq. m.)",Leasehold,"['Three double bedrooms', 'Extended kitchen/dining area flooded with light', 'Three en-suites', 'Section of garden']","[['Canonbury ', '0.3 miles'], ['Drayton Park ', '0.6 miles'], ['Highbury & Islington ', '0.7 miles']]","['overground', 'nationalrail', 'nationalrail']",Ask agent,Ask agent,Ask agent,Ask agent,False
294,140171081,"£585,000",Added on 19/09/2023,"Prescot Street, Aldgate","Presenting a cheerful and well proportioned two bedroom, two bathroom apartment located on the third floor of this Grade II listed building.",Flat,2,2,,Leasehold,"['Grade II Listed', '24 hour Concierge', 'Wood Floors', 'High Ceilings', 'Art Deco Building', 'OIEO £585,000']","[['Tower Gateway ', '0.2 miles'], ['Tower Hill ', '0.2 miles'], ['Aldgate East ', '0.3 miles']]","['dlr', 'underground', 'underground']",Ask agent,Ask agent,Ask agent,Ask agent,False
295,140170796,"£650,000",Added on 19/09/2023,"Lydford Close, London, N16","Element Properties & Co are proud to present a wonderful three bed, two bath property that has with its own front entrance as well as a private garden and terrace. Boasting an incredible 940 sq. ft. (87 sq. meters), this is a well-proportioned property which feels very much like a ...",House,2,3,,Leasehold,"['HOUSE', '3 BEDROOMS', 'RECEPTION ROOM', 'KITCHEN/DINER', '2 BATHROOMS', 'BALCONY', 'GARDEN', 'LEASEHOLD']","[['Dalston Kingsland ', '0.2 miles'], ['Dalston Junction ', '0.4 miles'], ['Rectory Road ', '0.7 miles']]","['overground', 'overground', 'nationalrail']",£0 per year,£0,Ask agent,Band: TBC,False
296,140170394,"£325,000",Added on 19/09/2023,"Maltings Close, London, E3","This charming flat is perfect for those looking to put their own stamp on a property. With its fantastic location and great potential, this property is sure to attract a lot of interest. Situated on the first floor of a building with lift service, this flat offers convenience and ease ...",Apartment,2,2,,Leasehold,"['Two bedroom flat with parking', 'Balcony for outdoor relaxation', 'Spacious master bedroom with en-suite', 'Great location with excellent transport links', 'Close to schools, amenities, and parks', 'EPC Grade B. Council Tax Band D.']","[['Bromley-by-Bow ', '0.1 miles'], ['Devons Road ', '0.4 miles'], ['Bow Church ', '0.6 miles']]","['underground', 'dlr', 'dlr']",£0 per year,£0,Ask agent,Band: D,False
297,140169197,"£575,000",Added on 19/09/2023,"Roach Road, Hackney Wick","An impeccably sleek two double bedroom apartment with balcony on the fourth floor of a modern block in Hackney Wick's delectable destination of Fish Island. Home to a creative canalside community, there's a bounty of things to see and do here. Transport's a cinch, too. Hackney Wick stati...",Apartment,2,2,980 sq. ft.(91 sq. m.),Leasehold,"['Two Bedroom Apartment', 'Two BAthrooms', 'Beautifully Presented', 'Fourth Floor', 'Just Under 1000 sq.ft', 'Private Balcony', 'River Views']","[['Hackney Wick ', '0.2 miles'], ['Pudding Mill Lane ', '0.5 miles'], ['Stratford International ', '0.6 miles']]","['overground', 'dlr', 'nationalrail']",£500 per year (Ask agent about the review period)When and how often your ground rent will be reviewed.Read more about ground rent review period in our glossary page.,£1629,102 years left,Band: D,False
298,140167940,"£700,000",Added on 19/09/2023,"Prestwood Street, London, N1",Attractive third floor apartment.,Apartment,1,2,,Leasehold,"['Two double bedrooms', 'Pleasant views', 'Private balcony', 'Communal gardens', 'Secure Entryphone', 'Close to Islington and Shoreditch', 'EPC Rating = B']","[['Old Street ', '0.5 miles'], ['Angel ', '0.5 miles'], ['Essex Road ', '0.7 miles']]","['nationalrail', 'underground', 'nationalrail']",£0 per year,£3232.8,Ask agent,Band: D,False
299,128413706,"£400,000",Added on 26/10/2022,"Beulah Road, Walthamstow","This beautiful one-bedroom apartment is situated on the top floor of a period conversion, right in the heart of the highly sought-after Walthamstow Village Conservation Area, making it something of a rare find. You have spacious rooms, timber floorboards throughout, and the entire space ...",Apartment,1,1,,Leasehold,"['One Bedroom Apartment', 'Top Floor', 'Walthamstow Village', 'Kitchen-Diner', 'Double Glazed Timber Sash Windows', 'Beautifully Presented', 'Council Tax Band B']","[['Walthamstow Central ', '0.4 miles'], ['Wood Street ', '0.5 miles'], ['Walthamstow Queens Road ', '0.6 miles']]","['nationalrail', 'nationalrail', 'overground']",£50 per year (Ask agent about the review period)When and how often your ground rent will be reviewed.Read more about ground rent review period in our glossary page.,£975.36,149 years left,Band: B,False
300,140356760,"£650,000",Added on 30/08/2023,"The Crescent, Walthamstow","Birchills Estate Agents are pleased to present the sale market this beautiful four double bedroom house, within close distance to St. James Street Overground Station. The ground floor of this lovely warm home boasts a reception room, separate kitchen/diner, family bathroom and a double b...",Terraced,1,4,,Freehold,"['Within Close Distance To St. James Street Overground Station', '4 Double Bedrooms', 'Separate Reception Rooms', 'Garden', 'On Street Resident Permit Parking']","[['St. James Street ', '0.1 miles'], ['Walthamstow Queens Road ', '0.4 miles'], ['Walthamstow Central ', '0.6 miles']]","['nationalrail', 'overground', 'nationalrail']",Ask agent,Ask agent,Ask agent,Band: B,False
301,128413706,"£400,000",Added on 26/10/2022,"Beulah Road, Walthamstow","This beautiful one-bedroom apartment is situated on the top floor of a period conversion, right in the heart of the highly sought-after Walthamstow Village Conservation Area, making it something of a rare find. You have spacious rooms, timber floorboards throughout, and the entire space ...",Apartment,1,1,,Leasehold,"['One Bedroom Apartment', 'Top Floor', 'Walthamstow Village', 'Kitchen-Diner', 'Double Glazed Timber Sash Windows', 'Beautifully Presented', 'Council Tax Band B']","[['Walthamstow Central ', '0.4 miles'], ['Wood Street ', '0.5 miles'], ['Walthamstow Queens Road ', '0.6 miles']]","['nationalrail', 'nationalrail', 'overground']",£50 per year (Ask agent about the review period)When and how often your ground rent will be reviewed.Read more about ground rent review period in our glossary page.,£975.36,149 years left,Band: B,False
302,140167310,"£475,000",Added on 19/09/2023,"Queensbridge Road, London Fields",A two bedroom apartment in the heart of Hackney with Regents canal close by. This home has been refurbished throughout by the current owners with open plan living and a private balcony.,Flat,1,2,,Leasehold,"['Private Balcony', 'Lift Serviced', 'Recently Refurbished', 'Local Markets', 'Regents Canal', 'Haggerston Park']","[['Haggerston ', '0.3 miles'], ['Hoxton ', '0.5 miles'], ['London Fields ', '0.6 miles']]","['overground', 'overground', 'nationalrail']",Ask agent,Ask agent,Ask agent,Ask agent,False
303,139414520,"£400,000",Reduced on 19/09/2023,"Albert Road, London, E10 6PB","Spacious two bedroom first floor flat in the popular Francis Road area of Leyton, chain-free. The well-designed layout includes two reception rooms, a kitchen, a family bathroom and a separate WC, along with a private garden.",Flat,1,2,,Leasehold,"['Two Bedroom Flat', 'Two Reception Rooms', 'First Floor', 'Period Property', 'Francis Road Area', 'Gas central Heating', 'Excellent Transport Links', 'Rear Garden', 'Chain Free', 'EPC Rating D']","[['Leyton Midland Road ', '0.3 miles'], ['Leytonstone High Road ', '0.5 miles'], ['Leytonstone ', '0.6 miles']]","['overground', 'overground', 'underground']",Ask agent,Ask agent,Ask agent,Band: B,False
304,134265971,"£525,000",Added on 19/09/2023,"Manorhall Gardens, Leyton, London, E10 7AT","Guide Price £525,000-£550,000 - Spacious three bedroom house for sale in Leyton – large reception room, spacious bedrooms, south facing garden, parking and much more…",Terraced,1,3,,Freehold,"['Three Bedroom House', ""L'Shaped Reception"", 'Off Street Parking', 'Ground Floor Cloakroom', 'First Floor Bathroom', 'Gas Central Heating', 'Double Glazing', 'Rear Access', 'Freehold', 'EPC Rating C']","[['Leyton Midland Road ', '0.5 miles'], ['Lea Bridge0.8 miles'], ['Leyton ', '0.9 miles']]","['overground', 'nationalrail', 'underground']",Ask agent,Ask agent,Ask agent,Band: C,False
305,136089125,"£450,000",Added on 19/09/2023,"Bakers Hill, Hackney, E5","THREE BEDROOM LATERAL APARTMENT | JUST UNDER 800 SQUARE FOOT | PRIVATE SOUTH EAST FACING BALCONY | MODERN HANDLELESS KITCHEN | REFURBISHED TO A HIGH SPECIFICATION | SEPARATE KITCHEN / DINER AND LIVING ROOM | DUAL ASPECT WINDOWS | TRANQUIL RIVERSIDE LIVING... GUIDE PRICE £450,000 - &pou...",Apartment,1,3,,Ask agent,"['GUIDE PRICE £450,000 - £470,000', 'VIEWINGS AVAILABLE NOW', 'THREE SPACIOUS BEDROOMS', 'PRIVATE BALCONY WITH FAR REACHING VIEWS', 'SLEEK MODERN KITCHEN', 'JUST UNDER 800 SQ FT', 'SEPARATE KITCHEN AND LIVING ROOM', 'EXCELLENT LOCATION FOR CANAL, PARKS & TRANSPORT LINKS']","[['Clapton ', '0.4 miles'], ['Lea Bridge0.7 miles'], ['Rectory Road ', '0.9 miles']]","['nationalrail', 'nationalrail', 'nationalrail']",Ask agent,Ask agent,Ask agent,Ask agent,False
306,139275695,"£425,000",Reduced on 19/09/2023,"Copenhagen Place, Limehouse","A two double bedroom apartment in a popular gated development, Carmine Wharf. Features to include unique private terrace, open plan living area, entry phone system and an allocated parking space.",Flat,1,2,,Leasehold,"['Gated Development', 'Allocated Parking Space', 'Unique Large Terrace', 'Two Double Bedrooms', 'Day Porter', 'Guide Price £425,000 - £450,000']","[['Westferry ', '0.3 miles'], ['Limehouse ', '0.4 miles'], ['West India Quay ', '0.6 miles']]","['dlr', 'nationalrail', 'dlr']",Ask agent,Ask agent,Ask agent,Ask agent,False
