,id,price,added_reduced,address,description,price_change_date,price_change_value,type_house,bathrooms,bedrooms,size,tenure,key_features,close_stations,close_stations_type,tenure_ground_rent,tenure_annual_service_charge,tenure_lease_length,council_tax_band
93,137680052,"£375,000",Added on 26/04/2023,"Golders Green Road, Golders Green, London, NW11","This beautiful 1 bedroom top floor flat is well-placed for the shops and restaurants on Golders Green Road, and is very well-presented throughout.",['27/07/2023'],"['Initial entry found: £375,000']",Flat,1,1,610 sq. ft.(57 sq. m.),Leasehold,"['Stunning 1 bedroom top floor flat', 'Moments from fantastic amenities', 'Bright open-plan living space', 'Well-equipped kitchen area', 'Charming double bedroom', 'Non-demised mezzanine with Skylight window', 'Modern shower room', 'Private roof terrace']","[['Golders Green ', '0.2 miles'], ['Brent Cross ', '0.7 miles'], ['Cricklewood ', '1.1 miles']]","['underground', 'underground', 'nationalrail']",Ask agent,Ask agent,Ask agent,Ask agent
94,124283036,"£375,000",Reduced on 12/01/2023,"Finchley Road, Hampstead",A delightful one bedroom flat with a lovely bow window set on the first floor of this attractive building close to multiple transport and shopping facilities.,"['12/01/2023', '24/06/2022']","['Price changed from £400,000 to £375,000', 'Initial entry found: £400,000']",Flat,1,1,,Leasehold,"['Reception Room', 'Kitchen Area', 'Double Bedroom', 'Bathroom', 'Convenient Location']","[['Cricklewood ', '0.7 miles'], ['West Hampstead Thameslink ', '0.7 miles'], ['Hampstead ', '0.8 miles']]","['nationalrail', 'nationalrail', 'underground']",Ask agent,Ask agent,Ask agent,Ask agent
95,131689772,"£375,000",Added on 14/02/2023,"Meadway, London, NW11","We are delighted to offer this highly desirable 1 bedroom ground floor apartment in Meadway Court. Meadway Court is situated on Meadway in the heart of Hampstead Garden Suburb, adjacent to the Heath Extension and within close proximity of Golders Green. The apartment is offered in good condition,...",['14/02/2023'],"['Initial entry found: £375,000']",Apartment,1,1,,Leasehold,"['1 Bedroom', 'Stunning Listed Building with Communal Gardens', 'Parquet Flooring', 'Ground Floor', 'Extra Storage', 'Modern Kitchen', 'Large Bathroom', 'Leasehold 999 years from 24/06/1907', 'SC Approx. £3300 P/A', 'EPC Rating: D']","[['Golders Green ', '0.7 miles'], ['East Finchley ', '1.0 miles'], ['Brent Cross ', '1.2 miles']]","['underground', 'underground', 'underground']",£0 per year,£0,Ask agent,Band: TBC
96,127646192,"£350,000",Reduced on 03/05/2023,"Heath Close, Hampstead Garden Suburb, NW11","Waterlow Court is wonderful enclave of flats designed in 1904 by architect M H Baillie Scott, his only multiple housing scheme in Hampstead Garden Suburb. Built in 1908 as a communal residence for professional single women by the Improved Industrial Dwellings Company Ltd, whose chairman was Lord ...","['03/05/2023', '23/02/2023', '03/10/2022']","['Price changed from £389,999 to £350,000', 'Price changed from £399,999 to £389,999', 'Initial entry found: £399,999']",Flat,1,1,,Share of Freehold,"['1 bedroom', 'Lounge', 'Kitchen', 'Bathroom', 'Communal gardens']","[['Golders Green ', '0.3 miles'], ['Brent Cross ', '1.1 miles'], ['Hampstead ', '1.3 miles']]","['underground', 'underground', 'underground']",£40 per year (Ask agent about the review period)When and how often your ground rent will be reviewed.Read more about ground rent review period in our glossary page.,Ask agent,961 years left,Ask agent
97,138563318,"£350,000",Added on 08/06/2023,"Waterlow Court, Heath Close, London, NW11","Set in this stunning nineteenth century development, a short walk away from Hampstead Heath and all the boutique shops, bars and restaurants along Finchley Road, is lovely one-bedroom, first floor apartment in Waterlow Court, Heath Close, NW11. This spacious property boasts a separate ki...",['28/08/2023'],"['Initial entry found: £350,000']",Flat,1,1,,Share of Freehold,"['Beautiful One Bed Apartment', 'Private and Highly Sought After Block', 'more photos and a floor plan coming soon', 'Picturesque Communal Gardens', 'Picturesque gardens', 'Close to Golders Green Station', 'Highly desirable block', 'Period Charm']","[['Golders Green ', '0.2 miles'], ['Brent Cross ', '1.1 miles'], ['Hampstead ', '1.2 miles']]","['underground', 'underground', 'underground']",£40 per year (Ask agent about the review period)When and how often your ground rent will be reviewed.Read more about ground rent review period in our glossary page.,£3060,951 years left,Band: C
