,id,price,added_reduced,address,description,price_change_date,price_change_value,type_house,bathrooms,bedrooms,size,tenure,key_features,close_stations,tenure_ground_rent,tenure_annual_service_charge,tenure_lease_length,council_tax_band
36,126965357,"£425,000",Added on 12/09/2022,"Archway Road, Highgate, N6",A one bedroom recently refurbished apartment occupying the first floor of this period building above commercial premises within close walking distance of Highgate Underground Station.,[],[],Flat,1,1,389 sq. ft.(36 sq. m.),Leasehold,[],"[['Highgate ', '0.3 miles'], ['Archway ', '0.7 miles'], ['Upper Holloway ', '0.9 miles']]",£200 per year (Ask agent about the review period)When and how often your ground rent will be reviewed.Read more about ground rent review period in our glossary page.,Ask agent,110 years left,Band: C
37,86226558,"£425,000",Reduced on 20/06/2023,"Hamlet Gate, High Road, London, N2","A brand new 1 bedroom / 1 bathroom apartment measuring 564 sq. ft. in this exclusive development.Hamlet Gate is a collection of brand new high specification one, two & three bedroom apartments all offering bright and spacious accommodation throughout. Located opposite East Finchley ...",[],[],Apartment,1,1,,Leasehold,"['Close to East Finchley Tube Station (Zone 3)', 'Underfloor heating throughout', 'Siemens Integrated Appliances', 'Communal Roof Terrace', 'Ready To Move In']","[['East Finchley ', '0.0 miles'], ['Highgate ', '1.0 miles'], ['Finchley Central ', '1.6 miles']]",Ask agent,Ask agent,Ask agent,Ask agent
38,138840935,"£400,000",Added yesterday,"Queens Lane, London, N10",Prickett and Ellis are proud to present this fantastically located one bedroom chain free flat that has been recently refurbished to a high standard throughout. EPC Rating - D ,[],[],Apartment,1,1,,Leasehold,"['CHAIN FREE', 'ONE BEDROOM FLAT WITH POTENTIAL TO TURN INTO TWO BEDROOMS', 'LOCATED ON MUSWELL HILL BROADWAY', 'RECENTLY REFERBISHED', '113 YEAR LEASE', '584 SQUARE FEET']","[['East Finchley ', '1.0 miles'], ['Highgate ', '1.0 miles'], ['Alexandra Palace ', '1.1 miles']]",£0 per year,£0,Ask agent,Band: TBC
39,124489745,"£400,000",Reduced on 27/07/2023,"Aylmer Road, Haringey","Located on the ground floor of this popular purpose built block is this spacious two double bedroom apartment with separate kitchen, direct access to secluded terrace & off street parking.",[],[],Flat,1,2,,Share of Freehold,"['Two double bedrooms ', 'Spacious reception room', 'Bathroom ', 'Fitted kitchen ', 'Communal terrace ', 'Ground floor ', 'Off street parking', 'EPC Rating D']","[['East Finchley ', '0.5 miles'], ['Highgate ', '0.6 miles'], ['Archway ', '1.5 miles']]",Ask agent,Ask agent,Ask agent,Ask agent
40,133272632,"£399,950",Reduced on 16/03/2023,"Risborough Court, Muswell Hill, London, N10",Situated within minutes walk of Muswell Hill Broadway’s vibrant promenades is a two double bedroom purpose built first floor maisonette. The property is in need of updating and is ideally placed with excellent bus services providing easy access to Highgate (Northern Line) and Finsbury Park ...,[],[],Apartment,1,2,,Leasehold,"['RECEPTION ROOM', '2 DOUBLE BEDROOMS', 'KITCHEN', 'BATHROOM/WC', 'GAS CH', 'LEASEHOLD', 'SOLE SELLING AGENT']","[['Highgate ', '0.9 miles'], ['Alexandra Palace ', '1.1 miles'], ['East Finchley ', '1.1 miles']]",£0 per year,£0,Ask agent,Band: TBC
41,130256282,"£395,000",Added on 26/12/2022,"Prospect Ring, East Finchley, N2","We offer this spacious three double bedroom flat situated in this cul-de-sac location just off Market Place, N2, minutes from East Finchley High Road, underground station, Holy Trinity and Martins Primary schools and the Archer Academy. The property offers ample living space, plenty of storage bo...",[],[],Apartment,1,3,,Leasehold,[],"[['East Finchley ', '0.3 miles'], ['Highgate ', '1.3 miles'], ['Finchley Central ', '1.3 miles']]",Ask agent,Ask agent,80 years left,Ask agent
42,136222961,"£395,000",Reduced on 17/06/2023,"Viceroy Close, East Finchley, London, N2","We offer a spacious three bedroom purpose built duplex apartment located on the second and third floors of this convenient block, in the heart of East Finchley. The property offers  spacious accommodation, including good size reception room, fitted kitchen, three bedrooms, bathroom and wc...",[],[],Apartment,1,3,,Leasehold,"['Three Bedrooms', 'Long Lease', 'Duplex', 'Chain Free', 'Close to Amenities', 'Garage', 'Own Parking Space', 'Double Glazed Windows']","[['East Finchley ', '0.2 miles'], ['Highgate ', '1.1 miles'], ['Finchley Central ', '1.5 miles']]",Ask agent,Ask agent,Ask agent,Ask agent
43,129500177,"£385,000",Reduced on 29/11/2022,"Norfolk Close, East Finchley, N2","We offer this spacious three double bedroom flat situated in this cul-de-sac location just off Park Road, N2, minutes from East Finchley High Road, underground station, Holy Trinity and Martins Primary schools and the Archer Academy. The property offers ample living space, plenty of storage both ...","['29/11/2022', '26/11/2022']","['Price changed from £400,000 to £385,000', 'Initial entry found: £400,000']",Apartment,1,3,,Leasehold,"['Large Reception Dining Room', 'Kitchen Breakfast Room', 'Three Double Bedrooms', 'Bathroom & WC', 'Balcony', 'External Storage Room', 'Off Street Parking', 'Chain Free']","[['East Finchley ', '0.4 miles'], ['Finchley Central ', '1.2 miles'], ['Highgate ', '1.4 miles']]",Ask agent,Ask agent,88 years left,Ask agent
44,135984602,"£382,500",Reduced on 22/01/2023,"Fortis Green, London, N2",Spacious 1 bedroom centrally located within close proximity to both Muswell Hill Broadway and East Finchley Station.,['12/06/2023'],"['Initial entry found: £382,500']",Apartment,1,1,,Leasehold,['*Off street parking *Storage *Terrace *One Bedroom *Small development *Long lease'],"[['East Finchley ', '0.4 miles'], ['Highgate ', '1.0 miles'], ['Alexandra Palace ', '1.7 miles']]",£0 per year,£0,134 years left,Band: C
45,138469241,"£380,000",Added on 09/08/2023,"Fortis Green, London, N2",Rarely available on the open market is this one bedroom apartment located in this sought after location on Fortis Green. Situated within equal walking distance to East Finchley tube and Muswell Hill Broadway.,['09/08/2023'],"['Initial entry found: £380,000']",Apartment,1,1,,Leasehold,"['Purpose built flat', 'Intercom entry', 'Second floor', 'Leasehold', 'Chain Free', 'Residents parking', '1 Bedroom', 'Fitted bathroom', '0.4m to East Finchley tube']","[['East Finchley ', '0.4 miles'], ['Highgate ', '1.0 miles'], ['Finchley Central ', '1.7 miles']]",£0 per year,£0,Ask agent,Band: TBC
46,133272854,"£380,000",Added on 09/03/2023,"Risborough Close, Muswell Hill, London, N10",Set on the third floor (with lift service) of this 1930’s purpose built block and boasting possibly some of the most breathtaking views across the City of London is a two double bedroom flat which could benefit from some updating. The property is situated within minutes’ walk of Muswe...,['05/04/2023'],"['Initial entry found: £380,000']",Apartment,1,2,,Leasehold,"['RECEPTION ROOM', 'KITCHEN', '2 DOUBLE BEDROOMS', 'BATHROOM/WC', 'GAS CH', 'DOUBLE GLAZED THROUGHOUT', 'LIFT SERVICE', 'LEASEHOLD', 'SOLE SELLING AGENT', 'CHAIN FREE']","[['Highgate ', '0.9 miles'], ['Alexandra Palace ', '1.1 miles'], ['East Finchley ', '1.1 miles']]",£0 per year,£0,Ask agent,Band: TBC
47,138391784,"£365,000",Added on 08/08/2023,"Chessing Court, Fortis Green, London, N2",This one bedroom penthouse apartment benefits from a South facing balcony with the most incredible panoramic views which seriously needs to be viewed to be fully appreciated!,['08/08/2023'],"['Initial entry found: £365,000']",Apartment,1,1,,Leasehold,"['One Bedroom', 'Top Floor', 'Balcony', 'East Finchley Tube Station 0.3 Miles Away', 'Open plan kitchen/lounge', 'Panoramic Views', 'Leasehold with 117 years remaining', 'Lift']","[['East Finchley ', '0.3 miles'], ['Highgate ', '1.0 miles'], ['Finchley Central ', '1.6 miles']]",£0 per year,£1440,116 years left,Band: C
48,128563007,"£360,000",Reduced on 01/06/2023,"Chessing Court, Fortis Green, London, N2",Bright and spacious one bedroom flat situated on the second floor in this modern purpose built block ideally located to shopping and transport facilities. The property is being offered for sale chain free.,"['01/06/2023', '31/10/2022']","['Price changed from £375,000 to £360,000', 'Initial entry found: £375,000']",Apartment,1,1,,Leasehold,"['Reception Room', 'Kitchen/Diner', 'Double Bedroom', 'Family Bathroom', 'Lift', 'Garage', 'Chain Free']","[['East Finchley ', '0.3 miles'], ['Highgate ', '1.0 miles'], ['Finchley Central ', '1.6 miles']]",£0 per year,£1440,156 years left,Band: C
49,131613989,"£350,000",Added on 11/02/2023,"Muswell Hill Broadway, Muswell Hill","A well proportioned mansion flat located the first floor of this period building. The bright accommodation comprises of high ceilings, one double bedroom, reception room & separate kitchen.",['11/02/2023'],"['Initial entry found: £350,000']",Flat,1,1,,Leasehold,"['Mansion flat', 'First floor', 'One bedroom ', 'Reception room', 'Seperate kitchen', 'Small balcony', 'Long lease ', 'EPC- D']","[['Highgate ', '0.9 miles'], ['East Finchley ', '1.0 miles'], ['Alexandra Palace ', '1.1 miles']]",Ask agent,Ask agent,Ask agent,Ask agent
50,133631147,"£350,000",Added on 14/04/2023,"Fortis Green Road, London","Never marketed before, is a rare opportunity to acquire a one bedroom, freehold cottage with separate kitchen and lounge area, the cottage is fully double glazed, requiring some modernisation with excellent potential for rental investment, first time purchase or downsizing.",['14/04/2023'],"['Initial entry found: £350,000']",Bungalow,1,1,,Freehold,"['One Bedroom', 'Freehold', 'Never Sold Before', 'Double Glazed Throughout', 'Cul-De-Sac Location', 'Chain Free']","[['East Finchley ', '0.7 miles'], ['Highgate ', '0.9 miles'], ['Alexandra Palace ', '1.4 miles']]",Ask agent,Ask agent,Ask agent,Ask agent
