,id,price,added_reduced,address,description,price_change_date,price_change_value,type_house,bathrooms,bedrooms,size,tenure,key_features,close_stations,close_stations_type,tenure_ground_rent,tenure_annual_service_charge,tenure_lease_length,council_tax_band
62,130117865,"£450,000",Reduced on 10/03/2023,"Hendon Way, Childs Hill","On the Hampstead, West Hampstead and Childs Hill borders is this spacious two double bedroom raised ground floor flat forming part of an impressive and substantial Tudor style mansion block.","['10/03/2023', '20/12/2022']","['Price changed from £500,000 to £450,000', 'Initial entry found: £500,000']",Flat,1,2,,Leasehold,"['Two Double Bedrooms', 'Spacious Reception', 'Separate Kitchen', '852 sq ft', 'Communal Garden', 'No Upper Chain']","[['Cricklewood ', '0.6 miles'], ['West Hampstead Thameslink ', '0.8 miles'], ['West Hampstead ', '0.9 miles']]","['nationalrail', 'nationalrail', 'nationalrail']",Ask agent,Ask agent,Ask agent,Ask agent
63,138392627,"£450,000",Reduced on 17/08/2023,"Finchley Road, Child's Hill, London, NW2","This charming 2 bedroom flat is located in a well-maintained house conversion in Childs Hill and features exposed wooden beams, open plan living and 2 well-proportioned bedrooms.","['17/08/2023', '07/08/2023']","['Price changed from £475,000 to £450,000', 'Initial entry found: £475,000']",Flat,1,2,662 sq. ft.(62 sq. m.),Share of Freehold,"['Fabulous 2 bedroom flat', '2nd (top floor)', 'Open-plan reception/kitchen', 'Exposed wooden beams', '2 well-proportioned bedrooms with fitted storage', 'Modern shower room', 'Utility room on first floor', 'Communal garden']","[['Cricklewood ', '0.7 miles'], ['Golders Green ', '0.7 miles'], ['Hampstead ', '0.9 miles']]","['nationalrail', 'underground', 'underground']",Ask agent,Ask agent,Ask agent,Ask agent
64,137964797,"£450,000",Reduced on 01/06/2023,"The Pantiles, NW11","A beautifully presented, second floor flat set in this popular Grade II Listed purpose built block designed by J B F Cowper in 1934. The property benefits from wooden flooring, a modern kitchen and bathroom, fire alarm system, communal gardens, rear facing balcony and no upper chain. The...",['27/07/2023'],"['Initial entry found: £450,000']",Flat,1,2,,Leasehold,"['Recently Renovated Bathroom', 'Chain Free', 'Spacious Reception Room', 'Fully Fitted, Modern Kitchen', 'Balcony', '104 Years Remaining On The Lease']","[['Brent Cross ', '0.8 miles'], ['Golders Green ', '0.9 miles'], ['Finchley Central ', '1.1 miles']]","['underground', 'underground', 'underground']",Ask agent,£3072.6,Ask agent,Band: D
65,136614728,"£450,000",Reduced on 14/07/2023,"The Pantiles, Finchley Road, Temple Fortune, NW11","A second floor flat set in this popular Grade II Listed purpose built designed by J B F Cowper in 1934 situated within the heart of Temple Fortunes ample amenities. The property, which offers 689 sq ft, has been refurbished to an exacting standard comprising 2 double bedrooms, a large lounge, a f...","['14/07/2023', '27/06/2023']","['Price changed from £480,000 to £450,000', 'Initial entry found: £480,000']",Flat,1,2,,Leasehold,"['2 double bedrooms', 'Lounge', 'Kitchen', 'Shower room', 'In the heart of Temple Fortune', 'Brand newly refurbished']","[['Brent Cross ', '0.9 miles'], ['Golders Green ', '1.0 miles'], ['Finchley Central ', '1.1 miles']]","['underground', 'underground', 'underground']",£200 per year (Ask agent about the review period)When and how often your ground rent will be reviewed.Read more about ground rent review period in our glossary page.,£3000,107 years left,Band: D
66,135923300,"£450,000",Added on 09/06/2023,"Montpelier Rise, London, NW11",*** Reduced for a Quick Sale *** Viewing by appointment only *** Ground floor 3 bedroom flat.,['09/06/2023'],"['Initial entry found: £450,000']",Ground Flat,1,3,,Leasehold,"['Reduced for a Quick Sale', 'Viewing by appointment only', 'Chain free', 'Ground floor']","[['Brent Cross ', '0.3 miles'], ['Golders Green ', '0.6 miles'], ['Hendon Central ', '1.0 miles']]","['underground', 'underground', 'underground']",Ask agent,Ask agent,125 years left,Ask agent
67,138995711,"£450,000",Added on 23/08/2023,"Finchley Road, NW11","Discover comfort and style in this generously spacious apartment spanning 747 sq. ft. Boasting two double bedrooms, two bathrooms, and two reception areas, this residence is situated on the upper floors of a modern conversion—a perfect blend of contemporary living and convenience. The in...",['23/08/2023'],"['Initial entry found: £450,000']",House,2,2,747 sq. ft.(69 sq. m.),Leasehold,"['Chain free', 'Low outgoings', '2 double bedrooms', '2 receptions', '2 bathrooms', 'Spacious 747 sq. ft']","[['Golders Green ', '0.5 miles'], ['Cricklewood ', '0.8 miles'], ['Hampstead ', '1.0 miles']]","['underground', 'nationalrail', 'underground']",Ask agent,Ask agent,125 years left,Band: A
68,138781091,"£450,000",Added on 17/08/2023,"Golders Court, Woodstock Road, Golders Green,  NW11","Presenting a stylish and well-maintained upper floor flat featuring two bedrooms, this property is ideally situated just moments away from the bustling Golders Green High Street. Additionally, it boasts the advantage of being a mere 0.3 miles away from Golders Green Underground Station.",['17/08/2023'],"['Initial entry found: £450,000']",Apartment,1,2,641 sq. ft.(60 sq. m.),Leasehold,"['Two bedroom upper floor flat', 'Fitted kitchen/dining room', 'Popular location near Golders Green Underground tube station', 'Allocated parking', 'Available as investment (with tenants) or vacant with no onward chain', 'Viewing recommended']","[['Golders Green ', '0.3 miles'], ['Brent Cross ', '0.6 miles'], ['Cricklewood ', '1.1 miles']]","['underground', 'underground', 'nationalrail']",Ask agent,Ask agent,Ask agent,Band: D
69,134169071,"£450,000",Added on 09/06/2022,"Britten Close, London","Maxwell Estates are delighted to offer to the market this spacious 2 bedrooms purpose built flat in the very desirable location of Golders Green. The property is split over two levels consisting of; 2 bedrooms of 1 en-suite, a family bathroom, a large living room and a good sized kitchen. The pr...",['02/05/2023'],"['Initial entry found: £450,000']",Maisonette,1,2,73 sq. ft.(7 sq. m.),Leasehold,[],"[['Golders Green ', '0.3 miles'], ['Hampstead ', '1.0 miles'], ['Brent Cross ', '1.2 miles']]","['underground', 'underground', 'underground']",£150 per year (Ask agent about the review period)When and how often your ground rent will be reviewed.Read more about ground rent review period in our glossary page.,£3000,65 years left,Band: F
70,138648041,"£440,000",Added on 15/08/2023,"Finchley Road, London, NW11","A first floor, newly built flat finished to a high standard in a luxury development of the former Golders Green Police Station. The flat has one double bedroom with built in wardrobes, a family bathroom and an open plan kitchen/living room available chain free. Temple Fortune is...",['15/08/2023'],"['Initial entry found: £440,000']",Flat,1,1,,Leasehold,"['One Bedroom', 'First Floor', 'Chain Free', 'New Build', 'Excellent Condition', 'Long Leasehold']","[['Golders Green ', '0.6 miles'], ['Brent Cross ', '0.7 miles'], ['Hendon Central ', '1.2 miles']]","['underground', 'underground', 'underground']",£300 per year (Ask agent about the review period)When and how often your ground rent will be reviewed.Read more about ground rent review period in our glossary page.,£1824,250 years left,Band: D
71,135266207,"£440,000",Added on 25/05/2023,"Sunnyside, Child's Hill, NW2"," Superbly situated in a quiet and highly sought after residential location close to beautiful Hampstead Heath, this spacious one double bedroom ground floor flat with private garden and long lease. The property offers bright, well planned accommodation with character ap...",['25/05/2023'],"['Initial entry found: £440,000']",Ground Flat,1,1,,Leasehold,"['Chain Free Sale', 'Spacious One Double Bedroom Ground Floor Flat', ""Highly Sought After Child's Hill Location"", 'Some Scope For Upgrade To Suit Taste', 'Beautiful Front Aspect Reception Room', 'Separate Kitchen Opening Onto Large Conservatory', 'Generous Private Garden', 'Long Lease And Low Outgoings', 'Close To Excellent Transport Links And Amenities', '* BOOK YOUR VIEWING ONLINE! *']","[['Cricklewood ', '0.6 miles'], ['Golders Green ', '0.7 miles'], ['Hampstead ', '1.0 miles']]","['nationalrail', 'underground', 'underground']",Ask agent,Ask agent,958 years left,Ask agent
72,128717342,"£435,000",Added on 03/11/2022,"Finchley Road, London","A one bedroom second floor flat set within this exciting new development in the heart of Temple Fortune. Offering 515 sq ft of accommodation, the property comprises an entrance hallway, open plan kitchen/reception room, principal bedroom and family bathroom. Further benefits include underfloor he...",['03/11/2022'],"['Initial entry found: £435,000']",Apartment,1,1,,Leasehold,"['1 Bathroom', '1 Bedroom', '1 Reception', 'Flat/Apartment', 'Upper Floor', 'Roof Terrace', '515 Approx Sq Ft', 'Leasehold with approximately 249 year(s) remaining']","[['Golders Green ', '0.6 miles'], ['Brent Cross ', '0.7 miles'], ['Hendon Central ', '1.2 miles']]","['underground', 'underground', 'underground']",£300 per year,£1779,249 years left,Band: TBC
73,134473358,"£425,000",Reduced on 16/05/2023,"Vernon Court, Hendon Way, NW2","This one's for you if... You like your own entrance, easy access to the communal gardens and separate garage with off-street parking This unique two bedroom flat, is set on the ground floor of an attractive and well maintained 1930's building. The flat offers a bright living...","['16/05/2023', '05/05/2023']","['Price changed from £450,000 to £425,000', 'Initial entry found: £450,000']",Flat,1,2,,Leasehold,"['Video tour available!', 'Bright two-bedroom flat', 'Communal gardens', 'No service charge', 'Own private entrance', 'Modern bathroom', 'Spacious open-plan kitchen', 'Long lease', 'Chain free', 'Private garage']","[['Cricklewood ', '0.6 miles'], ['West Hampstead Thameslink ', '0.8 miles'], ['West Hampstead ', '0.9 miles']]","['nationalrail', 'nationalrail', 'nationalrail']",£160 per year,£0,951 years left,Band: C
74,132651509,"£425,000",Added on 16/03/2023,"Finchley Road,  Hampstead, NW3","Spacious and well presented two bedroom ground floor flat, located on the edge of West Hampstead and benefitting from a spacious private rear garden and no onward chain, we highly recommend an internal viewing.",['16/03/2023'],"['Initial entry found: £425,000']",Apartment,1,2,831 sq. ft.(77 sq. m.),Share of Freehold,"['Impressive and spacious ground floor flat', 'Private rear garden and section of the front garden', 'Large reception with big windows and tall ceilings', 'Modern fitted kitchen and bathroom', 'Long share of Freehold', 'No onward chain']","[['Cricklewood ', '0.7 miles'], ['West Hampstead Thameslink ', '0.7 miles'], ['Hampstead ', '0.8 miles']]","['nationalrail', 'nationalrail', 'underground']",Ask agent,£1906,Ask agent,Band: E
75,138995738,"£550,000",Added on 23/08/2023,"Finchley Road, NW11","Step into spacious living with this 712 sq. ft apartment boasting two double bedrooms and two bathrooms. Situated on the first floor of a modern conversion, this property offers both comfort and convenience. The airy and well-lit interior creates an inviting atmosphere througho...",['23/08/2023'],"['Initial entry found: £550,000']",Flat,2,2,712 sq. ft.(66 sq. m.),Leasehold,"['Chain free', 'Low outgoings', '2 double bedrooms', 'Private balcony', '2 bathrooms', 'Spacious 712 sq. ft']","[['Golders Green ', '0.5 miles'], ['Cricklewood ', '0.8 miles'], ['Hampstead ', '1.0 miles']]","['underground', 'nationalrail', 'underground']",Ask agent,Ask agent,125 years left,Band: A
76,132679673,"£425,000",Reduced on 04/05/2023,"HEATH CLOSE, HAMPSTEAD GARDEN SUBURB, NW11","One double bedroom flat on the ground floor of historic Waterlow Court, Grade II listed 1908 built ‘Arts & Crafts’ block, quietly located almost adjacent to Hampstead Heath Extension. Golders Green underground station is approximately half a mile distant, shops & buses are nearer. * ONE DOUBLE...","['04/05/2023', '17/03/2023']","['Price changed from £440,000 to £425,000', 'Initial entry found: £440,000']",Flat,1,1,,Share of Freehold,"['ONE DOUBLE BEDROOM', 'FITTED & EQUIPPED KITCHEN', 'RECEPTION ROOM', 'BATHROOM / WC', 'ELECTRIC HEATING (heaters renewed 2023)', 'NEUTRAL DECORATIONS & FLOORING', 'WELL MAINTAINED COMMUNAL GARDENS', 'CHARACTER FEATURES', 'CHAIN FREE        SHARE OF FREEHOLD', 'FURNITURE / APPLIANCES INCLUDED']","[['Golders Green ', '0.2 miles'], ['Brent Cross ', '1.1 miles'], ['Hampstead ', '1.2 miles']]","['underground', 'underground', 'underground']",£0 per year,£3500,960 years left,Ask agent
77,134823758,"£425,000",Reduced on 03/07/2023,"Childs Hill (near Hampstead), London, NW2","EXCLUSIVE MARKETING AGENT - Impressive and spacious upper floor apartment located in Childs Hill near Hampstead, the accommodation includes a very spacious kitchen/breakfast room and lounge (that could be used as a third bedroom) Viewing recommended.","['03/07/2023', '15/05/2023']","['Price changed from £475,000 to £425,000', 'Initial entry found: £475,000']",Flat,1,2,816 sq. ft.(76 sq. m.),Leasehold,"['Impressive two/three bedroom upper floor flat', 'Located on Childs Hill High Street (Near Hampstead)', 'Modern fitted kitchen/breakfast room', 'Modern fitted bathroom', 'Sweeping staircase and spacious landing', 'Viewing recommended']","[['Golders Green ', '0.7 miles'], ['Cricklewood ', '0.7 miles'], ['Hampstead ', '1.0 miles']]","['underground', 'nationalrail', 'underground']",Ask agent,Ask agent,Ask agent,Band: C
78,136348283,"£420,000",Reduced on 27/07/2023,"Hampstead, London, NW2","This three bedroom flat is sure to impress. Boasting three double bedrooms, this flat is perfect for families or sharers who are seeking ample space and comfort.","['27/07/2023', '21/06/2023']","['Price changed from £445,000 to £420,000', 'Initial entry found: £445,000']",Link Detached House,1,3,837 sq. ft.(78 sq. m.),Freehold,"['Three bedroom', 'Being sold by Online Auction', 'Buyer’s fee applies', 'Buy it now option available']","[['Cricklewood ', '0.5 miles'], ['Golders Green ', '0.8 miles'], ['West Hampstead Thameslink ', '0.9 miles']]","['nationalrail', 'underground', 'nationalrail']",Ask agent,Ask agent,Ask agent,Band: C
79,138699977,"£415,000",Added on 16/08/2023,"Finchley Road, London, NW11","A third floor, newly built flat finished to a high standard in a luxury development of the former Golders Green Police Station. The flat has one double bedroom with built in wardrobes, a family bathroom and an open plan kitchen/living room available chain free. Temple Fortune is...",['16/08/2023'],"['Initial entry found: £415,000']",Flat,1,1,,Leasehold,"['One Bedroom', 'Top Floor With Lift', 'Good Views', 'Chain Free', 'New Build', 'Long Leasehold']","[['Golders Green ', '0.6 miles'], ['Brent Cross ', '0.7 miles'], ['Hendon Central ', '1.2 miles']]","['underground', 'underground', 'underground']",£300 per year (Ask agent about the review period)When and how often your ground rent will be reviewed.Read more about ground rent review period in our glossary page.,£1624,250 years left,Band: D
80,131259197,"£400,000",Added on 31/01/2023,"Waterlow Court, Heath Close, London, NW11","Waterlow Court is a sought after Grade II listed development designed by the Arts & Crafts architect M.H. Baillie Scott. The property is in a quiet location, set back from the road, surrounded by landscaped gardens and close to Hampstead Heath Extension. This one bedroom (originally two bedro...","['13/06/2023', '28/04/2023', '31/01/2023']","['Price changed from £430,000 to £400,000', 'Price changed from £450,000 to £430,000', 'Initial entry found: £450,000']",Apartment,1,1,,Share of Freehold,"['ONE BEDROOM (ORIGINALLY TWO BEDROOM) FIRST FLOOR CORNER FLAT', 'SHARE OF FREEHOLD', 'ARTS & CRAFTS PERIOD ORIGINAL FEATURES', 'QUIET HAMPSTEAD GARDEN SUBURB LOCATION', 'SHORT WALK TO HAMPSTEAD HEATH, TUBE AND SHOPS', 'SECURE STORAGE FOR BIKES ETC']","[['Golders Green ', '0.2 miles'], ['Brent Cross ', '1.1 miles'], ['Hampstead ', '1.2 miles']]","['underground', 'underground', 'underground']",£0 per year,£0,Ask agent,Band: TBC
81,85417953,"£400,000",Reduced on 09/06/2023,"Finchley Road, London, NW2","A bright, spacious, and immaculately presented first floor one bedroom apartment, recently converted and interior designed to the highest of specification. The apartment measures approx. 535 sq ft (50 sq m) and comprises a beautifully appointed Schmidt kitchen which features a Quartz wor...","['09/06/2023', '06/09/2022', '01/06/2022']","['Price changed from £425,000 to £400,000', 'Price changed from £450,000 to £425,000', 'Initial entry found: £450,000']",Flat,1,1,540 sq. ft.(50 sq. m.),Leasehold,[],"[['Cricklewood ', '0.7 miles'], ['Golders Green ', '0.8 miles'], ['Hampstead ', '0.9 miles']]","['nationalrail', 'underground', 'underground']",Ask agent,Ask agent,125 years left,Ask agent
82,130564397,"£400,000",Reduced on 09/06/2023,"Finchley Road, Childs Hill, NW2","A bright and airy first floor one bedroom apartment refurbished to the highest specification, with high ceilings, large windows and modern fittings. The apartment measures approx. 612 sq ft (56.9 sq m) and comprises a beautifully appointed Schmidt kitchen which features a Quartz worktop and Neff ...","['09/06/2023', '16/01/2023']","['Price changed from £425,000 to £400,000', 'Initial entry found: £425,000']",Apartment,1,1,612 sq. ft.(57 sq. m.),Leasehold,"['Refurbished to an Excellent Standard', 'Interior Designed to the Highest Specification', 'Double Glazed', 'Period Conversion', 'Wooden Floors Throughout', 'Fully Fitted Kitchen', 'Underfloor Heating Throughout', 'Video Entry System', 'Close to Transport Routes', 'Bright & Spacious']","[['Cricklewood ', '0.6 miles'], ['Golders Green ', '0.8 miles'], ['Hampstead ', '0.9 miles']]","['nationalrail', 'underground', 'underground']",Ask agent,Ask agent,125 years left,Ask agent
83,138014429,"£400,000",Reduced on 18/04/2023,"Avenue Court, Farm Avenue,  NW2, NW2","A three double bedroom flat featuring: reception room with open plan kitchen, decked balcony/terrace area, three piece bathroom, off-street/allocated parking bay.",['29/07/2023'],"['Initial entry found: £400,000']",Flat,1,3,705 sq. ft.(65 sq. m.),Leasehold,"['Leasehold Term 999 years from 24/06/2013', 'Three double bedrooms', 'Open plan reception/kitchen', 'Decked balcony/terrace area', 'Three piece bathroom', 'Off-street/allocated parking bay']","[['Cricklewood ', '0.3 miles'], ['Golders Green ', '1.0 miles'], ['Kilburn ', '0.9 miles']]","['nationalrail', 'underground', 'underground']",Ask agent,Ask agent,989 years left,Band: D
84,138995732,"£400,000",Added on 23/08/2023,"Finchley Road, NW11","Welcome to this impressive duplex apartment, offering a spacious layout across the ground and first floors of a modern conversion. Its contemporary design and well-lit interior offer both comfort and style. The apartment features a one double bedroom layout, ensuring a cozy living experi...",['23/08/2023'],"['Initial entry found: £400,000']",Flat,1,1,478 sq. ft.(44 sq. m.),Leasehold,"['Chain free', 'Low outgoings', 'Bright & modern', 'Ideally situated', 'Spacious duplex', '478 sq. ft']","[['Golders Green ', '0.5 miles'], ['Cricklewood ', '1.6 miles'], ['Hampstead ', '1.8 miles']]","['underground', 'nationalrail', 'underground']",Ask agent,Ask agent,125 years left,Band: A
85,135215168,"£400,000",Reduced on 17/07/2023,"Golders Green Road, Golders Green, NW11","This one's for you if... Entertaining on your large roof terrace during those summer months sounds like a dream come true. This property is an interior designer, newly refurbished, two double bedroom, first floor apartment set above commercial premises in the heart of Golde...","['17/07/2023', '24/05/2023']","['Price changed from £425,000 to £400,000', 'Initial entry found: £425,000']",Flat,1,2,,Leasehold,"['Roof terrace with artificial grass', 'Wood floors', 'Minutes from restaurants', 'Long lease', 'Abundance of natural light', 'Ideal for working from home', 'Private balcony', 'Leasehold', '1 Gbps available with Virgin Media']","[['Golders Green ', '0.2 miles'], ['Brent Cross ', '0.7 miles'], ['Cricklewood ', '1.1 miles']]","['underground', 'underground', 'nationalrail']",£300 per year,£1345,118 years left,Band: C
86,85415136,"£400,000",Reduced on 10/06/2023,"Finchley Road, London, NW2","A one bedroom apartment located in a newly refurbished development on Finchley Road, NW2. Forming part of a newly refurbished development situated on the first floor of this converted property. a beautiful one bedroom loft-style apartment presented in immaculate condition. This one bedroom apar...","['10/06/2023', '06/09/2022', '01/06/2022']","['Price changed from £425,000 to £400,000', 'Price changed from £450,000 to £425,000', 'Initial entry found: £450,000']",Flat,1,1,,Leasehold,"['1 bedroom', '1 reception room', '1 bathroom', 'Modern', 'First Floor', 'Town/City', 'Lateral']","[['Cricklewood ', '0.7 miles'], ['Golders Green ', '0.8 miles'], ['Hampstead ', '0.9 miles']]","['nationalrail', 'underground', 'underground']",£0 per year,£500,122 years left,Band: D
87,136092497,"£399,950",Reduced on 08/08/2023,"Hamilton Road, Temple Fortune, London, NW11",Recently refurbished to a high standard this bright and stylish three bedroom flat offers ample living space with trendy décor and modern fixtures and fittings throughout.,"['08/08/2023', '14/06/2023']","['Price changed from £425,000 to £399,950', 'Initial entry found: £425,000']",Flat,1,3,826 sq. ft.(77 sq. m.),Freehold,[],"[['Brent Cross ', '0.2 miles'], ['Golders Green ', '0.8 miles'], ['Hendon Central ', '0.9 miles']]","['underground', 'underground', 'underground']",Ask agent,Ask agent,Ask agent,Ask agent
88,137690963,"£399,950",Reduced on 07/08/2023,"Hamilton Road, Golders Green",This spacious three bedroom split-level maisonette offers ample living space with modern features. The property stretches over 800 sq.ft and will be sold with no onward chain.,"['07/08/2023', '21/07/2023']","['Price changed from £425,000 to £399,950', 'Initial entry found: £425,000']",Flat,1,3,,Freehold,"['Freehold', 'Period Property', 'Three Bedrooms', 'Split-Level', 'Separate Kitchen', 'No Onward Chain']","[['Brent Cross ', '0.1 miles'], ['Golders Green ', '0.8 miles'], ['Hendon Central ', '0.8 miles']]","['underground', 'underground', 'underground']",Ask agent,Ask agent,Ask agent,Ask agent
89,128874050,"£390,000",Added on 08/11/2022,"Crewys Road, London, NW2","A fabulous ONE BEDROOM GROUND FLOOR apartment with a shared garden ideally located in a PRIME RESIDENTIAL LOCATION within walking distance to Hampstead Heath and local shopping facilities. Benefits include: modern interior, luxury kitchen, good sized shared garden, share of freehold and viewing h...",['08/11/2022'],"['Initial entry found: £390,000']",Apartment,1,1,,Share of Freehold,"['MODERN INTERIOR', 'LUXURY KITCHEN', 'GOOD SIZED SHARED GARDEN', 'SHARE OF FREEHOLD', 'VIEWING HIGHLY RECOMMENDED']","[['Golders Green ', '0.6 miles'], ['Cricklewood ', '0.7 miles'], ['Hampstead ', '1.0 miles']]","['underground', 'nationalrail', 'underground']",£0 per year,£0,Ask agent,Band: TBC
90,130908650,"£385,000",Reduced on 07/08/2023,"Norwood Close, Cricklewood, NW2","This modern two-bedroom apartment in the vibrant area of Cricklewood, London, offers the perfect blend of contemporary style and practicality.","['07/08/2023', '20/01/2023']","['Price changed from £400,000 to £385,000', 'Initial entry found: £400,000']",Apartment,2,2,639 sq. ft.(59 sq. m.),Leasehold,"['Modern purpose built apartment in Cricklewood', 'Two bedrooms', 'Main bathroom and en-suite to main bedroom', 'Parking available for residents within the development', 'Recently redecorated', 'Vacant possession - no onward chain']","[['Cricklewood ', '0.3 miles'], ['Golders Green ', '0.9 miles'], ['Brent Cross ', '1.0 miles']]","['nationalrail', 'underground', 'underground']",Ask agent,Ask agent,76 years left,Band: E
91,133322078,"£385,000",Added on 05/04/2023,"West Heath Court, North End Road, London, NW11","PRIME LOCATION! A rare opportunity to acquire a one bedroom ground floor apartment situated in a sought after development close to Golders Green tube station and Hampstead Heath. Benefits include: long lease, lift, walk to tube, close to Golders Hill Park and viewing highly recommended. ","['19/05/2023', '05/04/2023']","['Price changed from £400,000 to £385,000', 'Initial entry found: £400,000']",Apartment,1,1,,Leasehold,"['LONG LEASE 142 YEARS REMAINING', 'COUNCIL TAX BAND C', 'LIFT', 'WALK TO TUBE', 'CLOSE TO GOLDERS HILL PARK', 'VIEWING HIGHLY RECOMMENDED']","[['Golders Green ', '0.2 miles'], ['Brent Cross ', '1.1 miles'], ['Hampstead ', '1.1 miles']]","['underground', 'underground', 'underground']",£0 per year,£0,Ask agent,Band: TBC
92,130532684,"£380,000",Reduced on 13/01/2023,"Cricklewood Lane, Cricklewood, NW2","Spacious three bedroom maisonette located in Cricklewood, also benefitting from a spacious lounge/dining room, cloakroom w/c and modern fitted bathroom. Viewing recommended.","['13/01/2023', '09/01/2023']","['Price changed from £390,000 to £380,000', 'Initial entry found: £390,000']",Flat,1,3,,Leasehold,"['Spacious maisonette', 'Three Bedrooms', 'Cricklewood, London location', 'Lounge/Dining room', 'Fitted Kitchen', 'Leasehold - EPC GRADE D']","[['Cricklewood ', '0.2 miles'], ['Kilburn ', '0.9 miles'], ['Golders Green ', '1.0 miles']]","['nationalrail', 'underground', 'underground']",Ask agent,£1103.69,89 years left,Band: C
