,id,price,added_reduced,address,description,price_change_date,price_change_value,type_house,bathrooms,bedrooms,size,tenure,key_features,close_stations,tenure_ground_rent,tenure_annual_service_charge,tenure_lease_length,council_tax_band
0,138391784,"£365,000",Added on 08/08/2023,"Chessing Court, Fortis Green, London, N2",This one bedroom penthouse apartment benefits from a South facing balcony with the most incredible panoramic views which seriously needs to be viewed to be fully appreciated!,['08/08/2023'],"['Initial entry found: £365,000']",Apartment,1,1,,Leasehold,"['One Bedroom', 'Top Floor', 'Balcony', 'East Finchley Tube Station 0.3 Miles Away', 'Open plan kitchen/lounge', 'Panoramic Views', 'Leasehold with 117 years remaining', 'Lift']","[['East Finchley ', '0.3 miles'], ['Highgate ', '1.0 miles'], ['Finchley Central ', '1.6 miles']]",£0 per year,£1440,116 years left,Band: C
1,135361100,"£550,000",Reduced on 28/06/2023,"Northwood Road, Highgate","Located on this popular tree lined road in Highgate is this well presented period conversion with an open plan reception and kitchen, providing two bedrooms and a separate study.","['28/06/2023', '26/05/2023']","['Price changed from £575,000 to £550,000', 'Initial entry found: £575,000']",Flat,1,2,,Share of Freehold,"['Two Bedrooms', 'Birght Reception Room', 'Fitted Kitchen', 'Bathroom', 'Separate Study', 'Great Transport Links', 'Shared Freehold', 'EPC Rating C']","[['Highgate ', '0.3 miles'], ['Archway ', '0.7 miles'], ['Upper Holloway ', '0.9 miles']]",Ask agent,Ask agent,Ask agent,Ask agent
2,133272386,"£550,000",Reduced on 01/08/2023,"The Copse, Fortis Green, London, N2","We are delighted to offer this well-proportioned three double bedroom first and second floor apartment set within this small but popular purpose built block which is set back off Fortis Green. The apartment benefits from a 22’11 x 11’6 reception room with door to balcony, 11’1 ...","['01/08/2023', '07/04/2023']","['Price changed from £580,000 to £550,000', 'Initial entry found: £580,000']",Apartment,1,3,,Leasehold,"['RECEPTION ROOM', 'KITCHEN', '3 BEDROOMS', 'BATHROOM/WC', 'SEPARATE WC', 'GAS CH', 'BALCONY', 'COMMUNAL GARDENS', 'LEASEHOLD', 'SOLE AGENTS']","[['East Finchley ', '0.5 miles'], ['Highgate ', '1.0 miles'], ['Alexandra Palace ', '1.6 miles']]",£0 per year,£0,92 years left,Band: TBC
3,138336368,"£550,000",Added on 05/08/2023,"Muswell Hill Broadway, Muswell Hill","A spacious 2 bedroom Edwardian mansion flat situated at the heart of Muswell Hill, providing a generous reception room, kitchen /diner and small study space.",['05/08/2023'],"['Initial entry found: £550,000']",Flat,1,2,,Leasehold,"['2 Double bedrooms ', 'Spacious reception ', 'Kitch/Diner ', 'Family bathroom', 'Study space', 'Great transport links', 'Schools close by', 'EPC - D']","[['Highgate ', '1.0 miles'], ['East Finchley ', '1.0 miles'], ['Alexandra Palace ', '1.1 miles']]",Ask agent,Ask agent,Ask agent,Ask agent
4,133278977,"£550,000",Reduced on 06/07/2023,"Muswell Hill Road, Muswell Hill","An exceptional split level, two double bedroom, period conversion featuring a recently refurbished kitchen and bathroom, large reception room and a spacious landing and hallway.",[],[],Flat,1,2,,Share of Freehold,"['Two double bedrooms', 'Large reception room', 'Refurbished kitchen', 'New contemporary bathroom', 'Walking distance to tube', 'Split level', 'Close to Muswell Hill', 'EPC - D']","[['Highgate ', '0.5 miles'], ['East Finchley ', '0.8 miles'], ['Archway ', '1.4 miles']]",Ask agent,Ask agent,Ask agent,Ask agent
5,129242114,"£550,000",Reduced on 20/03/2023,"Fortis Green Road, London","Offered with no onward chain and situated on the ground floor of Muswell Hill's most popular mansion block is this three bedroom flat in need of cosmetic work with an eat-in kitchen diner, original floor boards and delightful views out onto a landscaped communal garden area..","['31/07/2023', '20/03/2023', '04/01/2023', '21/11/2022', '18/11/2022']","['Price changed from £560,000 to £550,000', 'Price changed from £575,000 to £560,000', 'Price changed from £600,000 to £575,000', 'Price changed from £620,000 to £600,000', 'Initial entry found: £620,000']",Flat,1,3,,Leasehold,"['Three Bedrooms', 'Ground Floor', 'Kitchen Diner', 'Chain Free', 'Cosmetic Work Needed', 'Communal Gardens']","[['East Finchley ', '0.7 miles'], ['Highgate ', '0.9 miles'], ['Alexandra Palace ', '1.4 miles']]",Ask agent,Ask agent,Ask agent,Ask agent
6,123836303,"£525,000",Reduced on 21/06/2022,"Whittington Court, Aylmer Road, London, N2","An impressive large (1043 sq ft) 2 double bedroom (originally 3) 2 bathroom apartment situated on the top floor of this popular lift serviced purpose-built block, conveniently situated equidistant from both Highgate and East Finchley tube stations. ","['21/06/2022', '03/06/2022']","['Price changed from £550,000 to £525,000', 'Initial entry found: £550,000']",Apartment,2,2,,Leasehold,"['Two Double Bedrooms', 'Two Bathrooms', 'Two Balconies', 'Off Street Parking', '1043 sq ft', 'Communal Gardens', 'Lift', 'Ample Storage', 'Close to both East Finchley and Highgate Tube', 'Views over Highgate Golf Course']","[['East Finchley ', '0.5 miles'], ['Highgate ', '0.6 miles'], ['Archway ', '1.5 miles']]",£50 per year,£3000,90 years left,Band: E
7,134034254,"£522,500",Reduced on 02/08/2023,"Hillfield Park, Muswell Hill, London, N10","A stylish and beautifully presented two bedroom flat on the top floor of an attractive period property, moments from Muswell Hill Broadway. Chain Free","['02/08/2023', '24/04/2023']","['Price changed from £550,000 to £522,500', 'Initial entry found: £550,000']",Flat,1,2,,Leasehold,"['2 bedroooms', 'Central Muswell Hill location', 'Period features', '703 sq ft', 'Close to shops and transport links', 'EPC:D', 'Chain Free']","[['Highgate ', '0.9 miles'], ['East Finchley ', '0.9 miles'], ['Alexandra Palace ', '1.2 miles']]",£0 per year,£0,Ask agent,Band: TBC
8,133693271,"£500,000",Added on 17/04/2023,"Cholmeley Park, Highgate, N6","A split level one bedroom apartment occupying the top floor of a period conversion on a sought after road within close walking distance to Highgate Village. The accommodation comprises a large reception room, kitchen with space for dining, double bedroom, shower room and a guest WC.",[],[],Apartment,1,1,793 sq. ft.(74 sq. m.),Leasehold,"['Top Floor Period Conversion', 'Large Reception Room With Vaulted Ceiling', 'Communal Garden', 'Separate Kitchen With Space For Dining', 'Sought After Road In Highgate', 'Close To Public Transport']","[['Highgate ', '0.3 miles'], ['Archway ', '0.7 miles'], ['Upper Holloway ', '0.9 miles']]",£200 per year (Ask agent about the review period)When and how often your ground rent will be reviewed.Read more about ground rent review period in our glossary page.,£1200,112 years left,Band: C
9,137922818,"£500,000",Reduced on 15/08/2023,"Archway Road, Highgate","A well presented two double bedroom first floor ( top) purpose built apartment comes complete with a stylish fully bespoke separate kitchen, 14' reception room, modern bathroom and allocated off- street parking.","['15/08/2023', '26/07/2023']","['Price changed from £525,000 to £500,000', 'Initial entry found: £525,000']",Flat,1,2,,Leasehold,"['1st Floor (Top)', 'Two Double Bedrooms', 'Modern Kitchen', 'Reception Room', 'Modern Bathroom', 'Allocated Parking']","[['Highgate ', '0.1 miles'], ['East Finchley ', '0.9 miles'], ['Archway ', '1.1 miles']]",Ask agent,Ask agent,Ask agent,Ask agent
10,131557346,"£500,000",Added on 09/02/2023,"Great North Road, London","Agreed are delighted to offer for sale this newly refurbished two bedroom 2nd floor apartment situated in the popular Suburb of East Finchley. The property is within walking distance of local schools and amenities. Offering two reception rooms and two bathrooms, the property benefits from having ...","['10/04/2023', '09/02/2023']","['Price changed from £479,500 to £500,000', 'Initial entry found: £479,500']",Flat,2,2,,Leasehold,"['Property Ref : 1093', 'Two Bedrooms', 'Two Bathrooms', 'Furnished', 'Close to Local Transport Links', 'Close to Local Schools & Amenities', 'Recently Refurbished', 'Off Street Parking', 'Chain Free', 'Rental Investment Opportunity']","[['East Finchley ', '0.4 miles'], ['Highgate ', '0.6 miles'], ['Archway ', '1.5 miles']]",£0 per year,£1907,Ask agent,Band: D
11,133249475,"£500,000",Added on 04/04/2023,"Highgate Avenue, Highgate, N6","Well presented one double bedroom top floor purpose built flat with residents' parking and access to a communal garden, long lease and no onward chain, conveniently situated in a popular Highgate location, close to transport links and amenities. Ideal as either first time or investment purchase,...",[],[],Flat,1,1,,Leasehold,"['Well Presented One Double Bedroom Top Floor Flat', 'Popular Highgate Location', 'Neutral Finish And Modern Interiors', 'Bright And Spacious Dual Aspect Reception Room', 'Separate Well Equipped Kitchen', 'Modern Bathroom', ""Residents' Parking And Communal Garden"", 'Long Lease And No Chain', 'Close To Highgate Station And Amenities', 'Book Your Viewing Online!']","[['Highgate ', '0.3 miles'], ['Archway ', '0.7 miles'], ['Upper Holloway ', '1.0 miles']]",Ask agent,Ask agent,221 years left,Ask agent
12,130341239,"£500,000",Reduced on 09/02/2023,"North Hill, Highgate. N6","A spacious two bedroom ground floor flat situated at the rear of this sought after 1920`s, Art Deco purpose built block within close walking distance to Highgate Underground Station.",[],[],Apartment,1,2,672 sq. ft.(62 sq. m.),Share of Freehold,"['Art Deco Purpose Built Apartment', 'Original Parquet Wooden Floors', 'Double Glazed Windows', 'Communal Garden', 'Close To Highgate Village', 'Includes a Share of the Freehold']","[['Highgate ', '0.3 miles'], ['East Finchley ', '0.8 miles'], ['Archway ', '1.2 miles']]",£100 per year (Ask agent about the review period)When and how often your ground rent will be reviewed.Read more about ground rent review period in our glossary page.,£4800,989 years left,Band: D
13,138784370,"£500,000",Added on 17/08/2023,"Archway Road, London","Stylish loft-style first-floor apartment with bright outlook & two double bedrooms located within a 5 minute walk of Highgate Underground. Renovated to a high specification the flat boasts a spacious open plan reception with modern fully fitted kitchen, family bathroom and en suite shower room.",['17/08/2023'],"['Initial entry found: £500,000']",Flat,1,2,,Leasehold,"['Spacious Loft-Style Apartment', 'Open Plan Reception', 'Modern Kitchen & Bathrooms', 'Ideal for Highgate Tube', 'Close to Highgate Wood', 'No Upper Chain']","[['Highgate ', '0.1 miles'], ['East Finchley ', '0.9 miles'], ['Archway ', '1.1 miles']]",£150 per year (1% increase reviewed every 1 year)When and how often your ground rent will be reviewed.Read more about ground rent review period in our glossary page.,£0,85 years left,Band: D
14,133948721,"£500,000",Added on 21/04/2023,"Sheldon Avenue, East Finchley","A spacious apartment situated on the ground floor of this purpose built building providing three double bedrooms, bright reception room and access to a large communal garden",['21/04/2023'],"['Initial entry found: £500,000']",Flat,2,3,,Leasehold,"['Three double bedrooms ', 'Bright recpetion room ', 'Fitted kitchen ', 'Bathroom ', 'Large communal garden ', 'Ground floor ', 'Chain free', 'EPC Rating C']","[['East Finchley ', '0.5 miles'], ['Highgate ', '0.5 miles'], ['Archway ', '1.5 miles']]",Ask agent,Ask agent,Ask agent,Ask agent
15,138046208,"£500,000",Added on 29/07/2023,"North Hill, Highgate","Situated within this popular Art Deco building is this spectacular apartment comprising two double bedrooms, reception room, lift access and communal gardens",[],[],Flat,1,2,,Share of Freehold,"['Two double bedrooms ', 'Reception room', 'Fitted kitchen', 'Modern bathroom ', 'Lift access', 'Communal garden', 'Close to Highgate Woods', 'EPC rating D']","[['Highgate ', '0.3 miles'], ['East Finchley ', '0.8 miles'], ['Archway ', '1.2 miles']]",Ask agent,Ask agent,Ask agent,Ask agent
16,128846540,"£500,000",Added on 07/11/2022,"Aylmer Court, Sheldon Avenue, East Finchley, London, N2","Close to East Finchley and Highgate station is this three bedroom ground floor flat, situated in a popular purpose built block on Sheldon Avenue. The property is well presented and overlooking the sunny communal gardens which back onto Highgate Golf Course.",[],[],Apartment,2,3,,Leasehold,"['3 Bedrooms', '1 Bathroom', '1 Reception', 'Ground floor', 'Walking distance to East Finchley station', 'Communal gardens', 'Close to amenities', 'Chain free']","[['East Finchley ', '0.5 miles'], ['Highgate ', '0.5 miles'], ['Archway ', '1.5 miles']]",£20 per year,£4058.6,123 years left,Band: D
17,138046208,"£500,000",Added on 29/07/2023,"North Hill, Highgate","Situated within this popular Art Deco building is this spectacular apartment comprising two double bedrooms, reception room, lift access and communal gardens",[],[],Flat,1,2,,Share of Freehold,"['Two double bedrooms ', 'Reception room', 'Fitted kitchen', 'Modern bathroom ', 'Lift access', 'Communal garden', 'Close to Highgate Woods', 'EPC rating D']","[['Highgate ', '0.3 miles'], ['East Finchley ', '0.8 miles'], ['Archway ', '1.2 miles']]",Ask agent,Ask agent,Ask agent,Ask agent
18,77570946,"£490,000",Reduced on 15/06/2021,"Lyttelton Road, East Finchley, N2","*PROPERTY MARKET REMAINS OPEN FOR VIEWINGS & VALUATIONS IN PERSON OR BY VIRTUAL APPOINTMENT* Well presented and spacious two bedroom second floor flat with private balcony entrance, enviably located within an attractive purpose built block just a short walk from East Finchley station. The pro...",[],[],Flat,1,2,,Leasehold,"['Well Presented Two Bedroom Second Floor Flat', 'Attractive Block In Sought After Location', 'Beautiful Parquet Flooring And High Ceilings', 'Bright And Spacious Reception Room', 'Separate Well Equipped Eat-In Kitchen', 'Modern Bathroom And Separate WC', 'Private Balcony With External Store', 'Well Maintained Communal Gardens', 'Close To East Finchley Station And Amenities']","[['East Finchley ', '0.4 miles'], ['Golders Green ', '1.3 miles'], ['Highgate ', '1.3 miles']]",Ask agent,Ask agent,99 years left,Ask agent
19,134482088,"£490,000",Added on 05/05/2023,"Great North Road, East Finchley, N2","Adam Hayes Estate Agents are now in receipt of an offer for the sum of £460,000 for Flat 3 Highgate Edge, Great North Road, London, N2 0NT. Anyone wishing to place an offer on this property should contact Adam Hayes Estate Agents at 158 High Road, East Finchley, London N2 9AS or on ...",[],[],Apartment,1,2,776 sq. ft.(72 sq. m.),Share of Freehold,"['Two Bedrooms', 'First Floor', 'Chain Free', 'Garage', 'Balcony', 'Close to Station']","[['East Finchley ', '0.2 miles'], ['Highgate ', '0.9 miles'], ['Golders Green ', '1.6 miles']]",£75 per year (Ask agent about the review period)When and how often your ground rent will be reviewed.Read more about ground rent review period in our glossary page.,£1680.88,968 years left,Band: D
20,124750808,"£480,000",Reduced on 15/11/2022,"Shepherds Hill, Highgate",A particularly spacious ground floor flat in this small and highly sought after block with secure parking and a private terrace accessed directly from the reception room.,[],[],Flat,1,1,,Leasehold,"['Double Bedroom', 'Kitchen', 'Open Plan Living', 'Terrace', 'Secure Parking', 'On Site Caretaker']","[['Highgate ', '0.4 miles'], ['Archway ', '0.9 miles'], ['Crouch Hill ', '1.0 miles']]",Ask agent,Ask agent,Ask agent,Ask agent
21,130892681,"£479,900",Added on 19/01/2023,"Muswell Hill, London, N10","77 Muswell Hill provides the benefits of living in the city of London, combined with the beauty and relaxed atmosphere of village life. This prestigious development consists of 47 luxury apartments set in the heart of the village.",[],[],Flat,1,1,,Leasehold,"['One bedroom', 'private balcony', 'use of gym', 'conceirge', 'communal', 'close to the Broadway.']","[['Highgate ', '0.9 miles'], ['East Finchley ', '1.0 miles'], ['Alexandra Palace ', '1.1 miles']]",£0 per year,£0,Ask agent,Band: TBC
22,138420098,"£475,000",Reduced on 03/08/2023,"Stanhope Road, Highgate",This spacious 800 sq ft apartment has good storage facilities and a large reception room along with two double bedrooms a separate kitchen and a well-presented communal areas.,[],[],Flat,1,2,,Leasehold,"['Two Bedrooms', 'Reception Room', 'Separate Kitchen', 'Bathroom', 'Communal Gardens', 'External Storage']","[['Highgate ', '0.4 miles'], ['Archway ', '0.8 miles'], ['Crouch Hill ', '1.0 miles']]",Ask agent,Ask agent,Ask agent,Ask agent
23,135294797,"£475,000",Added on 25/05/2023,"Great North Road, London","Adam Hayes Estate Agents are now in receipt of an offer for the sum of £475,000 for Flat 4 Highgate Edge, Great North Road, London, N2 0NT. Anyone wishing to place an offer on this property should contact Adam Hayes Estate Agents at 158 High Road, East Finchley, London N2 9AS or on ...",[],[],Apartment,1,2,790 sq. ft.(73 sq. m.),Share of Freehold,"['Two Bedrooms', 'Chain Free', 'Investment Opportunity', 'Garage', 'First Floor', 'Communal Gardens']","[['East Finchley ', '0.5 miles'], ['Highgate ', '0.5 miles'], ['Golders Green ', '1.7 miles']]",£75 per year (Ask agent about the review period)When and how often your ground rent will be reviewed.Read more about ground rent review period in our glossary page.,Ask agent,968 years left,Band: E
24,86039892,"£460,000",Added on 16/02/2023,"Great North Road, East Finchley, London, N2",Located on the second floor of this art deco style block is this bright and airy two double bedroom flat. Doran Manor is situated equidistant to Highgate and East Finchley Northern Line underground stations.,[],[],Apartment,1,2,,Leasehold,"['Purpose-built', 'Leasehold', 'Second floor', 'Double glazed', '2 double bedrooms', 'Separate W/C', 'Communal gardens', 'Bathroom', 'Service exit', 'Residents parking']","[['East Finchley ', '0.4 miles'], ['Highgate ', '0.6 miles'], ['Archway ', '1.6 miles']]",£0 per year,£1928.56,146 years left,Band: C
25,134670113,"£450,000",Reduced on 31/05/2023,"Aylmer Parade, Aylmer Road, London","This immaculately presented, recently refurbished and surprisingly spacious two bedroom duplex apartment, is ideal for young professionals, first time buyers or as a buy to let investment and - located on Aylmer Parade, within easy reach of a host of local amenities in East Finchley including a g...",[],[],Apartment,2,2,,Leasehold,"['Beautifully Presented Two Bedroom Duplex Apartment', 'Spacious Loft Bedroom', 'Light and Spacious Throughout', 'Modern Kitchen', 'Two Bathrooms', 'Excellent Transport Links', 'Close to Local Amenities', 'Private Storage Shed', 'Permit Parking Available']","[['East Finchley ', '0.5 miles'], ['Highgate ', '0.6 miles'], ['Archway ', '1.5 miles']]",£0 per year,£578.83,153 years left,Band: B
26,133733888,"£450,000",Added on 17/04/2023,"Princes Avenue, Muswell Hill, London, N10",A two bedroom split level period conversion located just off of Muswell Hill Broadway on one of the area's popular Royal Roads.,[],[],Apartment,1,2,,Leasehold,"['2 Bedrooms', '1 Reception room', 'Open-plan kitchen', '1 Bathroom', '1st & 2nd floor', 'Chain free', 'Semi-Detached', 'Wooden flooring', 'Period features', 'Central Broadway location']","[['East Finchley ', '0.9 miles'], ['Highgate ', '0.9 miles'], ['Alexandra Palace ', '1.2 miles']]",£0 per year,£1650,114 years left,Band: D
27,123722477,"£450,000",Reduced on 08/03/2023,"Causton Road,  Highgate, London, N6",AVAILABLE AGAIN DUE TO CHAIN BREAK Situated in this highly desirable and convenient location is this level ground floor One bedroom converted Garden apartment within this imposing Victorian mansion. This charming apartment also benefits from delightful communal gardens and is located within 500...,[],[],Apartment,1,1,,Share of Freehold,['Fitted Double Bedroom * Delightful Living Room with Direct Access to Communal Gardens * Fitted Kitchen * Private Screened Landscaped Southerly Front Garden * Tastefully Presented * Highly (truncated)'],"[['Highgate ', '0.3 miles'], ['Archway ', '0.6 miles'], ['Upper Holloway ', '0.9 miles']]",£50 per year,£1200,994 years left,Band: C
28,138100628,"£450,000",Added on 31/07/2023,"Fortis Green, East Finchley, N2","Rarely available. A bright and airy two bedroom first floor flat, converted from an attractive period end of terrace house and situated in this highly favoured location in the heart of East Finchley. Located within 0.2 miles of East Finchley tube, cafes and restaurants, as ...",[],[],Flat,1,2,,Leasehold,"['Attractive Period Property', 'Large Reception Room', 'Two Double Bedrooms', 'Gas Central Heating', 'Double Glazed Windows', 'Sought After Location', 'Chain Free', 'Long Lease']","[['East Finchley ', '0.2 miles'], ['Highgate ', '1.1 miles'], ['Finchley Central ', '1.5 miles']]",Ask agent,Ask agent,Ask agent,Ask agent
29,136958825,"£445,000",Added on 05/07/2023,"Market Place, London, N2","Prickett and Ellis are proud to present this chain free two-bedroom first floor flat, located a short walk from the local amenities of East Finchley Highstreet and East Finchley station. EPC - C ",[],[],Apartment,1,2,,Ask agent,"['TWO DOUBLE BEDROOM EDWARDIAN CONVERSION', 'CHAIN FREE', '0.1 FROM LOCAL AMENITIES', '0.3 MILES FROM EAST FINCHLEY STATION', 'LARGE LIVING AREA', 'GREAT OPPURTUNITY FOR FIRST TIME BUYERS']","[['East Finchley ', '0.2 miles'], ['Highgate ', '1.2 miles'], ['Finchley Central ', '1.3 miles']]",Ask agent,Ask agent,Ask agent,Band: TBC
30,138522515,"£440,000",Added on 10/08/2023,"Aylmer Road, Highgate","Set on the top floor of this popular building is this well presented apartment comprising two double bedrooms, fitted kitchen and access to a large communal garden",[],[],Flat,1,2,,Leasehold,"['Two double bedrooms', 'Reception room ', 'Fitted kitchen ', 'Modern bathroom ', 'Communal garden ', 'Chain free', 'Good transport links', 'EPC Rating D']","[['East Finchley ', '0.5 miles'], ['Highgate ', '0.5 miles'], ['Archway ', '1.5 miles']]",Ask agent,Ask agent,Ask agent,Ask agent
31,129170519,"£435,000",Reduced on 03/07/2023,"Monarch Court, Hampstead Garden Suburb","A 2 double bedroom, second floor flat situated in this popular purpose built block with 2 balconies including one at the rear with fantastic views over Lyttelton Playing Fields. Also benefitting from a long lease with Share of the Freehold. Located within walking distance of Hampste...",[],[],Apartment,1,2,,Share of Freehold,[],"[['East Finchley ', '0.4 miles'], ['Golders Green ', '1.2 miles'], ['Highgate ', '1.3 miles']]",Ask agent,Ask agent,Ask agent,Ask agent
32,86153400,"£425,000",Added on 13/06/2023,"Pages Lane, Muswell Hill, N10","STYLISH AND TASTEFULLY PRESENTED TWO DOUBLE-BEDROOM UPPER (THIRD) FLOOR ART DECO MANSION BLOCK APARTMENT. The property boasts an abundance of natural light throughout and retains many fine period features reminiscent of a bygone era. The property, which is accessed via secure entry-phone and pass...",[],[],Apartment,1,2,,Leasehold,"['Upper Floor Security', 'Passenger Lift', 'Two Double Bedrooms', 'Stylish Lounge with Attractive Frontal Outlook.', 'Fitted Kitchen/Breakfast Room', 'Built In Storage Cupboards', 'Entry-Phone Access', 'Communal Gardens', 'Close to Muswell Hill Broadway', 'Close to Coldfall Primary & Fortismere Secondary Schools']","[['East Finchley ', '0.9 miles'], ['Highgate ', '1.1 miles'], ['Alexandra Palace ', '1.3 miles']]",Ask agent,Ask agent,Ask agent,Ask agent
33,128957333,"£425,000",Reduced on 17/02/2023,"Elmhurst Crescent, London, N2",Addison Townsend are delighted to offer for sale this well presented three bedroom ground floor apartment with direct access to the communal gardens. Situated in this residential turning off East End Road within 0.5 miles of East Finchley Station (northern line) and conveniently located in the ca...,[],[],Flat,1,3,,Leasehold,"['Three Bedroom Flat', 'Direct Access to Communal Gardens', 'Ground Floor', '0.5 Miles East Finchley Station', 'Communal Parking', 'Chain Free']","[['East Finchley ', '0.5 miles'], ['Finchley Central ', '1.1 miles'], ['Golders Green ', '1.4 miles']]",Ask agent,Ask agent,176 years left,Band: D
34,138130010,"£425,000",Added on 01/08/2023,"Prospect Ring, East Finchley, N2","We offer this spacious and beautifully kept three double bedroom first floor flat situated in this cul-de-sac location just off Market Place, N2, minutes from East Finchley High Road, underground station, Holy Trinity and Martins Primary schools and the Archer Academy. The property offers ample l...",[],[],Apartment,1,3,,Leasehold,"['28ft Kitchen Reception Room', 'Balcony', 'Three Double Bedrooms', 'Bathroom', 'Separate WC', 'Communal Gardens', 'Communal Playground', 'Chain Free']","[['East Finchley ', '0.2 miles'], ['Highgate ', '1.3 miles'], ['Finchley Central ', '1.3 miles']]",Ask agent,Ask agent,89 years left,Ask agent
35,135038846,"£425,000",Added on 19/05/2023,"Great North Road, East Finchley, London, N2","FANTASTIC TWO DOUBLE BEDROOM FLAT CLOSE TO EAST FINCHLEY STATION. The property is well situated between East Finchley, Highgate Village and Muswell Hill and benefits from two double bedrooms, spacious lounge and separate kitchen. It further benefits from access to with rear communal gardens and u...",[],[],Apartment,1,2,,Leasehold,"['Secure Purpose Built Block', 'Two Double Bedrooms', 'Spacious Reception Room', 'Separate Kitchen', 'Communal Gardens', 'Use Of Communal Off-Street Parking', 'Short Walking Distance To Station', 'Lease Approximately 151 Years Remaining']","[['East Finchley ', '0.4 miles'], ['Highgate ', '0.6 miles'], ['Archway ', '1.5 miles']]",£0 per year,£2289.24,145 years left,Band: D
