,id,price,added_reduced,address,description,type_house,bathrooms,bedrooms,size,tenure,key_features,close_stations,close_stations_type,tenure_ground_rent,tenure_annual_service_charge,tenure_lease_length,council_tax_band,sold_under_offer
70,136958825,"£425,000",Reduced on 08/09/2023,"Market Place, London, N2","Prickett and Ellis are proud to present this chain free two-bedroom first floor flat, located a short walk from the local amenities of East Finchley Highstreet and East Finchley station. EPC - C ",Apartment,1,2,,Leasehold,"['TWO DOUBLE BEDROOM EDWARDIAN CONVERSION', 'CHAIN FREE', '0.1 FROM LOCAL AMENITIES', '0.3 MILES FROM EAST FINCHLEY STATION', 'LARGE LIVING AREA', 'GREAT OPPURTUNITY FOR FIRST TIME BUYERS']","[['East Finchley ', '0.2 miles'], ['Highgate ', '1.2 miles'], ['Finchley Central ', '1.3 miles']]","['underground', 'underground', 'underground']",£0 per year,£0,90 years left,Band: TBC,False
71,140411780,"£425,000",Added on 25/09/2023,"Whittington Court, Aylmer Road, London, N2",Whittington Court is situated close to Highgate and East Finchley stations and is ideally located to benefit from the many amenities and open green spaces. ,Apartment,1,2,,Leasehold,"['Ground floor', 'Purpose built', 'Direct access to gardens', 'Residents parking', 'Art deco block', '2 Bedrooms', 'Modern kitchen', 'Storage', 'Long lease', 'Close to Highgate']","[['East Finchley ', '0.5 miles'], ['Highgate ', '0.6 miles'], ['Archway ', '1.5 miles']]","['underground', 'underground', 'underground']",£100 per year,£4300,102 years left,Band: D,False
72,138130010,"£425,000",Added on 01/08/2023,"Prospect Ring, East Finchley, N2","We offer this spacious and beautifully kept three double bedroom first floor flat situated in this cul-de-sac location just off Market Place, N2, minutes from East Finchley High Road, underground station, Holy Trinity and Martins Primary schools and the Archer Academy. The property offers ample l...",Apartment,1,3,,Leasehold,"['28ft Kitchen Reception Room', 'Balcony', 'Three Double Bedrooms', 'Bathroom', 'Separate WC', 'Communal Gardens', 'Communal Playground', 'Chain Free']","[['East Finchley ', '0.2 miles'], ['Highgate ', '1.3 miles'], ['Finchley Central ', '1.3 miles']]","['underground', 'underground', 'underground']",Ask agent,Ask agent,89 years left,Band: D,True
73,137654030,"£425,000",Added on 12/05/2023,"New Ash Close, East Finchley, London, N2","This amazing 2 bed flat is situated on second floor and it offers 2 bright double bedrooms, spacious reception and modern kitchen and bathroom.",Flat,1,2,569 sq. ft.(53 sq. m.),Leasehold,"['Amazing 2 bed flat', 'Bright and spacious bedrooms', 'Modern kitchen and bathroom', 'Close to schools and local amenities', 'Easy transport links']","[['East Finchley ', '0.4 miles'], ['Finchley Central ', '1.2 miles'], ['Highgate ', '1.4 miles']]","['underground', 'underground', 'underground']",Ask agent,Ask agent,Ask agent,Ask agent,False
74,137822984,"£415,000",Reduced on 17/08/2023,"Tetherdown, Muswell Hill, London, N10","Set on the ground floor of a stunning period conversion this beautifully finished 1 bedroom flat offers an incredible Garden and wonderfully bright and airy interiors, with an exceptional bay-fronted reception room.",Flat,1,1,488 sq. ft.(45 sq. m.),Share of Freehold,"['Excellent 1 bedroom apartment', 'Set in a stunning period conversion', 'Good-sized private garden', 'Large reception room with ample space to dine', 'Charming fitted modern kitchen', 'Well-presented throughout']","[['East Finchley ', '0.8 miles'], ['Highgate ', '1.0 miles'], ['Alexandra Palace ', '1.3 miles']]","['underground', 'underground', 'nationalrail']",Ask agent,Ask agent,Ask agent,Ask agent,True
75,138925229,"£400,000",Added on 19/08/2023,"Queens Lane, London, N10",Prickett and Ellis are proud to present this fantastically located one bedroom chain free flat that has been recently refurbished to a high standard throughout. EPC Rating - D ,Apartment,1,1,,Leasehold,"['CHAIN FREE', 'ONE BEDROOM FLAT WITH POTENTIAL TO TURN INTO TWO BEDROOMS', 'LOCATED ON MUSWELL HILL BROADWAY', 'RECENTLY REFERBISHED', '113 YEAR LEASE', '584 SQUARE FEET']","[['East Finchley ', '1.0 miles'], ['Highgate ', '1.0 miles'], ['Alexandra Palace ', '1.1 miles']]","['underground', 'underground', 'nationalrail']",£0 per year,£0,Ask agent,Band: TBC,False
76,135038846,"£400,000",Reduced on 04/09/2023,"Great North Road, East Finchley, London, N2","FANTASTIC TWO DOUBLE BEDROOM FLAT CLOSE TO EAST FINCHLEY STATION. The property is well situated between East Finchley, Highgate Village and Muswell Hill and benefits from two double bedrooms, spacious lounge and separate kitchen. It further benefits from access to with rear communal gardens and u...",Apartment,1,2,,Leasehold,"['Secure Purpose Built Block', 'Two Double Bedrooms', 'Spacious Reception Room', 'Separate Kitchen', 'Communal Gardens', 'Use Of Communal Off-Street Parking', 'Short Walking Distance To Station', 'Lease Approximately 151 Years Remaining']","[['East Finchley ', '0.4 miles'], ['Highgate ', '0.6 miles'], ['Archway ', '1.5 miles']]","['underground', 'underground', 'underground']",£0 per year,£2146.26,986 years left,Band: D,True
77,133272632,"£399,950",Reduced on 16/03/2023,"Risborough Court, Muswell Hill, London, N10",Situated within minutes walk of Muswell Hill Broadway’s vibrant promenades is a two double bedroom purpose built first floor maisonette. The property is in need of updating and is ideally placed with excellent bus services providing easy access to Highgate (Northern Line) and Finsbury Park ...,Apartment,1,2,,Leasehold,"['RECEPTION ROOM', '2 DOUBLE BEDROOMS', 'KITCHEN', 'BATHROOM/WC', 'GAS CH', 'LEASEHOLD', 'SOLE SELLING AGENT']","[['Highgate ', '0.9 miles'], ['Alexandra Palace ', '1.1 miles'], ['East Finchley ', '1.1 miles']]","['underground', 'nationalrail', 'underground']",£0 per year,£0,Ask agent,Band: TBC,False
78,139801736,"£399,000",Reduced on 21/09/2023,"Archway Road, Highgate, N6","Introducing a charming and recently refurbished one-bedroom first-floor flat in a period conversion, perfectly situated opposite Highgate Woods.",Flat,1,1,,Leasehold,"['One Double Bedroom (First Floor)', 'Newly Refurbished Throughout', 'Kitchen with Integrated Appliances', 'Quartz Stone Worktops', 'High Ceilings', 'Close to Highgate Underground (0.2 miles)', 'Opposite Highgate Woods', 'Long Lease (170 years +)', 'Chain Free']","[['Highgate ', '0.2 miles'], ['East Finchley ', '0.8 miles'], ['Archway ', '1.2 miles']]","['underground', 'underground', 'underground']",Ask agent,Ask agent,Ask agent,Ask agent,False
79,136222961,"£395,000",Reduced on 17/06/2023,"Viceroy Close, East Finchley, London, N2","We offer a spacious three bedroom purpose built duplex apartment located on the second and third floors of this convenient block, in the heart of East Finchley. The property offers  spacious accommodation, including good size reception room, fitted kitchen, three bedrooms, bathroom and wc...",Apartment,1,3,,Leasehold,"['Three Bedrooms', 'Long Lease', 'Duplex', 'Chain Free', 'Close to Amenities', 'Garage', 'Own Parking Space', 'Double Glazed Windows']","[['East Finchley ', '0.2 miles'], ['Highgate ', '1.1 miles'], ['Finchley Central ', '1.5 miles']]","['underground', 'underground', 'underground']",Ask agent,Ask agent,Ask agent,Ask agent,True
80,123255245,"£390,000",Added on 06/01/2023,"Muswell Hill Road, Muswell Hill",A one bedroom apartment on the first floor of an Edwardian double fronted period conversion with a balcony situated only moments away from Muswell Hill Broadway.,Flat,1,1,441 sq. ft.(41 sq. m.),Share of Freehold,"['Period Conversion', 'Balcony', 'First Floor', 'Moments Away From Muswell Hill Broadway', 'Share of Freehold', 'Chain Free']","[['Highgate ', '0.7 miles'], ['East Finchley ', '0.8 miles'], ['Alexandra Palace ', '1.4 miles']]","['underground', 'underground', 'nationalrail']",Ask agent,£432,998 years left,Band: C,True
81,129500177,"£385,000",Reduced on 29/11/2022,"Norfolk Close, East Finchley, N2","We offer this spacious three double bedroom flat situated in this cul-de-sac location just off Park Road, N2, minutes from East Finchley High Road, underground station, Holy Trinity and Martins Primary schools and the Archer Academy. The property offers ample living space, plenty of storage both ...",Apartment,1,3,,Leasehold,"['Large Reception Dining Room', 'Kitchen Breakfast Room', 'Three Double Bedrooms', 'Bathroom & WC', 'Balcony', 'External Storage Room', 'Off Street Parking', 'Chain Free']","[['East Finchley ', '0.4 miles'], ['Finchley Central ', '1.2 miles'], ['Highgate ', '1.4 miles']]","['underground', 'underground', 'underground']",Ask agent,Ask agent,88 years left,Ask agent,True
82,135984602,"£382,500",Reduced on 22/01/2023,"Fortis Green, London, N2",Spacious 1 bedroom centrally located within close proximity to both Muswell Hill Broadway and East Finchley Station.,Apartment,1,1,,Leasehold,['*Off street parking *Storage *Terrace *One Bedroom *Small development *Long lease'],"[['East Finchley ', '0.4 miles'], ['Highgate ', '1.0 miles'], ['Alexandra Palace ', '1.7 miles']]","['underground', 'underground', 'nationalrail']",£0 per year,£0,134 years left,Band: C,True
83,138469241,"£380,000",Added on 09/08/2023,"Fortis Green, London, N2",Rarely available on the open market is this one bedroom apartment located in this sought after location on Fortis Green. Situated within equal walking distance to East Finchley tube and Muswell Hill Broadway.,Apartment,1,1,,Leasehold,"['Purpose built flat', 'Intercom entry', 'Second floor', 'Leasehold', 'Chain Free', 'Residents parking', '1 Bedroom', 'Fitted bathroom', '0.4m to East Finchley tube']","[['East Finchley ', '0.4 miles'], ['Highgate ', '1.0 miles'], ['Finchley Central ', '1.7 miles']]","['underground', 'underground', 'underground']",£0 per year,£0,Ask agent,Band: TBC,True
84,140516765,"£380,000",Added yesterday,"Flat C, First Floor, 69 Muswell Hill, London, N10 3PN",N/A,Flat,1,1,,Ask agent,"['This sale is conditional and is subject to confirmation by the seller, who will accept or decline the highest bid no longer than two working days from the bidding closing time.\xa0', ""This listing is provided in association with Foxtons, London's leading estate agent."", 'Spacious reception room', 'Well-appointed kitchen', 'Master bedroom and bathroom', 'Moments from the heart of Muswell Hill', 'Gross internal floor area approx 359 sqft (33 sq m)', 'Online Auction on Wednesday, 25 October 2023']","[['Highgate ', '0.9 miles'], ['Alexandra Palace ', '1.0 miles'], ['East Finchley ', '1.1 miles']]","['underground', 'nationalrail', 'underground']",Ask agent,Ask agent,Ask agent,Ask agent,False
85,138322148,"£380,000",Reduced on 31/08/2023,"Cheapside, Fortis Green, London, N2",Spacious 1 bedroom apartment centrally located within close proximity to both Muswell Hill Broadway and East Finchley Station.,Apartment,1,1,,Leasehold,"['Chain free', 'Open plan kitchen/Diner', 'Great location', 'Double Bedroom', 'Family Bathroom', 'Close to amenities']","[['East Finchley ', '0.5 miles'], ['Highgate ', '1.0 miles'], ['Alexandra Palace ', '1.6 miles']]","['underground', 'underground', 'nationalrail']",£0 per year,£0,Ask agent,Band: B,False
86,140467127,"£375,000",Added on 26/09/2023,"2nd Floor Flat and Roof Void, 278 Archway Road, Highgate N6 5AU","Auction Sale - 10/10/2023 A well located second floor, four room self contained flat in need of modernisation. The flat has access to a good sized roof void, with potential for creation of an additional self contained flat, subject to the usual consents. Vacant.",Flat,,3,,Leasehold,"['Second floor flat', 'Requires modernisation', 'Gas central heating (not tested)', 'Well located for Highgate Village', 'Roof void included', 'Potential for creation of an additional self contained flat, subject to planning']","[['Highgate ', '0.2 miles'], ['Archway ', '0.8 miles'], ['Upper Holloway ', '1.0 miles']]","['underground', 'underground', 'overground']",Ask agent,Ask agent,Ask agent,Ask agent,False
87,133272854,"£365,000",Reduced on 06/09/2023,"Risborough Close, Muswell Hill, London, N10",Set on the third floor (with lift service) of this 1930’s purpose built block and boasting possibly some of the most breathtaking views across the City of London is a two double bedroom flat which could benefit from some updating. The property is situated within minutes’ walk of Muswe...,Apartment,1,2,,Leasehold,"['RECEPTION ROOM', 'KITCHEN', '2 DOUBLE BEDROOMS', 'BATHROOM/WC', 'GAS CH', 'DOUBLE GLAZED THROUGHOUT', 'LIFT SERVICE', 'LEASEHOLD', 'SOLE SELLING AGENT', 'CHAIN FREE']","[['Highgate ', '0.9 miles'], ['Alexandra Palace ', '1.1 miles'], ['East Finchley ', '1.1 miles']]","['underground', 'nationalrail', 'underground']",£0 per year,£0,Ask agent,Band: TBC,False
88,139468853,"£365,000",Added on 04/09/2023,"Summerland Grange, Summerland Gardens, London, N10",The property is well presented and is ideal for first time buyers or working professionals looking to be in close proximity to local amenities and transport links.,Apartment,1,1,,Ask agent,"['Key features', '1 Bedroom', '1 Reception', 'Gas Central Heating', 'Residents Parking', 'Outside Storage Shed', 'Communal Gardens', 'Double Glazing', 'Modern Kitchen and Bathroom', 'Close to Local Amenities']","[['Highgate ', '0.9 miles'], ['East Finchley ', '1.0 miles'], ['Alexandra Palace ', '1.1 miles']]","['underground', 'underground', 'nationalrail']",Ask agent,Ask agent,Ask agent,Band: TBC,True
89,128563007,"£360,000",Reduced on 01/06/2023,"Chessing Court, Fortis Green, London, N2",*BACK ON THE MARKET AS OF 21ST AUGUST 2023* Bright and spacious one bedroom flat situated on the second floor in this modern purpose built block ideally located to shopping and transport facilities. The property is being offered for sale chain free.,Apartment,1,1,,Leasehold,"['Reception Room', 'Kitchen/Diner', 'Double Bedroom', 'Family Bathroom', 'Lift', 'Garage', 'Chain Free']","[['East Finchley ', '0.3 miles'], ['Highgate ', '1.0 miles'], ['Finchley Central ', '1.6 miles']]","['underground', 'underground', 'underground']",£0 per year,£1440,156 years left,Band: C,True
90,131613989,"£350,000",Added on 11/02/2023,"Muswell Hill Broadway, Muswell Hill","A well proportioned mansion flat located the first floor of this period building. The bright accommodation comprises of high ceilings, one double bedroom, reception room & separate kitchen.",Flat,1,1,,Leasehold,"['Mansion flat', 'First floor', 'One bedroom ', 'Reception room', 'Seperate kitchen', 'Small balcony', 'Long lease ', 'EPC- D']","[['Highgate ', '0.9 miles'], ['East Finchley ', '1.0 miles'], ['Alexandra Palace ', '1.1 miles']]","['underground', 'underground', 'nationalrail']",Ask agent,Ask agent,Ask agent,Ask agent,True
91,133631147,"£350,000",Added on 14/04/2023,"Fortis Green Road, London","Never marketed before, is a rare opportunity to acquire a one bedroom, freehold cottage with separate kitchen and lounge area, the cottage is fully double glazed, requiring some modernisation with excellent potential for rental investment, first time purchase or downsizing.",Bungalow,1,1,,Freehold,"['One Bedroom', 'Freehold', 'Never Sold Before', 'Double Glazed Throughout', 'Cul-De-Sac Location', 'Chain Free']","[['East Finchley ', '0.7 miles'], ['Highgate ', '0.9 miles'], ['Alexandra Palace ', '1.4 miles']]","['underground', 'underground', 'nationalrail']",Ask agent,Ask agent,Ask agent,Ask agent,False
