,id,price,added_reduced,address,description,type_house,bathrooms,bedrooms,size,tenure,key_features,close_stations,close_stations_type,tenure_ground_rent,tenure_annual_service_charge,tenure_lease_length,council_tax_band,sold_under_offer
35,138046208,"£500,000",Added on 29/07/2023,"North Hill, Highgate","Situated within this popular Art Deco building is this spectacular apartment comprising two double bedrooms, reception room, lift access and communal gardens",Flat,1,2,,Share of Freehold,"['Two double bedrooms ', 'Reception room', 'Fitted kitchen', 'Modern bathroom ', 'Lift access', 'Communal garden', 'Close to Highgate Woods', 'EPC rating D']","[['Highgate ', '0.3 miles'], ['East Finchley ', '0.8 miles'], ['Archway ', '1.2 miles']]","['underground', 'underground', 'underground']",Ask agent,Ask agent,Ask agent,Ask agent,False
36,77570946,"£490,000",Reduced on 15/06/2021,"Lyttelton Road, East Finchley, N2","*PROPERTY MARKET REMAINS OPEN FOR VIEWINGS & VALUATIONS IN PERSON OR BY VIRTUAL APPOINTMENT* Well presented and spacious two bedroom second floor flat with private balcony entrance, enviably located within an attractive purpose built block just a short walk from East Finchley station. The pro...",Flat,1,2,,Leasehold,"['Well Presented Two Bedroom Second Floor Flat', 'Attractive Block In Sought After Location', 'Beautiful Parquet Flooring And High Ceilings', 'Bright And Spacious Reception Room', 'Separate Well Equipped Eat-In Kitchen', 'Modern Bathroom And Separate WC', 'Private Balcony With External Store', 'Well Maintained Communal Gardens', 'Close To East Finchley Station And Amenities']","[['East Finchley ', '0.4 miles'], ['Golders Green ', '1.3 miles'], ['Highgate ', '1.3 miles']]","['underground', 'underground', 'underground']",Ask agent,Ask agent,99 years left,Ask agent,False
37,134482088,"£490,000",Added on 05/05/2023,"Great North Road, East Finchley, N2","Adam Hayes Estate Agents are now in receipt of an offer for the sum of £460,000 for Flat 3 Highgate Edge, Great North Road, London, N2 0NT. Anyone wishing to place an offer on this property should contact Adam Hayes Estate Agents at 158 High Road, East Finchley, London N2 9AS or on ...",Apartment,1,2,776 sq. ft.(72 sq. m.),Share of Freehold,"['Two Bedrooms', 'First Floor', 'Chain Free', 'Garage', 'Balcony', 'Close to Station']","[['East Finchley ', '0.2 miles'], ['Highgate ', '0.9 miles'], ['Golders Green ', '1.6 miles']]","['underground', 'underground', 'underground']",£75 per year (Ask agent about the review period)When and how often your ground rent will be reviewed.Read more about ground rent review period in our glossary page.,£1680.88,968 years left,Band: D,False
38,133098251,"£490,000",Added on 30/03/2023,"Heath View, East Finchley, London, N2",Spacious two double bedroom first floor maisonette with modern fitted kitchen and bathroom. Early viewings are highly recommended. ,Maisonette,1,2,,Leasehold,"['2 Bedrooms', 'Large open plan living space', 'Bright and spacious with large windows', 'Fitted kitchen', 'Private front door/entrance', 'Amazing views of gardens', 'Free on-street parking', 'Long lease']","[['East Finchley ', '0.5 miles'], ['Finchley Central ', '1.1 miles'], ['Golders Green ', '1.3 miles']]","['underground', 'underground', 'underground']",£0 per year,£1200,938 years left,Band: E,True
39,139732469,"£489,995",Added on 09/09/2023,"Cholmeley Park, London","Sleek, Affluent & Charming, this splendid two-bedroom conversion apartment that beckons you to experience elegant living in a picturesque setting. This enticing property is a dream come true for those seeking a hassle-free move, as it's offered on a chain-free basis, ensuring a smooth transition ...",Flat,1,2,,Leasehold,"['Two Bedroom First Floor Conversion Apartment', 'Chain Free', 'Brand New Lease With 99 Years Remaining', 'Open Plan Lounge/Kitchen/Diner', 'Communal Gardens', 'Gas Central Heating via Combination Boiler', 'Kitchen & Bathroom Less Than Five Years Old', 'Sought After Location']","[['Highgate ', '0.4 miles'], ['Archway ', '0.5 miles'], ['Upper Holloway ', '0.8 miles']]","['underground', 'underground', 'overground']",£200 per year (Ask agent about the review period)When and how often your ground rent will be reviewed.Read more about ground rent review period in our glossary page.,£0,99 years left,Ask agent,False
40,139059044,"£485,000",Added on 24/08/2023,"Aylmer Road, East Finchley","An attractive two bedroom purpose built apartment, set on the top floor (3rd) offering a separate fitted kitchen, modern bathroom, balcony and communal gardens. The property also provides lift access and off street parking.",Flat,1,2,,Share of Freehold,"['Two Bedrooms', 'Reception Room', 'Kitchen', 'Bathroom', 'Balcony', 'Communal Gardens']","[['East Finchley ', '0.5 miles'], ['Highgate ', '0.6 miles'], ['Archway ', '1.5 miles']]","['underground', 'underground', 'underground']",Ask agent,Ask agent,Ask agent,Ask agent,False
41,124750808,"£480,000",Reduced on 15/11/2022,"Shepherds Hill, Highgate",A particularly spacious ground floor flat in this small and highly sought after block with secure parking and a private terrace accessed directly from the reception room.,Flat,1,1,,Leasehold,"['Double Bedroom', 'Kitchen', 'Open Plan Living', 'Terrace', 'Secure Parking', 'On Site Caretaker']","[['Highgate ', '0.4 miles'], ['Archway ', '0.9 miles'], ['Crouch Hill ', '1.0 miles']]","['underground', 'underground', 'overground']",Ask agent,Ask agent,Ask agent,Ask agent,False
42,139253852,"£479,900",Added on 19/01/2023,"Muswell Hill, London, N10","77 Muswell Hill provides the benefits of living in the city of London, combined with the beauty and relaxed atmosphere of village life. This prestigious development consists of 47 luxury apartments set in the heart of the village.",Flat,1,1,,Leasehold,"['One bedroom', ' private balcony', ' use of gym', ' conceirge', ' communal', ' close to the Broadway.']","[['Highgate ', '0.9 miles'], ['East Finchley ', '1.0 miles'], ['Alexandra Palace ', '1.1 miles']]","['underground', 'underground', 'nationalrail']",Ask agent,Ask agent,Ask agent,Ask agent,False
43,134159906,"£475,000",Reduced on 12/06/2023,"Lyttelton Court, Hampstead Garden Suburb, N2","A beautifully presented two double bedroom ground floor apartment set within this imposing block located in the Hampstead Garden Suburb, N2. The property has been maintained to a very high standard and offers large living space, large kitchen, bathroom, vast amounts of storage, balcony, residents...",Apartment,1,2,,Leasehold,"['Two Double Bedrooms', 'Large Reception', 'Large Kitchen', 'Bathroom', 'Balcony', 'Good Storage', 'Residents Off Street Parking', 'Chain Free']","[['East Finchley ', '0.6 miles'], ['Golders Green ', '1.2 miles'], ['Finchley Central ', '1.2 miles']]","['underground', 'underground', 'underground']",Ask agent,Ask agent,141 years left,Band: D,False
44,139705367,"£475,000",Added on 08/09/2023,"Muswell Hill Place, Muswell Hill, London, N10","Benefitting from its own front door this two bedroom ground floor garden maisonette is located in central Muswell Hill and is well-presented throughout. The property comprises, off a central hallway, two bedrooms, modern bathroom and an open-plan kitchen and reception room with French doors that...",Apartment,1,2,,Leasehold,"['1 Reception room', '2 Bedrooms', 'Modern kitchen', 'Modern bathroom', 'Ground floor', 'Own entrance', 'Off-street parking for 2 Cars', 'Long lease', 'Chain free', 'Purpose built']","[['Highgate ', '0.8 miles'], ['East Finchley ', '1.0 miles'], ['Alexandra Palace ', '1.1 miles']]","['underground', 'underground', 'nationalrail']",£150 per year,£2200,128 years left,Band: D,False
45,138951476,"£475,000",Reduced on 18/09/2023,"Great North Road, East Finchley, London, N2","A two double bedroom second floor flat, well located for walking to East Finchley tube station and local amenities.",Apartment,1,2,,Leasehold,"['2 Bedrooms', 'Reception', 'Bathroom', 'Upper floor', 'Residents parking', 'Chain free', 'Purpose built flat', 'Gas central heating', 'Communal garden', 'Close to Highgate']","[['East Finchley ', '0.3 miles'], ['Highgate ', '0.7 miles'], ['Archway ', '1.6 miles']]","['underground', 'underground', 'underground']",£0 per year,£1000,109 years left,Band: D,False
46,135846965,"£475,000",Added on 08/06/2023,"The Causeway, East Finchley N2","Situated in this popular tree lined residential location off East End Road and conveniently located within minutes’ walk of East Finchley tube station is this well presented two double bedroom, lower ground floor purpose built apartment. The property is offered chain free and benefits from an app...",Apartment,1,2,944 sq. ft.(88 sq. m.),Leasehold,"['Two Double Bedrooms', 'Close to Tube Station', 'Modern Kitchen With Integrated Appliances', 'Chain Free', 'Private Front and Rear Garden', 'Allocated Off Street Parking', 'Long Lease']","[['East Finchley ', '0.1 miles'], ['Highgate ', '1.2 miles'], ['Finchley Central ', '1.4 miles']]","['underground', 'underground', 'underground']",£10 per year (Ask agent about the review period)When and how often your ground rent will be reviewed.Read more about ground rent review period in our glossary page.,£1100,170 years left,Band: D,False
47,135294797,"£475,000",Added on 25/05/2023,"Great North Road, London","Adam Hayes Estate Agents are now in receipt of an offer for the sum of £475,000 for Flat 4 Highgate Edge, Great North Road, London, N2 0NT. Anyone wishing to place an offer on this property should contact Adam Hayes Estate Agents at 158 High Road, East Finchley, London N2 9AS or on ...",Apartment,1,2,790 sq. ft.(73 sq. m.),Share of Freehold,"['Two Bedrooms', 'Chain Free', 'Investment Opportunity', 'Garage', 'First Floor', 'Communal Gardens']","[['East Finchley ', '0.5 miles'], ['Highgate ', '0.5 miles'], ['Golders Green ', '1.7 miles']]","['underground', 'underground', 'underground']",£75 per year (Ask agent about the review period)When and how often your ground rent will be reviewed.Read more about ground rent review period in our glossary page.,Ask agent,968 years left,Band: E,False
48,134918882,"£475,000",Reduced on 04/07/2023,"Park Gate, East Finchley","A delightful ground floor 2 bedroom flat featuring a generous reception room leading out to a private garden, a stylish bathroom and contemporary kitchen as well as off street parking.",Flat,1,2,,Leasehold,"['Two bedrooms', 'Spacious living room', 'Private garden', 'Excellent transport links', 'Contemporary kitchen', 'Off street parking', 'Ground floor', 'EPC - C']","[['East Finchley ', '0.4 miles'], ['Finchley Central ', '1.2 miles'], ['Highgate ', '1.4 miles']]","['underground', 'underground', 'underground']",Ask agent,Ask agent,Ask agent,Ask agent,False
49,138420098,"£475,000",Reduced on 03/08/2023,"Stanhope Road, Highgate",This spacious 800 sq ft apartment has good storage facilities and a large reception room along with two double bedrooms a separate kitchen and a well-presented communal areas.,Flat,1,2,,Leasehold,"['Two Bedrooms', 'Reception Room', 'Separate Kitchen', 'Bathroom', 'Communal Gardens', 'External Storage']","[['Highgate ', '0.4 miles'], ['Archway ', '0.8 miles'], ['Crouch Hill ', '1.0 miles']]","['underground', 'underground', 'overground']",Ask agent,Ask agent,Ask agent,Ask agent,False
50,134736884,"£460,000",Reduced today,"North Hill, Highgate, London, N6",A charming ground floor 1 bedroom apartment within an attractive Victorian property (built 1877) known as Springfield Cottages. This well proportioned apartment enjoys direct access to a patio area with communal gardens beyond. Highgate Station is approx 0.5 miles & Highgate Village ...,Apartment,1,1,,Leasehold,['Charming Living Room with Bay Window * Fitted Double Bedroom * 14 x 10 Kitchen Diner with Door to Gardens * Modern Bathroom WC * Patio Area leading to Communal Gardens * Brick Built (truncated)'],"[['Highgate ', '0.4 miles'], ['East Finchley ', '0.6 miles'], ['Archway ', '1.3 miles']]","['underground', 'underground', 'underground']",£0 per year,£0,91 years left,Band: C,False
51,86039892,"£460,000",Added on 16/02/2023,"Great North Road, East Finchley, London, N2",Located on the second floor of this art deco style block is this bright and airy two double bedroom flat. Doran Manor is situated equidistant to Highgate and East Finchley Northern Line underground stations.,Apartment,1,2,,Leasehold,"['Purpose-built', 'Leasehold', 'Second floor', 'Double glazed', '2 double bedrooms', 'Separate W/C', 'Communal gardens', 'Bathroom', 'Service exit', 'Residents parking']","[['East Finchley ', '0.4 miles'], ['Highgate ', '0.6 miles'], ['Archway ', '1.6 miles']]","['underground', 'underground', 'underground']",£0 per year,£1928.56,146 years left,Band: C,True
52,139095866,"£455,000",Added on 25/08/2023,"Lyttelton Court, Hampstead Garden Suburb","A lovely bright second floor, 2 bedroom apartment located within moments of the shopping & transport facilities of The Market Place, as well as Lyttelton Playing Fields. Features include 2 balconies, parquet flooring, well maintained communal gardens, unreserved resident parking...",Apartment,1,2,,Leasehold,['SOLE AGENTS'],"[['East Finchley ', '0.7 miles'], ['Golders Green ', '1.1 miles'], ['Finchley Central ', '1.2 miles']]","['underground', 'underground', 'underground']",Ask agent,Ask agent,Ask agent,Ask agent,False
53,134670113,"£450,000",Reduced on 31/05/2023,"Aylmer Parade, Aylmer Road, London","This immaculately presented, recently refurbished and surprisingly spacious two bedroom duplex apartment, is ideal for young professionals, first time buyers or as a buy to let investment and - located on Aylmer Parade, within easy reach of a host of local amenities in East Finchley including a g...",Apartment,2,2,,Leasehold,"['Beautifully Presented Two Bedroom Duplex Apartment', 'Spacious Loft Bedroom', 'Light and Spacious Throughout', 'Modern Kitchen', 'Two Bathrooms', 'Excellent Transport Links', 'Close to Local Amenities', 'Private Storage Shed', 'Permit Parking Available']","[['East Finchley ', '0.5 miles'], ['Highgate ', '0.6 miles'], ['Archway ', '1.5 miles']]","['underground', 'underground', 'underground']",£0 per year,£578.83,153 years left,Band: B,False
54,138100628,"£450,000",Added on 31/07/2023,"Fortis Green, East Finchley, N2","Rarely available. A bright and airy two bedroom first floor flat, converted from an attractive period end of terrace house and situated in this highly favoured location in the heart of East Finchley. Located within 0.2 miles of East Finchley tube, cafes and restaurants, as ...",Flat,1,2,,Leasehold,"['Attractive Period Property', 'Large Reception Room', 'Two Double Bedrooms', 'Gas Central Heating', 'Double Glazed Windows', 'Chain Free', 'Long Lease', 'Low outgoings']","[['East Finchley ', '0.2 miles'], ['Highgate ', '1.1 miles'], ['Finchley Central ', '1.5 miles']]","['underground', 'underground', 'underground']",Ask agent,Ask agent,Ask agent,Ask agent,False
55,138648161,"£450,000",Added on 15/08/2023,"Widecombe Court, Lyttelton Road, East Finchley, London, N2","We are pleased to offer this well-presented two bedroom first floor purpose built apartment with private balcony entrance and storage. The property is conveniently located for East Finchley underground station, an array of shops, bars and restaurants, as well as ample local recreational parkland,...",Apartment,1,2,,Leasehold,"['Purpose built development', 'First floor', 'Spacious throughout', 'Two double bedrooms', 'Large Reception room', 'Eat-in kitchen', 'Private balcony & Storage', 'Communal grounds']","[['East Finchley ', '0.4 miles'], ['Golders Green ', '1.3 miles'], ['Highgate ', '1.3 miles']]","['underground', 'underground', 'underground']",£100 per year,£1630,91 years left,Band: D,False
56,127188098,"£450,000",Reduced on 27/06/2023,"Market Place, London, N2","Edwardian conversion, two double bedroom garden flat ideally located to local shopping and transport facilities. The property is being offered for sale chain free.",Apartment,1,2,,Leasehold,"['Reception Room', 'Two Double Bedrooms', 'Kitchen', 'Bathroom', 'Courtyard Garden', 'Chain Free']","[['East Finchley ', '0.2 miles'], ['Highgate ', '1.2 miles'], ['Finchley Central ', '1.3 miles']]","['underground', 'underground', 'underground']",£400 per year,£1020,90 years left,Band: C,False
57,139561454,"£450,000",Added on 06/09/2023,"Parkland Views, Muswell Hill, London, N10","FIRST EVER SHOW HOME LAUNCH SAT 23rd SEPTEMBER by appointment only - NEW PRICES RELEASED. A luxury 632 sqft 1 bedroom apartment with terrace located in the heart of Muswell Hill, on the door step of the Broadway. This prestigious development benefits a concierge, residents gym & underground parking",Apartment,1,1,,Leasehold,"['FIRST EVER SHOW HOME LAUNCH EVENT SATURDAY 23rd SEPTEMBER (by appointment only)', 'Luxury Development', 'Private terrace ', 'Chain Free and Ready to Move In', 'Concierge ', 'Underground Parking ', 'Residents Gym', 'Incentives available*']","[['Highgate ', '0.9 miles'], ['East Finchley ', '1.0 miles'], ['Alexandra Palace ', '1.1 miles']]","['underground', 'underground', 'nationalrail']",£0 per year,£0,124 years left,Band: D,False
58,123722477,"£450,000",Reduced on 08/03/2023,"Causton Road,  Highgate, London, N6",Situated in this highly desirable and convenient location is this level ground floor One bedroom converted Garden apartment within this imposing Victorian mansion. This charming apartment also benefits from delightful communal gardens and is located within 500m of both Highgate High Street &...,Apartment,1,1,,Share of Freehold,['Fitted Double Bedroom * Delightful Living Room with Direct Access to Communal Gardens * Fitted Kitchen * Private Screened Landscaped Southerly Front Garden * Tastefully Presented * Highly (truncated)'],"[['Highgate ', '0.3 miles'], ['Archway ', '0.6 miles'], ['Upper Holloway ', '0.9 miles']]","['underground', 'underground', 'overground']",£50 per year,£1200,993 years left,Band: C,True
59,131476736,"£450,000",,"Leicester Mews, East Finchley N2","Cash buyers only!!! Situated in this popular mews off Leicester Road and within walking distance to local shops, amenities and East Finchley tube station is this well presented B1 category C (light industrial) freehold building. The property has potential to be converted into a two bedroom mews h...",Plot,1,2,870 sq. ft.(81 sq. m.),,"['Unmodernised B1 Category C', 'Two Bedrooms', 'Character Features', 'Modern Kitchen', 'Popular Location', 'Courtyard Garden', 'Potential To Be Converted (STPP)', 'Chain Free', 'Bathroom']","[['East Finchley ', '0.3 miles'], ['Highgate ', '1.2 miles'], ['Finchley Central ', '1.4 miles']]","['underground', 'underground', 'underground']",Ask agent,Ask agent,Ask agent,Ask agent,False
60,130569977,"£450,000",Reduced on 30/03/2023,"Muswell Hill Broadway, London, N10","Neway Estate Agents is currently offering this spacious 3/4 bedroom 2nd floor flat located in the heart of Muswell Hill Broadway. Please respond via the ""Request Details"" button.",Flat,,3,900 sq. ft.(84 sq. m.),Ask agent,"['Full vacant possession ', 'New 150 year lease', 'No service charge']","[['East Finchley ', '1.0 miles'], ['Highgate ', '1.0 miles'], ['Alexandra Palace ', '1.1 miles']]","['underground', 'underground', 'nationalrail']",Ask agent,Ask agent,Ask agent,Ask agent,True
61,133733888,"£450,000",Added on 17/04/2023,"Princes Avenue, Muswell Hill, London, N10",A two bedroom split level period conversion located just off of Muswell Hill Broadway on one of the area's popular Royal Roads.,Apartment,1,2,,Leasehold,"['2 Bedrooms', '1 Reception room', 'Open-plan kitchen', '1 Bathroom', '1st & 2nd floor', 'Chain free', 'Semi-Detached', 'Wooden flooring', 'Period features', 'Central Broadway location']","[['East Finchley ', '0.9 miles'], ['Highgate ', '0.9 miles'], ['Alexandra Palace ', '1.2 miles']]","['underground', 'underground', 'nationalrail']",£0 per year,£1650,114 years left,Band: D,True
62,139850153,"£449,995",Added on 12/09/2023,"Muswell Hill Broadway, London, N10","Neway Estate Agents is currently offering this spacious 3 bedroom 1st floor flat located in the heart of Muswell Hill Broadway. Please respond via the ""Request Details"" button.",Flat,1,3,,Ask agent,"['Full vacant possession ', 'New 150 year lease']","[['East Finchley ', '1.0 miles'], ['Highgate ', '1.0 miles'], ['Alexandra Palace ', '1.1 miles']]","['underground', 'underground', 'nationalrail']",Ask agent,Ask agent,Ask agent,Ask agent,False
63,86065026,"£445,000",Reduced on 09/05/2023,"Aylmer Road, East Finchley","A two bedroom converted bungalow with two bathrooms, reception room and a kitchen breakfast room, quietly positioned amongst the communal gardens.",House,2,2,,Leasehold,"['Two Bedrooms', 'Bathroom', 'En Suite Shower', 'Reception Room', 'Kitchen', 'Communal Gardens']","[['East Finchley ', '0.5 miles'], ['Highgate ', '0.6 miles'], ['Archway ', '1.5 miles']]","['underground', 'underground', 'underground']",Ask agent,Ask agent,Ask agent,Ask agent,False
64,138522515,"£440,000",Added on 10/08/2023,"Aylmer Road, Highgate","Set on the top floor of this popular building is this well presented apartment comprising two double bedrooms, fitted kitchen and access to a large communal garden",Flat,1,2,,Leasehold,"['Two double bedrooms', 'Reception room ', 'Fitted kitchen ', 'Modern bathroom ', 'Communal garden ', 'Chain free', 'Good transport links', 'EPC Rating D']","[['East Finchley ', '0.5 miles'], ['Highgate ', '0.5 miles'], ['Archway ', '1.5 miles']]","['underground', 'underground', 'underground']",Ask agent,Ask agent,Ask agent,Ask agent,False
65,129170519,"£435,000",Reduced on 03/07/2023,"Monarch Court, Hampstead Garden Suburb","A 2 double bedroom, second floor flat situated in this popular purpose built block with 2 balconies including one at the rear with fantastic views over Lyttelton Playing Fields. Also benefitting from a long lease with Share of the Freehold. Located within walking distance of Hampste...",Apartment,1,2,,Share of Freehold,[],"[['East Finchley ', '0.4 miles'], ['Golders Green ', '1.2 miles'], ['Highgate ', '1.3 miles']]","['underground', 'underground', 'underground']",Ask agent,Ask agent,Ask agent,Ask agent,False
66,131197277,"£425,000",Reduced on 28/02/2023,"Bishops Road, Highgate Village ,London, N6","LitLitchfields is pleased to offer a top floor (2nd) one bedroom flat set in a quiet, semi-detached period conversion in Highgate Village. The flat is offered chain free with a long lease and share of freehold. This bright and airy apartment is in good internal condition and our seller informs us...",Apartment,1,1,,Share of Freehold,"['Chain Free', 'Top floor conversion ( 2nd)', 'Reception  room', 'Double Bedroom', 'Kitchen', 'Bathroom', 'Share of Freehold', 'Close to local Shops', 'close to Highgate Woods', 'within 500 yards approx of Highgate underground station']","[['Highgate ', '0.1 miles'], ['East Finchley ', '0.9 miles'], ['Archway ', '1.0 miles']]","['underground', 'underground', 'underground']",Ask agent,Ask agent,Ask agent,Band: C,True
67,128957333,"£425,000",Reduced on 17/02/2023,"Elmhurst Crescent, London, N2",Addison Townsend are delighted to offer for sale this well presented three bedroom ground floor apartment with direct access to the communal gardens. Situated in this residential turning off East End Road within 0.5 miles of East Finchley Station (northern line) and conveniently located in the ca...,Flat,1,3,,Leasehold,"['Three Bedroom Flat', 'Direct Access to Communal Gardens', 'Ground Floor', '0.5 Miles East Finchley Station', 'Communal Parking', 'Chain Free']","[['East Finchley ', '0.5 miles'], ['Finchley Central ', '1.1 miles'], ['Golders Green ', '1.4 miles']]","['underground', 'underground', 'underground']",Ask agent,Ask agent,176 years left,Band: D,True
68,126965357,"£425,000",Added on 12/09/2022,"Archway Road, Highgate, N6",A one bedroom recently refurbished apartment occupying the first floor of this period building above commercial premises within close walking distance of Highgate Underground Station.,Flat,1,1,389 sq. ft.(36 sq. m.),Leasehold,[],"[['Highgate ', '0.3 miles'], ['Archway ', '0.7 miles'], ['Upper Holloway ', '0.9 miles']]","['underground', 'underground', 'overground']",£200 per year (Ask agent about the review period)When and how often your ground rent will be reviewed.Read more about ground rent review period in our glossary page.,Ask agent,110 years left,Band: C,False
69,86153400,"£425,000",Added on 13/06/2023,"Pages Lane, Muswell Hill, N10","STYLISH AND TASTEFULLY PRESENTED TWO DOUBLE-BEDROOM UPPER (THIRD) FLOOR ART DECO MANSION BLOCK APARTMENT. The property boasts an abundance of natural light throughout and retains many fine period features reminiscent of a bygone era. The property, which is accessed via secure entry-phone and pass...",Apartment,1,2,,Leasehold,"['Upper Floor Security', 'Passenger Lift', 'Two Double Bedrooms', 'Stylish Lounge with Attractive Frontal Outlook.', 'Fitted Kitchen/Breakfast Room', 'Built In Storage Cupboards', 'Entry-Phone Access', 'Communal Gardens', 'Close to Muswell Hill Broadway', 'Close to Coldfall Primary & Fortismere Secondary Schools']","[['East Finchley ', '0.9 miles'], ['Highgate ', '1.1 miles'], ['Alexandra Palace ', '1.3 miles']]","['underground', 'underground', 'nationalrail']",Ask agent,Ask agent,Ask agent,Ask agent,True
