,id,price,added_reduced,address,description,type_house,bathrooms,bedrooms,size,tenure,key_features,close_stations,close_stations_type,tenure_ground_rent,tenure_annual_service_charge,tenure_lease_length,council_tax_band,sold_under_offer
0,139714331,"£550,000",Added on 08/09/2023,"Orchid Court, Granville Road, Childs Hill, NW2","Modern and well presented apartment with private WEST FACING terrace, located in Childs Hill the apartment offers a great first time purchase or investment buy.",Apartment,2,2,786 sq. ft.(73 sq. m.),Leasehold,"['Stunning Ground floor apartment located in Childs Hill', 'Two bedrooms with main room en-suite', 'Private terrace located just off the reception room', 'Modern fixtures throughout', 'Situated between Golders Green and Hampstead', 'Viewing highly recommended']","[['Golders Green ', '0.5 miles'], ['Cricklewood ', '0.7 miles'], ['Brent Cross ', '0.8 miles']]","['underground', 'nationalrail', 'underground']",Ask agent,£2650,Ask agent,Band: E,False
1,136230302,"£550,000",Added on 18/06/2023,"Windsor Court, NW11","A ready to move into 3 bedroom purpose built flat, centrally located with a long lease",Flat,1,3,,Leasehold,"['Spacious apartment', 'High ceilings', 'Hot Water & Heating Included in the Service Charges', 'Rubbish collected from outside the apartment', 'Virtual Freehold', 'Ready to move into']","[['Brent Cross ', '0.3 miles'], ['Golders Green ', '0.8 miles'], ['Hendon Central ', '0.8 miles']]","['underground', 'underground', 'underground']",£150 per year (Ask agent about the review period)When and how often your ground rent will be reviewed.Read more about ground rent review period in our glossary page.,£3500,980 years left,Band: E,False
2,138995738,"£550,000",Added on 23/08/2023,"Finchley Road, NW11","Step into spacious living with this 712 sq. ft apartment boasting two double bedrooms and two bathrooms. Situated on the first floor of a modern conversion, this property offers both comfort and convenience. The airy and well-lit interior creates an inviting atmosphere througho...",Flat,2,2,712 sq. ft.(66 sq. m.),Leasehold,"['Chain free', 'Low outgoings', '2 double bedrooms', 'Private balcony', '2 bathrooms', 'Spacious 712 sq. ft']","[['Golders Green ', '0.5 miles'], ['Cricklewood ', '0.8 miles'], ['Hampstead ', '1.0 miles']]","['underground', 'nationalrail', 'underground']",Ask agent,Ask agent,150 years left,Band: A,False
3,138332249,"£550,000",Reduced on 05/08/2023,"Granville Road, London, NW2","A two double bedroom apartment located on Granville Road, NW2. This modern apartment is exceptionally well presented throughout and is approximately 885 sq. ft. The property has a semi open plan kitchen and living room with integrated appliances with doors opening on to the private terrace. Ther...",Flat,2,2,,Leasehold,"['2 bedrooms', '1 reception room', '2 bathrooms', 'Lift', 'Modern', 'Ground Floor', 'Parking', 'Terrace', 'Town/City', 'Private Parking']","[['Golders Green ', '0.5 miles'], ['Cricklewood ', '0.7 miles'], ['Brent Cross ', '0.8 miles']]","['underground', 'nationalrail', 'underground']",£275 per year,£3023.19,993 years left,Band: E,False
4,134065736,"£550,000",Reduced on 08/05/2023,"Hoop Lane, Golders Green","This spacious two bedroom split-level maisonette has its own front door and offers over 1,000 sq ft. The property has a private garage and will be sold with no onward chain.",Flat,2,2,,Freehold,"['Two Bedrooms', 'Separate Kitchen', 'Private Entrance', 'Garage', 'Duplex', 'No Onward Chain']","[['Golders Green ', '0.2 miles'], ['Brent Cross ', '0.7 miles'], ['Cricklewood ', '1.2 miles']]","['underground', 'underground', 'nationalrail']",Ask agent,Ask agent,Ask agent,Ask agent,False
5,137969507,"£550,000",Added on 27/07/2023,"Pennine Drive, Golders Green Estate, NW2","LUXURIOUS ground floor apartment located near to GOLDERS GREEN & WEST HAMPSTEAD - No onward chain with high end finishes the property includes a PRIVATE GARDEN, PRIVATE PARKING AND STUDIO/ANNEX (with ensuite) in the garden.",Ground Flat,2,2,872 sq. ft.(81 sq. m.),Share of Freehold,"['Luxury ground floor apartment', 'Studio/Annex located in the Garden', 'Private south facing rear garden', 'Beautiful features and presentation throughout', 'Impressive open plan Kitchen/dining room/living area', 'Viewing recommended - No onward chain']","[['Cricklewood ', '0.6 miles'], ['Brent Cross ', '0.7 miles'], ['Golders Green ', '0.8 miles']]","['nationalrail', 'underground', 'underground']",Ask agent,Ask agent,Ask agent,Band: E,False
6,133045040,"£550,000",Added on 29/03/2023,"Woodlands, Golders Green, NW11 9QX","A bright and spacious south facing two bedroom flat situated in this sough tafter area off Golders Green Road. The flat offers spacious living accommodation. The flat offer living-room, kitchen, bathroom/wc, guest wc, balcony, garage, underfloor heating, lift, communal gardens and early vacant ...",Apartment,1,2,,Share of Freehold,"['Two Bedrooms', 'First Floor', 'Spacious Lounge', 'Balcony', 'EPC Rating C', 'Garage', 'Share of Freehold', 'Communal Gardens', 'Chain Free']","[['Brent Cross ', '0.4 miles'], ['Hendon Central ', '0.7 miles'], ['Golders Green ', '1.0 miles']]","['underground', 'underground', 'underground']",Ask agent,£5039,900 years left,Band: F,False
7,136190756,"£550,000",Reduced on 11/09/2023,"Tudor House, Madoc Close, London NW2","Situated on a small development of luxury modern houses and flats is this 2 bedroom, 2 bathroom first floor apartment. The property comprises an open plan high specification kitchen lounge dining room, two good size bedrooms with master benefiting from a luxury ensuite shower room and a guest bat...",Flat,2,2,,Share of Freehold,"['2 Bedrooms', '2 bathrooms (Ensuite to master)', 'Open plan kitchen/lounge/dining room', 'Allocated parking space', '993 year lease', 'Chain free', 'Share of Freehold']","[['Golders Green ', '0.6 miles'], ['Cricklewood ', '0.7 miles'], ['Hampstead ', '1.0 miles']]","['underground', 'nationalrail', 'underground']",Ask agent,Ask agent,Ask agent,Ask agent,False
8,130595939,"£550,000",Added on 11/01/2023,"James Close, Woodlands, London, NW11","A bright spacious 2 double bedroom apartment, nestled within a sought after residential road. Offering 983 sq. ft. and a south facing balcony with views overlooking the communal gardens. Benefits include separate kitchen, large reception/dining space, 2 double bedrooms, guest w/c, south facing ba...",Apartment,1,2,,Share of Freehold,"['SEPARATE KITCHEN', 'LARGE RECEPTION/DINING SPACE', '2 DOUBLE BEDROOMS', 'GUEST W/C', 'SOUTH FACING BALCONY', 'COMMUNAL GARDENS', 'GARAGE', 'LIFT', 'SHARE OF FREEHOLD', 'HUGE POTENTIAL FOR MODERNISATION']","[['Brent Cross ', '0.4 miles'], ['Hendon Central ', '0.8 miles'], ['Golders Green ', '0.9 miles']]","['underground', 'underground', 'underground']",£0 per year,£5039.67,899 years left,Band: TBC,False
9,85973010,"£550,000",Reduced on 24/06/2023,"Garden Apartment, Pennine Drive, Golders Green Estate, NW2","This recently refurbished ground floor abode, located within a meticulously converted semi-detached house, boasts a wonderful private garden and off street parking, and is the epitome of a contemporary two bedroom apartment. This stunning property boasts impeccable finishes throughout, i...",Flat,2,2,872 sq. ft.(81 sq. m.),Share of Freehold,"['Spacious reception with bi fold doors', 'Private garden', 'Separate office/gym', 'Newly converted', 'Off street parking']","[['Cricklewood ', '0.6 miles'], ['Brent Cross ', '0.7 miles'], ['Golders Green ', '0.9 miles']]","['nationalrail', 'underground', 'underground']",Ask agent,Ask agent,Ask agent,Ask agent,False
10,139585484,"£550,000",Added on 06/09/2023,"North End Road, NW11","A generously proportioned 706 sq. ft. 2 bedroom, 2 bathroom duplex apartment, located on the ground & first floors of this converted building. Offering bright, modern accommodation throughout and benefiting a private garden & off street parking on a first come first serve basis. ",Flat,2,2,706 sq. ft.(66 sq. m.),Share of Freehold,"['Chain Free', 'Share of Freehold', 'Private Gardens', '2 bedrooms', '2 bathrooms', 'Well located']","[['Golders Green ', '0.1 miles'], ['Brent Cross ', '0.9 miles'], ['Hampstead ', '1.2 miles']]","['underground', 'underground', 'underground']",Ask agent,Ask agent,74 years left,Ask agent,False
11,122267285,"£550,000",Added on 11/04/2022,"Eagle Lodge, Golders Green NW11","Situated on the top floor of this stunning art-deco building, within 0.5 miles of Golders Green Underground Station is this extremely spacious three double bedroom apartment. Internally the property comprises a spacious living room, bathroom, separate WC, fitted kitchen and three double bedrooms....",Apartment,1,3,,Leasehold,"['THREE DOUBLE BEDROOMS', 'BATHROOM', 'SEPARATE WC', 'SPACIOUS LIVING ROOM', 'KITCHEN', 'CHAIN FREE']","[['Brent Cross ', '0.5 miles'], ['Golders Green ', '0.5 miles'], ['Hendon Central ', '1.1 miles']]","['underground', 'underground', 'underground']",Ask agent,Ask agent,Ask agent,Ask agent,False
12,138248144,"£550,000",Reduced on 22/08/2023,"North End Road, NW11","2 Bed 2 bath, share of freehold, Off street parking, Private garden moments from Golders Green Station !",Flat,2,2,,Share of Freehold,"['Off Street Parking FCFS', 'Private Garden', 'Share of Freehold', 'Chain Free', 'Main bedroom on separate level', 'Moments from Golders Green Station']","[['Golders Green ', '0.1 miles'], ['Brent Cross ', '1.0 miles'], ['Hampstead ', '1.1 miles']]","['underground', 'underground', 'underground']",Ask agent,Ask agent,Ask agent,Ask agent,False
13,139297913,"£549,950",Added on 31/08/2023,"Granville Road, Childs Hill",This two bedroom maisonette backs on to Childs Hill Park and has direct access to a large private garden. The property will be sold with no onward chain.,Flat,1,2,,Leasehold,"['Two Double Bedrooms', 'Private Garden', 'Open Plan', 'Integrated Appliances', 'Outbuilding', 'No Onward Chain']","[['Golders Green ', '0.5 miles'], ['Cricklewood ', '0.7 miles'], ['Brent Cross ', '0.8 miles']]","['underground', 'nationalrail', 'underground']",Ask agent,Ask agent,Ask agent,Ask agent,False
14,132754151,"£549,000",Reduced on 15/05/2023,"Golders Green Road, London, NW11 9PX","A Delightful Ground Floor Apartment
Exclusive Building with Concierge",Ground Flat,2,2,,Leasehold,"['En-Suite', 'Walk-in Shower Room (Seniors)', 'Parking', 'Intruder Alarm / CCTV / Security Bars', 'Ground Floor', 'Guest Bathroom', 'Outdoor Terrace', 'Hot Water & Heating Included']","[['Brent Cross ', '0.3 miles'], ['Hendon Central ', '0.7 miles'], ['Golders Green ', '0.9 miles']]","['underground', 'underground', 'underground']",£0 per year,£0,177 years left,Ask agent,False
15,132121610,"£545,000",Reduced on 23/08/2023,"Meadway, Hampstead Garden Suburb","A delightful 2 bedroom ground floor apartment set within this highly desirable Grade II listed building located on the south side of Hampstead Garden Suburb, close to the Heath Extension, Temple Fortune and Golders Green.2 bedrooms, bathroom/WC, galley style kitchen, cosy reception room...",Apartment,1,2,,Leasehold,[],"[['Golders Green ', '0.7 miles'], ['East Finchley ', '1.0 miles'], ['Brent Cross ', '1.3 miles']]","['underground', 'underground', 'underground']",Ask agent,Ask agent,Ask agent,Ask agent,False
16,137892533,"£545,000",Added on 26/07/2023,"Willifield Way, Hampstead Garden Suburb, NW11","A good size 2 bedroom ground floor flat wonderfully located being a moments walk to the many shops, cafes and transport of Temple Fortune. The property is a rare purpose built ground floor apartment set in a detached double fronted property which has use of a patio garden. The property requires...",Flat,1,2,,Leasehold,"['2 bedrooms', 'Lounge', 'Kitchen', 'Bathroom', 'Patio garden', 'Close to shops & transport links', 'EPC=D']","[['Brent Cross ', '0.9 miles'], ['Golders Green ', '1.0 miles'], ['Finchley Central ', '1.0 miles']]","['underground', 'underground', 'underground']",Ask agent,Ask agent,Ask agent,Ask agent,False
17,85973229,"£530,000",Reduced on 14/09/2023,"Upper Maisonette, Pennine Drive, Golders Green Estate, NW2","For those who seek a turn-key abode, this elegant and meticulously refurbished first and second floor duplex apartment enjoys use of a private garden and the benefit of off street parking. This stunning property promises to deliver both the necessities and a bounty of luxury features, an...",Flat,1,2,848 sq. ft.(79 sq. m.),Share of Freehold,"['Contemporary kitchen / breakfast room', 'Private garden', 'Access to flat roof', 'Off street parking', 'Newly refurbished to exquisite standard']","[['Cricklewood ', '0.6 miles'], ['Brent Cross ', '0.7 miles'], ['Golders Green ', '0.9 miles']]","['nationalrail', 'underground', 'underground']",Ask agent,Ask agent,Ask agent,Ask agent,False
18,129545633,"£530,000",Reduced on 14/09/2023,"Pennine Drive, Golders Green Estate, NW2","This one's for you if... You are ready to move into a well decorated home. Walking in you are welcomed by a beautifully sophisticated communal hall which leads up to this first floor flat set over three floors, On the first floor you are welcomed by a spacious open plan kit...",Flat,1,2,,Share of Freehold,"['Video tour available!', 'Energy efficient', 'Newly converted two double bedroom conversion', 'On two floors', 'Spacious reception', 'Contemporary eat in kitchen', 'Luxury bathroom', 'Access to a flat roof', 'Private garden', 'Off street parking']","[['Cricklewood ', '0.6 miles'], ['Brent Cross ', '0.7 miles'], ['Golders Green ', '0.8 miles']]","['nationalrail', 'underground', 'underground']",£0 per year,£0,Ask agent,Band: TBC,False
19,137969636,"£530,000",Reduced on 14/09/2023,"Pennine Drive, Golders Green Estate, London, NW2","Beautiful condition throughout, this stunning duplex apartment has a high standard of finish and includes a private garden at the rear. Viewing highly recommended.",Apartment,1,2,854 sq. ft.(79 sq. m.),Freehold,"['Stunning duplex apartment located in Golders Green Estate', 'Two double bedrooms', 'High end finish', 'Garden to the rear', 'Modern fitted kitchen/breakfast room', 'Viewing Highly recommended']","[['Cricklewood ', '0.6 miles'], ['Brent Cross ', '0.7 miles'], ['Golders Green ', '0.8 miles']]","['nationalrail', 'underground', 'underground']",Ask agent,Ask agent,Ask agent,Ask agent,False
20,138377699,"£529,950",Added on 07/08/2023,"Golders Court, Golders Green NW11","A deceptively spacious three bedroom top floor apartment situated in this ever popular purpose built block within the heart of Golders Green and walking distance of Golders Green Tube station, Shopping facilities, local amenities and Golders Hill Park. The apartment is set around a communal Garde...",Apartment,1,3,,Share of Freehold,"['Three bedrooms', 'Large living room', 'Separate Kitchen/Breakfast room', 'Family bathroom', 'Off street parking', 'Walking distance to Golders Green Tube station', 'Chain Free ', 'Sole Agents']","[['Golders Green ', '0.3 miles'], ['Brent Cross ', '0.6 miles'], ['Cricklewood ', '1.1 miles']]","['underground', 'underground', 'nationalrail']",Ask agent,Ask agent,Ask agent,Ask agent,False
21,135238244,"£525,000",Added on 24/05/2023,"North Circular Road, London","A very spacious 3 bedroom apartment situated on the ground floor of this mansion block and extremely well presented, the service charge includes hot water and heating. Located within walking distance of public transport and local amenities. Comprising very spacious reception room with door leadin...",Flat,1,3,,Leasehold,"['Modern Apartment', 'Private Balcony', 'Off Street Parking', 'Communal Gardens']","[['Brent Cross ', '0.4 miles'], ['Hendon Central ', '0.6 miles'], ['Golders Green ', '1.0 miles']]","['underground', 'underground', 'underground']",Ask agent,£3200,144 years left,Band: C,False
22,132848921,"£525,000",Added on 22/03/2023,Brook Lodge,"A spacious and well presented three bedroom ground floor apartment situated in this attractive mansion block within walking distance of public transport, shopping facilities and local amenities. The property benefits from large living/dining room, separate fitted kitchen, two double bedrooms, one...",Flat,1,3,894 sq. ft.(83 sq. m.),Leasehold,[],"[['Brent Cross ', '0.3 miles'], ['Hendon Central ', '0.6 miles'], ['Golders Green ', '1.0 miles']]","['underground', 'underground', 'underground']",Ask agent,Ask agent,Ask agent,Ask agent,False
23,137822822,"£525,000",Reduced on 07/09/2023,"Cheviot Gardens, NW2","The generously proportioned three bedrooms and two bathrooms provide ample space for families or those seeking room for guests and home offices. The open-plan living room serves as the heart of the home, ideal for gatherings and relaxation. The west-facing garden bathes the interior in warm su...",Flat,2,3,755 sq. ft.(70 sq. m.),Ask agent,"['Open plan living room/ kitchen', '3 bedrooms and 2 bathrooms with one en-suite', 'Wooden floors throughout', 'Private garden', 'Close to all types of transport', 'Quiet tree lined street', 'Brent Cross Shopping Centre moments away', 'Ideal for buy to live or buy to let', 'Off street parking', 'EPC rating C']","[['Cricklewood ', '0.4 miles'], ['Brent Cross ', '0.8 miles'], ['Golders Green ', '1.0 miles']]","['nationalrail', 'underground', 'underground']",Ask agent,Ask agent,Ask agent,Band: D,False
24,137817302,"£525,000",Reduced on 07/09/2023,Cheviot Gardens NW2,"Introducing a beautifully renovated ground floor flat with three bedrooms and two bathrooms, in a sought-after area near Golders Green, Brent Cross, and Childs Hill. ",Ground Flat,2,3,755 sq. ft.(70 sq. m.),Share of Freehold,[],"[['Cricklewood ', '0.4 miles'], ['Brent Cross ', '0.8 miles'], ['Golders Green ', '1.0 miles']]","['nationalrail', 'underground', 'underground']",Ask agent,Ask agent,Ask agent,Ask agent,False
25,119866391,"£525,000",Reduced on 25/05/2023,"Britten Close, NW11","A very well maintained apartment set within this ever popular development in close proximity of The Heath Extension, Golders Hill Park & Golders Green with its numerous shops, restaurants and transport facilities. Arranged over two floors and offering bright & spacious accommodation thr...",Duplex,2,2,853 sq. ft.(79 sq. m.),Leasehold,"['2 double bedrooms', 'Moments from Golders Hill Park', 'Secure parking', 'Immaculate communal gardens', 'Bright & spacious', 'Duplex']","[['Golders Green ', '0.3 miles'], ['Hampstead ', '1.1 miles'], ['Brent Cross ', '1.2 miles']]","['underground', 'underground', 'underground']",Ask agent,Ask agent,158 years left,Band: E,True
26,135471449,"£525,000",Added on 30/05/2023,"Cricklewood Lane, Cricklewood, London, NW2","This fantastic 2 bedroom garden flat features a stunning bay-fronted double bedroom, spacious reception room and conservatory with access to the private garden.",Flat,1,2,796 sq. ft.(74 sq. m.),Share of Freehold,"['Superb 2 bedroom garden flat', 'Period conversion', 'Spacious reception room', 'Conservatory', 'Private garden with patio', 'Bay-fronted double bedroom', 'Bright kitchen']","[['Cricklewood ', '0.3 miles'], ['Golders Green ', '0.9 miles'], ['Kilburn ', '1.0 miles']]","['nationalrail', 'underground', 'underground']",Ask agent,Ask agent,Ask agent,Ask agent,True
27,128643407,"£525,000",Reduced on 03/02/2023,"Forres Gardens, Temple Fortune, NW11","Exclusive marketing and sales agent for this spacious and well presented three bedroom, two bathroom duplex apartment arranged over the first and second floors of this converted house extending to 955 ft.² 88.8 m².",Flat,2,3,955 sq. ft.(89 sq. m.),Share of Freehold,"['Three bedroom duplex flat', 'Share of Freehold', 'Two bathrooms', '955 sq ft / 88.8 sq m', 'Open plan kitchen / reception', 'Chain free']","[['Golders Green ', '0.4 miles'], ['Brent Cross ', '0.7 miles'], ['Hendon Central ', '1.4 miles']]","['underground', 'underground', 'underground']",Ask agent,Ask agent,Ask agent,Band: D,True
28,134501558,"£510,000",Reduced on 08/06/2023,"Platts Lane, Hampstead, London, NW3","Looking for the perfect one bed flat in a prime location? Look no further than Platts Lane NW3, just a stone's throw away from the charming village of Hampstead. Situated on the top floor, this flat comprises of an eat in kitchen, separate reception and has plenty of natural light. With all the a...",Flat,1,1,,Leasehold,[],"[['Hampstead ', '0.7 miles'], ['Cricklewood ', '0.8 miles'], ['West Hampstead Thameslink ', '0.8 miles']]","['underground', 'nationalrail', 'nationalrail']",Ask agent,£3200,110 years left,Band: D,False
29,127850843,"£500,000",Reduced on 23/01/2023,"Heathway Court, Finchley Road, Hampstead, NW3","A beautifully presented ground floor two bedroom apartment set within a portered purpose built mansion block. The property has been recently refurbished throughout and boasts a great size reception room with high ceilings and lots of light, stylish kitchen with integrated appliances, two spaciou...",Apartment,1,2,,Leasehold,"['Two bedrooms', 'One bathroom', 'Porter', 'Communal gardens', 'Off street parking on a first come first serve basis', 'Leasehold']","[['Golders Green ', '0.6 miles'], ['Cricklewood ', '0.8 miles'], ['Hampstead ', '0.9 miles']]","['underground', 'nationalrail', 'underground']",£0 per year,£3741,972 years left,Band: TBC,True
30,132687701,"£500,000",Reduced on 07/06/2023,"Wendover Court, Child's Hill, London, NW2","This excellent 2 bedroom ground floor flat is situated in a popular period building, and boasts attractive interiors including a generous double bedroom with built-in wardrobes.",Flat,,2,956 sq. ft.(89 sq. m.),Leasehold,"['Fabulous 2 bedroom flat', 'Imposing period building', 'Lovely wood floors throughout', 'Spacious reception room boasting a feature fireplace', 'Generous main bedroom with fitted storage', 'Well-proportioned second bedroom', 'Manicured communal gardens', 'Sought-after location']","[['Cricklewood ', '0.6 miles'], ['West Hampstead Thameslink ', '0.8 miles'], ['Hampstead ', '0.9 miles']]","['nationalrail', 'nationalrail', 'underground']",Ask agent,£5500,Ask agent,Ask agent,False
31,134620568,"£500,000",Reduced on 13/09/2023,"Beechcroft Avenue, Golders Green, NW11",EXCLUSIVE MARKETING AGENT - NEW PRICE - MOTIVATED TO SELL - In need of some updating this THREE BEDROOM Ground floor flat extends to 915 ft2 and is located near Golders Green Underground Station (Northern Line/Zone 3).,Flat,1,3,915 sq. ft.(85 sq. m.),Share of Freehold,"['A three bedroom ground floor apartment', 'Spacious Lounge', 'Purpose Built Block', 'Close to Golders Green Station (Northern Line/Zone 3)', 'No onward chain', 'Viewing highly recommended']","[['Golders Green ', '0.2 miles'], ['Brent Cross ', '0.7 miles'], ['Cricklewood ', '1.2 miles']]","['underground', 'underground', 'nationalrail']",Ask agent,£4774,Ask agent,Band: E,False
32,137222237,"£500,000",Added on 11/07/2023,"Sandringham Road, Golders Green, London, NW11","EXCLUSIVE MARKETING AGENT Exquisite two double bedroom duplex apartment located in Golders Green and close to Brent Cross underground station. Benefitting from spacious reception, modern eat in kitchen and no onward chain.",Apartment,1,2,832 sq. ft.(77 sq. m.),Share of Freehold,"['Stunning two bedroom duplex style apartment', 'Golders Green location near Brent Cross Underground station (Zone3/Northern Line)', 'Good size reception spanning the width of the building', 'Modern eat in kitchen/dining room', 'Fitted bathroom suite', 'No onward chain']","[['Brent Cross ', '0.3 miles'], ['Golders Green ', '0.7 miles'], ['Hendon Central ', '1.0 miles']]","['underground', 'underground', 'underground']",Ask agent,Ask agent,Ask agent,Band: D,True
33,137680142,"£500,000",Added on 23/11/2022,"Finchley Road, Temple Fortune, London, NW11","Featuring modern interiors, this bright and airy 2 bedroom flat features well proportioned rooms, separate kitchen and 2 en suite rooms exceptionally well-presented throughout.",Flat,2,2,806 sq. ft.(75 sq. m.),Leasehold,"['Stunning 2 bedroom 2 bathroom flat', 'Situated on first floor', 'Close to local shops', 'Separate contemporary kitchen', 'Communal garden to rear']","[['Golders Green ', '0.7 miles'], ['Brent Cross ', '0.7 miles'], ['Hendon Central ', '1.2 miles']]","['underground', 'underground', 'underground']",£200 per year (Ask agent about the review period)When and how often your ground rent will be reviewed.Read more about ground rent review period in our glossary page.,£1500,143 years left,Ask agent,False
34,132293033,"£500,000",Added on 06/03/2023,"Hamilton Road, London, NW11","CHAIN FREE! A 2 DOUBLE BEDROOM GROUND FLOOR apartment with an exceptionally GOOD SIZED GARDEN ideally situated close to tube station and local shopping facilities. Benefits include: en suite shower room, family bathroom, modern interior, own garden, long lease, convenient location and sold with n...",Apartment,2,2,,Leasehold,"['EN SUITE SHOWER ROOM', 'FAMILY BATHROOM', 'MODERN INTERIOR', 'OWN GARDEN', 'LONG LEASE', 'CONVENIENT LOCATION', 'SOLD WITH NO CHAIN']","[['Brent Cross ', '0.2 miles'], ['Golders Green ', '0.8 miles'], ['Hendon Central ', '0.9 miles']]","['underground', 'underground', 'underground']",£0 per year,£0,Ask agent,Band: TBC,False
35,134419874,"£500,000",Reduced on 15/09/2023,"Hocroft Court, 
Hendon Way, NW2","Located on the second floor of this well-maintained purpose built block, this spacious two bedroom apartment with a balcony, two double bedrooms and a separate kitchen.",Flat,1,2,,Share of Freehold,"['Two double bedrooms', 'Balcony', 'Share of freehold', 'Parking']","[['Cricklewood ', '0.5 miles'], ['Golders Green ', '0.8 miles'], ['West Hampstead Thameslink ', '1.0 miles']]","['nationalrail', 'underground', 'nationalrail']",Ask agent,£3360,986 years left,Band: D,False
