,id,price,added_reduced,address,description,type_house,bathrooms,bedrooms,size,tenure,key_features,close_stations,close_stations_type,tenure_ground_rent,tenure_annual_service_charge,tenure_lease_length,council_tax_band,sold_under_offer
67,135966743,"£675,000",Reduced on 19/10/2023,"Hanger Vale Lane, Ealing","A well-presented two bedroom, two bathroom apartment on the third floor of this much sought after development. With a west-facing balcony, lift access, private garage and share of freehold.",Flat,2,2,,Share of Freehold,"['Two Bedrooms', 'Two Bathrooms', 'West-Facing Balcony', 'Garage', 'Share Of Freehold', 'Close To Transport']","[['North Ealing ', '0.2 miles'], ['West Acton ', '0.4 miles'], ['Park Royal ', '0.6 miles']]","['underground', 'underground', 'underground']",Ask agent,Ask agent,Ask agent,Ask agent,False
68,137146805,"£260,000",Reduced on 19/10/2023,"Community Road, Greenford","ONE BEDROOM - GROUND FLOOR - CONVENIENT LOCATION- CHAIN FREE. Brian Cox and Company are pleased to bring to market this ideal, well maintained, one bedroom ground floor flat within easy reach of Greenford Station and local shops. The property briefly consists of a good sized hallway, fitted kitc...",Flat,1,1,,Leasehold,"['One Bedroom', 'Ground Floor Apartment', 'Approximately 87 Years Remaining', '£10 Ground Rent Per Annum', '£660 Service Charge Per Annum', 'Council Tax - C', 'EPC Rating - C']","[['Greenford ', '0.3 miles'], ['South Greenford ', '0.7 miles'], ['Northolt ', '1.0 miles']]","['nationalrail', 'nationalrail', 'underground']",Ask agent,Ask agent,Ask agent,Ask agent,False
69,141048638,"£600,000",Reduced on 19/10/2023,"Grange Park, London, W5","Introducing this centrally located 2 bedroom, 1 bathroom ground floor Victorian apartment. The property has it all: entering the property over your private driveway and 30ft garden, to your own front door, you also have a utility cupboard that houses the washing machine. Inside the apartme...",Flat,1,2,,Leasehold,"['sought after location', 'garden', 'period features', 'character property']","[['Ealing Broadway ', '0.4 miles'], ['Ealing Common ', '0.4 miles'], ['North Ealing ', '0.7 miles']]","['nationalrail', 'underground', 'underground']",Ask agent,Ask agent,Ask agent,Ask agent,False
70,141047156,"£200,000",Added on 19/10/2023,"Reading Road, Northolt, UB5 4PH","Being Sold via Secure Sale online bidding. Terms & Conditions apply. Starting Bid £200,000 This rarely available one bedroom maisonette is marketed chain free and comes with it's own rear garden space. The maisonette is located within a five minute walk of Northolt Park overground Station and ten...",Maisonette,1,1,,Leasehold,"['First Floor Maisonette', 'Online Auction - Sold via ‘Secure Sale’', 'Reception Room', 'Kitchen With Access To Garden', 'One Double Bedroom', 'Bathroom', 'Rear Garden', 'Close To Local Shops and Station', 'Immediate ‘Exchange Of Contracts’ Available', 'No Stamp Duty*']","[['Northolt Park ', '0.2 miles'], ['Northolt ', '0.6 miles'], ['South Harrow ', '0.7 miles']]","['nationalrail', 'underground', 'underground']",£100 per year (Ask agent about the review period)When and how often your ground rent will be reviewed.Read more about ground rent review period in our glossary page.,£0,77 years left,Band: B,False
71,141047147,"£465,000",Reduced on 19/10/2023,"B1.11.08 The Verdean, Acton, London, W3","JOHNS&CO are pleased to present for sale this studio apartment located in the new the highly sought after Verdean development. This apartment is located in The Oak building, this incredible studio apartment features a custom design kitchen with integrated Bosch appliances and bespoke modern bathr...",Apartment,1,1,,Leasehold,"['New Build', '571 Sq Ft', 'Private Balcony', 'Residents Gym', '24 Hour Concierge', 'Landscaped Communal Gardens', '0.1 miles to Acton Mainline Station', 'Completion Q2 2024']","[['Acton Main Line ', '0.1 miles'], ['Acton Central ', '0.6 miles'], ['North Acton ', '0.7 miles']]","['nationalrail', 'overground', 'underground']",£400 per year (Ask agent about the review period)When and how often your ground rent will be reviewed.Read more about ground rent review period in our glossary page.,£2723.67,999 years left,Ask agent,False
72,141047159,"£485,000",Reduced on 19/10/2023,"B1.16.01 The Verdean, Acton, London, W3","JOHNS&CO are pleased to present for sale this one-bedroom apartment located in the new the highly sought after Verdean development. This apartment is located in The Oak building, this incredible apartment features a custom design kitchen with integrated Bosch appliances and bespoke modern bathroo...",Apartment,1,1,,Leasehold,"['New Build', '569 Sq Ft', '0.1 miles to Acton Main Line', 'Residents Gym', '24 Hour Concierge', 'Private Balcony', 'Completion Q2 2024', 'Fitted Bosch Appliances', 'Cinema Room', 'Landscaped Communal Gardens']","[['Acton Main Line ', '0.1 miles'], ['Acton Central ', '0.6 miles'], ['North Acton ', '0.7 miles']]","['nationalrail', 'overground', 'underground']",£400 per year (Ask agent about the review period)When and how often your ground rent will be reviewed.Read more about ground rent review period in our glossary page.,£2674.3,999 years left,Ask agent,False
73,141046937,"£300,000",Added on 19/10/2023,"121 Barmouth Avenue, Perivale, Greenford, Greater London, UB6","Ground Floor - Three Rooms with Shower Rooms, Kitchen, First Floor - Two Rooms with Shower Rooms, Second Floor - Room with Shower Room, Kitchen, Outhouse fitted with Kitchen, Driveway providing off street Parking, Rear Garden, Perivale underground station (Central Line) is 0.4 miles to the east
",Terraced,1,3,,Freehold,[],"[['Perivale ', '0.3 miles'], ['South Greenford ', '0.4 miles'], ['Greenford ', '0.8 miles']]","['underground', 'nationalrail', 'nationalrail']",Ask agent,Ask agent,Ask agent,Ask agent,False
74,141046952,"£975,000",Added on 19/10/2023,"Normanby Road, Dollis Hill, London, NW10","Arranged over 3 generous floors, this stunning 4 bedroom house offers a stylish open-plan kitchen, ample storage space throughout and a beautiful garden.",Semi-Detached,1,4,"1,257 sq. ft.(117 sq. m.)",Freehold,"['A superb 4 bedroom house', 'Situated on a peaceful residential road', 'Spacious bay fronted reception room', 'Stunning kitchen/dining room leading to garden', '4 generous bedrooms', 'Lovely rear garden', 'Great location close to amenities']","[['Dollis Hill ', '0.3 miles'], ['Neasden ', '0.3 miles'], ['Willesden Green ', '0.9 miles']]","['underground', 'underground', 'underground']",Ask agent,Ask agent,Ask agent,Ask agent,False
75,140243489,"£649,950",Added on 21/09/2023,"Sherborne Gardens, London, NW9","*** COME ONE, COME ALL ***We are proud to present this 3 bedroom semi-detached home which is located on one of Kingsbury's most popular roads. The property comes with 2 reception rooms, family bathroom with WC as well as a separate WC for convenience, off street parking, rear garden, a ...",Semi-Detached,1,3,,Freehold,[],"[['Queensbury ', '0.2 miles'], ['Kingsbury ', '0.6 miles'], ['Burnt Oak ', '0.9 miles']]","['underground', 'underground', 'underground']",Ask agent,Ask agent,Ask agent,Band: E,False
76,141046763,"£465,000",Reduced on 19/10/2023,"B1.11.02 The Verdean, Acton, London, W3","JOHNS&CO are pleased to present for sale this one-bedroom apartment located in the new the highly sought after Verdean development. This apartment is located in The Oak building, this incredible apartment features a custom design kitchen with integrated Bosch appliances and bespoke modern bathroo...",Apartment,1,1,,Leasehold,"['One bedroom', '540 Sq Ft', 'Private Balcony', '24 Hour Concierge', 'Cinema Room', 'Residents Gym', '0.1 to Acton Main Line', 'Completion Q2 2024']","[['Acton Main Line ', '0.1 miles'], ['Acton Central ', '0.6 miles'], ['North Acton ', '0.7 miles']]","['nationalrail', 'overground', 'underground']",£400 per year (Ask agent about the review period)When and how often your ground rent will be reviewed.Read more about ground rent review period in our glossary page.,£2575.8,999 years left,Ask agent,False
77,141046751,"£459,000",Reduced on 19/10/2023,"B1.09.02 The Verdean, Acton, London, W3","JOHNS&CO are pleased to present for sale this one-bedroom apartment located in the new the highly sought after Verdean development. This apartment is located in The Oak building, this incredible apartment features a custom design kitchen with integrated Bosch appliances and bespoke modern bathroo...",Apartment,1,1,,Leasehold,"['One bedroom', '540 Sq Ft', 'Private Balcony', '24 Hour Concierge', 'Cinema Room', 'Residents Gym', '0.1 to Acton Main Line', 'Completion Q2 2024']","[['Acton Main Line ', '0.1 miles'], ['Acton Central ', '0.6 miles'], ['North Acton ', '0.7 miles']]","['nationalrail', 'overground', 'underground']",£400 per year (Ask agent about the review period)When and how often your ground rent will be reviewed.Read more about ground rent review period in our glossary page.,£2575.8,999 years left,Ask agent,False
78,141046748,"£453,000",Reduced on 19/10/2023,"B1.07.01 The Verdean, Acton, London, W3","JOHNS&CO are pleased to present for sale this one-bedroom apartment located in the new the highly sought after Verdean development. This apartment is located in The Oak building, this incredible apartment features a custom design kitchen with integrated Bosch appliances and bespoke modern bathroo...",Apartment,1,1,,Leasehold,"['New Build', '569 Sq Ft', '0.1 to Acton Main Line', 'Residents Gym', '24 Hour Concierge', 'Private Balcony', 'Completion Q2 2024', 'Fitted Bosch Appliances', 'Cinema Room', 'Landscaped Courtyard Gardens']","[['Acton Main Line ', '0.1 miles'], ['Acton Central ', '0.6 miles'], ['North Acton ', '0.7 miles']]","['nationalrail', 'overground', 'underground']",£400 per year (Ask agent about the review period)When and how often your ground rent will be reviewed.Read more about ground rent review period in our glossary page.,£2714.13,999 years left,Ask agent,False
79,138766781,"£1,399,999",Reduced on 19/10/2023,"South Hill Avenue, Harrow","A 5 double bedroom, 2 reception room, 2 bathroom (one en-suite) detached family home located on the sought after South Hill Estate just minutes walk from the renowned Orley Farm Preparatory School. The property boast a generous L shaped lounge/dining room, a good size kitchen plus a modern d...",Detached,2,5,,Freehold,"['5 DOUBLE BEDROOM DETACHED', 'SOUTH HILL ESTATE', 'OPEN PLAN RECEPTIONS ROOMS', 'GUEST CLOAK ROOM', 'LANDSCAPED REAR GARDEN', 'OWN DRIVE', 'AMPLE PARKING', 'INTEGRAL GARAGE', 'NO UPPER CHAIN']","[['Sudbury Hill Harrow ', '0.4 miles'], ['Sudbury Hill ', '0.5 miles'], ['South Harrow ', '0.6 miles']]","['nationalrail', 'underground', 'underground']",Ask agent,Ask agent,Ask agent,Ask agent,False
80,141045149,"£550,000",Added on 19/10/2023,"The Avenue, London, W13",A tastefully refurbished first floor apartment.,Apartment,1,2,,Share of Freehold,"['Beautifully presented two bedroom modern apartment', 'Newly refurbished', 'Easy distance to local transport links', 'Spacious first come first served parking', 'Period property', 'EPC Rating = D']","[['West Ealing ', '0.3 miles'], ['Drayton Green ', '0.5 miles'], ['Castle Bar Park ', '0.6 miles']]","['nationalrail', 'nationalrail', 'nationalrail']",£0 per year,£960,955 years left,Band: C,False
81,141043157,"£680,000",Added on 19/10/2023,"Langham Gardens, Harrow, Middlesex, HA0","Located on the ever popular and sought after, Sudbury Court Estate. ",Semi-Detached,,3,,Freehold,"['Semi-Detached House', 'Three Bedrooms', 'Two Reception Rooms', 'Own Drive To Garage', 'No Onward Chain', 'Walking distance to South Kenton Tube Station']","[['South Kenton ', '0.2 miles'], ['South Kenton ', '0.2 miles'], ['North Wembley ', '0.4 miles']]","['overground', 'underground', 'underground']",Ask agent,Ask agent,Ask agent,Ask agent,False
82,141044990,"£995,000",Added on 19/10/2023,"North Common Road, London",An impressive lateral ground floor period conversion which forms part of this beautiful Victorian property. Meticulously refurbished throughout in a contemporary style yet retaining many original features and has sole use of a private rear garden. It also benefits from the off-street parking.,Apartment,1,3,,Share of Freehold,[],"[['Ealing Common ', '0.3 miles'], ['Ealing Broadway ', '0.4 miles'], ['North Ealing ', '0.4 miles']]","['underground', 'nationalrail', 'underground']",Ask agent,£2400,Ask agent,Band: E,False
83,141044738,"£365,000",Added on 19/10/2023,"Rose Bates Drive, London, NW9","This luxurious apartment boasts a sleek and contemporary design that epitomizes modern living. You are immediately greeted by an ELEGANT entrance leading directly to a spacious family reception room, creating a warm and welcoming atmosphere for guests. The interior design showcases a seamless ble...",Apartment,1,2,,Leasehold,"['2 BEDROOMS', 'GROUND FLOOR', 'SPACIOUS FAMILY ROOM', 'RESISDENT PARKING', 'BALCONY']","[['Kingsbury ', '0.4 miles'], ['Queensbury ', '0.4 miles'], ['Burnt Oak ', '1.2 miles']]","['underground', 'underground', 'underground']",£0 per year,£0,102 years left,Band: TBC,False
84,138993665,"£899,950",Reduced on 19/10/2023,"Norval Road, Wembley",Daniels are delighted to present to the market this substantial property providing nearly 1750sqft of living accommodation with NO UPPER CHAIN. This large family home is located on a popular road situated with the ever popular Sudbury Court Estate. The property has been extended to the side and r...,Detached,2,5,,Freehold,"['NO UPPER CHAIN', 'FIVE BEDROOM DETACHED', 'EXTENDED TO SIDE & REAR', 'OPEN PLAN KITCHEN', 'LARGE FRONTAGE PROVIDING OFF STREET PARKING FOR 3+ CARS', 'LARGE PRIVATE REAR GARDEN / BACKING NORTHWICK PARK', 'WALKING DISTANCE TO NORTHWICK PARK & S.KENTON STATION', '1,747 SQFT OF LIVING ACCOMMODATION', 'EPC RATING - D / COUNCIL TAX BAND - D', 'ONLINE VIRTUAL TOUR:  ']","[['South Kenton ', '0.3 miles'], ['South Kenton ', '0.3 miles'], ['Northwick Park ', '0.6 miles']]","['overground', 'underground', 'underground']",Ask agent,Ask agent,Ask agent,Band: D,False
85,141044177,"£800,000",Added on 19/10/2023,"Norman Way, Acton, W3","A fantastic opportunity to purchase this double-fronted, semi-detached house. This generous accommodation comprises of two reception rooms, kitchen with breakfast bar, and three bedrooms, and a family bathroom. The property boasts, a wonderful large rear garden, side access, huge potential to ext...",House,1,3,,Freehold,"['Double Fronted Semi-Detached House', 'Three Bedrooms', 'Large Rear Garden', 'Off street Parking', 'Side Access', 'HUGE Potential FOR Double Storey Rear Extension S.T.P.P.']","[['West Acton ', '0.3 miles'], ['Acton Main Line ', '0.4 miles'], ['Park Royal ', '0.7 miles']]","['underground', 'nationalrail', 'underground']",Ask agent,Ask agent,Ask agent,Band: E,False
86,141042989,"£350,000",Added on 19/10/2023,Blackbird Hill,"Introducing a fantastic opportunity to own a beautiful first-floor maisonette with a private garden in the desirable location of Neasden. This property offers all the comforts and convenience of modern living, combined with the charm and character of a traditional maisonette",Maisonette,1,2,,Leasehold,"['Two bedroom', 'Maisonette', 'Private garden', 'Transport links', 'Local amenities', 'Neasden station']","[['Neasden ', '0.7 miles'], ['Wembley Park ', '0.9 miles'], ['Dollis Hill ', '1.1 miles']]","['underground', 'underground', 'underground']",Ask agent,Ask agent,Ask agent,Ask agent,False
87,136146200,"£160,000",Reduced on 19/10/2023,"Connell Crescent, Ealing, London, W5",One Bedroom Garden Flat situated in Hanger Lane / Park Royal with Planning Permission for rear extension and front driveway. NOTE: THIS IS SUITABLE FOR CASH INVESTORS AS THE LEASE REMAINING IS APPROX. 17 YEARS,Apartment,1,1,,Leasehold,"['1 Bedroom', 'Ground Floor', 'Private Garden', 'Good transport links', 'Planning Permission for rear extension and driveway', 'ONLY\xa0FOR\xa0CASH\xa0BUYERS']","[['Park Royal ', '0.2 miles'], ['Hanger Lane ', '0.3 miles'], ['North Ealing ', '0.7 miles']]","['underground', 'underground', 'underground']",£6.3 per year,£400,17 years left,Band: A,False
88,141038228,"£400,000",Added on 19/10/2023,"Wessex Lane, Greenford","A charming split-level maisonette nestled in the heart of Greenford, UB6.
Could this be your perfect first time home?",Maisonette,2,3,,Leasehold,"['Duplex', 'Three Double Bedrooms', 'Own Garage', 'Off Street Parking', 'Two Bathrooms', 'Greenford, UB6']","[['South Greenford ', '0.4 miles'], ['Greenford ', '0.5 miles'], ['Perivale ', '1.0 miles']]","['nationalrail', 'nationalrail', 'underground']",Ask agent,Ask agent,Ask agent,Ask agent,False
89,140343563,"£850,000",Reduced on 18/10/2023,"Lansdowne Road, Harrow on the Hill, Harrow, HA1","Located a stones throw away from local amenities in Harrow Town Centre, this impeccable 2 double bedroom flat located in a period house offers beautiful interiors, off street parking and an amazing wraparound garden.",Flat,1,2,"1,320 sq. ft.(123 sq. m.)",Share of Freehold,"['Substantial and luxurious two double bedroom ground floor flat with original period features throughout', 'Fabulous reception room with feature fireplace', 'Incredible main bedroom with direct access to the garden', 'Open plan kitchen/diner with vaulted ceiling', 'Driveway providing off-street parking space', 'Lovely views across green open spaces', 'Separate utility room', 'Wrap around private garden with patio area ideal for entertaining']","[['Harrow-on-the-Hill ', '0.1 miles'], ['West Harrow ', '0.6 miles'], ['Northwick Park ', '0.9 miles']]","['nationalrail', 'underground', 'underground']",Ask agent,Ask agent,86 years left,Ask agent,False
90,139684193,"£799,950",Reduced on 18/10/2023,"Brunner Road, London","This period family house situated on Brunner Road, set within a desirable conservation area, offers three bedrooms, a loft room, two receptions, front & large rear garden, a chalet home or garden office & no onward chain. Please call the Ealing branch for more information & to arrange a viewing!",End of Terrace,2,4,,Freehold,"['Charming, period, end of terrace family house ', 'Sought after conservation area ', 'Three bedrooms + loft room ', 'Two reception rooms', 'Front & large rear garden', 'Chalet home office', 'Very close to tube stations', 'No onward chain ']","[['Hanger Lane ', '0.6 miles'], ['Ealing Broadway ', '0.9 miles'], ['Park Royal ', '1.0 miles']]","['underground', 'nationalrail', 'underground']",Ask agent,Ask agent,Ask agent,Band: E,False
91,141029072,"£1,350,000",Added on 18/10/2023,"Byron Road, London, W5","Characterful Edwardian semi-detached family home situated in a sought-after location and presented to the market with no onward chain. The well-balanced accommodation offers approximately 1,553 sq ft spanning across two floors and comprises two reception rooms, separate kitchen, four bedrooms, a ...",Semi-Detached,2,4,,Freehold,"['Edwardian family home', 'Period features and character throughout', ""Secluded rear 54' garden"", 'Extension potential STPP', 'Sought-after location', 'Chain free sale']","[['Ealing Common ', '0.1 miles'], ['North Ealing ', '0.5 miles'], ['West Acton ', '0.5 miles']]","['underground', 'underground', 'underground']",Ask agent,Ask agent,Ask agent,Band: G,False
92,139463045,"£750,000",Reduced on 18/10/2023,"Burnley Road, London, NW10",We are pleased to be able to offer for sale this spacious extended semi-detached house constructed circa 1930 and offering spacious family accommodation. The property would allow a potential buyer to develop the house to their own taste.The property is situated on the ever popular Dolli...,Semi-Detached,1,3,,Freehold,"['•\tGas central heating', '•\tDouble glazed windows', '•\tGround floor rear extension', '•\tSouth facing rear garden', '•\tSide pedestrian access', '•\tPopular location', '•\tPotential for parking two cars by lowering the kerb', '•\tOriginal features', '•\tGross internal floor area of 1,176 sq ft (109 sq m) approximately']","[['Dollis Hill ', '0.1 miles'], ['Neasden ', '0.4 miles'], ['Willesden Green ', '0.8 miles']]","['underground', 'underground', 'underground']",Ask agent,Ask agent,Ask agent,Band: E,False
93,138342443,"£270,000",Reduced on 18/10/2023,"Wicket Road, Greenford, UB6","This fantastic top floor flat with amazing view s is a must see and one that's not to be missed as not only is it being sold with no onward chain, the fantastic decorative order makes it a superb choice for anyone seeking low maintenance living - ideal for the first home buyers or a landlord loo...",Flat,1,2,,Leasehold,"['Top Floor Apartment ', 'No Onward Chain ', 'Allocated Parking ', 'Two Bedrooms ', 'Uninterrupted Views ', 'Cul-De-Sac Location', 'Close To Transport Links', 'Close To Local Shops ', 'Book A Viewing Online Via Our Website ', 'PRICE GUIDE £270000 TO £300000']","[['Perivale ', '0.3 miles'], ['South Greenford ', '0.4 miles'], ['Castle Bar Park ', '0.7 miles']]","['underground', 'nationalrail', 'nationalrail']",£0 per year,£1150,87 years left,Band: C,False
94,130755584,"£375,000",Reduced on 18/10/2023,"Western Avenue, London","A TWO BEDROOM GROUND FLOOR FLAT WITH REAR GARDEN AND SHARE OF FREEHOLD. The property comprises of entrance hall, lounge/diner with doors leading to rear garden, kitchen, two bedrooms and bathroom. The total floor area is approximately 672 SQ/FT (62 SQ/M). Conveniently located o...",Flat,1,2,672 sq. ft.(62 sq. m.),Share of Freehold,"['TWO BEDROOMS', 'GROUND FLOOR FLAT', 'REAR GARDEN', 'SEPARATE KITCHEN', 'SHARE OF FREEHOLD', 'CLOSE TO TRAIN LINES']","[['North Acton ', '0.5 miles'], ['Acton Main Line ', '0.5 miles'], ['West Acton ', '0.8 miles']]","['underground', 'nationalrail', 'underground']",Ask agent,Ask agent,Ask agent,Band: C,False
95,141026093,"£1,175,000",Added on 18/10/2023,"Sudbury Court Drive, Harrow, Middlesex, HA1","Nestled in the popular Sudbury Court Drive, this impeccable family residence enjoys an ideal location.Brimming with natural light, this expansive abode features three reception rooms, a spacious kitchen and a ground-floor bedroom.",Detached,2,4,,Freehold,['Immaculate condition'],"[['Sudbury Hill Harrow ', '0.7 miles'], ['South Kenton ', '0.7 miles'], ['South Kenton ', '0.7 miles']]","['nationalrail', 'overground', 'underground']",Ask agent,Ask agent,Ask agent,Ask agent,False
96,141025979,"£275,000",Added on 18/10/2023,"Church Road, London","Offering Nearly 500sqft of internal accommodation, Portland Estate Agents are pleased to offer this Bright One Bedroom Apartment with Private Balcony to the market. Church Road is a popular residential modern block with parking and secure fob access. The apartment comes with bright view...",Flat,1,1,485 sq. ft.(45 sq. m.),Leasehold,"['Bright One Bedroom Apartment', 'Secure Development', 'Private Balcony', 'EWS1 Certificate', 'Amazing Views', 'Top Floor With Lift Access', 'Open Plan Kitchen', 'Vacant Possesion', 'Long Lease', 'Excellent Storage']","[['Harlesden ', '0.5 miles'], ['Neasden ', '0.8 miles'], ['Willesden Junction ', '0.8 miles']]","['underground', 'underground', 'underground']",£150 per year (Ask agent about the review period)When and how often your ground rent will be reviewed.Read more about ground rent review period in our glossary page.,£1629.78,116 years left,Band: B,False
97,141025415,"£200,000",Added on 18/10/2023,"Reading Road, Northolt, London, UB5 4PH","Being Sold via Secure Sale online bidding. Terms & Conditions apply. Starting Bid £200,000 - Front door opens onto stairs to first floor, doors from hallway lead to lounge with feature fireplace and front aspect bay window. Kitchen with matching wall and base units, 1 ½ bowl stai...",Maisonette,1,1,,Leasehold,"['Being Sold via Secure Sale online bidding. Terms & Conditions apply', 'First Floor Maisonette', 'Close To Local Shops and Station', 'No Stamp Duty*', 'pop', 'Vacant and Chain Free']","[['Northolt Park ', '0.2 miles'], ['Northolt ', '0.5 miles'], ['South Harrow ', '0.7 miles']]","['nationalrail', 'underground', 'underground']",Ask agent,Ask agent,Ask agent,Band: B,False
98,141023033,"£535,000",Reduced on 18/10/2023,"Tadworth Road, London, NW2",Key features Mid Terraced HouseThree BedroomsOne Bathroom with Walk-In bathroomDrivewayLarge GardenLiving RoomSeparate W.C,Terraced,1,3,,Freehold,"['Excellent Investment Oppurtunity', 'Mid-Terraced House', 'Large Garden', 'Driveway', 'Walkin Shower']","[['Dollis Hill ', '1.0 miles'], ['Hendon ', '1.0 miles'], ['Neasden ', '1.0 miles']]","['underground', 'nationalrail', 'underground']",Ask agent,Ask agent,Ask agent,Ask agent,False
99,141023456,"£400,000",Added on 18/10/2023,"Chalkhill Road, Wembley",** TWO BEDROOM APARTMENT ** PURPOSE BUILT BLOCK ** FIFTH FLOOR ** WELL PRESENTED THROUGHOUT ** SPACIOUS RECEPTION ROOM ** FULLY FITTED KITCHEN ** TWO BALCONIES ** STUNNING VIEWS OF WEMBLEY ** LUXURY BATHROOM ** IDEAL PROPERTY FOR FIRST TIME BUYERS ** VIEWINGS ARE HIGHLY RECOMMENDED **,Flat,1,2,,Leasehold,"['** TWO BEDROOM APARTMENT', '** PURPOSE BUILT BLOCK - FIFTH FLOOR ', '** SPACIOUS RECEPTION ROOM', '** MODERN FITTED KITCHEN', '** TWO BALCONIES', '** STUNNING VIEWS OF WEMBLEY', '** LUXURY BATHROOM', '** IDEAL PROPERTY FOR FIRST TIME BUYERS']","[['Wembley Park ', '0.2 miles'], ['Wembley Stadium ', '0.8 miles'], ['Preston Road ', '1.1 miles']]","['underground', 'nationalrail', 'underground']",£0 per year,£4500,105 years left,Band: D,False
