,id,price,added_reduced,address,description,type_house,bathrooms,bedrooms,size,tenure,key_features,close_stations,close_stations_type,tenure_ground_rent,tenure_annual_service_charge,tenure_lease_length,council_tax_band,sold_under_offer
135,140986274,"£399,950",Added on 17/10/2023,"Oxford Road, London, W5","A second floor one bedroom apartment centrally located in Ealing Broadway in a gated development, with communal gardens and an allocated parking space.",Flat,1,1,453 sq. ft.(42 sq. m.),Leasehold,"['One Bedroom Apartment', 'Central Ealing Location', 'Communal Gardens', 'Allocated Parking', 'Private Gated Development']","[['Ealing Broadway ', '0.1 miles'], ['Ealing Common ', '0.6 miles'], ['North Ealing ', '0.6 miles']]","['nationalrail', 'underground', 'underground']",Ask agent,£1400,85 years left,Band: D,False
136,140499395,"£280,000",Reduced on 17/10/2023,"Headstone Road, Harrow, HA1","We are proud to offer this One Bedroom Apartment – all interest and OFFERS are INVITED.*Guide Price £280,000 - £300,000*",Flat,1,1,,Leasehold,"['**GUIDE PRICE - £280,000 - £300,000**', 'Well-Presented Apartment', 'Double Bedroom with Built-in Wardrobe', 'Bright Open Plan Living Space', 'Modern Kitchen with Integral Appliances', 'Modern Four Piece Bathroom  Suite', 'Communal Garden', 'Close to Town Centre Amenities & Transport Links', 'Short Walk to the Train Station', 'Ideal for First Time Buyers & Buy to Let Investors']","[['Harrow-on-the-Hill ', '0.2 miles'], ['West Harrow ', '0.5 miles'], ['Harrow & Wealdstone ', '0.8 miles']]","['nationalrail', 'underground', 'nationalrail']",Ask agent,Ask agent,Ask agent,Ask agent,False
137,138074480,"£625,000",Reduced on 17/10/2023,"Hawkshead Road, London, NW10",We are pleased to be able to offer this end of terrace Victorian built house situated in this popular residential road between Roundwood Road and Oldfield road and offering spacious family accommodation.The property is located opposite Leopold Primary School (a sought after school) and ...,Terraced,2,3,,Freehold,"['•\tGas central heating', '•\tDouble glazed windows', '•\tTwo bathrooms', '•\tThree good sized bedrooms', '•\tDisability friendly', '•\tThe nearest Stations are Neasden and Dollis Hill (Jubilee Line)', '•\tGross internal floor area of 1,237 sq ft (115 sq m) approximately']","[['Dollis Hill ', '0.6 miles'], ['Neasden ', '0.7 miles'], ['Harlesden ', '0.7 miles']]","['underground', 'underground', 'underground']",Ask agent,Ask agent,Ask agent,Band: E,False
138,140981660,"£385,000",Added on 17/10/2023,"Victoria Road, Acton",A two bedroom apartment situated on the tenth floor with just under 650 sq.ft of internal living space. The flat has two bathrooms (one en suite) and a private balcony.,Flat,2,2,,Leasehold,"['Seventh Floor', 'Two Double Bedrooms', 'Two Bathrooms', 'Lift Access', 'Private Balcony', 'No Onward Chain']","[['North Acton ', '0.3 miles'], ['Acton Main Line ', '0.5 miles'], ['East Acton ', '0.7 miles']]","['underground', 'nationalrail', 'underground']",Ask agent,Ask agent,Ask agent,Ask agent,False
139,140981255,"£975,000",Added on 17/10/2023,"Dewsbury Road, Willesden","A well-presented semi-detached house, offering accommodation across three floors. With a double reception with a bay window, a large kitchen/diner leading out on to a private garden, five double bedrooms and three bathrooms making this a perfect family home. The property also comes with off-stree...",House,3,5,,Freehold,"['Five Bedrooms', 'Semi-Detached', 'Two Reception Rooms', 'Three Bathrooms', 'Off Street Parking', 'Eat-In Kitchen']","[['Dollis Hill ', '0.1 miles'], ['Neasden ', '0.6 miles'], ['Willesden Green ', '0.6 miles']]","['underground', 'underground', 'underground']",Ask agent,Ask agent,Ask agent,Ask agent,False
140,138291458,"£450,000",Reduced on 17/10/2023,"Highfield Road, London","This ground floor flat situated on Highfield Road in Acton, offers two double bedrooms, two bathrooms, off street parking and a private garden. Please call the Ealing branch today to arrange a viewing!",Ground Flat,2,2,,Leasehold,"['Ground floor flat with its own entrance', 'Two bedrooms & two bathrooms ', 'Off street parking', 'Private garden', 'No onward chain', 'Close to transport links']","[['Acton Main Line ', '0.5 miles'], ['West Acton ', '0.5 miles'], ['Park Royal ', '0.6 miles']]","['nationalrail', 'underground', 'underground']",£0 per year,Ask agent,Ask agent,Band: C,False
141,140978762,"£550,000",Added on 17/10/2023,"Windmill Lane, Greenford","A luxurious, newly constructed ground floor apartment located on Windmill Lane in Greenford, UB6",Apartment,3,2,,Share of Freehold,"['Three Bedrooms', 'Separate Reception Room', 'Four Bathrooms', 'Finished To A High Standard', 'Ample Off Street Parking', 'Decking And Rear Garden', 'Chain Free', 'Share Of Freehold']","[['South Greenford ', '0.9 miles'], ['Castle Bar Park ', '1.0 miles'], ['Greenford ', '1.1 miles']]","['nationalrail', 'nationalrail', 'nationalrail']",Ask agent,Ask agent,Ask agent,Ask agent,False
142,140978066,"£795,000",Added on 17/10/2023,"Hillcroft Crescent, Wembley, Middx, HA9",Acorn Properties are pleased to offer this rarely available Three Bedroom Semi Detached House located within walking distance of Wembley Park Station. The Property is well presented sitting on a larger than average plot with great potential to extend to the side and rear (subject to planning perm...,Semi-Detached,1,3,,Freehold,"['3 Bedrooms', 'Two Reception Room', 'Dining Room', 'Kitchen', 'Bathroom/Wc', 'Garage Via Own Drive', 'Front and Rear Gardens', 'Potential To Extend (Stpp)']","[['Wembley Stadium ', '0.3 miles'], ['Wembley Park ', '0.5 miles'], ['Wembley Central ', '0.6 miles']]","['nationalrail', 'underground', 'nationalrail']",Ask agent,Ask agent,Ask agent,Band: TBC,False
143,140977358,"£425,000",Reduced on 17/10/2023,"Rose Bates Drive, Kingsbury, London, NW9","Sonia Estates are pleased to offer to the market this Immaculate, Large & Newly Refurbished Two Double Bedroom / Two Bathroom 2nd Floor Flat In The Highly Popular Rose Bates Drive Development Just Off Honeypot Lane.This Accommodation Comprises Of An Entrance Hallway, Large Reception Room With A P...",Flat,2,2,,Leasehold,"['The Popular Rose Bates Drive Development', 'Currently Achieving £1900 Per Month', 'Ideal Investment Opportunity', 'Ideal Buy To Let', 'Two Double Bedrooms', 'Two Bathrooms / One Of Which Is Ensuite To The Master Bedroom', 'Brand New Luxury Kitchen & A Brand New Luxury Separate Bathroom', 'Private Balcony', 'Allocated Parking', 'Situated Between Kingsbury & Queensbury']","[['Kingsbury ', '0.4 miles'], ['Queensbury ', '0.4 miles'], ['Burnt Oak ', '1.2 miles']]","['underground', 'underground', 'underground']",£120 per year (Ask agent about the review period)When and how often your ground rent will be reviewed.Read more about ground rent review period in our glossary page.,Ask agent,96 years left,Band: C,False
144,140976476,"£650,000",Added on 17/10/2023,"Ilex Road, Willesden, London, NW10","Boasting newly refurbished interiors, this spacious 3 bedroom house offers bright and neutral decor, 3 well proportioned double bedrooms and a lovely private garden.",Semi-Detached,1,3,956 sq. ft.(89 sq. m.),Freehold,"['Excellent 3 bedroom terraced house', 'Bay fronted reception room', 'Modern fitted kitchen with ample space to dine', 'Peaceful residential street', 'Separate dining room', 'Brand new carpets', 'Moments from amenities and transport links']","[['Neasden ', '0.5 miles'], ['Dollis Hill ', '0.5 miles'], ['Harlesden ', '0.9 miles']]","['underground', 'underground', 'underground']",Ask agent,Ask agent,Ask agent,Ask agent,False
145,140976443,"£649,500",Added on 17/10/2023,"AFFINITY HOUSE,  GRAND UNION, WEMBLEY,","Tenure: Leasehold, 999 years remaining . Apartment 243 Grand Union by St George (part of the Berkeley Group). This three bedroom, 1,083 sq ft apartment is located on the 1st floor of Affinity House and Grand Union. Available for £826,500* the home is complete with a private balcony and terrace ov...",Flat,2,2,,Leasehold,"['3 BEDROOMS - 3rd floor', '1,127 sq ft', 'PRIVATE BALCONY & TERRACE', 'LANDSCAPED GARDENS', 'FIRST CLASS EDUCATION  WITHIN CLOSE PROXIMITY', 'COMING  SOON WITH  WITH GYM - NURSERY AND SUPERMARKET', 'COMPLETION Q4 2022', '999 YEAR LEASE']","[['Stonebridge Park ', '0.4 miles'], ['Alperton ', '0.7 miles'], ['Hanger Lane ', '0.9 miles']]","['underground', 'underground', 'underground']",Ask agent,Ask agent,Ask agent,Ask agent,False
146,140976188,"£422,500",Added on 17/10/2023,"WATERVIEW HOUSE  - Beresford Avvenue, Wembley, Alperton, HA0 1NW","Waterview House now launched - Waterview House is the latest collection of apartments at Grand Union, offering outstanding residents' facilities and 14 acres of open space consisting of landscaped gardens, riverside meadows and riverside walkways, everything you need on your doorstep. Located in...",Flat,1,1,,Leasehold,"['NOW LAUNCHED', 'BUY OFF PLAN', 'SELACTION OF FLATS', 'RESIDENTS LOUNGE', 'PARKING AVAILABLE', 'ALL IMAGES ARE CGI AND FOR ILLUSTRATION ONLY', '22 Acres', ""Exclusive residents' facilities  residents'-  conciergeFirst class education within close proximityEasy access to the City and West End"", 'Ten-pin bowling,', '24 HOUR CONCIERGE']","[['Stonebridge Park ', '0.4 miles'], ['Alperton ', '0.6 miles'], ['Hanger Lane ', '0.8 miles']]","['underground', 'underground', 'underground']",Ask agent,Ask agent,Ask agent,Ask agent,False
147,138883133,"£825,000",Reduced on 17/10/2023,"Haven Green Court, Ealing, London","This exceptional second floor flat with share of freehold offers the perfect blend of comfort, space, style and abundance of natural light. With four generously sized bedrooms, a spacious reception room with dining space, a fully fitted kitchen, a this property is designed to cater to all your ne...",Apartment,1,3,"1,265 sq. ft.(118 sq. m.)",Share of Freehold,"['Second Floor Flat', 'Share of Freehold (Lease - 990 Years Remaining)', 'Four Bedrooms', 'Spacious Open Plan Reception Room', 'Fully Fitted Kitchen', 'Utility Room', 'Storage', 'Bathroom', 'Service Charge - £6,000pa', 'Council Tax Band – F']","[['Ealing Broadway ', '0.2 miles'], ['North Ealing ', '0.7 miles'], ['West Ealing ', '0.7 miles']]","['nationalrail', 'underground', 'nationalrail']",£0 per year,£6000,Ask agent,Band: F,False
148,140476058,"£525,000",Reduced on 17/10/2023,"Burnley Road, Dollis Hill, London, NW10",This fantastic 2 bedroom flat located on the ground floor of a period conversion offers a superb living space with private rear garden and well proportioned rooms throughout.,Maisonette,1,2,893 sq. ft.(83 sq. m.),Freehold,"['Impressive 2 bedroom garden flat', 'Open plan reception room', 'Modern kitchen with access to garden', 'Attractive lawned garden with shed', 'Period conversion on residential street', 'Bay fronted main bedroom']","[['Dollis Hill ', '0.2 miles'], ['Neasden ', '0.3 miles'], ['Willesden Green ', '0.9 miles']]","['underground', 'underground', 'underground']",Ask agent,Ask agent,Ask agent,Ask agent,False
149,140975624,"£385,000",Added on 17/10/2023,"Gayton Road, Harrow, HARROW, HA1","Located moments from the fantastic amenities and transport links in Harrow, this spacious 1 bedroom 5th floor flat benefits from an open-plan kitchen, generous sized bedroom, private balcony and an excellent location.",Flat,1,1,630 sq. ft.(59 sq. m.),Leasehold,"['Spacious one bedroom fifth floor flat', 'Generous sized bedroom', 'Bright open plan reception room', 'Kitchen with fully integrated appliances', 'Private balcony with far reaching views', 'Excellent location moments from local amentiies in Harrow Town Centre', 'Walking distance to local transport links at Harrow On The Hill Underground and National Rail station', 'Excellent condition throughout']","[['Harrow-on-the-Hill ', '0.2 miles'], ['Northwick Park ', '0.6 miles'], ['Kenton ', '0.6 miles']]","['nationalrail', 'underground', 'underground']",£355.14 per year (Ask agent about the review period)When and how often your ground rent will be reviewed.Read more about ground rent review period in our glossary page.,£1535,243 years left,Ask agent,False
150,135711317,"£579,950",Added on 05/06/2023,"St. Johns Close, Wembley","*AN EXTREMELY WELL PRESENTED THREE BEDROOM, EXTENDED FAMILY HOME* We are delighted to bring to the market this superb three bedroom chain free property perfectly located on a small Cul-de-Sac in the heart of Wembley. Internally the property briefly comprises of a welcoming entrance hall, a beauti...",Terraced,1,3,,Freehold,"['THREE BEDROOMS', 'MODERN EXTENDED KITCHEN', 'THROUGH LOUNGE', 'GAS CENTRAL HEATING', 'DOUBLE GLAZING', 'OFF STREET PARKING', 'CONVENIENT LOCATION', 'CHAIN FREE SALE']","[['Wembley Central ', '0.2 miles'], ['Wembley Stadium ', '0.5 miles'], ['North Wembley ', '0.7 miles']]","['nationalrail', 'nationalrail', 'underground']",Ask agent,Ask agent,Ask agent,Band: D,False
151,86526549,"£450,000",Reduced on 17/10/2023,"Highfield Road, Acton, W3","Situated on the ground floor with access to a rear garden, this fantastic 2 bedroom flat offers comfortable accommodation with an open plan reception room/kitchen and 2 bedrooms with en suites.",Flat,2,2,451 sq. ft.(42 sq. m.),Leasehold,"['Fantastic 2 bedroom, ground floor flat', 'Open plan reception room with space to relax', 'Modern kitchen space with fitted appliances', '2 generously sized bedrooms', '2 en suites, one bath and one shower room', 'Lovely rear garden with space to relax and entertain', 'Located close to a range of amenities, green spaces and transport links']","[['Acton Main Line ', '0.5 miles'], ['West Acton ', '0.5 miles'], ['Park Royal ', '0.6 miles']]","['nationalrail', 'underground', 'underground']",Ask agent,Ask agent,Ask agent,Ask agent,False
152,140972249,"£400,000",Added on 17/10/2023,"Churchill Road, Willesden Green","A spacious and modern ground floor one bedroom flat which has direct access to its own private, secluded garden located in Willesden Green. The property boasts a wealth of character and charm benefiting from a share of freehold and is in excellent condition throughout. Churchill Road is a sought ...",Maisonette,1,1,,Share of Freehold,"['Private Rear Garden', 'Potential to Extend (Stpp)', '0.4 Miles to Willesden Green Underground Station', 'Well Presented Throughout', 'Share of Freehold', 'Ideal First Time Buy']","[['Dollis Hill ', '0.3 miles'], ['Willesden Green ', '0.4 miles'], ['Neasden ', '0.8 miles']]","['underground', 'underground', 'underground']",Ask agent,Ask agent,Ask agent,Ask agent,False
153,140970053,"£800,000",Added on 17/10/2023,"Gay Close, Willesden Green","An immaculately presented garden flat located in Willesden Green. The apartment is split level and offers four double bedrooms, living room, kitchen and two family bathrooms. Added benefits include double glazing, gas central heating and a private rear garden. Willesden Green Underground Station ...",Flat,2,4,,Leasehold,"['Private Rear Garden', '0.4 Miles to Willesden Green Underground Station', 'Split Level', '1570 Sq. Ft', 'Immaculately Presented Throughout', 'Close to Gladstone Park']","[['Willesden Green ', '0.4 miles'], ['Dollis Hill ', '0.4 miles'], ['Cricklewood ', '0.8 miles']]","['underground', 'underground', 'nationalrail']",£26.25 per year (Ask agent about the review period)When and how often your ground rent will be reviewed.Read more about ground rent review period in our glossary page.,£0,130 years left,Ask agent,False
154,140814083,"£465,000",Reduced on 17/10/2023,"Tubbs Road, Willesden Junction/Harlesden, London","On three split levels is this 900 sq.ft (83 sq.m) approx First & Second Floor converted Flat within an End of Terrace Victorian property situated moments from Willesden Junction (Zone 2 - London Overground & Bakerloo Line) station and comprising 3 bedrooms, reception/open plan kitchen and bathroo...",Flat,1,3,900 sq. ft.(84 sq. m.),Leasehold,"['FIRST & SECOND FLOOR CONVERTED FLAT ON 3 SPLIT LEVELS', '3 BEDROOMS', 'DOUBLE GLAZED WINDOWS', 'MOMENTS FROM WILLESDEN JUNCTION STATION', 'NO UPPER CHAIN']","[['Willesden Junction ', '0.1 miles'], ['Harlesden ', '0.6 miles'], ['North Acton ', '0.7 miles']]","['underground', 'underground', 'underground']",£10 per year (Ask agent about the review period)When and how often your ground rent will be reviewed.Read more about ground rent review period in our glossary page.,Ask agent,92 years left,Band: B,False
155,139363043,"£595,000",Reduced on 17/10/2023,"Roxborough Road, Harrow Central","Requiring Modernisation | ""Viewing Event"" Saturday 21st October | In a favoured no-through road close to Harrow Centre and Park this handsome larger-style semi-detached is offered with no onward chain. Offering considerable potential, this spacious property features excellent proportions & a garden.",Semi-Detached,1,3,,Freehold,[],"[['Harrow-on-the-Hill ', '0.4 miles'], ['West Harrow ', '0.5 miles'], ['Harrow & Wealdstone ', '0.6 miles']]","['nationalrail', 'underground', 'nationalrail']",Ask agent,Ask agent,Ask agent,Band: D,False
156,140400818,"£500,000",Reduced on 17/10/2023,"Carr Road, Northolt","Bennett Holmes are pleased to offer this three bedroom mid terraced house situated in a popular, residential location in Northolt. The property is located just a few minutes walk to Oldfields Circus shopping parade and bus links. The property is less than 0.9 miles to Greenford's Central Line...",Terraced,1,3,,Ask agent,"['MID TERRACED FAMILY HOME', 'THREE BEDROOMS', 'DOUBLE GLAZED CONSERVATORY', 'MODERN FITTED KITCHEN', 'DOUBLE GLAZING', 'GAS CENTRAL HEATING', 'OFF STREET PARKING', ""APPROXIMATELY 70' REAR GARDEN""]","[['Greenford ', '0.5 miles'], ['Northolt ', '0.6 miles'], ['Northolt Park ', '0.7 miles']]","['nationalrail', 'underground', 'nationalrail']",Ask agent,Ask agent,Ask agent,Band: D,False
157,86587206,"£630,000",Reduced on 17/10/2023,"Cloister Road, Acton",A mid terraced family home currently arranged over two floors with the potential to be extended (STPP). The property is in need of modernisation and comes with driveway parking and a rear garage.,Terraced,1,3,,Freehold,"['Three Bedrooms', 'Mid-Terraced', 'Off-Street Parking', 'No Onward Chain', 'Potential to Extend', 'Close to Elizabeth Line']","[['Acton Main Line ', '0.3 miles'], ['North Acton ', '0.5 miles'], ['West Acton ', '0.7 miles']]","['nationalrail', 'underground', 'underground']",Ask agent,Ask agent,Ask agent,Ask agent,False
158,129669884,"£250,000",Reduced on 17/10/2023,"Ribblesdale Avenue, Northolt",Bennett Holmes are pleased to offer this one double bedroom ground floor maisonette with patio doors from the lounge onto own section of rear garden. Situated in a popular residential location in Northolt the property is within 0.5 miles of Northolt's main shopping and transport facilities to...,Maisonette,1,1,,Share of Freehold,"['ONE BEDROOM', 'GROUND FLOOR MAISONETTE', 'DOORS ONTO REAR GARDEN', 'RESIDENTIAL LOCATION', 'OFF STREET PARKING', 'SHARE OF FREEHOLD', 'NO SERVICE CHARGE, NO GROUND RENT', 'NO UPPER CHAIN']","[['Northolt ', '0.3 miles'], ['Northolt Park ', '0.5 miles'], ['Greenford ', '0.8 miles']]","['underground', 'nationalrail', 'nationalrail']",£0 per year,£0,Ask agent,Band: C,False
159,133530590,"£475,000",Reduced on 17/10/2023,"Pienna Apartments, Elvin Gardens, Wembley, HA9 0GN","ALL OFFERS WELCOMED!!! IMMACULATE, CHAIN FREE, GENEROUSLY PROPORTIONED 2 BEDROOM, 2 BATHROOM NEWLY BUILT APARTMENT WITH ITS OWN PRIVATE DECKED PATIO AREA OCCUPYING AN EXCELLENT SPOT ON THE 2ND FLOOR - OVERLOOKING THE LANDSCAPED WATER GARDENS - OF THE BRAND NEW PIENNA APARTMENTS! THE APARTMENT...",Apartment,2,2,,Leasehold,"['OPPOSITE WEMBLEY STADIUM', 'PURPOSE BUILD BUILDING WITH GYM, MASSAGE ROOM', 'CONFERENCE FACILITIES', 'LIFTS', 'MOMENTS FROM LONDON DESIGNER OUTLET', 'LUXURY 2 BEDROOM 2 BATHROOM FLAT', 'LONG LEASE', 'CHAIN FREE', 'OPEN TO OFFERS']","[['Wembley Park ', '0.3 miles'], ['Wembley Stadium ', '0.4 miles'], ['Wembley Central ', '0.8 miles']]","['underground', 'nationalrail', 'nationalrail']",£570 per year (Ask agent about the review period)When and how often your ground rent will be reviewed.Read more about ground rent review period in our glossary page.,£3667,291 years left,Band: D,False
160,135564356,"£300,000",Reduced on 17/10/2023,"Preston Road, Harrow, Middlesex, HA3 0PY","OFFERS OVER £310,000 for this super buy to let or first tome purchase - spacious two double bedroom flat above shops on the popular Preston Road. This large flat has a spacious lounge, two double bedrooms, a modern bathroom and new fitted kitchen. Benefits from gas central heating and double gla...",Flat,1,2,,Leasehold,"['CLOSE TO PRESTON ROAD TUBE', '2 DOUBLE BEDROOMS', 'ABOVE SHOPS ON PRESTON ROAD', 'LARGE  FITTED KITCHEN', 'FAMILY BATHROOM', 'GAS CENTRAL HEATING', 'DOUBLE GLAZED', 'NEW 125 YEAR LEASE', 'FREEHOLD AVAILABLE AT £25,000']","[['Preston Road ', '0.1 miles'], ['South Kenton ', '0.6 miles'], ['South Kenton ', '0.6 miles']]","['underground', 'overground', 'underground']",Ask agent,Ask agent,125 years left,Ask agent,False
161,140955110,"£425,000",Added on 17/10/2023,"57B Oldfield Road, Willesden London, NW10 9UD",Auction Sale - 01/11/2023 A two bedroom first floor self contained flat. In need of modernisation. Forming part of a two storey mid terrace property. Vacant.,Flat,,2,,Leasehold,"['A two bedroom first floor self contained flat', 'In need of modernisation', 'Forming part of a two storey mid terrace property', 'Vacant']","[['Neasden ', '0.6 miles'], ['Dollis Hill ', '0.6 miles'], ['Harlesden ', '0.7 miles']]","['underground', 'underground', 'underground']",Ask agent,Ask agent,Ask agent,Ask agent,False
162,134793650,"£875,000",Reduced on 17/10/2023,"Barn Rise, Wembley","Joseph Scott Presents - A Unique Opportunity To Purchase This Detached, Four Bedroom Family Home Located On The Quiet, Residential Barn Rise, Only 0.9 Miles To Preston Road Underground (Metropolitan Line) This versatile three-bedroom home is nestled within the heart of Wembley. Currently co...",Detached,1,4,,Freehold,"['DETACHED', 'Four Bedrooms', 'Large Rear Garden', 'Off Street Parking ', '0.9 Miles To Preston Road Underground (Metropolitan Line) ', 'Potential To Extend (S.T.P.P)']","[['Wembley Park ', '0.4 miles'], ['Preston Road ', '0.7 miles'], ['Kingsbury ', '1.1 miles']]","['underground', 'underground', 'underground']",Ask agent,Ask agent,Ask agent,Ask agent,False
163,140953439,"£375,000",Added on 17/10/2023,"Glenwood Close, Harrow","Robertson Phillips are pleased to be able to offer for sale this two bedroom ground floor maisonette with off street parking, own rear garden and a 900 plus year lease well positioned for shopping and transport facilities in the surrounding area. Benefits to the property include modern fitted kit...",Flat,1,2,,Ask agent,"['Two bedroom ground floor maisonette', 'Own garden and off street parking (for two cars to the front)', 'Offered for sale in very good condition throughout', 'Gas central heating, double glazed window and a car charging point', 'Viewing comes highly recoemended ']","[['Harrow & Wealdstone ', '0.5 miles'], ['Kenton ', '0.6 miles'], ['Harrow-on-the-Hill ', '0.6 miles']]","['nationalrail', 'underground', 'nationalrail']",Ask agent,Ask agent,Ask agent,Ask agent,False
164,139634486,"£550,000",Reduced on 17/10/2023,"Melrose Avenue, London, NW2 4JY","Ref: MS0129
Mark Stern is proud to bring to market this three bedroom duplex apartment arranged over the top two floors of this period semi-detached house. Located only yards from Gladstone Park with facilities such as outdoor gym, children's playground, a cafe plus transport links from...",Duplex,1,3,,Leasehold,[],"[['Willesden Green ', '0.4 miles'], ['Dollis Hill ', '0.5 miles'], ['Cricklewood ', '0.8 miles']]","['underground', 'underground', 'nationalrail']",£0 per year,£1190,Ask agent,Ask agent,False
165,138001163,"£289,000",Reduced on 17/10/2023,"Kennedy Road, Hanwell","A well presented one bedroom first floor flat with its own, private section of rear garden, well placed moments from Greenford Avenue and attractively offered Chain Free.",Apartment,1,1,407 sq. ft.(38 sq. m.),Leasehold,"['Good Size Accommodation', 'Excellent Condition', 'Close To The Elizabeth Line', 'Private Garden', 'Gas Central Heating', 'Chain Free']","[['Castle Bar Park ', '0.4 miles'], ['South Greenford ', '0.6 miles'], ['Drayton Green ', '0.7 miles']]","['nationalrail', 'nationalrail', 'nationalrail']",£10 per year (Ask agent about the review period)When and how often your ground rent will be reviewed.Read more about ground rent review period in our glossary page.,£1300,88 years left,Band: B,False
166,135390035,"£525,000",Added on 17/10/2023,"Northolt, UB5","Perkins are proud to present this three bedroom semi detached house situated in Northolt. This home offers three well sized bedrooms, reception room, kitchen and family bathroom, the property also benefits from a large garden to the rear and off street parking. This home is situated mome...",Semi-Detached,1,3,,Freehold,"['Ideal Family Home', 'Off Street Parking', 'Large Garden', 'Potential To Extend', 'Walking Distance To Northolt Park Station', 'Moments Away From Local Amenities']","[['Northolt Park ', '0.3 miles'], ['South Harrow ', '0.7 miles'], ['Northolt ', '0.7 miles']]","['nationalrail', 'underground', 'underground']",Ask agent,Ask agent,Ask agent,Band: D,False
