,id,price,added_reduced,address,description,type_house,bathrooms,bedrooms,size,tenure,key_features,close_stations,close_stations_type,tenure_ground_rent,tenure_annual_service_charge,tenure_lease_length,council_tax_band,sold_under_offer
756,133829081,"£575,000",Reduced on 15/09/2023,"Ayr Way, Romford, RM1","GUIDE PRICE £575,000 - £600,000 Ideally located within this popular Rise Park turning comes this four bedroom Chalet Bungalow. With easy access to the A12,M25 & Romford Town Centre with its Overground Station which will get you into Liverpool Street in under 30mins this could be ...",Bungalow,2,4,,Freehold,"['Large Four bedroom semi detached home', 'Ideal for families', 'Off street parking for 3 cars', 'Popular Rise Park location', 'Lovely rear garden', 'Easy access to A12 & M25']","[['Romford ', '1.4 miles'], ['Gidea Park ', '1.5 miles'], ['Harold Wood ', '2.3 miles']]","['nationalrail', 'nationalrail', 'nationalrail']",Ask agent,Ask agent,Ask agent,Band: D,False
757,141134630,"£500,000",Added on 15/09/2023,"Belgrave Avenue, Romford",Viewings are highly recommended for this beautiful and well maintained Three Bedroom Family Home situated in a very popular part of Gidea Park Decorated to a high standard this property is literally ready to just move straight into,Terraced,1,3,,Freehold,"['Three Bedroom', 'Decorated to a high standard', 'Loft Room', 'Conservatory', 'Off Street Parking', 'Good Commuter Links']","[['Gidea Park ', '0.6 miles'], ['Harold Wood ', '0.8 miles'], ['Emerson Park ', '1.4 miles']]","['nationalrail', 'nationalrail', 'nationalrail']",Ask agent,Ask agent,Ask agent,Band: D,False
758,138603527,"£550,000",Reduced on 15/09/2023,"Suttons Avenue, Hornchurch",This well positioned attractive double fronted 1930's home is conveniently located within access to Hornchurch Station and the vast array of amenities that Hornchurch has to offer. This is an ideal home for the growing family for years to come. Call to view,End of Terrace,2,4,,Freehold,"['DOUBLE FRONTED', 'CLOSE TO STATION', 'FOUR BEDROOMS', 'AMPLE PARKING', 'LARGE REAR GARDEN', 'IDEAL FAMILY HOME']","[['Hornchurch ', '0.4 miles'], ['Elm Park ', '0.7 miles'], ['Emerson Park ', '1.0 miles']]","['underground', 'underground', 'nationalrail']",Ask agent,Ask agent,Ask agent,Band: D,False
759,139448639,"£625,000",Reduced on 15/09/2023,"Little Gaynes Lane, Upminster, RM14","* Guide Price £625,000 - £675,000 * •THREE BEDROOM SEMI DETACHED HOME •OFF STREET PARKING FOR MULTIPLE VEHICLES •17' GARAGE •SITUATED IN A POPULAR ROAD IN UPMINSTER •27' LOUNGE AND 15' KITCHEN •GROUND FLOOR WC AND FIRS...",Semi-Detached,1,3,,Freehold,[],"[['Upminster Bridge ', '0.7 miles'], ['Upminster ', '0.9 miles'], ['Hornchurch ', '0.9 miles']]","['underground', 'nationalrail', 'underground']",Ask agent,Ask agent,Ask agent,Band: TBC,False
760,132114050,"£250,000",Reduced on 14/09/2023,"Victoria Court, Romford, ROMFORD","APPLE PROPERTY SERVICES are delighted to present to the sales market, this two bedroom property on the Ground floor of this purpose built development with off street parking (on a first come first serve basis) in Romford, RM1. . Accommodation comprises; a bright and spacious receptio (cont.)",Apartment,1,2,,Freehold,"['215 years lease', 'Chain Free', 'GROUND FLOOR', 'TWO DOUBLE BEDROOMS', 'Modern Kitchen', 'Modern BATHROOM', 'UPDATED ELECTRICS', 'Close to Local Amenities', 'Close to Town Centre', 'Double Glazed']","[['Romford ', '0.5 miles'], ['Gidea Park ', '0.7 miles'], ['Emerson Park ', '1.3 miles']]","['nationalrail', 'nationalrail', 'nationalrail']",Ask agent,Ask agent,Ask agent,Ask agent,False
761,139981793,"£375,000",Added on 14/09/2023,"Primula Court, Safflower Lane, RM3","One of the best blocks within Kings Park Development , this spacious two bedroom, two bathroom first floor flat offers high specification throughout and benefits from having a good size balcony. The area is ideal for professionals looking for a quiet well presented apartment with excellent links ...",Apartment,2,2,,Leasehold,"['TWO BEDROOM APARTMENT', 'FIRST FLOOR', 'TWO BATHROOMS', 'PRIVATE BALCONY', 'ALLOCATED  PARKING', '0.1 MILES FROM HAROLD WOOD STATION', 'HIGH QUALITY SPECIFICATION', 'SPACIOUS LIVING AREA']","[['Harold Wood ', '0.2 miles'], ['Gidea Park ', '1.2 miles'], ['Emerson Park ', '1.7 miles']]","['nationalrail', 'nationalrail', 'nationalrail']",£300 per year,£2050,243 years left,Band: TBC,False
762,139079999,"£425,000",Reduced on 14/09/2023,"Cranham Gardens, Upminster, RM14","***** GUIDE PRICE £425,000 to £450,000 ***** ** NO ONWARD CHAIN ** Beresfords are delighted to offer this well appionted 2 bedroom end of terrace bungalow with parking to the front and rear garden. (UPS220061) ",Bungalow,1,2,,Freehold,"['NO ONWARD CHAIN', 'Recently Decorated', 'Two Bedrooms', 'Lounge', 'Kitchen', 'Rear Garden', 'Parking', 'Close proximity to local shops and amenities']","[['Upminster ', '1.2 miles'], ['Upminster Bridge ', '1.8 miles'], ['Emerson Park ', '2.3 miles']]","['nationalrail', 'underground', 'nationalrail']",Ask agent,Ask agent,Ask agent,Band: D,False
763,139976198,"£550,000",Added on 14/09/2023,"Harwood Avenue, Hornchurch",Three-Double Bedroom Family Home | En-Suite to Master Bedroom | First Floor Bathroom | Lounge/Diner | Kitchen Breakfast Room | Outbuilding Used as a Bar/Games Room with Shower Room W.C. | Planning Permission to Extend Ref: P1187.22 | New Wren Kitchen Being Fitted October 2023 | Large Garden | ,End of Terrace,2,3,,Freehold,[],"[['Harold Wood ', '0.7 miles'], ['Gidea Park ', '0.8 miles'], ['Emerson Park ', '1.1 miles']]","['nationalrail', 'nationalrail', 'nationalrail']",Ask agent,Ask agent,Ask agent,Band: C,False
764,139065134,"£700,000",Reduced on 14/09/2023,"Southview Drive, Upminster, RM14",** NO ONWARD CHAIN ** Beresfords are delighted to present this opportunity in Southview Drive to purchase a 3 bedroom semi-detached family home offering the upmost amount of potential. (UPS230229),Semi-Detached,1,3,,Freehold,"['NO ONWARD CHAIN', 'Three bedroom semi-detached', 'Lounge', 'Dining room', 'Garage', 'Ample Parking', 'Garden', 'In close proximity to local amenities', 'Walking distance to Branfil Primary School']","[['Upminster Bridge ', '0.5 miles'], ['Upminster ', '0.6 miles'], ['Hornchurch ', '1.0 miles']]","['underground', 'nationalrail', 'underground']",Ask agent,Ask agent,Ask agent,Band: F,False
765,138621842,"£550,000",Reduced on 14/09/2023,"Pretoria Road, Romford, Essex","Beautifully presented, extended period, family home. Located only a short distance from Romford Town Centre with Elizabeth Line Station, as well as being within close proximity of the A12 and M25. The house has been finished to a high standard throughout. To the ground floor is a spacious entranc...",End of Terrace,1,3,,Freehold,"['Extended end of terraced period home with some original features', 'Dressing room to bedroom 1', 'Well maintained, large rear garden', 'Ample off road parking', 'Situated less than a mile to Romford Train Station & Town Centre', 'EPC energy rating E']","[['Romford ', '0.8 miles'], ['Chadwell Heath ', '1.7 miles'], ['Gidea Park ', '1.8 miles']]","['nationalrail', 'nationalrail', 'nationalrail']",Ask agent,Ask agent,Ask agent,Band: D,False
766,139951622,"£350,000",Added on 14/09/2023,"Charlock Close, Romford, RM3",Open Plan Living Room And Kitchen - Two Bedrooms With Fitted Wardrobes - Contemporary Bathroom - Allocated Parking and Visitor Permits - Excellent Transport Links,Apartment,1,2,772 sq. ft.(72 sq. m.),Leasehold,"['Open Plan Living Room And Kitchen', 'Two Bedrooms With Fitted Wardrobes', 'Contemporary Bathroom', 'Allocated Parking And Visitor Permits', 'Excellent Transport Links']","[['Harold Wood ', '0.2 miles'], ['Gidea Park ', '1.2 miles'], ['Emerson Park ', '1.7 miles']]","['nationalrail', 'nationalrail', 'nationalrail']",£300 per year (Ask agent about the review period)When and how often your ground rent will be reviewed.Read more about ground rent review period in our glossary page.,£1600,243 years left,Band: C,False
767,139948187,"£375,000",Added on 14/09/2023,"Western Avenue, Dagenham, RM10","• GUIDE PRICE £375,000 - £400,000 • NO ONWARD CHAIN • TWO BEDROOMS • MID TERRACE • EXTENDED TO REAR • GROUND FLOOR SHOWER ROOM • FIRST FLOOR BATHROOM • SITUATED 0.2 MILES TO DAGENHAM EAST DISTRICT LINE ST...",Terraced,1,2,,Freehold,[],"[['Dagenham East ', '0.1 miles'], ['Dagenham Heathway ', '0.9 miles'], ['Elm Park ', '1.3 miles']]","['underground', 'underground', 'underground']",Ask agent,Ask agent,Ask agent,Band: TBC,False
768,134844557,"£460,000",Reduced on 14/09/2023,"Macdonald Avenue, Ardleigh Green, Hornchurch, RM11","Located in this popular residential turning in the heart of Ardleigh Green being within walking distance of the ever popular Ardleigh Green Primary School, local shopping facilities and Gidea Park Elizabeth Line Station is this spacious four bedroom family home.",Terraced,2,4,969 sq. ft.(90 sq. m.),Freehold,[],"[['Harold Wood ', '0.7 miles'], ['Gidea Park ', '1.0 miles'], ['Emerson Park ', '1.0 miles']]","['nationalrail', 'nationalrail', 'nationalrail']",Ask agent,Ask agent,Ask agent,Band: D,False
769,139944002,"£700,000",Added on 14/09/2023,"Upper Brentwood Road, Gidea Park, Romford, RM2",Set within this extremely sought after location being within walking distance of Gidea Park Main Line Railway Station is this much improved and extended semi detached family home.,Semi-Detached,1,3,"1,658 sq. ft.(154 sq. m.)",Freehold,"['FULL BROCHURE CAN BE VIEWED AT THE BOTTOM OF THIS PAGE', 'CHARACTER RECEPTION HALL', 'FOUR RECEPTION ROOMS', 'FITTED KITCHEN 11\'4"" X 9\'4""', 'UTILITY AREA 7\'3"" X 6\'7""', 'THREE BEDROOMS TO THE FIRST FLOOR', 'LARGE FAMILY BATHROOM/WC', 'OFF ROAD CAR PARKING TO THE FRONT', ""REAR GARDEN APPROX. 100' IN DEPTH"", 'WALKING DISTANCE TO GIDEA PARK STATION']","[['Gidea Park ', '0.3 miles'], ['Harold Wood ', '1.1 miles'], ['Emerson Park ', '1.2 miles']]","['nationalrail', 'nationalrail', 'nationalrail']",Ask agent,Ask agent,Ask agent,Band: E,False
770,139942223,"£450,000",Added on 14/09/2023,"Havering Road, Romford, RM1","*** Guide Price £450,000 - £475,000 *** An Extended Three Bedroom Terraced House with Double Off-Street Parking. This family home is Conveniently located to a good choice of Schools for all age groups, including the adjacent Parklands School. Romford Town Centre, Rise Park and Collier Row Town Ce...",Terraced,1,3,,Freehold,"['An Extended Three Bedroom Terraced House ', 'Double Off-Street Parking', 'Front Living Room With Fireplace Feature', 'Dining Room And Conservatory', '17Ft Galley Fitted Kitchen', 'Private Rear Garden', 'Close To Romford Station (Elizabeth Live) ', 'Close To Romford Town Centre ', 'Close To Schools, Parks And Transport']","[['Romford ', '1.0 miles'], ['Gidea Park ', '1.5 miles'], ['Chadwell Heath ', '2.3 miles']]","['nationalrail', 'nationalrail', 'nationalrail']",Ask agent,Ask agent,Ask agent,Band: D,False
771,139939931,"£575,000",Added on 14/09/2023,"Canterbury Avenue, Upminster, RM14",We are proud to present an exceptional 3-bedroom bungalow situated in Upminster’s highly desirable Cathedral Estate.,Semi-Detached Bungalow,2,3,,Freehold,"['SEMI DETACHED BUNGALOW', 'EXTENDED TO REAR', 'OWN DRIVEWAY TO GARAGE', 'BATHROOM AND ADDITIONAL SHOWER ROOM', 'MODERN KITCHEN', 'SPACIOUS LOUNGE/DINER', 'THREE BEDROOMS']","[['Upminster ', '0.9 miles'], ['Upminster Bridge ', '1.5 miles'], ['Emerson Park ', '2.3 miles']]","['nationalrail', 'underground', 'nationalrail']",Ask agent,Ask agent,Ask agent,Band: E,False
772,139939775,"£220,000",Added on 14/09/2023,"Squirrels Heath Lane, Hornchurch, RM11 2DX","We are pleased to offer for sale, this two-bedroom apartment, located in a central position in Gidea Park. The accommodation has been modernised and redecorated and boasts double glazed windows, gas radiator heating and built in appliances in the kitchen. There is a private front door allowin...",Flat,1,2,,Leasehold,"['Being Sold via Secure Sale online bidding. Terms & Conditions apply.', 'Ground Floor Two Bedroom Flat', 'Cash Buyers Only', 'Resident Parking', 'Walking Distance to Gidea Park Station', 'Great Location']","[['Gidea Park ', '0.6 miles'], ['Harold Wood ', '0.9 miles'], ['Emerson Park ', '1.0 miles']]","['nationalrail', 'nationalrail', 'nationalrail']",Ask agent,Ask agent,Ask agent,Band: C,False
773,139937246,"£270,000",Added on 14/09/2023,"South Street, Romford, Essex","Ground floor flat that benefits from a security entry system, has gas central heating and double glazed. The property has over a 100 years left on the lease, an allocated parking space and is situated less than a mile to Romford Town Centre & Train Station.",Ground Flat,1,2,,Leasehold,"['Ground floor flat with over a 100 years on the lease', 'Security entry phone system', 'Gas central heating & double glazed', 'Allocated parking space', 'Less than half a mile to Romford Town Centre & Station', 'EPC energy rating D']","[['Romford ', '0.4 miles'], ['Gidea Park ', '1.2 miles'], ['Emerson Park ', '1.5 miles']]","['nationalrail', 'nationalrail', 'nationalrail']",£200 per year (Ask agent about the review period)When and how often your ground rent will be reviewed.Read more about ground rent review period in our glossary page.,£1706,101 years left,Band: C,False
774,138938840,"£220,000",Reduced on 14/09/2023,"Thyme Court, 109 Whitchurch Road, RM3","A stunning high specification two-bedroom two bathroom apartment located on the second floor. Finished to a high standard throughout and offering plenty of storage space, the flat features stylish decor throughout and comprises of an open plan kitchen/living/dining, two bedrooms (one en-suite) an...",Apartment,2,2,,Leasehold,"['Total floor area 63 square metres', 'Council Tax C', 'Second Floor apartment', 'With designated parking', 'High specification apartment', 'Two Double Bedrooms Two Bathrooms', 'Open Plan Living.', 'Served by excellent bus and road routes.', 'LEASE REMAINING 110 YEARS', '£216 PER MONTH SERVICE CHARGE.']","[['Harold Wood ', '1.3 miles'], ['Gidea Park ', '2.2 miles'], ['Emerson Park ', '2.9 miles']]","['nationalrail', 'nationalrail', 'nationalrail']",£0 per year,£0,Ask agent,Band: C,False
775,140101667,"£400,000",Reduced on 02/10/2023,"Bosworth Crescent, Romford","Guide Price £400,000 - £425,000. Quietly Convenient! Nestled in a quiet cul-de-sac is this three bedroom family home with driveway and a good size garden. With a driveway and being sold with no onward chain. Call now!",Semi-Detached,1,3,,Freehold,"['Lounge', 'Kitchen/Diner', 'Three Bedrooms', 'Large Rear Garden', 'Cul-de-Sac Location', 'Driveway', 'Close To Amenities', 'No Onward Chain']","[['Harold Wood ', '1.2 miles'], ['Gidea Park ', '1.5 miles'], ['Romford ', '2.4 miles']]","['nationalrail', 'nationalrail', 'nationalrail']",Ask agent,Ask agent,Ask agent,Ask agent,False
776,137793128,"£215,000",Reduced on 14/09/2023,"Harkness Close, Harold Hill, Romford, Essex, RM3 9NX","SITUATED IN A CUL-DE-SAC LOCATION OVERLOOKING CENTRAL PARK TO THE REAR, CENTRALLY LOCATED FOR LOCAL SHOPS, BUS SERVICES AND THE A12 AND M25 PLUS EASY ACCESS TO ROMFORD TOWN CENTRE IS THIS TWO BEDROOM ...",Flat,1,2,,Leasehold,"['LOUNGE', 'TWO BEDROOMS', 'GAS CENTRAL HEATING', 'FITTED KITCHEN', 'BATHROOM', 'DOUBLE GLAZED']","[['Harold Wood ', '1.1 miles'], ['Gidea Park ', '2.1 miles'], ['Emerson Park ', '2.8 miles']]","['nationalrail', 'nationalrail', 'nationalrail']",£0 per year,Ask agent,147 years left,Band: C,False
777,138090209,"£750,000",Reduced on 13/09/2023,"Netherpark Drive, Gidea Park, RM2","***GUIDE PRICE £750,000 to £775,000*** • SOUGHT AFTER GIDEA PARK LOCATION • DETACHED FAMILY HOME • IN AND OUT DRIVEWAY WITH OFF STREET PARKING FOR THREE VEHICLES • 23' DETACHED GARAGE WITH ADDITIONAL PARKING SPACE IN FRONT • STUN...",Detached,2,4,,Freehold,[],"[['Gidea Park ', '1.1 miles'], ['Romford ', '1.2 miles'], ['Harold Wood ', '2.0 miles']]","['nationalrail', 'nationalrail', 'nationalrail']",Ask agent,Ask agent,Ask agent,Band: TBC,False
778,139920308,"£475,000",Added on 13/09/2023,"Gay Gardens, RM10 7TR","With tasteful and neutral decoration throughout, this mid terraced extended family home is a must for the home hunter looking for something a little bit special.  With its desirable location providing easy access to public transport links and local amenities, this property is perfect for those l...",Terraced,1,3,,Freehold,"['Three Bedrooms', 'Extended to the Rear', 'Through Lounge', 'L-Shaped Kitchen/Diner/Utility Area', 'First Floor Bathroom', 'Downstairs W/C', 'Double Glazed', 'Gas Central Heating', 'Large Detached Garage to Rear']","[['Dagenham East ', '0.3 miles'], ['Dagenham Heathway ', '0.9 miles'], ['Elm Park ', '1.4 miles']]","['underground', 'underground', 'underground']",Ask agent,Ask agent,Ask agent,Band: C,False
779,139919447,"£950,000",Added on 13/09/2023,"Shepherds Hill, Harold Wood","CHAIN FREE! Delaney's are pleased to offer this four bedroom, detached family home. Situated in a sought after location, overlooking fields, this property boasts: off street parking, family lounge, dining area, ground floor WC, garage and rear garden. ",Detached,2,4,,Freehold,[],"[['Harold Wood ', '0.5 miles'], ['Gidea Park ', '1.8 miles'], ['Emerson Park ', '1.9 miles']]","['nationalrail', 'nationalrail', 'nationalrail']",Ask agent,Ask agent,Ask agent,Band: G,False
780,126639245,"£210,000",Reduced on 13/09/2023,"77 London Road, Romford, RM7","**Guide price £220,000-£230,000** Set within one of Romford's most sought after developments is this well presented one bedroom apartment occupying part of the ground floor. Immaculately finished throughout this property comprises of a master bedroom, modern bathroom and an inviting hallway wit...",Flat,1,1,,Leasehold,"['Well Presented', 'Offered Chain Free', 'Ideal For First Time Buyers/Landlords', 'Allocated Parking Space', 'Walking Distance To Romford Station', '999 Year Lease']","[['Romford ', '0.6 miles'], ['Gidea Park ', '1.8 miles'], ['Chadwell Heath ', '1.8 miles']]","['nationalrail', 'nationalrail', 'nationalrail']",£200 per year,£1300,998 years left,Band: B,False
781,139912655,"£475,000",Added on 13/09/2023,"Leonard Avenue, Romford",Just move in to this beautifully presented three bedroom end terrace home. Featuring open plan kitchen family room with bi fold doors leading to good size garden. Located close to Romford town centre and station,End of Terrace,1,3,,Freehold,"['Off street parking', 'Lounge', 'Cloakroom', 'Kitchen/diner', 'Three bedrooms', 'Family bathroom', 'Side access']","[['Romford ', '0.9 miles'], ['Dagenham East ', '1.4 miles'], ['Elm Park ', '1.6 miles']]","['nationalrail', 'underground', 'underground']",Ask agent,Ask agent,Ask agent,Band: D,False
782,135840479,"£290,000",Reduced on 13/09/2023,"Cottons Approach, Romford","Ideally located for Romford town centre and Elizabeth Line station is this two bedroom ground floor apartment with en suite to master, balcony and views over the park. Call now to arrange your viewing",Apartment,2,2,,Leasehold,"['Balcony', 'Ensuite showeroom', 'Two bedrooms', 'Close to the station', 'Views over the park', 'Open plan living space']","[['Romford ', '0.4 miles'], ['Gidea Park ', '1.4 miles'], ['Chadwell Heath ', '2.1 miles']]","['nationalrail', 'nationalrail', 'nationalrail']",Ask agent,Ask agent,Ask agent,Ask agent,False
783,141175043,"£595,000",Added on 13/09/2023,"Lancaster Drive, Hornchurch, RM12","Located within minutes of Ofsted's ''Outstanding'' rated Scotts Primary School is this larger than average plot, which includes private side access and a detached garage. Offered with no onward chain and in immaculate condition, this turn-key home is ready for immediate occ...",Semi-Detached,1,3,,Freehold,"['No Onward Chain', 'Extended', 'Room For Further Extension (STPP)', 'Two Receptions', 'W.C', 'Garage', 'Off Street Parking']","[['Elm Park ', '0.4 miles'], ['Hornchurch ', '0.8 miles'], ['Upminster Bridge ', '1.6 miles']]","['underground', 'underground', 'underground']",Ask agent,Ask agent,Ask agent,Ask agent,False
784,139898630,"£325,000",Added on 13/09/2023,"Chalforde Gardens, Romford",Situated just minutes away from Gidea Park Station and the Elizabeth Line is this fantastic Two Bedroom Ground floor Maisonette With over 900 years still remaining on the Lease plus its own rear Garden this really is a must buy property.,Maisonette,1,2,,Leasehold,"['Two Bedroom ', 'Ground floor Maisonette ', 'Private Rear Garden']","[['Gidea Park ', '0.1 miles'], ['Emerson Park ', '1.0 miles'], ['Romford ', '1.1 miles']]","['nationalrail', 'nationalrail', 'nationalrail']",£10 per year,£0,932 years left,Band: C,False
785,137811329,"£299,999",Reduced on 13/09/2023,"Tyrells Close, Upminster, Essex, RM14","Located on the ground floor of this purpose built block in a residential cul de sac, within walking distance to Upminster Bridge District Line Station and Upminster Town Centre, we offer to the market this two bedroom flat which will be sold with the benefit of no onward chain.",Ground Flat,1,2,,Leasehold,"['Purpose built ground floor two bedroom flat', 'Walking distance of Upminster Bridge and Upminster Stations', 'Garage', 'Communal Gardens', 'NO ONWARD CHAIN']","[['Upminster Bridge ', '0.3 miles'], ['Upminster ', '0.4 miles'], ['Hornchurch ', '1.0 miles']]","['underground', 'nationalrail', 'underground']",Ask agent,Ask agent,Ask agent,Ask agent,False
786,138258869,"£290,000",Reduced on 13/09/2023,"Thomas Drive, Romford","HS Estate Agents are delighted to present this double bedroom apartment with a spacious living/dining/kitchen area, two modern tiled bathrooms and a balcony. Situated close to Romford high street, the Elizabeth Line into London as well as the A12 & M25. Great for first time buyers & investors alike.",Apartment,2,2,646 sq. ft.(60 sq. m.),Leasehold,"['TWO DOUBLE BEDROOMS', 'TWO MODERN TILED BATHROOMS', 'LIGHT AND AIRY LIVING SPACE', 'BALCONY', '0.2 MILES TO GIDEA PARK`S `ELIZABETH LINE` STATION', 'ALLOCATED PARKING SPACE', 'IDEAL FOR FIRST TIME BUYERS OR INVESTORS', 'NO ONWARD CHAIN', 'EPC RATING C', 'COUNCIL TAX BAND C']","[['Gidea Park ', '0.2 miles'], ['Emerson Park ', '1.1 miles'], ['Harold Wood ', '1.2 miles']]","['nationalrail', 'nationalrail', 'nationalrail']",£250 per year (Ask agent about the review period)When and how often your ground rent will be reviewed.Read more about ground rent review period in our glossary page.,£1965,140 years left,Band: C,False
787,139880381,"£225,000",Added on 13/09/2023," Kingsmead Avenue, Romford",Lux Homes brings to market this two bedroom first floor apartment. In need of updating and being within walking distance to Romford town centre and mainline train station suitable for all buyers must be viewed call Lux Homes today to book an appointment.,Apartment,1,2,548 sq. ft.(51 sq. m.),Leasehold,"['Chain Free', 'Two Bedroom First Floor Flat', 'In Need Of Modernisation ', 'Separate Kitchen', 'Family Bathroom ', 'Private Parking', 'Walking Distance To Romford Town Centre', 'Walking Distance To Romford Train Station', 'Walking Distance To Local Supermarket ', 'Ideal First Home Or Investment Opportunity']","[['Romford ', '0.1 miles'], ['Gidea Park ', '1.1 miles'], ['Emerson Park ', '1.6 miles']]","['nationalrail', 'nationalrail', 'nationalrail']",Ask agent,Ask agent,Ask agent,Ask agent,False
788,133322129,"£400,000",Reduced on 13/09/2023,"Harlesden Close, Romford","***Chain Free*** ***Guide Price £400,000-£425,000*** Lux Homes are pleased to bring to market this two bedroom semi detached home, well cared for throughout with off street parking, low maintenance garden and fitted kitchen. Located within close proximity of local schools, transport l...",Semi-Detached,1,2,789 sq. ft.(73 sq. m.),Freehold,"['Two Bedroom Semi Detached House', 'Kitchen With Fitted Appliances ', 'First Floor Family Bathroom', 'Walk- In Wardrobe', 'Low Maintenance Rear Garden', 'Out Building', 'Off Street Parking ', 'Close Proximity To Local Transport Links ', 'Close Proximity To Local Schools ', 'Close Proximity To Local Amenities ']","[['Harold Wood ', '0.6 miles'], ['Gidea Park ', '1.7 miles'], ['Emerson Park ', '2.3 miles']]","['nationalrail', 'nationalrail', 'nationalrail']",Ask agent,Ask agent,Ask agent,Ask agent,False
789,139868495,"£550,000",Added on 12/09/2023,"Front Lane, Upminster, RM14","The property, a unique chalet-style bungalow, offers a fantastic opportunity for those seeking a renovation project with endless potential.",Chalet,2,3,,Freehold,"['UNIQUE PROPERTY', 'DETACHED FAMILY HOME', 'NO ONWARD CHAIN', 'DOUBLE GARAGE', 'GARDEN IN EXCESS OF 95’', 'RENOVATION PROJECT WITH POTENTIAL']","[['Upminster ', '0.8 miles'], ['Upminster Bridge ', '1.4 miles'], ['Emerson Park ', '2.0 miles']]","['nationalrail', 'underground', 'nationalrail']",Ask agent,Ask agent,Ask agent,Band: F,False
790,136920086,"£900,000",Reduced on 12/09/2023,"Heath Drive, Exhibition Estate, Gidea Park, RM2","Nestled within the heart of the Exhibition Estate overlooking the Golf Course, this family home benefits from being close to Raphael Park, Private Tennis Courts, Romford Golf Course and Gidea Park ' village' shops",Detached,2,4,,Freehold,"['Exhibition Estate', '4 Bedrooms', 'Detached', 'En-Suite', 'Kitchen/Diner', 'Two Reception Rooms', 'Ground Floor W/C', 'Garage', 'Overlooking The Golf Course']","[['Gidea Park ', '0.8 miles'], ['Romford ', '1.3 miles'], ['Harold Wood ', '1.6 miles']]","['nationalrail', 'nationalrail', 'nationalrail']",Ask agent,Ask agent,Ask agent,Ask agent,False
