,id,price,added_reduced,address,description,type_house,bathrooms,bedrooms,size,tenure,key_features,close_stations,close_stations_type,tenure_ground_rent,tenure_annual_service_charge,tenure_lease_length,council_tax_band,sold_under_offer
231,140884493,"£370,000",Added on 14/10/2023,"Halley House, 30 Westmoreland Road, Queenbury, London, NW9","LOCATION, LOCATION, LOCATION! Nestled in the heart of Queensbury, this TURN KEY BEAUTIFUL flat is situated on the 5th floor and offers approximately 535 sq. ft of luxurious living space with STUNNING VIEWS that will take your breath away. RECENTLY CONSTRUCTED, boasting CONTEMPORARY LIVING SPACE t...",Apartment,1,1,,Leasehold,"['OPEN-PLAN LIVING', '5TH FLOOR- WITH LIFT', 'BALCONY', 'COMMUNAL GARDENS', 'LONG LEASE']","[['Queensbury ', '0.2 miles'], ['Kingsbury ', '0.5 miles'], ['Burnt Oak ', '1.1 miles']]","['underground', 'underground', 'underground']",£400 per year,£1844,Ask agent,Band: C,False
232,137378945,"£625,000",Reduced on 13/10/2023,"Springfield Gardens, Kingsbury, London, NW9",This three bedroom residence delivers tasteful and well presented living space and is located on the desirable and popular 'Springfield Estate' being situated within the catchment area for highly regarded Oliver Goldsmith Primary School.,Semi-Detached,1,3,,Freehold,"['Springfield Estate', 'Semi-Detached', 'Three Bedrooms', 'Freehold', 'Well Presented With Neutral Decor', 'Through Lounge', 'Fitted Kitchen', 'Family Bathroom', 'Rear Garden', 'Off Road Parking']","[['Hendon ', '0.8 miles'], ['Colindale ', '0.8 miles'], ['Kingsbury ', '1.0 miles']]","['nationalrail', 'underground', 'underground']",Ask agent,Ask agent,Ask agent,Band: D,False
233,140879813,"£300,000",Added on 13/10/2023,"59 Barmouth Avenue, Perivale, Greenford, Middlesex, UB6","Internally arranged as 6 Units , Each unit subject to an Assured Shorthold Tenancy, Driveway providing Off Street Parking, Rear Garden
",End of Terrace,1,3,,Freehold,[],"[['South Greenford ', '0.3 miles'], ['Perivale ', '0.3 miles'], ['Greenford ', '0.8 miles']]","['nationalrail', 'underground', 'nationalrail']",Ask agent,Ask agent,Ask agent,Ask agent,False
234,140879279,"£525,000",Added on 13/10/2023,"15 Lewis Crescent, Neasden, London, NW10","Ground Floor - Reception Room, Kitchen, First Floor - Three Bedrooms, Bathroom, WC, Second Floor - Two further Bedrooms, Bathroom WC, Rear Garden, Within 0.9 miles of Neasden underground station (Jubilee Line), The London Designer Outlet and Wembley Stadium are close by, Video Tour available below
",Semi-Detached,2,5,,Freehold,[],"[['Neasden ', '0.6 miles'], ['Stonebridge Park ', '0.8 miles'], ['Wembley Stadium ', '1.0 miles']]","['underground', 'underground', 'nationalrail']",Ask agent,Ask agent,Ask agent,Ask agent,False
235,140879261,"£230,000",Added on 13/10/2023,"57 Station Grove, Wembley, Greater London, HA0","Reception Room, Two Bedrooms, Kitchen, Bathroom/WC, Unexpired Lease Term of approximately 62 Years , Rear Garden, Overground, Southern and West Midlands services run from Wembley Central station which is within walking distance to the north, Wembley Stadium is 1.2 miles to the north east , The op...",Flat,1,2,,Leasehold,[],"[['Wembley Central ', '0.1 miles'], ['Wembley Stadium ', '0.5 miles'], ['Alperton ', '0.7 miles']]","['nationalrail', 'nationalrail', 'underground']",Ask agent,Ask agent,Ask agent,Ask agent,False
236,140878166,"£450,000",Added on 13/10/2023,"Grasmere Avenue, Wembley, Middlesex, HA9","**Sold with the freehold**within a stones throw of Preston Road Station and refurbished to a very high standard is this beautifully presented, two bedroom, ground floor garden flat with off street parking.",Flat,1,2,,Freehold,"['2 bathrooms', 'Garden', 'Parking', 'Driveway']","[['Preston Road ', '0.2 miles'], ['South Kenton ', '0.4 miles'], ['South Kenton ', '0.4 miles']]","['underground', 'overground', 'underground']",Ask agent,Ask agent,Ask agent,Ask agent,False
237,135260153,"£825,000",Reduced on 13/10/2023,"Randall Avenue, London, London, NW2","A spacious semi-detached 1930’s built house situated at the Dollis Hill Lane end of this desirable street and located within a few hundred yards of the magnificent 80 acres of Gladstone Park. The property has been recently redecorated and lovingly maintained to a high standard, offering ...",Semi-Detached,2,3,,Freehold,"['•\tGas central heating', '•\tDouble glazed windows', '•\tWood flooring', '•\tGround floor shower room/WC and first floor bathroom/WC', '•\tExtended kitchen/diner', '•\tGross internal floor area of 1,292 sq ft (120 sq m) approximately', '•\tThree good sized bedrooms', '•\tSouth westerly facing rear garden']","[['Neasden ', '0.6 miles'], ['Dollis Hill ', '0.7 miles'], ['Hendon ', '1.3 miles']]","['underground', 'underground', 'nationalrail']",Ask agent,Ask agent,Ask agent,Band: E,False
238,140876972,"£285,000",Added on 13/10/2023,"Donnington Road, London","A rarely available purpose built one bedroom flat with incredible views, positioned on the edge of the Dobree Estate. Donnington Court is a bright one bedroom flat comprising a large open plan kitchen with access to a private balcony, family bathroom and large double bedroom. This apart...",Flat,1,1,666 sq. ft.(62 sq. m.),Leasehold,"['Private Balcony', 'Bright One Bedroom Apartment', 'Concierge Service', 'Off Street Parking', 'Secure Modern Building', 'Close To Roundwood Park', 'Double Bedroom', 'Open Plan Kitchen', 'Popular Residential Location', 'Vacant Possesion']","[['Willesden Green ', '0.6 miles'], ['Dollis Hill ', '0.8 miles'], ['Kensal Rise ', '0.7 miles']]","['underground', 'underground', 'overground']",Ask agent,£2691,108 years left,Band: C,False
239,134862422,"£250,000",Reduced on 13/10/2023,"Acton Lane, London","A GROUND FLOOR TWO BEDROOM FLAT. The property comprises of entrance hall, open plan reception room / kitchen, two bedrooms and bathroom. The total floor area is approximately 468 SQ/FT (43 SQ/M). Acton Lane is located close to schools, shops and independent cafes on Harlesden Hi...",Flat,1,2,,Leasehold,"['TWO BEDROOM', 'GROUND FLOOR FLAT', 'OPEN PLAN RECEPTION ROOM / KITCHEN', 'CLOSE TO SHOPS', 'CLOSE TO STATION']","[['Harlesden ', '0.3 miles'], ['Willesden Junction ', '0.4 miles'], ['North Acton ', '0.8 miles']]","['underground', 'underground', 'underground']",Ask agent,Ask agent,88 years left,Ask agent,False
240,86148324,"£700,000",Added on 13/06/2023,St. James Gardens,FOUR BEDROOM - TWO BATHROOM - OFF STREET PARKING - LARGE REAR GARDEN - SEMI DETACHED - FREEHOLD,Semi-Detached,2,4,,Freehold,"['Four Bedrooms', 'Two Bathrooms', 'Rear Extension', 'Loft Extension', 'Private Rear Garden', 'Off Street Parking', 'Freehold']","[['Alperton ', '0.2 miles'], ['Wembley Central ', '0.6 miles'], ['Sudbury Town ', '0.9 miles']]","['underground', 'nationalrail', 'underground']",Ask agent,Ask agent,Ask agent,Band: E,False
241,135595397,"£550,000",Reduced on 13/10/2023,"The Grange, The Knoll, Ealing, W13","This beautifully designed and spacious two double-bedroom apartment offers a delightful living space with an abundance of natural light. The modern fully fitted kitchen is equipped with top-of-the-line appliances, complementing the contemporary style. The highlight of this property is the generou...",Flat,1,2,940 sq. ft.(87 sq. m.),Share of Freehold,"['A prestigious purpose built ground floor apartment', 'Generous two double bedrooms', 'Spacious L shaped reception room and fitted kitchen', 'Private cul-de-sac development', 'Communal indoor swimming pool', 'Beautifully landscaped grounds', 'Walking distance to Ealing Broadway', 'Private garage', 'Walking distance to local schools', 'No chain']","[['West Ealing ', '0.6 miles'], ['Ealing Broadway ', '0.7 miles'], ['Drayton Green ', '0.8 miles']]","['nationalrail', 'nationalrail', 'nationalrail']",Ask agent,Ask agent,995 years left,Ask agent,False
242,86658540,"£625,000",Added on 13/10/2023,"Costons Lane, Greenford",THREE BEDROOM - END OF TERRACE - NO CHAIN - DRIVEWAY - POTENTIAL TO EXTEND (stpp). Brian Cox and Company are delighted to present to the market this three bedroom END OF TERRACE family home. This three bedroom family home presents exciting opportunity for those seeking a project with a little TLC...,Terraced,2,3,,Freehold,"['Three Bedroom', 'End of Terrace', 'Extended', 'Two Bathrooms', 'Garage to the Side', 'Chain Free', 'Off Street Parking', 'EPC Rating - D', 'Council Tax Band - D']","[['South Greenford ', '0.6 miles'], ['Greenford ', '0.7 miles'], ['Castle Bar Park ', '1.0 miles']]","['nationalrail', 'nationalrail', 'nationalrail']",Ask agent,Ask agent,Ask agent,Ask agent,False
243,86658498,"£675,000",Added on 13/10/2023,"Park Hill, Ealing","A large two bedroom and two bathroom apartment on the first floor of this purpose built block with over 900sq.ft of living space. The property has been fully refurbished and recently benefited from new double glazing throughout, there is a long underlying lease and a separate garage.",Flat,2,2,,Leasehold,"['Two Bedrooms', 'First Floor', 'No Onward Chain', 'Long Lease', 'Garage', 'Premium Location']","[['Ealing Broadway ', '0.5 miles'], ['North Ealing ', '0.6 miles'], ['Hanger Lane ', '0.6 miles']]","['nationalrail', 'underground', 'underground']",Ask agent,Ask agent,Ask agent,Ask agent,False
244,86658261,"£750,000",Added on 13/10/2023,"Regal Way, Harrow, HA3","Spacious 3 bed semi-detached house with side garage near Preston Road/Kenton stations. Bright lounge, modern kitchen/dining, guest cloakroom. 2 double bedrooms, 1 single, family bathroom. Large private garden, own driveway, no chain. Close to Claremont High School, Mount Stewart Junior School.",Semi-Detached,1,3,,Freehold,"['Chain Free', '3 Bed Semi-Detached House', 'Spacious Through Lounge', 'Kitchen with Dinning Area', 'Guest Cloakroom', 'Built-in Wardrobes', 'Own Driveway & Garage', 'Private Rear Garden', 'Walking Distance To Kenton Station and Preston Road Tube Station', 'Close to Claremont High School and Mount Stewart Junior School']","[['Preston Road ', '0.7 miles'], ['Kingsbury ', '0.8 miles'], ['Kenton ', '0.9 miles']]","['underground', 'underground', 'underground']",Ask agent,Ask agent,Ask agent,Band: E,False
245,139256876,"£825,000",Reduced on 13/10/2023,"Draycott Avenue, Harrow, HA3",** CHAIN FREE ** Introducing a remarkable property that captures the perfect blend of refined elegance and contemporary comfort. This detached gem proudly presents an array of captivating features that collectively embody the essence of exceptional living close to local scho...,Detached,2,3,,Freehold,"['CHAIN FREE', 'Detached House', '3 Double Bedrooms', '2 Reception Rooms', 'Kitchen', 'Huge 160-Foot Garden', 'Driveway For 3 Cars', 'Garage', 'Potential To Extend STPP']","[['Northwick Park ', '0.5 miles'], ['South Kenton ', '0.5 miles'], ['South Kenton ', '0.5 miles']]","['underground', 'overground', 'underground']",Ask agent,Ask agent,Ask agent,Ask agent,False
246,139355543,"£1,000,000",Reduced on 13/10/2023,"Ashbourne Road, W5","Presenting a delightful 3-bedroom detached residence nestled on Ashbourne Road in the coveted Ealing W5 area. This property holds exceptional promise, inviting the attention of discerning cash buyers with a taste for transformative projects. Envisioned as an ideal canvas for your dream home, this...",Detached,1,3,"1,288 sq. ft.(120 sq. m.)",Freehold,"['Three bedroom detached home', 'Sought after location - Haymills Estate', 'Cash buyers only', 'Fantastic renovation opportunity', 'Secured planning permission', 'Superb location within Ealing', 'Easily accessible to Central London', 'Excellent local schools', 'Close to local shops and tube station', 'Good size private garden, garage and off street parking']","[['Park Royal ', '0.3 miles'], ['Hanger Lane ', '0.2 miles'], ['North Ealing ', '0.7 miles']]","['underground', 'underground', 'underground']",Ask agent,Ask agent,Ask agent,Ask agent,False
247,86642205,"£440,000",Added on 13/10/2023,"Freeland Road, Ealing","Attractive two bedroom conversion apartment, offering easy access to both Ealing Broadway and Ealing Common Station. With circa 659 sq ft this is an ideal first time buy.",Flat,1,2,,Leasehold,"['Two bedroom conversion ', 'Close to Ealing Common', 'Off street parking ', 'Good condition throughout', 'Near to Ealing Broadway', 'Good transport links', 'Communal cellar', 'Communal garden']","[['Ealing Common ', '0.2 miles'], ['North Ealing ', '0.3 miles'], ['Ealing Broadway ', '0.5 miles']]","['underground', 'underground', 'nationalrail']",Ask agent,Ask agent,Ask agent,Ask agent,False
248,86639484,"£450,000",Added on 13/10/2023,"St Anns Road, Harrow, HA1",This 2 bedroom apartment in the heart of Harrow boasts a high end finish with a contemporary-style kitchen fitted with Miele appliances and two spacious double bedrooms. Off street parking is available to rent.,Flat,1,2,622 sq. ft.(58 sq. m.),Leasehold,"['High specification and attractive second floor apartment', 'Ultra conveinient Central Harrow location', ""Situated within one of Harrow's most sought after developments"", 'High end finish throughout the property including Miele appliances', '2 large double bedrooms', 'Stylish fitted bathroom', 'Off street parking is available to rent', 'Secure entrance with Lift access']","[['Harrow-on-the-Hill ', '0.1 miles'], ['Harrow & Wealdstone ', '0.7 miles'], ['Northwick Park ', '0.8 miles']]","['nationalrail', 'nationalrail', 'underground']",£250 per year (Ask agent about the review period)When and how often your ground rent will be reviewed.Read more about ground rent review period in our glossary page.,£2366.32,132 years left,Ask agent,False
249,137896781,"£550,000",Reduced on 13/10/2023,"Grasmere Avenue, Wembley, HA9 8TB",Salter McGuinness are delighted to offer for sale this three bedroom mid terraced property situated within a one minute walk from Preston Road high street with its excellent transport links and multiple shopping facilities.,Terraced,1,3,,Freehold,"['EXCELLENT LOCATION', 'THREE BEDROOMS', 'TWO RECEPTION ROOMS', 'GARAGE VIA SERVICE ROAD', 'IN NEED OF MODERNISATION', 'CHAIN FREE']","[['Preston Road ', '0.1 miles'], ['South Kenton ', '0.5 miles'], ['South Kenton ', '0.5 miles']]","['underground', 'overground', 'underground']",Ask agent,Ask agent,Ask agent,Band: E,False
250,139141529,"£440,000",Added on 26/08/2023,"Cavendish Avenue, Ealing, W13","A CHARMING TWO BEDROOM FIRST FLOOR GARDEN FLAT IN THIS POPULAR STREET. This 1930's built maisonette is well presented throughout making a comfortable, and spacious home. The private entrance leads into a hallway leading to all rooms. The property offers a light and airy lounge with a larg...",Flat,1,2,650 sq. ft.(60 sq. m.),Leasehold,"['Own private entrance', 'First floor', 'Light & airy lounge', 'Modern fitted kitchen', 'Two bedrooms', 'Family bathroom', 'Rear garden', 'Electric Storage Heating', 'Long lease', 'No chain']","[['Castle Bar Park ', '0.1 miles'], ['Drayton Green ', '0.4 miles'], ['West Ealing ', '0.7 miles']]","['nationalrail', 'nationalrail', 'nationalrail']",Ask agent,Ask agent,Ask agent,Ask agent,False
251,86637069,"£665,000",Added on 13/10/2023,"Greenford Road, Greenford",FOUR BEDROOM - SEMI-DETACHED - IMMACULATE CONDITION - OFF STREET PARKING - VIEW NOW. Brian Cox and Company are delighted to offer to the market this immaculately presented four bedroom semi-detached family home. This ideal family home is well located within easy reach of Greenford and Sudbury Hil...,Semi-Detached,2,4,,Freehold,"['Four Bedroom', 'Semi-Detached', 'Immaculate Condition', 'Garage', 'Two Bathrooms', 'Off Street Parking', 'Council Tax Band - D']","[['Sudbury Hill ', '0.5 miles'], ['Greenford ', '0.6 miles'], ['Sudbury Hill Harrow ', '0.6 miles']]","['underground', 'nationalrail', 'nationalrail']",Ask agent,Ask agent,Ask agent,Ask agent,False
252,86634660,"£325,000",Added on 13/10/2023,"Cheriton Close, W5",Delightful One Bedroom Apartment set in this quiet development just moments from Pitshanger Lane. ,Flat,1,1,,Leasehold,"['One Bed Top Floor Apartment', 'Chain Free', 'Fantastic Location', 'Well Kept Communal Grounds', 'Double Glazed Throughout', 'Easy Access into Ealing Broadway', 'Ideal Investment Purchase', 'Great Starter Home', 'Lease Length of Circa 88 Years']","[['Ealing Broadway ', '0.7 miles'], ['West Ealing ', '0.8 miles'], ['Hanger Lane ', '0.9 miles']]","['nationalrail', 'nationalrail', 'underground']",£10 per year (Ask agent about the review period)When and how often your ground rent will be reviewed.Read more about ground rent review period in our glossary page.,£2640,88 years left,Ask agent,False
253,139666247,"£788,000",Reduced on 13/10/2023,"Beresford Avenue, Wembley, HA0","Ref# BEA230237 Spanning an impressive 1140 square foot (approx.) is this luxurious three bedroom apartment in the sought after development, Grand Union. The apartment is set on the eighth floor of the newly built Affinity Tower and offers a south and west facing private balcony which overlo...",Apartment,2,3,,Leasehold,"['Resident Permit Parking', '3 Bedroom Apartment', 'Two Bathrooms', 'Eight Floor', '1140 Sq Feet (approx.)', ""Residents' Facilities Including A lounge & Ten-Pin Bowling Alley"", 'A Waterfall Garden to Relax and Unwind In', 'Stonebridge Park (Bakerloo Line)']","[['Stonebridge Park ', '0.4 miles'], ['Alperton ', '0.7 miles'], ['Hanger Lane ', '0.9 miles']]","['underground', 'underground', 'underground']",£500 per year,£1379.02,995 years left,Band: E,False
254,86625567,"£300,000",Added on 12/10/2023,"North End Road, Wembley, HA9","Boasting a central Wembley Park location, this lovely 2 bedroom top floor flat boasts spacious accommodation, neutral decor and access to attractive communal gardens.",Flat,1,2,583 sq. ft.(54 sq. m.),Leasehold,"['Attractive 2 bedroom top floor flat', 'Lovely reception room with dining area', 'Spacious main bedroom', 'Modern kitchen and bathroom', 'Secure residential building', 'Moments from BOXPARK and London Designer Outlet']","[['Wembley Park ', '0.3 miles'], ['Wembley Stadium ', '0.6 miles'], ['Wembley Central ', '1.1 miles']]","['underground', 'nationalrail', 'nationalrail']",Ask agent,Ask agent,Ask agent,Ask agent,False
255,138653987,"£650,000",Reduced on 12/10/2023,"Villiers Road, Dollis Hill, London, NW2","Set on a superb residential road in Willesden, this fantastic 3 bedroom house provides bright and spacious interiors over 2 floors and a superb landscaped private garden.",House,1,3,"1,064 sq. ft.(99 sq. m.)",Freehold,"['Excellent 3 bedroom terraced house', 'Bay fronted reception room', 'Modern integrated kitchen with ample space to dine', '3 good sized double bedrooms', 'Contemporary shower room', 'Moments from Willesden High Road', 'Paved rear garden']","[['Dollis Hill ', '0.2 miles'], ['Neasden ', '0.6 miles'], ['Willesden Green ', '0.6 miles']]","['underground', 'underground', 'underground']",Ask agent,Ask agent,Ask agent,Ask agent,False
256,86625315,"£599,999",Added on 12/10/2023,"Ealing Village, Ealing Broadway, London, W5","This well proportioned 4 bedroom flat boasts comfortable living with a spacious reception room, 4 good sized bedrooms and a lovely private balcony.",Flat,1,4,869 sq. ft.(81 sq. m.),Share of Freehold,"['Generously sized 4 bedroom flat on the 1st floor', 'Spacious reception room with space to relax and dine', 'Separate kitchen with fitted appliances', '4 well proportioned bedrooms', 'Well-presented bathroom', 'Lovely private balcony']","[['Ealing Broadway ', '0.3 miles'], ['North Ealing ', '0.3 miles'], ['Ealing Common ', '0.5 miles']]","['nationalrail', 'underground', 'underground']",£50 per year (Ask agent about the review period)When and how often your ground rent will be reviewed.Read more about ground rent review period in our glossary page.,£9420.54,957 years left,Ask agent,False
257,140120024,"£550,000",Reduced on 12/10/2023,"Uxbridge Road, Ealing Broadway, London, W5","A bright and spacious two bedroom flat boasting generous reception room, dining room, modern kitchen, balcony and off-street parking.",Flat,2,2,975 sq. ft.(91 sq. m.),Leasehold,"['Superb 2 bedroom 3rd floor flat', 'Bright and spacious accomodation', 'Modern fixtures and fittings', 'Air conditioning', 'Large wrap around balcony', 'Concierge and lift', 'Secure parking space']","[['West Ealing ', '0.3 miles'], ['Ealing Broadway ', '0.5 miles'], ['Drayton Green ', '0.8 miles']]","['nationalrail', 'nationalrail', 'nationalrail']",Ask agent,Ask agent,104 years left,Ask agent,False
258,86623518,"£835,000",Added on 12/10/2023,"St. Andrews Avenue, Wembley, Middlesex HA0","This substantial Five/Six Bedroom Semi-Detached family home is heavily extended and thought out to make the most of the space provided. To the ground floor there is a large lounge, large kitchen/diner, conservatory, prayer room, guests’bathroom and integrated garage. To the first floor all Five B...",Semi-Detached,2,5,,Freehold,"['Extended', 'Large Garden', 'Ample Parking', 'Five Bedrooms', 'Spacious', 'Two Bathrooms']","[['Sudbury Hill Harrow ', '0.5 miles'], ['Sudbury & Harrow Road ', '0.5 miles'], ['Sudbury Hill ', '0.6 miles']]","['nationalrail', 'nationalrail', 'underground']",Ask agent,Ask agent,Ask agent,Ask agent,False
259,86622666,"£550,000",Added on 12/10/2023,"Cody Close, Harrow, HA3","Large Three-Bedroom Terrace House with Outhouse/Gym in Desirable Kenton, Harrow! Nestled in the heart of the sought-after Kenton neighborhood in Harrow, this delightful three-bedroom terrace house offers an excellent opportunity for comfortable family living. The property boasts a unique featu...",Terraced,1,3,,Freehold,"['Charming 3-bedroom terrace house in Kenton, Harrow.', 'Proximity to local schools makes it perfect for families.', 'Potential to extend into the loft for added value (stpc).', 'Convenient access to shopping centers and parks.', 'Great family home situated in a quiet cul de sac', 'Unique outhouse/gym, ideal for fitness or as a home office.', 'Excellent public transport links for easy commuting.', 'Larger than average houses in the area, offering more space.', 'Quick access to Queensbury station for city and local travel.', 'Act fast, early viewing recommended!']","[['Queensbury ', '0.6 miles'], ['Canons Park ', '1.0 miles'], ['Kingsbury ', '1.1 miles']]","['underground', 'underground', 'underground']",Ask agent,Ask agent,Ask agent,Band: D,False
260,127230977,"£290,000",Reduced on 12/10/2023,"Carr Road, Northolt",Another local homeowner has trusted Brian Cox to sell there property on Carr Road. This property is a two bedroom first floor maisonette and comes with a private rear garden and is a few minutes walk from Northolt Station which is ideal for first time buyers looking to get onto the property ladde...,Maisonette,1,2,,Leasehold,"['900+ Years Lease', 'Chain Free', 'Private Rear Garden', 'Short Walk to Northolt Station', 'First Floor', 'Two Bedrooms', 'Council Tax Band- C', 'EPC Rating - D']","[['Northolt ', '0.3 miles'], ['Greenford ', '0.7 miles'], ['Northolt Park ', '0.7 miles']]","['underground', 'nationalrail', 'nationalrail']",Ask agent,Ask agent,Ask agent,Band: C,False
261,86621886,"£370,000",Added on 12/10/2023,"Evesham Close, Greenford","This three double bedroom purpose built apartment is located on the ground floor with direct access onto a private garden, leading to an additional communal garden.",House,1,3,,Leasehold,"['Three Bedrooms', 'Ground Floor', 'Purpose Built', 'Private Garden', 'Separate Kitchen', 'Communal Gardens']","[['Greenford ', '0.7 miles'], ['Northolt ', '0.8 miles'], ['South Greenford ', '1.1 miles']]","['nationalrail', 'underground', 'nationalrail']",Ask agent,Ask agent,Ask agent,Ask agent,False
262,139773896,"£435,000",Reduced on 12/10/2023,"Grange Road, Ealing",This one bedroom period conversion is located on the first floor of this detached building. Deceptively spacious with high ceilings throughout and overlooking quiet gardens to the rear. There is off street parking to the front and a private section of garden to the rear.,Flat,1,1,,Leasehold,"['One Bedroom', 'Allocated Parking', 'Private Garden', 'Period Conversion', 'Recently Modernised', 'Share Of Freehold']","[['Ealing Broadway ', '0.3 miles'], ['Ealing Common ', '0.6 miles'], ['South Ealing ', '0.7 miles']]","['nationalrail', 'underground', 'underground']",Ask agent,Ask agent,Ask agent,Ask agent,False
263,139595321,"£499,999",Reduced on 12/10/2023,"Mount Park Road, Ealing","Set in one of Ealing's most desirable locations, this two bedroom apartment comes with a long lease, garage and is being sold with no onward chain.",Flat,1,2,,Leasehold,"['Two Bedrooms', 'Second Floor', 'Garage', 'No Onward Chain', 'Close to Transport', 'Long Lease']","[['Ealing Broadway ', '0.5 miles'], ['North Ealing ', '0.8 miles'], ['Hanger Lane ', '0.8 miles']]","['nationalrail', 'underground', 'underground']",Ask agent,Ask agent,Ask agent,Ask agent,False
264,86614011,"£999,950",Added on 12/10/2023,"Randall Avenue, Gladstone Park","An immaculately presented semi-detached house close to Gladstone Park. This excellently sized four-bedroom, two-bathroom family home provides stylish accommodation of over 2000 sq ft offering spacious rooms & open plan living areas with high-spec finishes. Dollis Hill Underground Station is serve...",Semi-Detached,2,4,,Freehold,"['Immaculately Presented Family Home', 'Off Street Parking', 'Utility Room', 'Kitchen-Diner', 'Office Space', 'Downstairs W/C', '0.7 Miles to Dollis Hill Underground Station (Zone 3 - Jubilee Line)', 'Over 2000 Sq.Ft']","[['Neasden ', '0.6 miles'], ['Dollis Hill ', '0.7 miles'], ['Hendon ', '1.3 miles']]","['underground', 'underground', 'nationalrail']",Ask agent,Ask agent,Ask agent,Ask agent,False
