,id,price,added_reduced,address,description,type_house,bathrooms,bedrooms,size,tenure,key_features,close_stations,close_stations_type,tenure_ground_rent,tenure_annual_service_charge,tenure_lease_length,council_tax_band,sold_under_offer
0,138543686,"£325,000",Added on 11/08/2023,"Firwood Lane, Romford","Guide Price £325,000-£350,000. Great Location & No Chain! On this two bedroom flat in the lovely Kings Park Development in Harold Wood. Being ideally located next to the new Elizabeth line & other local Amenities, this is a must view, Call haart now!",Flat,1,2,,Leasehold,"['Two Double Bedrooms', 'Lift Access', 'Walking Distance To Station', 'Open Kitchen Living', 'Modern Bathroom', 'Close To All Amenities', 'Huge Balcony', 'Utility Area', 'Great Storage Options']","[['Harold Wood ', '0.4 miles'], ['Gidea Park ', '1.0 miles'], ['Emerson Park ', '1.5 miles']]","['nationalrail', 'nationalrail', 'nationalrail']",Ask agent,Ask agent,Ask agent,Ask agent,False
1,136285067,"£550,000",Reduced today,"Squirrels Heath Lane, Hornchurch, RM11",Ideally located for Gidea Park Station (Elizabeth Line) 0.5 miles. Enlarged semi detached with 90 foot rear garden. Ground floor shower room. First floor bathroom. Large outbuilding. Off street parking.,Semi-Detached,2,3,,Ask agent,"['Large Outbuilding', 'Semi Detatched', '90 foot Rear Garden', '0.5 miles to Gidea Park Station', 'Ardleihg Green School']","[['Gidea Park ', '0.5 miles'], ['Harold Wood ', '1.0 miles'], ['Emerson Park ', '1.0 miles']]","['nationalrail', 'nationalrail', 'nationalrail']",Ask agent,Ask agent,Ask agent,Band: E,False
2,141376571,"£1,700,000",Added today,"Hacton Lane, Upminster, RM14","REF: HADER - An amazing beautiful detached house truss bodied frame throughout, with a private gated drive which leads up a driveway with ample parking",Detached,3,4,"3,019 sq. ft.(280 sq. m.)",Freehold,"['Truss beams', 'Indoor swimming pool', 'Gated drive', 'Ample parking']","[['Hornchurch ', '0.8 miles'], ['Upminster Bridge ', '0.8 miles'], ['Upminster ', '1.1 miles']]","['underground', 'underground', 'nationalrail']",Ask agent,Ask agent,Ask agent,Ask agent,False
3,141375224,"£290,000",Added yesterday,"Grenfell Avenue, Hornchurch","This first floor apartment offers two bedrooms, two bathrooms -one as En-suite shower room, open plan living area with Juliette balcony, 107 years remaining on the lease, allocated parking bay, communal gardens, CHAIN FREE, access to Romford town centre & Queens hospital,. Contact today to view!",Apartment,2,2,,Leasehold,"['Well Maintained Throughout', 'Two Double Bedrooms', 'Two Bathrooms one being En-Suite', 'Lease In Excess of 107 years', 'Quiet Residential Development', 'Access to Romford Town Centre & Queens Hospital', 'Allocated Parking Space', 'First Floor Apartment', 'Chain Free']","[['Romford ', '0.7 miles'], ['Elm Park ', '1.1 miles'], ['Gidea Park ', '1.5 miles']]","['nationalrail', 'underground', 'nationalrail']",Ask agent,Ask agent,107 years left,Ask agent,False
4,141371045,"£780,000",Added yesterday,"St. Lawrence Road, Upminster, Essex",Chain Free! A Stunning Home with good sized reception room with an open plan kitchen and living area downstairs shower room - Five Bedrooms Two With Fitted Wardrobes - Luxury Family Bathroom - Garden With Decking Area -Detached Garage - Excellent Transport Links. Internally this property benefits...,Semi-Detached,2,5,,Freehold,"['Well maintained, extended semi detached home offered with no onward chain', 'Ground floor shower room & first floor bathroom', 'Open plan living/dining area', 'Garage & off road parking', 'Conveniently located less than 0.3 miles away from  Upminster C2C Train Station', 'Situated in a good convenient location for local schools and amenities', 'EPC energy rating E']","[['Upminster ', '0.2 miles'], ['Upminster Bridge ', '0.7 miles'], ['Hornchurch ', '1.5 miles']]","['nationalrail', 'underground', 'underground']",Ask agent,Ask agent,Ask agent,Band: E,False
5,141368192,"£450,000",Added yesterday,"Percy Road, Romford","Presenting this chain free, three-bedroom extended home. Recently refreshed with a new façade, it offers a practical paved driveway for two vehicles. ",Terraced,,3,,Freehold,"['NO ONWARD CHAIN', 'THREE BEDROOM EXTENDED HOME', 'PAVED DRIVEWAY FOR TWO VEHICLES', 'GOOD SIZE REAR GARDEN']","[['Romford ', '1.2 miles'], ['Gidea Park ', '1.9 miles'], ['Chadwell Heath ', '2.1 miles']]","['nationalrail', 'nationalrail', 'nationalrail']",Ask agent,Ask agent,Ask agent,Ask agent,False
6,141369665,"£530,000",Added yesterday,"Lyndhurst Drive, Hornchurch, Essex","Beautifully presented and extended terrace house situated in a popular residential turning close to Hornchurch High Street and transport links. The house has been finished to a high standard throughout offering; entrance hall, spacious dining room with bay window to the front, separate extended l...",End of Terrace,1,3,,Freehold,"['An extended end terraced family home', 'Good condition and modern decoration throughout', 'Large rear garden', 'Off road parking', 'Close to good schools and shops']","[['Emerson Park ', '0.3 miles'], ['Gidea Park ', '1.0 miles'], ['Hornchurch ', '1.0 miles']]","['nationalrail', 'nationalrail', 'underground']",Ask agent,Ask agent,Ask agent,Band: D,False
7,139590827,"£625,000",Reduced yesterday,"Howard Road, Upminster","LOCATION LOCATION LOCATION This is an incredible opportunity to be situated within walking distance to Upminster station and local High Street! A detached, chalet style bungalow, twice extended and in fair condition throughout offers fantastic bedroom sizes, one with it's own en-suite an...",Detached Bungalow,2,3,,Freehold,"['Detached Chalet Style Bungalow', 'Three/ Four Double Bedrooms', 'Extended ""annex"" with Rear Bedroom and En-Suite', 'Second Entrance Door for Annex Style Living', 'Converted Loft', 'Modern Fitted Kitchen', 'Conveniently Located for Upminster Station and High Street', 'EPC: tbc']","[['Upminster ', '0.2 miles'], ['Upminster Bridge ', '0.9 miles'], ['Hornchurch ', '1.6 miles']]","['nationalrail', 'underground', 'underground']",Ask agent,Ask agent,Ask agent,Band: E,False
8,141363794,"£499,995",Added yesterday,"Forest Road, Romford, London, RM7","Located in a quiet popular residential area, Brian Thomas Estate Agents are delighted to offer for sale this spacious extended three-bedroom end of terrace family house. The property is conveniently located to shops, schools and public transport facilities with easy access to the A12. ",End of Terrace,2,3,,Freehold,"['THREE BEDROOM - END OF TERRACE HOUSE ', 'OPEN PLAN LOUNGE ', 'EXTENDED FITTED KITCHEN', 'GROUND FLOOR SHOWER ROOM/W.C. AND FIRST FLOOR FAMILY BATHROOM', 'POTENTIAL FOR DOUBLE STOREY SIDE EXTENSION (STPP)', 'OFF STREET PARKING FOR THREE CARS', 'DOUBLE GLAZED AND GAS CENTRAL HEATING  ', 'UTILITY ROOM', 'GOOD SIZE REAR GARDEN', 'VIEWING HIGHLY ADVISED']","[['Romford ', '1.2 miles'], ['Chadwell Heath ', '1.8 miles'], ['Gidea Park ', '2.0 miles']]","['nationalrail', 'nationalrail', 'nationalrail']",Ask agent,Ask agent,Ask agent,Ask agent,False
9,141361766,"£475,000",Added yesterday,"Pembroke Close, Hornchurch, RM11","Guide Price £475,000 - £500,000. Great size well maintained family style home in a sought-after location of Hornchurch. The home is within close proximity to local shops and schools, with great transport links nearby. The property offers three great size bedrooms & ground floor r...",Semi-Detached,1,3,,Freehold,"['Excellent School Catchment Area', 'Easy Reach of Local Shops', 'Great Transport Links Within Walking Distance', 'Sought After Location', 'Must View Home', 'Virtual Tour Available']","[['Harold Wood ', '0.9 miles'], ['Emerson Park ', '1.0 miles'], ['Gidea Park ', '1.3 miles']]","['nationalrail', 'nationalrail', 'nationalrail']",Ask agent,Ask agent,Ask agent,Band: D,False
10,141358424,"£500,000",Added yesterday,"Redriff Road, Romford, Essex","A superb extended semi Detached house situated in a sought after turning which is within easy reach of local shops and a bus services to Romford station. The property offers a spacious living room with double doors leading to sitting room area, fitted kitchen/diner and utility room with further s...",Semi-Detached,1,3,,Freehold,"['An immaculate family home in a great location', 'Ground floor cloakroom and utility room', 'Modern and well kept Kitchen/diner', 'Off road parking', 'Good size rear garden', 'EPC energy rating D']","[['Romford ', '1.4 miles'], ['Gidea Park ', '1.9 miles'], ['Chadwell Heath ', '2.2 miles']]","['nationalrail', 'nationalrail', 'nationalrail']",Ask agent,Ask agent,Ask agent,Band: D,False
11,141357908,"£425,000",Added yesterday,"Hillcrest Road, Hornchurch","Guide Price £425,000 - £450,000 Located on this attractive tree lined road is this quaint cottage style three bedroom home located just yards from Hylands Park, the accommodation includes entrance porch opening into the hallway, two reception rooms kitchen, three bedrooms and bathroom. Externally...",Terraced,1,3,,Freehold,"['Three Bedrooms', 'Two Reception Rooms', 'New Boiler (Feb 2023)', 'Double Glazing', '55ft Garden', 'Double Garage']","[['Romford ', '0.9 miles'], ['Emerson Park ', '0.8 miles'], ['Gidea Park ', '0.9 miles']]","['nationalrail', 'nationalrail', 'nationalrail']",Ask agent,Ask agent,Ask agent,Band: D,False
12,141356108,"£780,000",Added yesterday,"St. Lawrence Road, Upminster",Welcome to this stunning end of terrace house situated in a sought after location in Upminster. This property consists of living/kitchen area which has been extended on the ground floor. The kitchen has been thoughtfully done up to a high standard and comes complete with kitchen island a...,End of Terrace,2,5,,Freehold,"['3 Bedroom End-Terrace House', 'Recently Refurbished', 'Close to Upminster Station', 'Driveway', 'Garage', 'Complete Chain', 'Council Tax Band: E']","[['Upminster ', '0.2 miles'], ['Upminster Bridge ', '0.7 miles'], ['Hornchurch ', '1.4 miles']]","['nationalrail', 'underground', 'underground']",Ask agent,Ask agent,Ask agent,Band: E,False
13,139780622,"£550,000",Reduced yesterday,"Chelmer Road, Upminster, Essex",Located within a cul de sac is this well presented Three Bedroom Semi Detached property which is offered with No Onward Chain.,Semi-Detached,1,3,,Freehold,"['Spacious Hallway', 'Lounge/Diner: 24’8 x 12’5 > 10’8', 'Fitted Kitchen: 12’5 x 7’5, Conservatory: 9’ x 7’7', 'Bedroom One: 14’ x 9’9 fitted', 'Bedroom Two: 10’8 x 9’ fitted', 'Bedroom Three: 8’7 x 8’3 with storage', 'Shower Room/WC', 'Off Street Parking to Front, Shared Driveway to Flank', 'West Facing Rear Garden: 60’, Garage: 29’10 x 10’3', 'Cul de Sac Location']","[['Upminster ', '0.8 miles'], ['Upminster Bridge ', '1.2 miles'], ['Emerson Park ', '1.7 miles']]","['nationalrail', 'underground', 'nationalrail']",Ask agent,Ask agent,Ask agent,Ask agent,False
14,141355232,"£385,000",Added yesterday,"St. Clements Avenue, Harold Wood, RM3","Open Plan Kitchen, Living And Dining Room – Master Bedroom With Fitted Wardrobes – Additional Bedroom - Contemporary Family Bathroom - Private Balcony - Allocated Secure Gated Parking - Excellent Transport Links - Far Reaching Views - Lift Access",Apartment,2,2,787 sq. ft.(73 sq. m.),Leasehold,"['Open Plan Kitchen, Living And Dining Room', 'Master Bedroom With Fitted Wardrobes', 'Additional Bedroom', 'Contemporary Family Bathroom', 'Private Balcony', 'Allocated Secure Gated Parking', 'Excellent Transport Links', 'Far Reaching Views', 'Lift Access']","[['Harold Wood ', '0.3 miles'], ['Gidea Park ', '1.2 miles'], ['Emerson Park ', '1.7 miles']]","['nationalrail', 'nationalrail', 'nationalrail']",Ask agent,Ask agent,245 years left,Band: D,False
15,141351962,"£185,000",Added yesterday,"Straight Road, Romford, RM3","A well maintained second floor one bedroom flat which is being offered with no onward chain. The property has just been redecorated and carpeted in readiness for the new owners. Located in a convenient locating close to local shops and close to a well served bus route, giving access to nearby ...",,1,1,,Ask agent,"['No Onward Chain', 'Close to local shops', 'Lounge', 'Kitchen / Diner', 'Large Bedroom', 'Well Maintained Communal Area', 'Convenient location', 'Second Floor', 'Long Lease']","[['Harold Wood ', '1.0 miles'], ['Gidea Park ', '1.1 miles'], ['Romford ', '2.0 miles']]","['nationalrail', 'nationalrail', 'nationalrail']",Ask agent,Ask agent,Ask agent,Ask agent,False
16,140288681,"£500,000",Reduced yesterday,"Court Avenue, Romford","Finished to exacting standards throughout, this semi-detached three-bedroom bungalow offers a turn-key opportunity to any potential new owner whilst also enjoying the modern-day layout of open-plan living.",Semi-Detached Bungalow,2,3,828 sq. ft.(77 sq. m.),Freehold,"['Stunning Extended Semi-Detached Family Home', 'Three Bedrooms/Two Bathrooms', 'Open Plan Lounge/Kitchen/Diner With Separate Utility Room', 'Off-Street Parking For Three Vehicles', 'Westerly Facing Rear Garden', 'Backing Onto Harold Court Primary School Fields', '0.6 Miles To Harold Wood Station (Elizabeth Line)', 'Available Chain Free']","[['Harold Wood ', '0.6 miles'], ['Gidea Park ', '1.9 miles'], ['Emerson Park ', '2.3 miles']]","['nationalrail', 'nationalrail', 'nationalrail']",Ask agent,Ask agent,Ask agent,Band: D,False
17,141349517,"£600,000",Added yesterday,"Avon Road, Upminster, RM14","Beresfords are delighted to offer this four bedroom semi-detached family home set in the heart of Upminster within walking distance to local schools, shops and amenities. Awaiting EPC. (CAV230081)",Semi-Detached,2,4,,Freehold,"['Four Bedroom Semi-Detached', 'Lounge', 'Dining Room', 'Utility Room', 'Garage', 'Drive for 6+ Cars', 'Approximate 50ft Garden', '0.3 Mile To Engayne Primary School', '0.6 Mile To Hall Mead School', '1.4 Miles To Upminster C2C Station']","[['Upminster ', '0.9 miles'], ['Upminster Bridge ', '1.3 miles'], ['Emerson Park ', '1.8 miles']]","['nationalrail', 'underground', 'nationalrail']",Ask agent,Ask agent,Ask agent,Band: F,False
18,141339044,"£900,000",Added yesterday,"The Grove, Upminster, RM14","** GUIDE PRICE £900,000 - £950,000** •FIVE DOUBLE BEDROOM EXTENDED SEMI DETACHED FAMILY HOME •THREE RECEPTION ROOMS •GARDEN BOASTS IN EXCESS OF 150' WITH COMPOSITE DECKING, SUMMER HOUSE AND REAR SHED •19' KITCHEN/BREAKFAST ROOM WITH BIFOLD...",Semi-Detached,2,5,,Freehold,[],"[['Upminster Bridge ', '1.0 miles'], ['Upminster ', '1.0 miles'], ['Hornchurch ', '1.2 miles']]","['underground', 'nationalrail', 'underground']",Ask agent,Ask agent,Ask agent,Band: TBC,False
19,138301334,"£225,000",Reduced yesterday,"Elvet Avenue, Romford, RM2","Your Move is delighted to present this spacious apartment to the market. The property has been refurbished to a high standard and is ready to move in. It offers two double bedrooms, shower room, fitted kitchen and the living room which leads out to the balcony which offers beautiful views. Locate...",Flat,1,2,,Leasehold,"['EPC C', 'SIXTH FLOOR', 'BALCONY', 'RESIDENTS PARKING', 'SPACIOUS APARTMENT', '0.3 MILES TO GIDEA PARK STATION', 'EASY ACCESS TO ROMFORD TOWN CENTRE', 'BEAUTIFULLY PRESENTED', 'TWO DOUBLE BEDROOMS', 'AMPLE STORAGE']","[['Gidea Park ', '0.3 miles'], ['Emerson Park ', '1.0 miles'], ['Harold Wood ', '1.1 miles']]","['nationalrail', 'nationalrail', 'nationalrail']",£0 per year,£1440,84 years left,Band: TBC,False
20,141330839,"£525,000",Added yesterday,"Warriner Avenue, Hornchurch, RM12",Chain Free - Lift - Large Living And Dining Area - Three Bedrooms - Kitchen - Family Bathroom - Rear Detached Garage - Garden With Patio Area And Outbuilding - Off Road Parking - Excellent Transport Links,Semi-Detached,1,3,"1,461 sq. ft.(136 sq. m.)",Freehold,"['Chain Free', 'Lift', 'Large Living And Dining Room', 'Kitchen', 'Three Bedrooms', 'Family Bathroom', 'Rear Detached Garage', 'Garden With Patio Area And Outbuilding', 'Off Road Parking', 'Excellent Transport Links']","[['Hornchurch ', '0.2 miles'], ['Upminster Bridge ', '0.8 miles'], ['Emerson Park ', '0.8 miles']]","['underground', 'underground', 'nationalrail']",Ask agent,Ask agent,Ask agent,Band: E,False
21,136636187,"£475,000",Reduced yesterday,"Gillian Crescent, Gidea Park, RM2","Guide Price £475,000 to £500,000 Three bedroom semi-detached home with shared drive to garage. Off Street Parking. No through Road. Modern Kitchen and Bathroom. 61tf Rear Garden. EPC awaited. Council Tax D. ",Semi-Detached,1,3,,Freehold,"['3 Bedrooms', 'Porch', 'Entrance Hall', '2 xReception Room', 'Kitchen', 'Bathroom', 'Garden', 'Shared Drive to Garage', 'Gidea Park Elizabeth Line', 'Ardleigh Green School']","[['Gidea Park ', '0.7 miles'], ['Harold Wood ', '0.9 miles'], ['Emerson Park ', '1.6 miles']]","['nationalrail', 'nationalrail', 'nationalrail']",Ask agent,Ask agent,Ask agent,Band: D,False
22,141327218,"£425,000",Added yesterday,"Tiverton Grove, Romford","Delaney's are pleased to offer with NO ONWARD CHAIN this THREE DOUBLE BEDROOM family home. This property boasts: REAR GARDEN, DOUBLE GLAZING, TWO BATHROOMS and located in a quiet turning. AN EARLY VIEWING IS HIGHLY RECOMMENDED! .",Terraced,2,3,,Freehold,[],"[['Harold Wood ', '1.1 miles'], ['Gidea Park ', '2.3 miles'], ['Brentwood ', '2.6 miles']]","['nationalrail', 'nationalrail', 'nationalrail']",Ask agent,Ask agent,Ask agent,Band: C,False
23,137695907,"£400,000",Reduced on 26/10/2023,"Western Avenue, Dagenham, RM10","GUIDE PRICE £400,000 - £425,000 Located in the popular Dagenham East area of Dagenham offering access close to Dagenham East station, John Perry Primary school and local country parks. This two bedroom semi detached home has been very well presented throughout and this fol...",Semi-Detached,2,2,,Freehold,[],"[['Dagenham East ', '0.5 miles'], ['Elm Park ', '1.0 miles'], ['Dagenham Heathway ', '1.3 miles']]","['underground', 'underground', 'underground']",Ask agent,Ask agent,Ask agent,Band: TBC,False
24,141326024,"£1,495,000",Added on 26/10/2023,"Holden Way, Upminster, RM14","NO ONWARD CHAIN. Popular Location – North Upminster. 0.3 Miles To Hall Mead School, 0.6 Miles To Engayne Primary School, 0.7 Miles To The Coopers Company & Coborn School, 0.7 Miles To Upminster Train Station. Close Proximity To Upminster Town Centre & Local Amenities, Detached Gara...",Detached,2,4,,Freehold,"['NO ONWARD CHAIN', 'FOUR BEDROOMS', 'FANTASTIC POTENTIAL', 'DETACHED GARAGE', 'GROUND FLOOR SHOWER ROOM', 'CLOSE TO LOCAL AMENITIES']","[['Upminster ', '0.5 miles'], ['Upminster Bridge ', '1.1 miles'], ['Emerson Park ', '1.7 miles']]","['nationalrail', 'underground', 'nationalrail']",Ask agent,Ask agent,Ask agent,Band: G,False
25,140847782,"£575,000",Added on 05/10/2023,"Kingsmead Avenue, Romford","GUIDE PRICE £575,000 - £600,000 Being offered with no onward chain, is this five bedroom, semi-detached home. Situated within a short walk to Romford Town Centre which gives you great access into London via the Elizabeth Line",End of Terrace,3,5,,Freehold,"['End of terrace', 'Living room', 'Open plan kitchen/family area', 'Ground floor shower room', 'Five bedrooms', 'Two bathrooms', 'Off street parking']","[['Romford ', '0.2 miles'], ['Gidea Park ', '1.1 miles'], ['Emerson Park ', '1.5 miles']]","['nationalrail', 'nationalrail', 'nationalrail']",Ask agent,Ask agent,Ask agent,Band: D,False
26,141326024,"£1,495,000",Added on 26/10/2023,"Holden Way, Upminster, RM14","NO ONWARD CHAIN. Popular Location – North Upminster. 0.3 Miles To Hall Mead School, 0.6 Miles To Engayne Primary School, 0.7 Miles To The Coopers Company & Coborn School, 0.7 Miles To Upminster Train Station. Close Proximity To Upminster Town Centre & Local Amenities, Detached Gara...",Detached,2,4,,Freehold,"['NO ONWARD CHAIN', 'FOUR BEDROOMS', 'FANTASTIC POTENTIAL', 'DETACHED GARAGE', 'GROUND FLOOR SHOWER ROOM', 'CLOSE TO LOCAL AMENITIES']","[['Upminster ', '0.5 miles'], ['Upminster Bridge ', '1.1 miles'], ['Emerson Park ', '1.7 miles']]","['nationalrail', 'underground', 'nationalrail']",Ask agent,Ask agent,Ask agent,Band: G,False
27,141319013,"£500,000",Added on 26/10/2023,"Stanley Road, Hornchurch",Offered for sale with no onward chain is this two bedroom detached bungalow with huge scope to extend (STPP). Call now to book your viewing ,Detached Bungalow,1,2,,Freehold,"['Chain Free', 'Two Double Bedrooms', 'Moments Away From Harrow Lodge Park', 'Potential To Extend (STPP)', 'Garage', 'Detached Bungalow']","[['Hornchurch ', '0.5 miles'], ['Emerson Park ', '0.8 miles'], ['Elm Park ', '0.8 miles']]","['underground', 'nationalrail', 'underground']",Ask agent,Ask agent,Ask agent,Ask agent,False
28,137514476,"£300,000",Reduced on 26/10/2023,"Westbury Terrace, Upminster, RM14",Your Move are pleased to offer for sale this second floor apartment located within easy reach of all local amenities and transport links with the C2C line offering easy access to Fenchurch Street and District line. The property is being offered on a chain free basis and benefits from t...,Flat,1,2,,Leasehold,"['CHAIN FREE', 'EPC B', 'SECOND FLOOR', 'TWO DOUBLE BEDROOMS', '1 MILE TO UPMINSTER STATION', 'CLOSE PROXIMTY TO HIGH STREET', 'ALLOCATED PARKING']","[['Upminster ', '0.7 miles'], ['Upminster Bridge ', '1.4 miles'], ['Hornchurch ', '2.1 miles']]","['nationalrail', 'underground', 'underground']",£100 per year,£940,99 years left,Band: C,False
29,141313808,"£900,000",Reduced on 26/10/2023,"Mill Park Avenue, Hornchurch, Essex",Situated in one of Hornchurch’s premier turnings and in an enviable position is this Three Bedroom Detached property boasting a wealth of features.,Detached,2,3,,Freehold,"['Ground Floor Shower Room/Cloakroom: 9’9 x 6’10', 'Dining Room: 17’10 x 10’11, Lounge: 19’5 x 13’9 > 11’10', 'Snug Area: 10’3 x 8’, Kitchen/Diner: 19’1 x 10’6', 'Cellar: 14’10 x 6’4', 'Bedroom One: 15’7 x 10’8 plus wardrobes', 'Bedroom Two: 13’ x 10’1 plus wardrobes', 'Bedroom Three: 11’7 x 10’5, Bathroom/WC: 7’9 x 6’9', 'Garden Room: 29’ 2 x 8’1 max, Garage: 15’9 x 7’2 plus 7’5 recess', 'Extensively Double Glazed, Gas Central Heating', 'Good size rear garden, Off Street Parking to Front, NO ONWARD CHAIN']","[['Hornchurch ', '0.4 miles'], ['Upminster Bridge ', '0.5 miles'], ['Emerson Park ', '0.6 miles']]","['underground', 'underground', 'nationalrail']",Ask agent,Ask agent,Ask agent,Ask agent,False
30,132837611,"£550,000",Reduced on 26/10/2023,"Squirrels Heath Lane, Hornchurch, RM11","Situated 0.5 miles to Gidea Park station is this EXTENDED three bed SEMI-DETACHED family home. To the ground floor the property benefits from TWO RECEPTION ROOMS, an extended fitted kitchen and dining room, GROUND FLOOR SHOWER ROOM and access to the attached GARAGE which is currently split into t...",Semi-Detached,2,3,,Freehold,"['EXTENDED', 'SEMI-DETACHED', 'GROUND FLOOR SHOWER ROOM/FIRST FLOOR BATHROOM', 'ATTACHED GARAGE', 'OFF STREET PARKING FOR MULTIPLE VEHICLES', 'SOUTH FACING REAR GARDEN', 'OUTBUILDING WITH POTENTIAL FOR ANNEXE', 'COUNCIL TAX BAND E']","[['Gidea Park ', '0.5 miles'], ['Harold Wood ', '1.0 miles'], ['Emerson Park ', '1.0 miles']]","['nationalrail', 'nationalrail', 'nationalrail']",Ask agent,Ask agent,Ask agent,Band: E,False
31,138482315,"£625,000",Reduced on 26/10/2023,"Severn Drive, Upminster","Located in the ever popular Upminster, comes this spacious family home! Offering three sizeable bedrooms, family bathroom, two reception rooms, modern kitchen, ground floor cloakroom, sun room and utility room, this semi-detached property really has it all. You'll be pleasantly surprised...",House,1,3,,Freehold,"['Semi-Detached Home', 'Three Good Size Bedrooms', 'Good Condition Throughout', 'Extended Sun Room Area', 'Utility Room and Cloakroom', 'Maintained Garden and Cabin', 'Garage and Multi Car Driveway', 'EPC: TBC']","[['Upminster ', '1.0 miles'], ['Upminster Bridge ', '1.5 miles'], ['Emerson Park ', '1.8 miles']]","['nationalrail', 'underground', 'nationalrail']",Ask agent,Ask agent,Ask agent,Band: E,False
32,141306212,"£420,000",Added on 26/10/2023,"Pearcy Close, Romford, London, RM3",MS Estates are pleased to present a three bedroom town house available for sale in Romford. ,Terraced,,3,,Freehold,"['THREE BEDROOM TOWN HOUSE', 'GOOD LOCATION ', 'DOWNSTAIRS WATER CLOSET', 'BRAND NEW MODERN KITCHEN', 'THREE DOUBLE BEDROOMS', 'SPACIOUS BACK GARDEN', 'GARAGE', 'CHAIN FREE', 'CLOSE TO ALL LOCAL AMENITIES ']","[['Harold Wood ', '0.5 miles'], ['Gidea Park ', '1.4 miles'], ['Emerson Park ', '2.0 miles']]","['nationalrail', 'nationalrail', 'nationalrail']",Ask agent,Ask agent,Ask agent,Ask agent,False
33,141306038,"£550,000",Added on 26/10/2023,"Shaftesbury Road, RM1","WHEN ENQUIRING PLEASE QUOTE REFERENCE PP0079 ***GUIDE PRICE £550,000-£575,000*** Situated in a desirable area and being within walking distance to Romford town centre and station, is this well presented and good sized three double bedroom detached family home. Upon entering the hom...",Detached,1,3,,Freehold,"['***WHEN ENQUIRING PLEASE QUOTE REFERNCE PP0079***', 'Three DOUBLE Bedroom DETACHED Family Home', 'Catchment Area To Highly Regarded Primary & Secondary Schooling', '0.5 Miles To Romford Station & Town Centre', ""60' Southerly Facing Rear Garden"", 'Four Piece Family Bathroom & Downstairs WC', 'Open Plan Lounge, Diner And Modern Fitted Kitchen', 'Must Be Viewed To Fully Appreciate The Size']","[['Romford ', '0.4 miles'], ['Gidea Park ', '0.8 miles'], ['Emerson Park ', '1.3 miles']]","['nationalrail', 'nationalrail', 'nationalrail']",Ask agent,Ask agent,Ask agent,Band: E,False
